,category,header,contents
358,technology,6 Key Takeaways from Apple’s Recent iOS Update,"Apple's iOS 14.5 privacy update is dangerous for app developers and small businesses. However, Apple customers will definitely appreciate having the option to choose whether websites have the right to use their personal information to personalize their ads. ."
359,technology,4 Steps to Installing Your Rooftop Water Tank,
360,technology,Top Self-Defence Gadgets You Can Buy Today on Amazon,"Self-Defence gadgets are essential for those who feel vulnerable and alone. From pepper sprays to stun guns, these devices can be the difference between life and death in an attack! With so many great options available on Amazon today we're sure you'll find what your heart desires"
361,technology,Futurist: What Will Edge Computing Bring?,A friend asked what will edge computing really bring. so I answered!
362,technology,Questyle’s M12 Mobile HiFi Amplifier with DAC Really Makes The Music Sing,Improving streaming and mobile audio takes a portable turn with the Questyle M12 Mobile HiFi Amplifier with DAC
363,technology,6 Technology Trends That Will Rule the World for Eternity.,"This article explains emerging technologies like digital health, customer data platforms, Remote work, and HR Tech, Ethical AI, Internet of behavior, and Distributed Cloud, etc. These are trending technologies nowadays."
364,technology,Retail Modernization -- Creating the Groundwork for Future Success,"Bringing transformation to your retail store or chain is not just about technology. It's also about the strategy, design and experience you provide for your customers."
365,technology,"From Crypto to NFT, Virtual Trading Has Changed Investing Forever","NFTs are rapidly widening their scope, taking so many domains into their ambit. In this article, you will know what NFT means? Also, the reason behind this emerging era of NFTs."
366,technology,The Different Types of Equipment You're Going to Need in Your Mine,
367,technology,What is Proxy? Here's Everything You Need To Know About Web Proxies,"Proxies are one of the terms, you probably might have come across a lot of times on the Internet. What are they all about, what are their uses, and their types, this article will clear all your doubts regarding web proxies."
368,technology,Different Machinery Parts to Pay Attention to Before They Break,"Keeping your equipment functioning is rather essential to keep up with production. However, machines do tend to break down over time, so it's important to keep an eye on some rather important parts to watch for when it's time to replace them."
369,technology,What is Communication? Types of Communication,"Communication is the process of sharing your thoughts, ideas, feelings with others. Verbal, nonverbal, written, and visual communication are the four types of communication."
370,technology,Music Instrument Names in Punjabi for English Readers,"In this article, you will find information about the names of different kinds of music instruments in the Punjabi language. The Punjabi names have been provided alongside their English meanings to help readers learn them. Certain traditional musical instruments from Punjab have also been described."
371,technology,The Best Google Chrome Extensions for Web Development & Design,"The beauty of these Chrome extensions is that anyone can use them. The tools are not just for professionals. They can help you achieve the desired look and feel for your website, blog, page, or project."
372,technology,Futurist: How Do 5g and the Enterprise Resource Triangle Come Together?,A friend asked how do 5g and the Enterprise Resource Triangle work together or coexist. this is my response to that question!
373,technology,Top IT Technology Areas You Should Learn This Year,"The present era is the era of innovation and advancement in technology. This article explains about advancement in technology and useful skills for future. Cyber security, artificial intelligence, and machine learning, cloud computing, blockchain, AR & VR, and the IoT are highly demanding skills."
374,technology,Why Are Robots Likely to Replace Humans in the Workplace?,"There have been many developments in robotics in recent years. There is a concern that cyborgs will replace human in all workplaces. Although, many people might not believe it, there are several reasons for the likelihood."
375,technology,Mobile and Laptop Batteries,"An electrochemical battery is a source of power that converts chemical energy into electrical energy. A battery generally consists of a positive electrode, negative electrode, separator and electrolyte. Many kinds of batteries are used in different electronic devices and electric vehicles."
376,technology,Enable Windows Built In administrator,By default we're not able to see the Windows Administrator built in account.  The only account you normally see on initial boot up is your local users account.  Enabling the built in administrator account allows us to perform different types of maintenance to our system that not normally available.
377,technology,Can Robots Be More Intelligent and Human-like With Advanced Learning?,"Numerous advances in robotics make it seem that robots will take over the world and be like humans. However, it is not possible even with reinforced learning. It is impossible for robots to become like people."
378,technology,Top 11 Apps Like Snapchat You Should Use,Are you looking for apps like Snapchat? You've come to the right place.
379,technology,weBoost’s Home Complete Is the Cellular Signal Booster Kit for Large Spaces,Getting a good cellular signal inside a home or small office is often hard. The weBoost Home Complete is designed to amplify a cellular signal throughout a large space to make its use stable and strong
380,technology,The Best Ways to Earn Money with WordPress 2021,
381,technology,The Age of Social Media Enlightenment Is Here to Stay,"From most of the articles I have read online, I am supposed to do keyword research on my audience’s desires, then do topic research to see what they will read before I even think about putting pen to paper. Hence, the topic I choose to discuss with you is appropriately named “Analysis Paralysis.”"
382,technology,Futurist: Where Should We Apply Ethics?,"We blame big technology companies for issues. But in reality, should we blame ourselves?"
383,technology,How to Enhance Video Quality?,"Are you wondering about how to enhance video quality? If yes, stay tuned because you will get all the required information here on how to improve video quality."
384,technology,How To Remove Background In Images?,"So, you have a few images whose backgrounds you don’t like, but the issue is you don’t know how to remove background. Well, it is not difficult to remove background, all you need is the right background remover. Keep on reading to know how to remove background using different online tools."
385,technology,What Are Ticketed Spaces on Twitter and Should Creators Use Them?,Twitter is famous for launching new features. Are Ticketed Spaces here to stay?
386,technology,Vocal Media Review: Is it Worth Your Time?,Vocal Media is a  revenue share blogging platform that offers its content creators multiple ways of making extra money online. Here is my review of the platform.
387,technology,How Will Virtual Reality Affect the Way People Live?,The huge upsurge in virtual reality will have a significant effect on the future. There can be positive and negative aspects of technology. It is crucial to explore the different areas affected by virtual reality.
388,technology,Weird Questions People Ask Google,We ask so many questions to Google and some are quite puzzling
389,technology,What Are the Challenges of Implementing Green Technology in Developing Countries?,"As developed nations continue to acquire green technology, most people seem not to care about the developing countries. They face challenges in implementing green technology. There is a need to ensure they too have access to green technology to ensure sustainability and a clean environment."
390,technology,How Cybercriminals Are Raising the Bar With Apt-Style Attacks,"As security threats grow in number and complexity, cybercriminals continue to find new ways to gain access to information. Advanced Persistent Threats- style attacks, or APTs, are a relatively recent type of threat that take advantage of long forgotten vulnerabilities."
391,technology,Top 15 Dangerous Computer Viruses in History: How To Protect Your Computer From It?,"Computer virus is a computer program that can steal data from your system and spread itself to other computers. Virus becomes active when it gets into your system and can bring many serious problems like: destroy your entire hard disk, use up all the space on the hard drive, loss of important files."
392,technology,Futurist: How Do You Select the Technologies You Think Will Be Big in the Coming Year?,"In December each year, i publish a what tech is going to big in 2022."
393,technology,REDKEY USB Really Is The Computer Data Wiping Tool,"To fully wipe a computer’s hard drive, you need software that goes the distance. That’s a good description for the easy way that REDKEY USB works"
394,technology,How Your Mobile Phone Can Be So Much More in 2021,"In many cases, our mobile phones, those life-saving gadgets, are underused, as we never get to explore most of their functions."
395,technology,Find Out About Full Stack Web Development,Learn what Full Stack Web Development is and why it is such a valuable skillset.
396,technology,USB-C VS Lightning: Which Interface Is Better?,"This article describes USB_C and Lightning. Their functionality, compatibility, power, and data transmission speed, user-friendly use, and prices are compared. In the end, a conclusion is drawn about preference in use from one of them."
397,technology,How AI Can Solve Real-World Problems?,"Artificial intelligence has been a hot topic in the past few years. It has been debated whether or not we should use AI to solve some of our world's most pressing problems, while others have argued that this will only create more issues and problems."
398,technology,5 Benefits Of Automation Software For Ecommerce Business,Automation projects can lead to increased engagement by shifting to technology from several tasks that keep people from picking up more interesting work or devoting time to skills development exercises that may boost productivity.
399,technology,Is Migrating to Azure Beneficial? Here Are 10 Secret Reasons You Should Know!,"Although there are different cloud providers for migrating applications, many enterprises choose Microsoft Azure as the backbone of their IT strategy. In this article, you are going to explore the 10 key benefits of using Azure for migration for almost every enterprise."
400,technology,Things You Should Know When Choosing a Hosting Provider,"Some companies offer free hosting, but that doesn't necessarily mean they're great hosts. Consider the security features of the host that you choose. This article offers a look at some of the things you should consider when you're looking for a hosting package."
401,technology,How Excessive Use of Social Media Influences Academic Performance,This article explains How Excessive Use of Social Media Influences Academic Performance
402,technology,The Futurist: Is 5G More Than Watching Movies on My Cell Phone?,"I was asked a question is 5g more than faster YouTube? At first I said yes it is not about faster YouTube. Then I realized, it is."
403,technology,How To Get First 1000 Subscribers On Youtube Fast,"Hello friends, In this video, I am going to tell you 'How you can get the first 1000 subscribers on youtube.' You all must know that it is the biggest challenge for new YouTubers to get the first 1000 subscribers on their youtube channel."
404,technology,Benefits of Alternative Source of Energy,"In these modern times, energy is one of the most essential needs of human beings. Some people believe that governments of each nation should maximize their promotion on use of other sources of energy rather than the conventional one."
405,technology,Negative Effects of Modern Communication,"Modernization has given the world the gift of ease in communication with other people. Despite its extensive usefulness, some people believe that it has its drawbacks in terms of social relationships. The writer thinks as well that these modern platforms for communication has its negative impact."
406,technology,What to Do With a Dead MacBook,"MacBooks tend to be very reliable but, as with all electronics, they can still go wrong."
407,technology,How to Speed up Windows 10; Make Your PC 10 Times Faster,"Windows 10 has been known for being hanging up when you need it the most. In this article, we'll talk about how we can make our Pc work much faster"
408,technology,A Visual Way to Build Your Website from Scratch,Webflow: The no-code platform for web design and development.
409,technology,M. Visvesvaraya - the Founder of Indian Engineering,September 15 is celebrated as Engineer's Day in the memory of M. Visvesvaraya. Visvesvaraya started the great tradition of engineering in India. The tremendous achievements he has made in the field of engineering without any tools should inspire and guide today's generation as well.
410,technology,Important Social Network,This article create on important of social networks
411,technology,"New Facebook Page Badges - Complete Page, Active Page & More","Facebook has just released a series of badges to Facebook page owners, rewarding them with an icon based on their page activity and engagement."
412,technology,Boost Your Business Prospects With IOS App Development,In this article you will learn how to Boost  Your Business Prospects With IOS App Development
413,technology,AWS (Amazon Web Services) Summary,Here is an article about AWS - the web service created by Amazon that lets you do cloud computing operations.
414,technology,Are We Characters of a Mere Video Game?,"In recent times, there are many papers published and books written claiming that we the humans can be a part of a very sophisticated Video Game or a simulation environment. This article talks about such researches and papers and what they claim"
415,technology,Will Physical Devices Disappear Because of Cloud Computing?,"There are many questions on whether cloud computing will completely replace physical gadgets. The huge uptake of cloud computing makes it seem that physical devices will disappear soon. However, the cloud has its limitations and it is not in a position to replace tangible devices."
416,technology,How To Live With “Itchy Feet”,"The nomadic lifestyle isn’t for some, but for others staying in one place just won’t cut it"
417,technology,Futurist: Expanding on the Enterprise Resource Triangle (Ert),Expanding the Enterprise Resource Triangle Concept more. Considering each of the components in more detail!
418,technology,What Are Smart Contracts? A Quick Intro to Automated Contract Fulfillment on the Blockchain,An easy to follow introduction to the concept of smart contracts and oracles.
419,technology,How to Make a Clicker Game in Html,If you want to know how to make a clicker game in HTML then this is the right place for you. With very little code you can make your own clicker game in HTML.
420,technology,Microsoft Xamarin Forms for Building a Technical Website,Learn about the advantages and disadvantages of the MS Xamarin Forms for app development.
421,technology,Instagram Photo Editing Tips for Beginners,"If you want your Instagram profile to take off and attract new followers and customers, it’s crucial that you take the time to edit your photos effectively so that they look as visually stunning as possible."
422,technology,Code Table in HTML,Code table in HTML very simply using this tutorial. Copy and paste the provided code and you got yourself a nice looking HTML table.
423,technology,Kanto’s YU6 Powered Speakers Have All The Ways To Play Your Music,The Kanto YU6 Powered Speakers comes equipped with Bluetooth and a Phono Input plus Optical Digital Inputs so as to give you so many ways to play music through streaming as well as through a direct connection
424,technology,LocalBTV: A Future Alternative to Locast?,"Like Locast, LocalBTV is a local TV station streaming service. Unlike Locast, it doesn't yet offer the major networks. However, that might change because LocalBTV is planning to offer a planned Premium service."
425,technology,Futurist: Edge Computing and the Enterprise Resource Triangle,"Edge Computing offers a reboot for applications. Now, we can build applications that focus on the edge of the network!"
426,technology,How Does Remote Desktop Protocol Work?,"What is a remote access system and how does the system work? This is a system that came into existence a few years ago. With the proliferation of the Internet as well as the latest technology, radical changes are taking place."
427,technology,Advantages and Disadvantages of Blockchain Technology,"Blockchain's success has shifted technology across a wide spectrum, providing organizations with an enormous amount of convenience, but on the other hand, every technology has advantages and disadvantages."
428,technology,An Alternative To Petrol Oil Is Ethanol,India is currently paying a heavy price for relying on other countries for any infrastructure product or technology. India is suffering from rising fuel prices due to shortage of crude oil.
429,technology,The Joker Malware In Android Phones,This app hides in many apps that you download from Google Play Store. It can empty your bank account without your knowledge.
430,technology,The DLab Ultralight Portable 4K Touchscreen Monitor Really Does The Viewing Job,A sophisticated portable monitor that goes where you go is found with the DLab Ultralight Portable 4K Touchscreen Monitor
431,technology,How Easy Is It to Hack IoT Devices?,"Hacking IoT devices is so easy it is not funny anymore. As more people buy the devices and connect to the internet, it is clear that there is a lot of danger ahead and there is need for awareness."
432,technology,5 Reasons Why People Use Linux Instead Of Windows And Mac,Why do people use Linux as a basic system instead of Windows and Mac?
433,technology,Futurist: The History of and Question About What Would You Like Your Next Printer to Do?,A brief recap of the history of home printers. And then a question what would you like your next printer to do?
434,technology,Smart And Effective Ways To Increase Your YouTube Subscribers,"Increasing your YouTube subscribers can be an arduous task, but there are a few smart and effective ways that you can opt for in order to make that subscribers' count go up. In this blog, you will learn about as many as 8 ways in which you can increase your subscribers on YouTube!"
435,technology,Importance and Types of Technology of Sensors in Smartphones,Sensors also help us in many of the things we do on our smartphones in our daily lives. They make it easy to use a smartphone. Let's take a look at the technologies and types of sensors that make smartphones truly 'smart'.
436,technology,Geographic Information Systems (GIS) Certifications and Professional Affiliations,"To advance your career in the field of Geographic Information Systems (GIS) technology, you must obtain certifications and become affiliated with professional organizations. The article explores some of the top certifications and professional organizations in the field of GIS technology."
437,technology,"What Keeps the Internet Keeps Running, the Economics Behind the Internet.","This article aims to explain how money circulates in the world of the internet and how do the internet companies keep their lights open and in the long run, how does this money finally reaches back to where it started."
438,technology,How to Spot a Phishing Scam,Phishing is a social engineering method of breaking into organizations' or individual's personal confidential information using email as the medium of communication.  The intent is to steal such information for monetary and financial gain.  In this article you will learn how to quickly spot them!
439,technology,Monoprice's Monolith M-TWE True Wireless Earbuds Provides Good Listening,Good sound comes from good opponents and good technologies. Both are found in Monoprice’s Monolith M-TWE True Wireless Earbuds
440,technology,Best blog niche to make money easily,You might be thinking about starting a blog and millions of ideas bouncing around your head. But confused about where to start or the idea will work or not. It’s a little bit of a head-scratcher but you are not alone. Choosing a blog niche is one of the hardest decisions.
441,technology,What in the World Is Yield Farming?,Quick guide on crypto yield farming
442,technology,10 Css Tips You Need to Know to Improve Your Site Speed,"The speed of your website is an essential criterion in the user experience and the quality of your natural referencing. In this article, we will focus on the CSS code. These different lines, so crucial for the layout and the various animations of your site, can slow it down."
443,technology,Printer - Changing the Ink,"It's easy, and then sometimes no so easy..."
444,technology,Why the Social Media Turns People Into Communists,We’re analyzing a very interesting new social development in the world today: social media communists. People without any allegiance to dictatorial communism act on social media in a way that will make even Lenin shed a tear. This is a story about the internists.
445,technology,5 Best Android Emulator (2021),"Looking for best android emulators for playing games and apps on pc, You are at the best place."
446,technology,My Fiverr Review,"In this article, I will give you my honest review of Fiverr."
447,technology,What Is Procurement Consulting and How Can It Help Your Business?,"Procurement consulting is an integral part of every organization. Procurement consulting helps business organizations meet their cost-saving goals. In this blog, you are going to learn about procurement along with its importance."
448,technology,How to Install Windows 11 Without a Tpm 2.0 Chip?,"Easy way to install windows 11 without TPM, on any computer."
449,technology,Let's Hold Facebook and the Hackers Accountable,"I understand that there is a need to protect both sides of the Hacker Syndrome, but when you are the victim who has put in years and years to build your facebook page and that page is taken away in a blink it’s beyond heart wrenching."
450,technology,Helix Model of Communication,"Frank Dance proposed the Dance's Helix Model of communication in 1967.He  has compared ""Helix"" to the evolution of communication that occurs throughout a person's life, from birth to the moment of existence."
451,technology,Want Some Custom Hollywood Style Music?,"If you have ever wondered what it takes to create gorgeous, Hollywood style musical scores, using nothing more than the computer that you have in front of you, this is your article!"
452,technology,The Ambassador Interpreter Will Translate Languages For You,"Because there’s no way to learn a dozen languages, here’s the Ambassador Interpreter to do it for you"
453,technology,The Futurist: Walking Hud,
454,technology,"How the Tiktok Algorithm Works in 2022 [+ How Twitter, LinkedIn, Pinterest Algorithms Work]","Like other social media algorithms TikTok algorithm curates and sends recommendations of videos based on users' interests. Twitter algorithms value the relevancy of posts. Read: How the TikTok Algorithm Works in 2022 [+ How Twitter, LinkedIn, Pinterest Algorithms Work]"
455,technology,How Does the YouTube Algorithm Work? Crack It For More Views,How does the YouTube algorithm work? ... Crack now how algorithms on YouTube work to increase your YouTube video views.
456,technology,How Do Facebook Algorithms Work [Facebook Algorithms 2021],"The Facebook algorithm decides how to order and present posts. And values user engagement more compared to the quality of content. Consequently, gives weight to posts most relevant to end-users & can incite engagement. Facebook algorithms publish content based on relevance, not chronologically."
457,technology,How to Sign out of One Google Account When Using Multiple Accounts on Phone,"I'm sure we have all seen those phones where the user has multiple accounts. In this article, we will share the step-by-step process of how to sign out of one Google account when using multiple accounts on smartphones."
458,technology,OWC’s Envoy Pro SX Thunderbolt Bus-Powered Portable SSD Is A Fast and Durable Portable Drive,The Envoy Pro SX Thunderbolt Bus-Powered Portable SSD Is the modern high speed solid state drive that you can take anywhere
459,technology,How Scammers Target Innocent Online Users,"Cyber Talk:
Cyber stalking and hacking. Information technology and its challenges."
460,technology,Can I use Alexa or Siri in China?,People often ask themselves whether Alexa or Siri work in China. When individuals travel to China they want to know if they can experience the same comfort they have with IoT devices at home while in the country.
461,technology,The Futurist: The Future of Voice!!!!,"Voice, it is the merging of transcription and translation"
462,technology,The Comfobuds Z True Wireless In-Ear Headphones Will Help You Sleep,"1More always provides a quality sound, but the Comfobuds Z adds sleep-inducing calming sounds as an additional part of it"
463,technology,Headway - Self Growth Challenge,Headway is an app I found in Google Play Store that I found interesting so read on to get my insights and review.
464,technology,The Tribit Home Is A Speaker That Gives Up A Lot Of Music,"The Tribit Home has a lot of tech working, but its best use is cranking up the 25 watts for loud sound from a cool looking Bluetooth speaker"
