,category,header,contents
0,entertainment,Days of Our Lives: Fans Are Thrilled at the Return of Peter Reckell,Bo Bragy is back and his followers want him to stay.
1,entertainment,The Empty Man (2020) Movie Review,"The Empty Man is thrilling, movie about a mysterious supernatural force that can be summoned but causes chaos in a small town when teenagers try test the myth."
2,entertainment,The Harder They Fall 2021 Movie Review,The Harder They Fall was released in 2021. Two groups of criminals are in conflict and traumatic truths are unveiled. The movie has a vintage setting during a time when horses were the main form of transportation.
3,entertainment,"Synth Album Review: ""Star Child"" by HeartBeatHero","Read on to learn about why I feel that ""“Star Child” combines intricately entangled synths, beautiful melodic moments and mingled emotions."
4,entertainment,"Synthpop Single Review: ""Sick House"" by Eulalie and Star Madman","Read on to learn about how ""Sick House"" captures the profound alienation and pain of isolation."
5,entertainment,The Bold and the Beautiful: Tanner Novlan Has Moved on to Other Projecfts,Persistent rumors that Finn is still alive are unfounded.
6,entertainment,"""The Innocents"" (2022) Review: A Story-Driven and Tensely Foreboding Norwegian Thriller","The Innocents brings maturity to the superhero genre. While superhero films often toy with being darker, The Innocents prioritizes a solid story structure over special effects and a slow build up that leads to a payoff that is as intriguing as it is polarizing."
7,entertainment,A Silent Voice,"A Silent Voice is a story about Shoya who is a young teenage boy trying to end his life. However, he changes his mind at the last minute and decides not to jump off the bridge. As Shoya starts recalling the events that led him to that moment and sets out on a journey of redemption to meet Shoko."
8,entertainment,Top 10 Pokémon World Location and Its Real World Counterpart,What are the 10 most beautiful locations in the Pokémon world that are taken from real world locations? Pokémon writers go all over the world in search of the most fitting locations for their anime and movies. This article lists 10 most iconic Pokémon locations that have real world counterparts.
9,entertainment,Not Today Satan: The Church phrase Came From Bianca Del Rio and Ru Paul's Drag Race,Christians use this slogan on a regular basis but may not know the origin is not from the Bible.
10,entertainment,“Firestarter” (2022) Review: A Misfire of a Movie,"Firestarter has the potential to become something like the movie It (2017), but it falls far short."
11,entertainment,Eurovision 2022- and the Winner Is...Ukraine,After a bumpy couple of years Eurovision is back but is a win for Ukraine a given?
12,entertainment,Disaster Porn Saturday Night: Hard Rain,You'll get wet
13,entertainment,Twenty-Five Truly Exceptional Religious Songs That Even Non-Believers Will Love,"Regardless of what your religious denomination may be or regardless of whether you even have any religious beliefs at all, the music entertainment industry has produced religious songs that everyone can like.  Lay back and allow me to take you on a journey into this world of spiritual music."
14,entertainment,Why Does My Rawhide Drum Sound Flat?,Often i receive the question from folk asking me why their rawhide drum is sounding flat or even sounding dead. Here’s a tip i learned…
15,entertainment,Friday Film Fest: Bill Paxton,"From bartender to psycho, Bill Paxton certainly became one of Hollywood's most in demand leading men."
16,entertainment,Firestarter (2022) Movie Review,This Firestarter (2022) Review Doesn’t Like The Way That Sweater Looks On You! Starring Zac Efron and Ryan Kiera Armstrong! Directed by Keith Thomas!
17,entertainment,15 Best Romantic Turkish Drama Series,"Looking for the best romantic Turkish drama series? Here’s the list of the best, most popular ones! They are heart-touching, funny, sad, twisted, or soothing – they all are different, but each of them is super romantic!"
18,entertainment,100 Best Songs About Blood,Get an adrenaline rush with an epic playlist of songs about blood.
19,entertainment,Should I Watch..? 'Prometheus' (2012),Ridley Scott returns to the series that made him a household name with this spiritual prequel to 'Alien'. But is it another sci-fi horror flick or something much deeper? Benjamin Cox explains all.
20,entertainment,Why the '89 Batman Is Still My Favorite,A new Batman film is making waves. But sometimes we need to look at where we came from
21,entertainment,Tokyo Mew Mew Reboot Drops in July 2022,My blog regarding the Tokyo Mew Mew reboot coming in July.
22,entertainment,The Complete Biography of Cassandra Harris (Part 3),The 3rd installment of the most complete biography of actress and model Cassandra Harris (the original Mrs. Pierce Brosnan) online.
23,entertainment,Top 40 Silent Sanctuary Songs,Here are the top 40 Silent Sanctuary songs that probably made you indulge in the feeling of love and misery of breakups. Learn more about the inspirations and facts behind these songs.
24,entertainment,"10 Best BlackPink Songs, The Most Popular Ever","BlackPink is a KPOP Girl Band from North Korea, which was formed by the YG Entertainment company. Members of Blackpink itself have 4 girl members, They are: Jisso (Kim Ji-Soo), Jennie (Jennie Kim), Rose (Roseanne Park), and Lisa (Lalisa Manoban/Pranpriya Manoban)."
25,entertainment,"Synth Single Review: ""Escape From Synth Wave"" by Jokerhed","Read on to learn about how ""Escape From Synth Wave"" crackles with tension and shadowy energy."
26,entertainment,"""When You're Gone"" Is Almost Too Heartbreaking to Listen To, and That's a Good Thing.","Sometimes art is almost too painful to listen to, and that's a good thing."
27,entertainment,Doctor Strange In The Multiverse of Madness,Disposable Strange in the Multiverse of CGI Madness
28,entertainment,The Bold and the Beautiful Spoilers: May Sweeps Brings Two Big Reveals,A setup leads Lt..Baker to the truth about Sheila and Deacon could be responsible for Brooke finding out she was set up on New Year's Eveeeeeee.
29,entertainment,"Like Mother, Like Daughters","Well, it's Mother Day this weekend, May 8th, 2022, and we often hear the term 'Like Father, Like Son' so I wanted to share a mother and daughter story to honor our moms everywhere."
30,entertainment,"Is ""The Originals"" Elijah Mikaelson's Story?","Here's a theory about why ""The Originals"" could be more about the Noble Elijah than Klaus."
31,entertainment,Kevin Samuels Famous Relationship-Image Consultant Died,
32,entertainment,An Update on Urusei Yatsura 2022's Cast.,My follow up blog about the upcoming Urusei Yatsura reboot.
33,entertainment,Doctor Strange in the Multiverse of Madness Review: A Surreal and Mind-Bending Adventure,"There are some strange things going on in Doctor Strange, so if you like that kind of thing, this movie is right up your alley! Now, let’s talk about what I liked about the movie Doctor Strange in the Multiverse of Madness, shall we?"
34,entertainment,Top 20 Movie Curses,There are many stories of unexplained phenomena behind some of your favourite films but how many are real or just cheap marketing? Benjamin Cox guides you through some truly horrifying tales...
35,entertainment,Sheree Gustin Burton: All You Need to Know,Soap fans have been stunned by actor Steve Burton's announcement that he is not the father of his wife's baby and desire to know more about her.
36,entertainment,Days of Our Lives Spoilers: Abigail Klein Is a Recast Stephanie Johnson,Steve and Kayla will be in for some surprises when their daughter returns to Salem.
37,entertainment,Children of Sin (2022) Movie Review,This Children of Sin (2022) Review Puts The Fun In Cinnamon! Starring Meredith Mohler and Lewis Hines. Directed by Christopher Wesley Moore And Three Other Names!
38,entertainment,The Unbearable Weight of Massive Talent,Cage Rampage
39,entertainment,Resident Evil: An Unconventional Addition to the Zombie Genre,"2002's Resident Evil is an action-packed, irreverent take on the zombie genre."
40,entertainment,A short blog Spiderman Across The Spiderverse,Sharing what little I know about Spiderman Across The Spiderverse
41,entertainment,"Synthpop Single Review: ""World Falls Away"" by Eric C. and Andrea Powell","Read on to learn why ""World Falls Away"" is an expression of the hopelessness with which many of us struggle of late."
42,entertainment,Why Oculus is More Than Just a Haunted House Movie,"Oculus may not have reinvented the haunted house genre, but it's still worth the watch."
43,entertainment,"""The Northman"" - Nathan's Movie Review","At last, Robert Eggers has created his masterpiece. His highly overrated The Witch and his vastly superior follow-up The Lighthouse has led him to The Northman, a tragically beautiful tale of lost innocence, rising vengeance, and the hope of redemption. I give the film a 4 out of 4."
44,entertainment,It Feels Good to Be Proven Wrong: A Review of Everything Everywhere All At Once,"I went into Everything Everywhere All At Once having no clue what to expect. I'd heard so much praise over the film, but I just couldn't see past my own skepticism. What did I walk out of the theatre thinking? Keep reading if you want to find out!"
45,entertainment,Strange Sexual Preferences of Gundam Villains,"At some point, Gundam villains are creeps."
46,entertainment,General Hospital Spoilers: May Sweeps Begins but Will There Be Harmony in Port Charles,Secrets come to light and strange alliances will be made during the week of May 2-6.
47,entertainment,"World News Diary, April 2022","My world diary for the month of April 2022, we talk about Easter religious beliefs, the Australian elections, Some world happenings, the war in Ukraine and my views about these issues."
48,entertainment,Chip N' Dale Make a Comeback in May 2022.,My blog on the upcoming Chip n' Dale Rescue Rangers film.
49,entertainment,Vincenzo (2021) K-Drama Review,An engrossing Korean drama which features a fantastic cast and a crazy and dramatic plot line with plenty of surprises that you can't help but follow. Here's why you should watch it if you haven't already.
50,entertainment,General Hospital Spoilers: May Sweeps Begins but Will There Be Harmony in Port Charles,Secrets come to light and strange alliances will be made during the week of May 2-6.
51,entertainment,"World News Diary, April 2022","My world diary for the month of April 2022, we talk about Easter religious beliefs, the Australian elections, Some world happenings, the war in Ukraine and my views about these issues."
52,entertainment,Chip N' Dale Make a Comeback in May 2022.,My blog on the upcoming Chip n' Dale Rescue Rangers film.
53,entertainment,Vincenzo (2021) K-Drama Review,An engrossing Korean drama which features a fantastic cast and a crazy and dramatic plot line with plenty of surprises that you can't help but follow. Here's why you should watch it if you haven't already.
54,entertainment,Disaster Porn Saturday Night: Tycus,"As a comet races toward the moon, a secret city is being built under the earth's surface."
55,entertainment,The Pebbles and Bamm-Bamm Show: A Chip off the Old Bedrock,This spin-off of The Flintstones only lasted one season but remains beloved and celebrated by fans.
56,entertainment,"Cyberpunk Album Review: ""Alternate Realms"" by Chris Keya","Read on to learn why I feel that ""Alternate Realms"" is drenched in shadow, full of monumental power and radiates a palpable sense of danger."
57,entertainment,Should I Watch..? 'Chicago' (2002),"This Bob Fosse-inspired stage adaptation has all the razzle-dazzle you could ever wish for. But Benjamin Cox, it isn't a question of quality but more one of taste as he now explains."
58,entertainment,Friday Film Fest: Dennis Quaid,"He claims to have been under the influence, but these performances are worth checking out."
59,entertainment,The Young and the Restless: May Sweeps Begin With Blow Ups and Breakups,Trouble is all around Genoa City couples and families and not everyone will suvive
60,entertainment,Return to Mayberry Will Air on MeTV on May 1st,If you missed the original or the  2021 airing you have a chance to catch this classic and relive the fun of Andy and the gang.
61,entertainment,4 Horror Movies Not to Watch While Driving a Bus or Flying a Passenger Plane!,Driving a Bus? Flying a Passenger Plane? Want To Watch A Horror Movie? Don’t Watch These!
62,entertainment,"Synth Album Review: ""Ready To Fight Evil"" by Exorcisor","Read on to learn about why I feel that ""Ready To Fight Evil"" is a heavily shadowed, thundering assault on the senses that brims over with danger, darkness and demonic energy."
63,entertainment,Should I Watch..? 'Kiss Of The Dragon' (2001),"This French production featured Jet Li in one of his earliest English-speaking roles. But while his fellow star Jackie Chan found success, Li struggled to get across with audiences the same way. And Benjamin Cox thinks he may know why..."
64,entertainment,Fantastic Beasts: The Secrets of Dumbledore,Missing that magical spark...
65,entertainment,"Synth Album Review: ""The Curse of the Daydreamer"" by Victor Roy","Read on to learn about why I feel that ""The Curse of the Daydreamer” is an intricately woven synth tapestry that unfolds stories of high adventure in ancient lands."
66,entertainment,Cute Anime Outfits You can Easily Copy,Adorable anime girl outfits you can recreate using clothes you already have in your closet!
67,entertainment,Top 10 Episodes From Supernatural,Here are Top 10 episodes from Supernatural!
68,entertainment,Pusha T’s “it’s Almost Dry” Album Review,Pusha T's fourth studio album showcases all that his music is about. Sharp lyricism revolving around Coke bars and backed by masterful production.
69,entertainment,Doctor Stranger Multiverse of Madness brings the madness in May,My blog regarding the upcoming Doctor Strange sequel film.
70,entertainment,Should I Watch..? 'Oldboy' (2003),"Arguably the film that put a spotlight on Korean cinema, Park Chan-wook's extreme thriller delivers thrills and twists in a way that we rarely see these days. Benjamin Cox just feels sad for the octopus."
71,entertainment,Original Team of Legends of Tomorrow,
72,entertainment,'Married at First Sight' Season 14: None of the Couples Should Stay Married,"In my opinion, none of the couples on ""Married at First Sight"" Season 14 will or should stay together. Decision Day is coming soon, and none of the four couples are on the verge of saying they will stay together."
73,entertainment,"Techno Album Review: ""Lost Frequencies"" by John Faust","Read on to learn about why ""Lost Frequencies"" is a deep, powerful musical journey through lushly crafted techno landscapes."
74,entertainment,"Synth Album Review: ""Hey Sexy Remixes"" by Oceanside85 & Guests","Read on to learn why I feel that ""Hey Sexy Remixes"" takes the sensual, erotic vibe of the original album and adds unique interpretations of the music."
75,entertainment,Friday Film Fest: Patricia Arquette,"From horror to winning an Oscar, Patricia Arquette still has a lot to offer in coming years."
76,entertainment,I can't believe I slept on Nanbaka Part 1: My first Impressions on Nanbaka!,My first impression on the 2016 anime Nanbaka!
77,entertainment,"Synth Album Review: ""Pyramind"" by Raiman","Read on to learn why I feel that ""Pyramind"" is a cinematic, cosmic journey through layered soundscapes that unfold on a lush synth palette,"
78,entertainment,The Young and the Restless: Rey’s Death Shatters Sharon and Will Affect Genoa City Residents in Surprising Ways,A painful journey is ahead and viewers may be stunned at how this plays out in the long run.
79,entertainment,"Everybody Loves BTS, Including the United Nations","TS is loved by young and old alike. There are even Facebook and Instagram pages for BTS  Moms, and they've performed and spoken at the United Nations. BTS is bigger than the Beatles ever were."
80,entertainment,Hot or Cold... Fantastic Beasts: The Secrets of Dumbledore Movie Review,"The latest entry in the Fantastic Beasts series has been released! Taking place in the world of Harry Potter, this film takes another dive into the wizarding world we all love. The real question is, how was it?"
81,entertainment,"Alternative Album Review: ""Present"" by Paul Iwan","Read on to learn about why I feel that ""Present"" is a collection of emotionally deep, expressive songs"
82,entertainment,Should I Watch..? 'The Pink Panther' (1963),"Blake Edwards' comic crime caper stood out for several reasons, not least was the debut of cinema's favourite clumsy cop Clouseau. Benjamin Cox thinks you'll be tickled pink by this theatrical farce."
83,entertainment,"Bonnie Bennett Vs Freya Mikaelson, Who Would Win?","Two of the strongest witches in The Vampire Diaries Universe fight, who wins?"
84,entertainment,"Synth EP Review: ""Staring At The Moon"" by Last Survivor","Read on to learn how ""Staring At The Moon"" explores the many moods and sounds that synths can create along with first-rate vocal performances and strong lyrics."
85,entertainment,The Hidden Review: Spiderman No way home Film Review,"""The multiverse is real."""
86,entertainment,A Movie Review: Fortress (2021),"Fortress is a 2021 action movie about people hiding out in an obscure location in the middle of a jungle, but their safety is compromised as secrets about who they are, unravel."
87,entertainment,The Hidden Review: King Richard Film Review,"""We're More Than A Team; We're A Family."""
88,entertainment,Top 10 Breaking Bad Episodes According to IMDB,Here are top 10 episodes from Breaking Bad as ranked by IMDb.
89,entertainment,The EnterPAINment Industry: Jay Z,From Pain to fame
90,entertainment,Footlight Parade - Busby Berkeley's Pinnacle of Dance,"Chester Kent, a driven man, works more than ever to stage prologues in theaters and proves to doubters that it can be done."
91,entertainment,Kate Sharma’s 11 Best Costumes and Dresses,"These are my picks for the top 11 costumes worn by Kate Sharma from the Netflix original series ""Bridgerton."""
92,entertainment,Bands Named After Body Parts,
93,entertainment,"Synth Album Review: ""Rituals"" by SkyYamaha","Read on to find out why I feel that ""Rituals"" weaves a mystical sonic spell as it journeys through reverent, meditative spaces."
94,entertainment,Top 20 James Bond Theme Songs,"A little while ago, Benjamin Cox set himself the challenge of ranking the best James Bond themes. After much listening, he presents his findings here - for your eyes only (actually, everybody's eyes - I need the hits!)"
95,entertainment,"""The Ominous Project Universe Presents: Curse of Bloody Mary"" Movie Review","A riveting follow-up to Bakari's first Bloody Mary film, Curse not only lives up to the first film but also has the guts to embrace the unexpected. I give the film a well-deserved perfect 4 out of 4."
96,entertainment,General Hospital Spoilers: Charlotte Cassadine Is Being Sent to Boarding School and May Return Soras.,Valentin’s daughter will be off-screen for now but it’s possible she may return later and be much older.
97,entertainment,The Hidden Review: Tick Tick Boom Film Review,"""How much time do we have to do something great?"""
98,entertainment,Disaster Porn Saturday Night: Titanic 2,"One of these days we might be able to take a cruise on Titanic 2, but until then, we have this"
99,entertainment,Which 6 Pokémon to Have on Your Team If Pokémon Were Real?,"This article lists 6 Pokémon to have on your team if Pokémon were real. You want to have Pokémon that will help you in real life. With amazing powers, these 6 Pokémon will make your everyday life worry free. This article is for the diehard Pokémon fans."
100,entertainment,"Destruction, ""Inventor of Evil"" Album Review",Inventor of Evil is the superb 2005 studio album by German thrash metal band Destruction.
101,entertainment,"""Fantastic Beasts: The Secrets of Dumbledore"" Movie Review",The third Fantastic Beasts film hits like a political thriller with mystery elements. It's a new direction and a great one at that. I give the film a 4 out of 4.
102,entertainment,VLive Solo: Jungkook Responds to an ARMY’s Request to Be Her Boyfriend for 5 Seconds,"During Jungkook's interaction with ARMYs on VLive on April 5, 2022, an ARMY asked, ""Can you be my boyfriend for 5 seconds?"" And that one lucky ARMY got a bold response from Jungkook."
103,entertainment,"Album Review: ""Virus"" by Swedish Melodic Death Metal Band Hypocrisy",Virus is the 2005 studio album by Swedish melodic death metal band Hypocrisy. This may be their best album since 1994's The Fourth Dimension.
104,entertainment,Dragonball Super Super Hero Coming in 2022,My thoughts on what we know so far about DragonBall Super Super Hero.
105,entertainment,The Beatle Experience in 1961,Imagine yourself going back to 1961. Things were so different and pop music was changing. You and your friends are young adults are out for a weekend night of partying. You stop outside one of the many German clubs because of the music. Something that was new to you....
106,entertainment,The Hidden Review: Eternals Film Review,"""Do not forget your place"""
107,entertainment,4 Awesome Free Movie Apps For Your Next Movie Night,"Grab your popcorn, candy, and a soda pop! Movie night just got better with these free apps."
108,entertainment,"Synth Album Review: ""The Void Drifter"" by GalacticTapes","Read on to find out why I feel that ""Void Drifters"" paints vivid images of cosmic power and galactic vistas through a varied, interlacing synth palette."
109,entertainment,The Life and Times of Paul Rudd,
110,entertainment,"The Most Hilariously Bad Audition Ever On ""American Idol""","""American Idol"" has been on the television airwaves for nearly two decades.  This priceless gem has brought some of the most exceptional talent to the music entertainment industry.  The tricky part of it all is for their judges to get past all the outlandish auditions.  Prepare to laugh out loud."
111,entertainment,Daytime Talk Shows Coming to an End in 2022,More and more daytime talk shows are coming to an end. Two talk shows have been canceled after only one season. One was canceled after eight seasons. Another is being canceled after four seasons. Two are coming to an end because of the hosts' decision and one is being replaced by another host.
112,entertainment,"Revisiting the Album ""Nemesis Divina"" by Satyricon",Nemesis Divina is the 1996 studio album by Norwegian black metal band Satyricon. It may be the best early studio album from this band.
113,entertainment,Ranking the Star Wars Franchise,I have a bad feeling about this! Everyone has very strong opinions on where they would put each film of the Star Wars franchise. I hope to be able to share my opinions and maybe show you why each film has a special charm.
114,entertainment,"Synth Single Review: ""Your Last Kiss"" by Vvmpyre & Maverick","Read on to to learn about Vvmpyre and Maverick’s ""Your Last Kiss "" which is a song of vampiric desire and hunger."
115,entertainment,"Synth Single Review: ""Faith (Lost In Space)"" by Kal-Elle Jagger & Syst3m Glitch","Read on to learn why ""Faith (Lost In Space)"" is about feeling unmoored and leaning back on faith to get through."
116,entertainment,"Rock Single Review: ""Undercurrents"" by ELYXIR and Neilio","Read on to learn why ""Undercurrents"" is a song about looking back in joy and sorrow on a relationship that never could have been."
117,entertainment,"Synth Single Review: ""With You"" by eLxAr & Neaon","Read on to learn why ""With You"" is a song about a special, unique connection between two people."
118,entertainment,Hunt for These Hide Songs While the Kids Seek Eggs,
119,entertainment,"""Resident Evil: Welcome to Raccoon City"" (Movie Synopsis)","Raccoon City, formerly the thriving headquarters of pharmaceutical company Umbrella Corporation, is now a decaying Midwestern town. A tiny number of survivors should work together just to learn the truth about Umbrella and survive the night."
120,entertainment,The Outfit (2022) Movie Review,"This The Outfit (2022) Review Has One Armed Jackets and Four Legged Pants! Starring Mark Rylance, Zoey Deutch and Johnny Flynn! Directed by Graham “Who Wants” Moore!"
121,entertainment,Joseph Morgan Almost Played Voldemort In Harry Potter,"Did you know Joseph Morgan aka Klaus Mikaelson was almost cast in Harry Potter and The Chamber Of Secrets? Here, find out:"
122,entertainment,My First Impressions of The CupHead Show,This is a long overdue blog about my first impressions of The CupHead Show
123,entertainment,Should I Watch..? 'The King's Speech' (2010),"Based on actual events, this lavish costume drama may be a bit of Oscar-bait but it fundamentally works as a human interest story. Benjamin Cox was suitably impressed."
124,entertainment,The Life and Times of JRR Tolkien,
125,entertainment,My First Year on Youtube,"In my first year being a Youtuber, I learned that getting subscribers is hard, being able to monetize your channel takes a very long time and a lot of hard work and Youtube's algorithms don't make any sense."
126,entertainment,Video Rewind: Blue Skies Again,"There may not be crying in baseball, but there is something sneaky going on"
127,entertainment,Will Smith's Iconic Slap Moment,The response over Will Smiths' iconic slap moment and what Jada Pinkett thinks of it.
128,entertainment,"Synth Single Review: ""The Divide"" by SynthPrincipal","Read on to learn about how ""The Divide"" combines surging percussive power and shining synths to create a layered and dynamic piece of music."
129,entertainment,"Lo-Fi Album Review: ""Vol. 1"" by Chrome Waves","Read on to find out about why I feel that ""Vol. 1"" is a delicate, soothing and atmospheric lo-fi journey."
