,category,header,contents
243,technology,Review of Supcase Unicorn Beetle Pro Series Case Designed for Galaxy S9,A review of one of my favorite phone cases for the Samsung Galaxy S9. Hopefully you will find this helpful if you are looking for a durable case for this phone. Check it out for yourself here: https://amzn.to/3dX4cNj
244,technology,How to Know If Someone Blocked You on WhatsApp,"WhatsApp is the most popular messaging app outside China, where WeChat is used instead. This article is going to show you how to know if someone blocked you from sending messages or make calls."
245,technology,How Technology Makes Sure Your Money Gets Where it Needs To Be,
246,technology,Back-End Web Architecture: How It Works.,"An overview of the hardware and software on the server side and how all these work together during web development. Get a deeper understanding of databases, routing and servers."
247,technology,Futurist: Also Ran Tech That Won't Make My Hot Tech 2022 Column!,"I look a some tech that won't be in my upcoming 2022 hot tech column, but were interesting enough to deserve a little coverage!"
248,technology,Tips on Buying Your Next Dell Computer (and Others),"With many great deals out there with low prices, finding your best unit for the best price is always a challenge. Do you buy new, used, refurbished, scratch and dent? There are few hardware things you need to think about and maybe that is why the price is low."
249,technology,1more Comfobuds 2 and Colorbuds 2 True Wireless Headphones Bring Personal Audio to Every Ear,"Wireless earbuds abound, but choose from high quality results when that’s your aim — because both the ComfoBuds 2 and ColorBuds 2 put out the audio you’ll enjoy"
250,technology,25 Years Ago WIRED Predicted the Future. How Wrong Were They?,WIRED magazine published a book in 1996 that attempted to predict future technology. Here's what it got right and what it got wrong.
251,technology,What Is 5g? What Are the Current Status and Key Advantages of 5G?,"5G is the new technology we’ve been waiting for, and it’s time we start using it. Smartphones, laptops, tablets, and other mobile devices are becoming more powerful. They are getting faster. And they are connecting to the Internet even faster"
252,technology,How to Make a Successful E-commerce App like Amazon: A Step-by-Step Guide,"With any eCommerce app development company in India uncompromisingly and indeed unrelentingly competing with each other to create an online shopping app the road to achieving success is anything but seamless. In other words, attaining success seamlessly is practically unattainable."
253,technology,Is Scaled Agile Framework Better Than Scrum?,"When choosing a framework for developing software, companies usually face which framework is ideal for the project. While there are conflicting views about Scaled Agile Framework, commonly known as SAFe and Scrum, there is little distinction between the two."
254,technology,How To Get Free SSL Certificate For Your Website,"An SSL Certificate is a security protocol that creates an encrypted link between a web server and a web browser. It is optional for your website, but allowing your website to be online without an SSL Certificate is a risk on the information of your website users."
255,technology,Boxe Is the Portable 1080p Mini Smart Projector That Goes Wherever You Want,"Watching a big picture is a lot more fun when you aren’t forced to sit in one place every single time. Boxe is a portable projector that not only shows a big picture, but it can go just about anywhere because it has its own internal power supply"
256,technology,How to Become a Software Developer in 2022 With No CS Degree.,"The world of technology is always changing, and this is happening fast. If you are thinking of how to get a slice of this rapidly growing industry then you are in the right place."
257,technology,What Happens If You Restrict Or Block Someone on Instagram,"Instagram is a popular social network based on the sharing of pictures and videos. Like other platforms, it allows you to block certain people from seeing your profile, but there's also the ability to simply restrict users. This article will highlight the difference between the two things."
258,technology,Understanding Your Internet Speed,One of the most common calls placed at your ISP provider from irate customers is about their Internet plan and what the plan promises in Internet speed. It can be a frustrating discussion because not everyone understands (including some of the tech people) some critical things.
259,technology,5 of the Best Types of Flooring Types for Manufacturing Facilities,"When it comes to flooring at your manufacturing plant or factory, you may be wondering if there is a difference or if the floor type matters. In this article, we evaluate the best types of flooring to help you decide what works best for your business."
260,technology,Futurist: Wandering (and Improving) Tethered Drones (Remotely Operated Vehicles)!,"I am a huge fan of tethered drones - this article talks about some recommendations and considerations, and frankly impages are of two of the tethered drones I've owned!"
261,technology,Why TikTok Accounts Get Deleted & What to Do,TikTok is one of the most famous social network services of the last years. It happens that some accounts on the platform get banned or deleted. This article will uncover the most frequent reasons why does it happen and what to do in this situation.
262,technology,"Elon Musk's Tesla Phone ""Model Pi""",Is Tesla's rumored new 'Model Pi' smartphone capable of functioning on Mars?
263,technology,What Is the Internet of Behaviors (IoB),"Apart from the fascinating facet of technology widely known as progress, the other aspect is acronyms which are equally fascinating. Ranging from the Internet of Things (IoT) to Brain-Computer Interface (BCI), year after year newer terminologies are coined and the list is purportedly endless."
264,technology,The Industry and Human Augmentation,
265,technology,Grocery Shopping Online on a Regular Basis,Shopping at Walmart using my phone...
266,technology,Machine Identity Management Unlocks the New Era of Digital Trust,
267,technology,5 Years Away From Connecting Your Brain to a Computer,"If this phrase sounds crazy, you are not alone. Countless people have said the same thing, but it is a common-sense idea in a few years. The real question is: Do we want our brains connected to computers? This article will challenge your opinion and discuss my thoughts on this."
268,technology,5 Things That Are Easy to Replace on Your Processing Equipment,
269,technology,USB Flash Drive - Using for Photo Storage,"Not enough room on DVD, so now, I use a flash drive..."
270,technology,Is a Website Important for Your Company?,"In this article, I will describe why websites are so important for every company, and I'll also mention the ways you can have a website that is suitable for you with the best budget starting from fairly free to $100k."
271,technology,Futurist: How Long Until We Get the Smart Camera?,"How long utnil we have or get a smart camera in the market? I did a google search for this article. Smart Cameras was the search, it returned security camera images."
272,technology,Why a Toaster Manufactured in 1949 Is Still Smarter Than Any Now on the Market,
273,technology,React Router V6 - The Main Changes,Some of the main upgrades in react router V6
274,technology,Website Development Technologies,"In this article, I will cover many aspects of websites development and how can you be a web developer. Web technologies are incredibly expanding for Front-End & Back-End to Full-Stack development. You will read all about websites once you enter."
275,technology,The Next Generation of Websites Development,"In this article, I will be talking about 3D inside the web apps and the best libraries and programs to work with to achieve a great style within HTML, CSS, Javascript, or even C#."
276,technology,Everything-as-a-Service (XaaS): The Comprehensive Cloud Prototype,The IT market is widely known for its deployment and varied adoptions of the Cloud. There are varied ways of hosting and using services on the cloud platform facilitating a window of opportunity for managing solutions concerning a certain service that one may need.
277,technology,How Will VR Change the Entertainment Industry?,"Virtual reality can change the entertainment industry positively and negatively. The entertainment industry is one of the fields most affected by change, and there are many applications of VR in the area. The future of entertainment depends of the technology, changing it for better or worse."
278,technology,How Will VR Change the Way People Work?,"Virtual reality continues to affect many areas in life. VR is the future of workplaces and will change the way people work and view their jobs. The use of virtual reality at work has positive and negative aspects. Although it might make some time, virtual worlds will become the new offices."
279,technology,What Is a Metaverse? And How Far Are We From It?,This article tries to bring light to the newly coined buzzword called Metaverse and why are companies and people talking about it and how is it going to change the way we use the internet.
280,technology,Futurist: What Technologies I Am Thankful for 2021,
281,technology,Iphone Vs. Android: How to Choose the Best Smartphone for You,"Here are some helpful tips that might help you decide which phone is best for your lifestyle. 
 How much money are you willing to spend on a new cell phone? 
 Which operating system do you prefer? What color would you prefer your phone to be?"
282,technology,7 Ways Mobile Technology Can Be Used To Improve Your Life,"Mobile technology has undoubtedly changed the way we live our lives. The majority of people in developed countries now own a smartphone, and the number is increasing every year. These devices are not just used for talking or texting anymore."
283,technology,Reducing Our Carbon Footprint & Saving Money with Solar Panels and Wall Battery,"Our journey to getting solar panels and wall battery installed in our home, and switching Utility Company to get the best tariffs for importing cheap electricity overnight to recharge our wall battery, and getting paid a good rate for exporting our surplus energy generated by our solar panels."
284,technology,Mega Construction Projects are Underway in the World,"If you want to imagine on future, you may have imagined a glistening metropolis with outrageous architecture and cutting-edge technology. It seems like something out of a science fiction film, yet part of it is actually happening in long-term construction projects all around the world."
285,technology,The Latest Technologies & Trends in E-Commerce Application Development,The retail industry of late has seen massive disruptions causing a seismic shift in consumer behavior. E-commerce has sustained the sector with more people relying on online shopping of groceries and necessity items in times of crisis.
286,technology,Implementing the Strategy Pattern With Java Enums,The strategy pattern solves the problem of selecting an action in response to an input. This note shows how to implement it in Java using the Enum class and relates it to rule based computing.
287,technology,Removing YouTube Dislike Count Is Pointless,"As removing dislike count still leaving content creators prone to dislikes and YouTube have actually added similar feature previously, the decision to remove dislike count is pointless and unnecessary"
288,technology,Why You Should Use Plastic When Manufacturing Your Products,Plastic is a versatile material that can be put to a lot of good uses. Here are some examples of why choosing to make your product out of plastic is a good idea.
289,technology,Futurist: The Rise of the Smartwatch,"Sometimes we need to stop and remember how we got from where we were to where we are. in the 1990s wrist watches were declining. Now in the 2020s, they are a growing market!"
290,technology,Edge Computing vs Cloud Computing: Which is better?,"Edge computing is used to process time-sensitive data, while cloud computing is used to process data that is not time-driven."
291,technology,Internet of Behaviours (IoB) - Everything You Need to Know,The Internet of Behaviours (IoB) is the next big thing in marketing. Get to know how it can impact your career in this article.
292,technology,Air Pollution and Modern Technology to Purify Air,AQI is cause for concern all over the world and the human race will have to address this problem.
293,technology,Why Facebook Sells User's Data to Third Parties,
294,technology,How to Create Your Secure and Productive Hybrid Workforce for 2022,Many enterprises are transitioning to hybrid workplaces. Many others are still procrastinating. This blog is for those organizations
295,technology,Jooki Is The Wireless Screen-Free Portable Music and Story Speaker Made Just For Kids,"The Jooki enables a child to participate, rather than stare at a screen and so foster creativity and independence"
296,technology,Metaverse: Another world in the universe,Metaverse is going to be another world. It will be the world that is virtually present.
297,technology,Beginners Guide to Linux,A brief description about Linux as an operating system to the first time uses and for the people who are trying to seek privacy in their digital lives.
298,technology,A robot playing basketball and another superior in table tennis.. How will artificial intelligence change sports?,It is expected that robots will be able to play all kinds of sports (European)
299,technology,Futurist: What Drove the Rise of the Consumer Device Market?,"Post-WWII the technology market was driven by military and government innovation. It isn't now, why is that?"
300,technology,3D Printer Shopping Checklist: The Ultimate Advice from Our Experts,"There are so many different printers available in the market, it can be pretty overwhelming when shopping for one. So we’ve put together this comprehensive guide with our experts to help you choose a printer that is perfect for your needs!"
301,technology,Fiber Optic vs. Cable For Your Internet,"Which type of internet connection is best for you? In this article, we go through the pros and cons of fiber optic and cable internet so you can make the best decision for your needs."
302,technology,How to Setup a Django Project,
303,technology,What Is Experience Design?,"Experience Design is a story about people, told through their needs, emotions and abilities. Here is your ultimate guide"
304,technology,How Can I Improve My Chances of Business Tech-cess With a VoIP System?,"When you're running a business, communication is super important for your overall success. This topic is covered in detail in this recent episode of the technology podcast ""Techcess""."
305,technology,How to Change Your Wix Website Color Theme for Safari Ios 15,Learn the quick and easy way on how to add any color to Safari iOS 15 address bar for you Wix website.
306,technology,"Between 2021 to 2026, Pi Network In Prediction of Prices",The Valuation of the Pie coin actually looks a lot better than initially thought and for anybody who has no idea. Pi network is a decentralized cryptocurrency platform that allows you to mine Pi from your phone and the whole thing was started by a  couple of Stanford graduates back in 2019.
307,technology,Tribit Earbuds Makes Your Ears Hear Music,The Tribit Flybuds C2 true Wireless Earbuds and the Tribit Flybuds NC Active Noise Cancel True Wireless Earbuds all have their own audio characteristics — making for great sound
308,technology,"Cop26: True Statesmanship, Big Tech, and Going Green","At the UN Climate Change 2021 conference seminar ""Accelerating clean technology, innovation, and deployment"" on Tuesday November 2nd, some big players in tech stepped up to partner with world governments."
309,technology,8 Simple Ways To Strengthen Your Home Office Security,"Cybersecurity is not just a concern for those who work in traditional offices or businesses. It’s a risk everywhere. As more people started working from home last year and continue to work from home now, data breaches and other digital crimes will continue to be a growing threat."
310,technology,Types of Data Storage,Just a quick round up of media and hardware used to store data.
311,technology,Top 3 3D Printers for Home in 2022,What's the best 3d printers for home in 2022? Read on to find out...
312,technology,Ways to Protect Your Factory Floors While Handling Harsh Chemicals,
313,technology,7 Steps to Start the 3D Printing Business,Looking to kickstart your 3D printing hobby into passion. Here are some simple steps
314,technology,What is Kubernetes?,Understand Kubernetes and know how it works
315,technology,What Is Cryptocurrency and How Does It Work?,Cryptocurrency is a virtual currency that you can store online and transfer to another individual or business.
316,technology,Google Adsense and How It's Working,"It was necessary to find a solution for bloggers and writers so that they could invest in their private blogs. Here comes the role of Google, the owner of the Google Adsense program, under the motto ""Turn your passion into earnings"". Let's get to know more about them."
317,technology,Reliable Flooring for Processing Facilities,
318,technology,Why Is TikTok so Addictive & Successful: The Secret of Its Popularity,TikTok is one of the most popular apps of the last years. But what’s the secret of the success of this new social network?
319,technology,How to Implement DevSecOps?,Perfect the digital strategy of the future and gain a competitive advantage over others. Here are some battle-tested strategies to effectively deploy DevSecOps.
320,technology,Top IT Engineering Jobs that Will be Demand in 2022,Looking for a job in the IT Continuum? Here are some top skills that will be in demand in the future
321,technology,Data Science Trends for 2022 and Beyond,Data is the golden ticket to future success. If enterprises will not adapt these data science trends then they will definitely fall behind in the race.
322,technology,The History of the Computer Virus,
323,technology,DVDO’s Air 4K Uncompressed Wireless HDMI Makes Cable Free 4K Video  Real,"Transmitting 4K video and audio wirelessly used to be prohibitively expensive, but worse it didn’t just work right. DVDO’s Air 4K Uncompressed Wireless HDMI takes care of all that and does it in a simple fashion"
324,technology,JBL Tune 110 Wired in Ear Headphones Review and Opinion,"Big sound from a small package. The JBL Tune 110 wired in ear headphones offer a huge bang for the buck. With rich bass and crystal clear highs, these headphones are engineered to JBL's highest standards. Light enough for all day wear, rugged enough to last for years."
325,technology,Retail AI Use Cases for 2021 and Beyond,"Retailers adapting AI technologies will have a clear edge over other laggard counterparts. However, what AI trends will help retailers in gaining the maximum yield? Let’s find out"
326,technology,What Is A Geothermal Energy Source?,"The alternative to geothermal power generation is a ray of hope. By reducing India's dependence on coal, it will help increase the country's energy security and energy self-reliance. It is possible for India to overcome the difficulties."
327,technology,Motorola Moto G Power (2021) Review and Opinion,"The Motorola G Power (2021) is an inexpensive device offering exceptional smartphone features at a reasonable price. This budget-minded smartphone is very capable and includes options found in many higher-priced phones. An excellent camera, sharp styling, and multi-day battery life are just a few."
328,technology,Why Is TikTok so Cringe? Because You Misunderstood It's Real Value,TikTok is one of the most popular apps of the last times. The app is loved by some people while it is getting criticized by others. Is TikTok a good app or do the critics are right?
329,technology,How to Use Advance Number Formatting and Flash Fill?,
330,technology,Top Technology Trends for 2022 and Beyond,The future is now. 2022 is few months away. This is our list of top technology trends that will drive business results for enterprises over the next five years and beyond.
331,technology,Is Becoming TikTok Famous Really Easy or Is That Just an Illusion?,Becoming TikTok famous is the dream of many people who actively use the app. Is that an easy task or fame on TikTok is just an illusion for most people?
332,technology,What Is a Micrometer?,
333,technology,Block Chain and Its Types,Blockchain is a decentralized ledger technology that proposes a novel way to save and track transactional data without the supervision and intervention of a central authority.....
334,technology,An Introduction to Google's Flagship Mobile and Web App Development Tool,"Previously an independent firm, Firebase, is one of Google's recent offerings when it comes to making applications for mobile or website use."
335,technology,Blockchain Use Cases for 2022 & Beyond,Blockchain is a mystery in itself. And so are its potential use cases. Let's evaluate what possibilities will come along with the immutable ledger in 2022
336,technology,Futurist: Thinking About 3d Printers,"3d printers continue to evovle. Yes, they are a Niche Market, but that Niche is growing!!!!"
337,technology,How to Use Alignment Under Home Tab in Microsoft Excel?,"In this article, you will learn what is alignment and how to use in excel for data formatting. This article helps to you in data formatting"
338,technology,Learn Bitcoin Fundamentals in Under 3 Hours,"Udemy online course review on Bitcoin and Blockchain fundamental. Learn about this new technology evolution, how you can implement this in your business domain, and become part of the Blockchain disruption."
339,technology,Top 13 Digital Marketing Trends -- Predictions for 2022 and Beyond,"The digital marketing continuum is converging and diverging to take new forms. The landscape is in a state of flux. However, the changes that took place in 2020 hold enduring lessons of sustainable success for the future. Here are some of the #topdigitalmarketingtrendsfor2022 and beyond"
340,technology,Harnessing Hyperautomation for Business Success,Hyperautomation is a solid use case. It can help industries in reaching tangible business benefits. Here are some use cases.
341,technology,Top 10 Youtube Strategies to Find New Customers,"YouTube being the video marketing giant, unquestionably has the potential to promote your content, business and introduce your website to the masses worldwide."
342,technology,Top 7 Ways To Get More Followers On Instagram,This articles is about to increase followers on instagram.
343,technology,Why It's Better to Rent a Boiler for Your Business Than Own One,
344,technology,"How to remove bloatware from Windows 11,10","Although Windows is a sophisticated operating system, it frequently comes with bloatware. Remove the bloatware and optimize your Windows 11 and 10 by following the step-by-step instructions."
345,technology,Monitor Rentals,
346,technology,Top Ten Dumbest Things People Say on Social Media,"Jesus was a Socialist, human beings evolved from apes, January 6th Capitol Protests an Insurrection, people are born gay, Hitler a Christian, America built on Slavery and Genocide, An unborn baby not a human being, America a Racist Country, A man became a woman, Pro-Life people don't care for babies"
347,technology,Exclusive Guide to Robotic Process Automation,"Robotic Process Automation has been a buzzword recently, but what does it actually mean? In simple terms, Robotic Process Automation means software bots that complete tasks which were earlier done by humans. It is still an unfathomable adobe for many. Here are some of its core concepts"
348,technology,How to Start a Blog as a Beginner,
349,technology,12 Benchmark Best Practices for DevOps Excellence,DevOps benefits can be amplified with some minor hacks. Here are some most common ways.
350,technology,What is Hyperautomation?,Hyperautomation (also called smart automation) is an emerging form of automation technology capable of replacing all functions typically performed by humans in traditional manufacturing processes. It represents the next generation in manufacturing technologies and it has already started
351,technology,What is a Colocation Data Center?,Know the fundamentals and unique advantages of colocation data centers
352,technology,What are Microservices?,What exactly a microservice is and how it differs from traditional monolithic application design. Let's take a deep dive to understand its fundamentals.
353,technology,Motorola Moto G Fast Review and Opinion,The Moto G Fast is a well-designed and inexpensive budget smartphone offering slightly more than basic smartphone features. The Moto G Fast sports a fantastic camera system and shoots 4K video at a reasonable price. I will dig deeper into some of the features that stand out and others that don't.
354,technology,Top Three Reasons to Get a Steam Boiler,"There are many ways to power an industrial plant, and one of those ways is through steam. Here are at least three reasons you should consider switching to a steam boiler as the power source for your processing needs."
355,technology,How to Grow Youtube Channel in 2021,Come friends today with me I will tell you how to grow your youtube channel in 2021
356,technology,Answer this Q&A Checklist to Partner with the Right Programmatic Solution Provider,Enterprises should keep their heads above the water and tread carefully while finalizing the Programmatic Advertising Solution Provider
357,technology,Deep Capabilities that an RTTVPs Platform Should Offer,Looking to partner with a RTTVPs Platform vendor? This checklist can help you make a strategically wise investment
