,category,header,contents
0,technology,Review: Nubia RedMagic 7 Pro,
1,technology,Futurist: How Do We Get to Internet for All?,"The internet was built originally to share information among scientists. What we need now is an internet all can access, freely."
2,technology,How to Create a Website With Google Sites and Connect It With Google Analytics,The article explains how to create a free website with Google Sites and connect it to Google Analytics.
3,technology,1MORE's EVO True Wireless Active Noise Canceling Headphones Are Flagship Quality,Earbuds that are top of the line mean great sound accompanied by greats tech. 1MORE’s EVO True Wireless Active Noise Canceling Headphones goes both routes hard
4,technology,How to Report Spam Texts,"Spam text messages are annoying, but there are ways you can report them."
5,technology,The Top 10 Robotics Software You'll Need for Your Business in 2022,"In a world where more and more automation is becoming prevalent in our daily lives, it's interesting to consider what kind of software development may be happening behind all those closed doors."
6,technology,What are the key differences between Spark and Hadoop?,"Spark and Hadoop are big data frameworks that are extensively used. In this article, the key variations of the technologies have been discussed at length.
When it comes to data processing frameworks for big data architecture Spark and Hadoop are among the most well-known frameworks"
7,technology,Futurist: Machine Intelligence on the Road to Self Awareness,Machine Intelligence (AI) will take our jobs! (Do humans really want the jobs that Robots and MI will take?) But in the end it is all about the moment of awareness. What do we do then?
8,technology,Motivational Sayings Great Ones,"Why examine motivational sayings? For motivation! You may want a bit, if you can use closing year’s listing of dreams this yr due to the fact it’s as correct as new. All of us can gain from inspirational thoughts, so right here are ten wonderful ones."
9,technology,5 Reasons Why the Fire TV Stick 4k Is the Top Streaming Device on Amazon,"The Fire TV Stick 4K has quickly become the top streaming device on Amazon. It offers a great mix of features, performance, and value. But is it the right 4K streaming device for you? Read on to find out."
10,technology,The Anker PowerConf H700 AI-Powered Wireless Headset Lets You Talk And Listen,A headset that mitigates noise and lets you talk with ease and has software and charges fast and more….that’s Anker’s PowerConf H700 headset for sure
11,technology,Four Gadgets that will Enhance Your Cycling Experience,"Friends, through this article of today, we are going to tell you about the gadgets and benefits of cycling while cycling, so friends, read this article carefully and learn about the four best cycling gadgets. And if you want to buy gadgets then I have also given them a link in the content..."
12,technology,The Wonders of Hypertext Markup Language (HTML)---Part I,"It is impossible not to follow in the footsteps of all the good-hearted people the world over, dead or alive, who have contributed or still contribute toward making the world a better place than they met it. Sir Tim Bernes-Lee, the inventor of the World Wide Web (WWW), is one of those great minds."
13,technology,Headphones On and World Off With Happy Plugs Air 1 ANC True Wireless Earbuds,The Happy Plugs Air 1 ANC True Wireless Earbuds gives you options for how you hear the sound and how you look wearing them
14,technology,Futurist: What Is the Current Value of 5g?,"A very quick survey of short term, available now benefits for a 5g network. The list is growing, and i haven't shared all of them!"
15,technology,Can Google Play Cards Be Used on iPhone? Yes: Here’s How,Google Play cards can be used to purchase digital content on Android devices. Can iPhone users benefit too from these gift cards? The answer is not as obvious as many may believe and this article is going to explain the reason why.
16,technology,Is Crypto Trading More Profitable Than Forex Trading,"Trading in cryptocurrencies has grown in popularity in recent years, becoming increasingly mainstream as we witness a ""digital"" gold rush of new technology and creativity."
17,technology,Technology to Make Your Life Easier,
18,technology,Radiation Hates A Case If It’s SafeSleeve’s Detachable For iPhone 13 Pro Max Or  Antimicrobial for iPhone 12 Mini,The SafeSleeve Detachable For iPhone 13 Pro Max Or Antimicrobial for iPhone 12 Mini both provide radiation and RFID protection in an attractive case
19,technology,The PUNKT MPO2 4G LTE Mobile Phone Is A Pleasant Way To Talk,"A phone made for communication is as smart as it needs to be, so that’s why the PUNKT MPO2 4G LTE Mobile Phone is made against the whole “smartphone” point of way"
20,technology,Steps to Automating Your Production Plant,
21,technology,Benefits of SaaS-Based App Development Services,A number of brands are adapting mobile SaaS. Mobile SaaS is helping a wide range of businesses enhance user engagement and their real-time users and cut their business process costs.
22,technology,"Wireframe, Design Sketch and Prototype - What's the Difference?","A web app design needs a wireframe, design sketch, and prototype, so it isn't easy to differentiate them. But, here, we have tried to enlist some of them. Read now!"
23,technology,"Istiqlal, Eco-Friendly Mosque and Energy Saving Religious Building","Istiqlal, the biggest mosque in Southeast Asia, has got its appreciation this year as an Excellence in Design for Greater Efficiencies (EDGE) awarded by International Finance Corporation (IFC) as the first green religious building. It's a good step in creating new Indonesian Islam for energy freedom"
24,technology,A Summary of Computer File Sharing,This article discusses computer file-sharing in a listicle format.
25,technology,A Beginner's Guide to the Dark Web,"Do you want to know what the dark web is? It can be a scary place, but it's also an interesting one. In this hub, we will provide a beginner's guide to the dark web. We will explain what it is, how to access it, and some of the things that you can find there. Stay safe out there!"
26,technology,Planetary threat internet defense with celestial mass detector,Planetary defense strategy for threats of celestial body impacts and new use for useless junks/garbage orbiting Earth.
27,technology,8 Ways to Protect Yourself from Hackers: Tips for Staying Safe Online,"We've all heard the horror stories about people's online identities being stolen or their bank accounts being hacked. Luckily, there are steps you can take to protect yourself from hackers and stay safe online. Here are eight tips to get you started!"
28,technology,A Cybercriminal's Pastime,This article discusses data theft and mitigation methods.
29,technology,How Accurate Is A Death Clock Website?,"Have you ever been curious to know exactly when you're going to die?  There are various websites that allow you to obtain a suggested date and time that you will be taking your last breath.  To some, this idea sounds creepy.  However, to others, curiosity killed the cat.  Pardon the pun."
30,technology,Why is Python Popular Among Data Scientists?,"Python may be quite popular as you can use it in a range of projects but would you consider Python for projects related to data science?   
The well-known advanced programming language Python is primarily used in artificial intelligence, web development, automation, and data science projects."
31,technology,How to Retrieve Microsoft Authenticator in Case of Lost Phone,"Microsoft Authenticator, one of the most popular alternatives to Google Authenticator, is an app that allows to generate temporary codes for accounts protected by multi-factor authentication. This article is going to show how to deal with the loss of codes in case your phone gets stolen or lost."
32,technology,23 Legit Apps That You Should Know,"There are so many fake apps that will promise to pay you but they could not pay you. That why here in this article, there are 23 legit apps that you should know and try them."
33,technology,I Just Discovered Ko-Fi and I Like It!,Ko-Fi seems like a fun site for artists! It's sort of a hybrid of Facebook and a blog hosting site.
34,technology,"How Innovative Technologies: Blockchain, Cloud Computing, and Cryptocurrencies Are Affecting Our Lives.","Blockchain and Cloud Computing are two of the most common and famous on-demand technologies changing various aspects of our lives today. Blockchain is reordering the world through technology.
The sought-after Bitcoin/Cryptocurrency is a digital form of exchange and an offshoot of Blockchain."
35,technology,What is Data Engineering and the Important Skills of Becoming a Data Engineer?,"Broadly, data science and data engineering complement each other for optimal utilization of unstructured and raw data. Data scientists and data engineers, in turn, complement each other as well in building pipelines transforming the format of the raw data that data scientists can use."
36,technology,What Is the Future for Bitcoin? Should You Invest in It?,What is the blockchain and how much will Bitcoin’s value be? What are the other Crypto Currencies to keep an eye on? Click here to know it all!
37,technology,Futurist: Let's Make Global Education Better!,"I have long had a passion for education. For helping, schools built the young minds of tomorrow. We could, with a little effort, make schools powerful tools in the future!"
38,technology,How to Grow Your Audience on Twitter,Want to know how to build your own twitter community and keep your audience engaged? Follow these 7 sure and trusted steps to make it happen.
39,technology,The True Meaning of TikTok Logo: It's Not a Musical Note,"TikTok is one of the most common social networks for sharing short musical videos. What is less common is the true meaning of its logo, which is not a musical note. So, what is the meaning of TikTok Logo? You will find the answer here."
40,technology,The IRIScan Desk 6 Business Document Scanner Does It All,"Need to scan flat art and documents, books, etc. — then you need the IRIScan Desk 6 Business Document Scanner because the hardware and software makes it a breeze to scan whatever you want"
41,technology,Beginners Guide to SEO and Doing It Yourself.,"So you've finally finished your amazing website, you are uploading regular content, and social media promotion is on point – but why is your amazing and polished business website not getting the traction it so rightfully deserves."
42,technology,The ZIKE 2-in-1 MagSafe Wireless Charger Is Both Fast and Cool,A fast iPhone charger could cause more heat to the phone that is good for the electronics — the ZIKE 2-in-1 MagSafe Wireless Charger brings a cooling breeze to help obviate that
43,technology,What Is Metal Fabrication and How Is It Done?,
44,technology,How to Factory Reset Your iPhone and When You Should Do It,Factory resetting your iPhone means bringing it back to like when it was turned on the first time. This article is going to show you how to do it and when you may do this.
45,technology,Futurist: What Would You Take With You on a Trip to Mars? or Perhaps I Should Ask What You Would Truly Need With You?,"What would you take? I used to ask 2nd graders that question and got some pretty amazing answers. What would you take for a three years trip, knowing you couldn't stop and buy missing things when you got there?"
46,technology,How to Easily Delete Your Microsoft Account,Microsoft provides several services you can easily access through an account. Only in case you don’t need these services you may choose to delete this account. This article is going to guide you through this process.
47,technology,Noteworthy Efforts to Tackle Plastic Pollution,These environment-friendly solutions may help to alleviate the plastic dilemma
48,technology,Anker’s Powerconf C200 2K HD Webcam Puts out a Lot of View for Little Cost,A compact and full featured webcam that provides a 2K high-def image and has stereo mics and embedded tech to make the video look good? That’s what you get with Anker’s PowerConf C200 2K HD Webcam
49,technology,Internet - Making Switch from Jetpack to DSL,"I live in a heavily forested yard, and it interferes with my internet, until now..."
50,technology,1MORE’s PistonBuds Pro True Wireless Is Affordable High Tech Earbuds,The PistonBuds Pro True Wireless is high technology built into a compact and affordable form
51,technology,Beginners Guide for Google Analytics 4 or GA4: How to Setup for Optimum Result,"Google Analytics 4 or GA4 is a new type of Google Analytics that promises to be more helpful for businesses. It uses machine learning and artificial intelligence to collect and analyze data. In this article, we will discuss how to setup GA4 and how to use it to your advantage."
52,technology,How Many Reports to Delete an Instagram Account?,"Some people may face the issue of having their photos hit by flood reports made by other people, because of jealousy or other reasons. Should you worry about this situation and, in case, how many reports to delete an Instagram account? This article is going to explain this aspect of Instagram."
53,technology,How to Cancel Amazon Prime & Why You May Want to Do It,"Amazon Prime is a convenient membership that gives their users some advantages. Still, you may not need it forever or you don't make enough purchases to make it a convenient choice. This article is going to show how to cancel Amazon Prime in case you do not need it anymore."
54,technology,Phishing Scam Awareness,This article discusses common techniques used by cybercriminals for obtaining private information.
55,technology,Android Security Flaws Discovered: What You Can Do,This article discusses Android security flaws discovered in 2021 and what can be done to mitigate the risk.
56,technology,IT Security in the Cloud,This article discusses some computer security options available as software via internet-based subscription services.
57,technology,An Overview of Cybercrime,This article is a short overview and definition of cybercrime.
58,technology,How to Recognize Facebook TV Scams,They are all over Facebook—those LCD TV deals that cost no more than $99. Here's how you can determine if an ad is the real deal or a scam?
59,technology,How to Cancel a Subscription on iPhone,
60,technology,What Happens When You Follow Someone on Facebook,Facebook is one of the most used social networks ever. It allows people to connect each other with friendships and followings. This article is going to explain the difference between adding someone as a friend or following them.
61,technology,What Happens When You Force Stop an App and Why This Won’t Save Your Battery,Force stopping apps on a smartphone is considered an effective way to save battery. The reality is different and this article is going to explain the reason.
62,technology,What Tools Are Needed for 5G mmWave Testing?,
63,technology,Pixel 6 and 5g Upgrade From 3a and 4g,Well. It's supposed to be easy to change phones...
64,technology,What Happens When You Archive an Instagram Post,Instagram allows people to archive their posts. This article is going to explain what does it mean and how you can use this feature.
65,technology,TRXmining : The Next Decentralized Finance Hub,
66,technology,Apple AirPods Pro Review,"The Apple AirPods are compatible with all iOS devices, but the new version also has some great features for iPhone users.  It includes a transparent mode that lets you listen to music in a more natural way. The stem is now functional, too, and it allows you to pause your music and take phone calls."
67,technology,How To Recover Photos From Your Phone Gallery,"Your phone may be a great place where to store your picture, but what happens when it gets lost, stolen or damaged? This article is going to give advices in order to ensure the safety of your photos on your device."
68,technology,"In-House vs Outsourcing Software Development Is Sometimes Confusing for Many Software Houses, to Choose Between Them","In-house VS outsourcing software development is sometimes confusing for many software houses, to choose between them."
69,technology,What Is the Dark Web and Why Isn't It as Bad as You Think,"You may have heard of the Dark Web. You may have heard of the people who's lives have been ruined. You may have heard of the people who's lives have ended. In this article, I will break down exactly what the Dark Web is, how it works, and why we can't stop it. Some things may surprise you."
70,technology,Futurist: Looking Over the Horizon and Considering Options for 5g and Wi-Fi.,"I call them wanders, where I start out thinking about a problem and wander around its impact. This is what is coming in terms of connectivity wander."
71,technology,Let's Summarize DevOps!,Understanding the purpose of DevOps.
72,technology,OSS Full Form & BSS Full Form: What Is The Full Form and Meaning Of OSS & BSS?,"OSS stands for Operations Support System, while BSS stands for Business Support System. These two enable service providers to support and extend operations to improve business services. Learn how OSS and BSS developed and what they do."
73,technology,10 Advantages of Social Media for Youth,Social media is very important to teenagers because it helps them to connect with others. It also gives them a chance to express themselves
74,technology,The Moonbounce Virus and Evolving Computer Security Threats,This article discusses the Moonbounce virus discovered in 2021 and evolving security threats.
75,technology,Why It's Important to Build Pathways on Your Construction Site,
76,technology,Impacts of Technology on Mental Health,Impacts of technology on Mental Health is an argumentative essay. The increasing demand for technology leads to technological webs. Technology acts as a double edge-sword in promoting and reducing cybercrimes or cyberbullying.
77,technology,Virtual Reality: A Simple (But Complete) Guide,"Virtual Reality (VR) witnessed tremendous growth in the past few years. This technology has the potential to change our lives, the way we socialize, and the way we work."
78,technology,Your New Laptop Computer Is a Lemon: Here's Why,This article discusses why some new laptops don't seem to run optimally and what can be done about it.
79,technology,The T-Mobile Data Breach of 2021 and Implications,This is a listicle article discussing commonly overlooked factors relating to computer security.
80,technology,Desktop PC review: HP EliteDesktop 800 G1 Small Form Factor,The HP EliteDesktop 800 G1 Small Form Factor desktop is an office PC that is used for office work and some light gaming if you buy one with a graphics card pre-installed into it.  Does the desktop work well for office work?  Is this desktop PC worth your time and money?  Let's find out!
81,technology,How to Avoid Mistakes and Hire an Expert Laravel Developer for Your Project,"Over the last couple of years, PHP has been constantly gaining in popularity. Therefore it is not surprising that most businesses worldwide seek to hire Laravel Developers India being their preferred destination."
82,technology,The ComfoBuds Mini True Wireless Earbuds Are Tiny Powerful Sound,1MORE's ComfoBud Mini True Wireless Earbuds bring all the audio desired features to a small form factor
83,technology,REvil Ransomware and Its Implications,This article highlights a new type of computer virus that is undetectable by traditional antivirus software.
84,technology,Mysql Database User Management and Permissions,
85,technology,Power-on Issues: Desktop Computer Troubleshooting Guide,This is a guide for troubleshooting startup problems in desktop computers.
86,technology,Virus Removal Guide for Windows,This is a simple guide for removing malicious software from Microsoft Windows.
87,technology,The Future of Web 3.0 in 2023,"Web 3.0 is the future of the Internet, where all information and digital assets are decentralized, and users are in control. This article explores what 2023 will look like for Web 3.0."
88,technology,Goonzquad: The Two Ukrainian American Brothers From Tennessee who are Setting YouTube on Fire,"These two young Ukrainian brothers from Tennessee have taken YouTube by storm. With their creativity and skills, they have welcomed themselves into millions of living rooms around the world. With the creation of their Goonzquad channel, they continue to create viral videos every week."
89,technology,HubPages Cons Plus My Blogger Blog Can Monetize Better,Earn more money when you Monetize your content on a more open platform like Blogger or WordPress. Community writing sites that share ad revenue with you are holding you back from earning. Limiting your content from having affiliate links unless the link has been approved is just one example.
90,technology,Desktop and Laptop Computer Performance Tips,This is a listicle article about common computer issues mitigated relatively easily.
91,technology,Computer Network Guide for Aspiring Entrepreneurs,This is an overview of basic computer network topology. Entrepreneurs planning to use computers in their businesses can benefit from it.
92,technology,UPI Full Form: What Is UPI Full-Form & Its Meaning In Banking?,"If your business processes a high volume of transactions, then you need to be using the Unified Payment Interface (UPI). UPI applications are quick, simple to utilize, and secure. Figure out how to get everything rolling with the UPI in this blog."
93,technology,Spam Account Emails - Slimy Spammers Demand Ransom,Their solution is for me to quietly pay them to keep quiet....this is where we laugh together.
94,technology,How To Mint NFT Art For Free At Opensea,"Learn how to mint your first digital NFT, for free, at the popular Ethereum powered marketplace Opensea."
95,technology,Six Thing To Remember Before Choosing A Perfect Hosting Company.,"Photo

Text
Once you have decided to start your blog or launch a website now the next step is of course to select a perfect hosting company for your website/blog. Though it sounds quite challenging to select a perfect hosting but not an impossible task."
96,technology,Agile and DevOps- The Distant Cousins,
97,technology,OTT Full Form: What Is the Full Form of OTT in Cinema?,"Would you like to know, What Does OTT Stand For? Here, we will find out about the full-form of OTT in cinema, not just this you will likewise come to know the Meaning of OTT in Different Categories? All in all, you should peruse this post till the end."
98,technology,Artificial Intelligence Is More Than a Program,
99,technology,A Comprehensive Guide to SAAS,"SAAS applications are currently limited to on-premise software and mainly focus on sales, procurement, collaboration, and communication."
100,technology,The Attack of the Scraper Bots! (Stolen Online Content),"No matter what type of online writing you do, if it has any quality at all it is always in danger of being stolen as content for other websites and blogs. the most insidious of all theft involves the dreaded scraper bots."
101,technology,What Is Dairy Brick and Why Should You Use It,
102,technology,Futurist: A Brief Survey of AR and VR,"AR and VR and including Machine Intelligence, will have a huge impact on the world around us. But in the end, it is all about the connection!"
103,technology,AKASO Brave 8 Action Camera Review,The AKASO Brave 8 proves to be a polished upgrade in every possible way.
104,technology,How to Remove Background Using Microsoft PowerPoint,Sometimes we want to take a picture and put in onto other backgrounds to be more presentable for the type of content we want. There are a lot of softwares for this job. This article teaches how to Use Powerpoint in order to accomplish this job.
105,technology,Pet Peeves While Using the Phone,"Since 1959, I have used rotary, touchtone, cell, and smartphones in both the United States and Thailand.  During this time, I have encountered many annoyances while on the phone and around people using one.  In this article, I list my pet peeves while using the phone."
106,technology,10 Super-Duper Unique Tech Gadgets in This Year You Have Must,"Good day, everyone! This article provides you with up-to-date information about new technology that will undoubtedly make your life easier. I'll show you ten incredible gadgets that you should have on hand. Guys, believe me when I say that you'll fall in love with these gadgets."
107,technology,What Is Netflix and How It Works?,"Netflix revolutionized the way we view television, and has since gone on to become one of the leading streaming services in the world. With Netflix, you have access to thousands of movies and TV shows, all at your fingertips!"
108,technology,The Difference Between Traditional Welding and Orbital Welding,
109,technology,Wall-E That Paints,An Insight On Fascinating World Of Painter Robots
110,technology,Rules for the Development and Creation of Programs,"The software itself is the set of instructions or programs. If you’re into programming, then follow these rules to bring a major transformation to your work."
111,technology,Now These 10 New Features Are Going to Be Available on Whatsapp Soon,"Hello friends, today we are going to talk about 10 new upcoming features of WhatsApp. So read the full article and know in detail about 10 new features of WhatsApp."
112,technology,Futuristic Renewable Energy: The Solar Power Satellite,"Just to keep this article crisp and interesting, instead of covering the whole Space-Based Solar Power (SBSP) concept, I will only focus on the satellite, its implications on the usage of the solar energy and its advantages."
113,technology,Qualities of a Good Custom Web Development Company?,
114,technology,Brain Storage Capacity and the Future of Intelligent Life on Earth,How can brain chips enhance brain capacity and make a longer life possible
