,category,header,contents
271,entertainment,Gold Diggers of 1933 a Powerful Statement of Its Time,During the Great Depression a group of eager actors makes a statement about the times in which they live.  They have fun and score a big hit.
272,entertainment,Rock Star's Autobiography Is Some Fantastic Book,
273,entertainment,"Synth Single Review: ""Mater Noctis"" by Dark Side of Synth","Read on to learn how ""Mater Noctis"" mingles deep emotion with powerful background energy."
274,entertainment,"1969 Panasonic Silverlake Television, Tr-339r Tv & Am Fm Radio 3 in 1 Transistor Solid-State.",1969 Panasonic Silverlake TR-339R TV & AM FM Radio was a Transistor Television made in Japan during the age of quality and space age design. Because in 1969 Panasonic give you more sets to choose from than anyone else.
275,entertainment,Video Rewind: A Star Is Born (Twice),The rise and struggles of a starlet when thrust into an adoring public which spawned three remakes.
276,entertainment,"Synth Album Review: ""Primewave"" by OtherWorldRio","Read on to find out why I feel ""Primewave"" is a synth-based album overflowing with a luscious mixture of fascinating sounds, intriguing auditory imagery and a feeling of freshness."
277,entertainment,Is Matt Reeves' Batman Worth Watching?,My honest review on Matt Reeves' cinematography and storytelling of Batman.
278,entertainment,The Night Stalker Movies and Series,"The Night Stalker received the highest Nielsen rating for an original TV movie. This sparked the TV movie sequel The Night Strangler, and a TV series Kolchak: The Night Stalker. This article contains spoilers for the movies and series episodes."
279,entertainment,Why the Power of the Dog Will Definitely Win Best Picture,"The Oscars are happening this Sunday, witch means the myself and the two people who still watch the Oscars have one question on our minds. What movie will win the big prize, aka Best Picture?"
280,entertainment,Gay and Can't Dress? Here's Why,"For most of us, stepping into society looking like what the cat dropped has never been a problem. And here's why."
281,entertainment,How to Be Queer and Closeted in an Homophobic Country,Just queer codes from one community member to another. Hey!
282,entertainment,Master (2022) Movie Review,"This Master (2022) Review Is Retsam Spelled Backwards! Starring Regina Hall, Regina Doorway, and Zoe Renee! Directed by Mariama Dialla!"
283,entertainment,General Hospital: Spoilers and Fans Believe Luke Is Alive and Working With Jennifer Smith,"In spite of what has transpired on screen and statements from Anthony Geary.the storyline seems to be giving false hope,"
284,entertainment,Physical Media and Blu-Ray,"Blu-rays are some of the most collectable physical media items available on the open market right now, and it might be interesting for some to dive into this phenomenon and find out why these discs are so great to obtain and own."
285,entertainment,“The Adam Project” (2022) Review: The Good and The Bad,"The Adam Project sees time-travelling fighter pilot Adam Reed (Ryan Reynolds) accidentally crash-land in 2022, where he meets with his 12-year-old self, who was played brilliantly by Walker Scobell. Now they both need to team up to save the future."
286,entertainment,Should I Watch..? 'Alien Resurrection' (1997),It's often sad to see how a once-great franchise stumbles on in the quest for ever diminishing box office returns. Benjamin Cox tries to scream in frustration in space but can't.
287,entertainment,Disaster Porn Saturday Night: Tornado!,"Before Twister, there was Tornado! which hit television screens before the blockbuster movie hit the movie houses"
288,entertainment,"Synth Single Review: ""Sirens and Screams"" by Chypriann","Read on to learn about why I feel that ""Sirens And Screams"" is thick with fear and darkness pouring from its interwoven synth sounds."
289,entertainment,"Synth Single Review: ""Survive"" by Beautiful Machines","Read on to learn why I feel that ""Survive"" is a song full of surging energy and a message about struggling to make it through."
290,entertainment,"Synth Single Review: ""The Station"" by Eric C. Powell & Andrea Powell","Read on to find out about the themes of love and absence in ""The Station."""
291,entertainment,"Review of the Album ""Common Sense"" by Costa Rica’s Thrash Metal Band Chemicide",Common Sense is the 4th studio album released by Costa Rican thrash metal band Chemicide.
292,entertainment,Music with Audio Engineering: Kid Reign along with Selections of the Day,What is the art picture of the day? What is the song of the day?
293,entertainment,Friday Film Fest: Rosie O'Donnell,"From Peach to Socialite, Rosie plays them well"
294,entertainment,Scream (2022): Cash Grab or Fun Slasher?,"A cause of much controversy, let's delve into the new Scream movie and look at what was done well, and what was done...not so well."
295,entertainment,The Batman (2022) Movie Review,"The Batman is alright in parts but in others, it is dumb annoying especially certain scenes and characters, and a little stupid, and Bruce Waye seems poorly written."
296,entertainment,Stop This Listening Habit Now!,
297,entertainment,"Synth Single Review: ""Oneironaut"" by Die, Miami, Die!","Read on to learn why I feel that ""Oneironaut"" is a gliding synth journey propelled by active bass and driving drums."
298,entertainment,"Synth EP Review: ""Contact"" by Sonic Gap","Read on to learn about how ""Contact"" evokes the high strangeness that might be associated with an extraterrestrial contact event through experimental modular synth sounds."
299,entertainment,"""The Ellen Degeneres Show"" Reveals Date of Last Show With Michelle Obama and Special Guests","""The Ellen Degeneres Show"" announces date of the last show with special guests including former First Lady Michelle Obama."
300,entertainment,Should I Watch..? 'Bridget Jones: The Edge of Reason' (2004),"The first film, while not exactly a classic, certainly had its fans. This second outing, however, completely botches the job and nearly killed the franchise on the spot. Benjamin Cox pleads for mercy."
301,entertainment,The Complete Biography of Cassandra Harris (Part 2),The 2nd installment of the most complete biography of actress and model Cassandra Harris (the original Mrs. Pierce Brosnan) online.
302,entertainment,A Tribute to Japanese Actress and Former Akb48 Member Rina Kawaei,"Rina Kawaei is an actress, author, and former member of the famous Japanese pop music group AKB48 that has endured adversity but she has gone past that adversity to become a successful celebrity that people should look up to as a role model."
303,entertainment,"Septicflesh, ""The Great Mass"" Album Review",The Great Mass is the sensational 2011 studio album by Greek symphonic death metal band Septicflesh.
304,entertainment,The Universe Revolves Around My Russia and Ukraine Knowledge,Short-form satire directed at pseudo war experts
305,entertainment,Should I Watch..? 'Sunset Boulevard' (1950),"Billy Wilder's classic film noir isn't just one of the best examples of the genre but also one of the very best films about Hollywood itself. And unlike Benjamin Cox, it's not showing its age in any way at all."
306,entertainment,"Should I Watch..? 'Aguirre, the Wrath of God' (1972)",Werner Herzog's best known feature film is an assault on your expectations as well as your senses. But try not to watch it if you're feeling a little low as Benjamin Cox now explains.
307,entertainment,"What It Was Like to Have Met and Commissioned 3 Songs From Indie Rock Music Legend, Max Bemis","In 2022, I met Max Bemis of the band, Say Anything, and through his program, Song Stream, had my third song commissioned. I believe that as the world becomes increasingly interconnected, more opportunities will arise for fans to interact with their favorite artists and performers."
308,entertainment,Is 4*Town a Real Band? Will They Continue After 'Turning Red'?,"Is the boy band in 'Turning Red,' Pixar's new animated coming-of-age film directed by Domee Shi, real? Who are the members of 4*Town?"
309,entertainment,This Is England (2006): Revisited 16 Years On,Revisiting This Is England 16 Years on
310,entertainment,March To 17 Of the Best Music Artists With Some Form of the Name Pat,
311,entertainment,"Synth Single Review: ""Kung Fu"" by Swayze","Read on to learn why I think ""Kung Fu"" is a theatrical, hyperactive synth romp."
312,entertainment,"Synth Single Review: ""Streets of Thunder"" by L'Avenue","Read on to learn why I feel that ""Streets Of Thunder"" is a cinematic, richly interlocking synth journey which creates strong imagery."
313,entertainment,Attack On Titan Season 3 Part 2 Review,"My review of Attack On Titan Season 3, Part 2..."
314,entertainment,Hallmark Actor: Chris McNally,"You might think you know all there is to know about Chris McNally. However, there is bound to be something you don't know about the talented actor. For instance, did you know he auditioned for two parts on ""When Calls the Hearts""?"
315,entertainment,"Darkwave Single Review: ""Cauchemar Noir"" by Draven","Read on to learn about ""Cauchemar Noir's"" full-on, terrorizing synth assault that ferociously batters the senses with dark power."
316,entertainment,"Synth Album Review: ""Do Or Die"" by Russell Nash","Read on to learn why I feel that ""Do Or Die"" erupts with classic synth energy and melodic power."
317,entertainment,"Review of the Album ""All Hell Breaks Loose"" by German Thrash Metal Band Destruction",All Hell Breaks Loose is the 6th studio album by German Thrash Metal band Destruction. It marks the triumphant return of original bassist and vocalist Marcel Schirmer.
318,entertainment,What Are The Instruments in an Orchestra?,"When you go to an orchestra concert can you identify the instruments? Can you name the different sections? Most people can't! In this article, we will answer the question - What Are The Instruments in an Orchestra? Read further and learn the names and sounds that an orchestra can produce."
319,entertainment,"The 5 most talked-about topics at the Baftas in 2022, from Putin jokes to jabs at JK Rowling",
320,entertainment,4 Lesser-Known Kaiju That Need a Comeback,"Godzilla is hardly the only kaiju, there are a number of others that could use a good return. I intend on listing a few of them."
321,entertainment,Hallmark Actress: Erin Krakow,Erin Krakow is a familiar face on the Hallmark Channel.
322,entertainment,General Hospital: Nicholas Alexander Chaves Updates Fans About His New Role,The actor shares how his Tubi project affects portraying Spencer Cassadine
323,entertainment,"Experimental Music Review: ""Victor Gloriosa"" by Armageddon Speaking","Read on to learn about why i feel that ""Victor Gloriosa"" is a sonic exploration of interacting tonal, timbral and textural elements."
324,entertainment,Should I Watch..? 'The Hidden Fortress' (1958),"Even when he is in crowd-pleasing mode, Akira Kurosawa's historical comic adventure would prove to be hugely influential to a young George Lucas, making it one of the most important films ever made. So why hasn't it the same stature as his more famous films?"
325,entertainment,Turning Red Over Theft,"What do Turning Red, Shrek, Sailor Moon and the video game Darkstalkers all have in common? Plenty, but Pixar and Disney don't want you to know that."
326,entertainment,The Complete Biography of Cassandra Harris (Part 1),"The most complete biography of the actress and model Cassandra Harris (the original ""Mrs. Pierce Brosnan"") online."
327,entertainment,The Heart Swindlers: How Simon Leviev and Anna Delvey Romantic Comedy Film Could Work,
328,entertainment,First Impression of Jujutsu Kaisen,My first impression on the immensely hyped Jujutsu Kaisen
329,entertainment,The Seed (2021) Movie Review,"This Seed (2021) Review Will Need Your Steed To Feed! Starring Lucy Martin, Chelsea “Over The” Edge, and Batman! Directed by Sam “Run Don’t” Walker"
330,entertainment,"Review of the Album ""Voices From the Void"" by Blackened a Very Good French Death and Thrash Metal Band",Voices from the Void is the very good second album from Paris France based death and thrash metal band Blackened released in February 2022.
331,entertainment,Popeye the Sailor: How It All Began,Fun facts about the beloved cartoon character.
332,entertainment,Disaster Porn Saturday Night: Fire!,Another all star Irwin Allen movie that limps along
333,entertainment,Hallmark Actress: Cindy Busby,"You have seen Cindy Busby on the Hallmark Channel, but find out some interesting things about the talented actress who has now moved over to the GAC Family Channel."
334,entertainment,"""The Adam Project"" Movie Review","I did not expect the amazing film I just witnessed. Wow, the critics bashing this film need chest compressions because their hearts have obviously stopped working. I give the film a 4 out of 4."
335,entertainment,Perfect Time of the Year To Revisit Jim Peterik and The Ides of March,
336,entertainment,"Synth Single Review: ""Heart and Soul"" by Ash Electric","Read on to discover how ""Heart and Soul"" exudes melodic joy and uplifting emotion."
337,entertainment,"Synth Single Review: ""Midnight Run"" by Runaway Droid","Read on to learn how ""Midnight Run"" conveys the feeling of a fast car speeding through neon-lit streets."
338,entertainment,"Synth Single Review: ""Red Rock Ridge"" by Karl Vincent","Read on to learn why I think that ""Red Rock Ridge"" seethes with explosive energy and unfolds in a guitar-driven rush."
339,entertainment,"Synth Single Review: ""Life"" by Klurig","Read on to learn why I feel that ""Life"" thrums with energy and overflows with melodic warmth."
340,entertainment,Friday Film Fest: Duane Boutte,"Even though he's known primarily for stage work, Duane Boutte is a force to watch when it comes to independent movies. In each of these picks, you can see just how versatile he is and fans of Sex and the City may remember him as Stanford's one time boyfriend in the last episode of Season 1."
341,entertainment,"Electronic Music Album: ""The Awakening"" by Helefonix","Read on to learn why I feel that ""The Awakening"" is musically complex, emotionally affecting and full of a deep, abiding sense of humanity."
342,entertainment,Sami Yusuf — A Promoter of Global Peace and Harmony,"This article is dedicated to Sami Yusuf. He is a well-known Muslim musician and singer. He was appointed by the United Nations as UN World Ambassador Against Hunger and Promoter of Global Harmony and Peace. The Guardian called him ""the biggest British star in the Middle East."""
343,entertainment,6 Live Action Batmans in Alphabetical Order!,"When You Can’t Alphabetize Your Bale From Your Pattinson, This List Will Save Your Life And The Lives of Others! Starring Batman And Young Wards!"
344,entertainment,"Synth EP Review: ""Signal Loss"" by Game Genie Sokolov","Read on to learn about how ""Signal Loss"" explores FM synth tones and timbres with richly layered sounds and a distinct retro VGM sensibility."
345,entertainment,"Rock Single Review: ""Anthem X"" by John Denton","Read on to learn about why I feel that ""Anthem X"" is a confident rock song from a talented young artist."
346,entertainment,10 Beautiful Movies About Flowers,"Are you looking for movies about flowers? Then you have to check out our top 10 list flower based movies, perfect for anyone obsessed with anything floral."
347,entertainment,Sebastian Bach: Still Quiet,"Sebastian Bach, who was loved by all the girls who listened to rock for a while, and one of the leading icons of the rocker movement with long hair with perm, is now in his maturity period. The album ""Give 'Em Hell"", the last product of this period, is in smoke..."
348,entertainment,"Synth Single Review: ""Midnight Rush"" by GeoVoc","Read on to find out how ""Midnight Rush"" explores the desire to rekindle youthful dreams and emotions."
349,entertainment,"Synth Album Review: ""Sacred Order"" by Terrordyne","Read on to learn how ""Sacred Order"" creates hellish synthscapes that surge with shadowy power and fill the listener with unsettling feelings of dread and tension."
350,entertainment,Hallmark Actor: Aaron O'Connell,"Aaron O'Connell is best known for the now-canceled Tyler Perry's show, ""The Haves and the Have Nots."" However, O'Connell has appeared in two Hallmark Christmas movies."
351,entertainment,"""AeroVederci Baby!"" - Aerosmith","One of the biggest band in rock music, made a farewell tour in 2016 called ""AeroVederci Baby!"" . And the fans have been still wating for the tour and album news with hope."
352,entertainment,"""Deceivers"", The Best Arch Enemy Album Ever?","Arch Enemy, Swedish Melodic Death Metal band, will release their new album on July."
353,entertainment,"Review of the Album ""Terror Squad"" by Artillery Perhaps Denmark’s Best Thrash Metal Band",Terror Squad is the 1987 studio album by Danish thrash metal band Artillery.
354,entertainment,"Review: Dababy and Youngboy Never Broke Again's Mixtape, ""Better Than You""","North Carolina rapper DaBaby and Louisiana's YoungBoy Never Broke Again come together to release their collaborative mixtape, 'Better Than You'..."
355,entertainment,Here Come The Supergirls Star Girl The Complete Second Season and Supergirl The Sixth and Final Season,Star Girl ano Supergirl come to Blu-ray with Star Girl The Complete Second Season and Supergirl The Sixth and Final Season
356,entertainment,"Synth Single Review: ""Exodus"" by A New Hope","Read on to learn about how ""Exodus"" mingles muscled bass power with melodic, ethereal synth sounds and gigantic retro drums."
357,entertainment,"Synth Single Review: ""Bad Cop"" by L'Avenue","Read on to learn why I feel that ""Bad Cop"" is a gritty, dangerous slice of shadowy synth music."
358,entertainment,"Synth Single Review: ""Hide The Sun"" by Anniee","Read on to find out about why I feel that ""Hide The Sun"" is a song about rising again after a relationship’s ending."
359,entertainment,John Wick Movie Series Review. Is This Keanu Reeves Best Film Series?,"John Wick, John Wick Chapter II, and John Wick Chapter III:Parabellum"
360,entertainment,10 Shows To Watch After Supernatural,"Supernatural ended on a good note on November 19, 2020 with it's finale ""Carry On"". The episode was written by showrunner and executive producer Andrew Dabb and directed by co-showrunner Robert Singer."
361,entertainment,Quotable Lines From It's Okay to Not Be Okay K-Drama,It's okay to not be okay was the first-ever k-drama that I watched. From thereon began my journey to this beautiful world. I came to realise that k-dramas are not only about visuals but also teaches us essential life lessons. Since then it became my hobby to collect quotes or quotable lines from eac
362,entertainment,21 Best Albums From the Nineties,
363,entertainment,Real' Andrews Returns to General Hospital,
364,entertainment,Hallmark Actress: Catherine Bell,"You have seen Catherine Bell in many Hallmark movies, but how much do you know about her personal life?"
365,entertainment,All Life Was Extinguished In 2031 Due to a Botched Climate Experiment!,"A Film called Snowpiercer- A revolution grows amid the newly-forming class system in a future where a disastrous climate-change experiment has killed all life, except for the earth's remaining inhabitants, who are assigned to a single train circling the world."
366,entertainment,The Windmill/Nether Gundam is the Goofiest Mobile Suit There is,"It’s not the silliest, but definitely the goofiest."
367,entertainment,Should I Watch..? 'Tropic Thunder' (2008),The 'actors acting for real' trope has been recycled a number of times but rarely as bombastic as it is here. Benjamin Cox touches down and goes into battle once again.
368,entertainment,"Looking Back at Hatesphere’s 2007 Studio Album ""Serpent Smiles and Killer Eyes""",Serpent Smiles and Killer Eyes is the 2007 studio album by Danish desth and thrash metal band Hatesphere.
369,entertainment,Fresh (2022) Movie Review,This Fresh (2022) Review Must Be Kept At Room Temperature Along With The Open Jar of Mayo! Starring Daisy Edgar-Jones and Sebastian Stan! Directed by Mimi Cave!
370,entertainment,Disaster Porn Saturday Night: Cat.8,"Forget the Daddy-Daughter dance, this father and daughter duo save the world."
371,entertainment,"Review of the Album ""The Sickness Within"" by Danish Death and Thrash Metal Band Hatesphere",The Sickness Within is the 2005 studio album by Danish death and thrash metal band Hatesphere.
372,entertainment,Don Crichton: Lead Ernie Flatt Dancer on The Carol Burnett Show,Although he was uncredited the actor was in 10 episodes of the variety show.
373,entertainment,A Ranking of Elvis Presley's Gospel Songs,Elvis Presley is arguably the greatest American singer of all time. A big part of his catalog was gospel music. He was inducted into the Gospel Hall of Fame in 2001. He used and combined different styles for his gospel work.
374,entertainment,"Synth Single Review: ""Wistful Skies"" by Saros-FM","Read on to learn why I think that ""Wistful Skies"" is dense with melancholy emotion and delicate sound, shaped by throbbing drums and bass."
375,entertainment,Biggest Movie Flops In Disney History!,
376,entertainment,Top 5 Actors Who Have Won Oscars For Playing Real People,"Once in a while, genuine is considerably really engaging - - and rousing - - than fiction. This rundown of our most loved biopics incorporates films pretty much elite player competitors, significant performers, strong government officials, from there, the sky is the limit."
377,entertainment,Should I Watch..? 'Above the Law' (1988),"Steven Seagal has been much maligned as a leading man over the years, but perhaps his distant debut is different? Benjamin Cox approaches this with an open mind and is mildly surprised."
378,entertainment,"""The Batman"" Movie Review","The Batman is a mystery first, a thriller second, and a superhero film third. It has everything you'd want in a film - drama, intrigue, mystery, and a couple good pummelings. I loved this film and have no negativity to say about it at all. I give The Batman a 4 out of 4."
379,entertainment,"Synth Album Review: ""Twilight Radio Show"" by Nakatomi Freefall","Read on to find out why I feel that ""Twilight Radio Show"" combines powerful vocal performances, emotive songwriting and a richly unique mixture of synth sounds."
380,entertainment,How Children Hear Music,How early do children begin to hear musical sounds?
381,entertainment,Friday Film Fest: Sarah Jessica Parker,"From dancer to therapist, SJP knew how to work the '90's"
382,entertainment,Review of 'The Dropout' on Hulu,"""The Dropout"" is a movie about the real-life story of Elizabeth Holmes and her fall from grace for using her company Therados to allegedly defraud investors, medical facilities and patients. The movie is worth watching."
383,entertainment,Hallmark Actress: Becca Tobin,How much do you know about Hallmark actress Becca Tobin?
384,entertainment,"Ukraine said - 60 Russian soldiers are in their possession, mothers of soldiers can come and take them","In this news blog, we will try to give you some information about the war going on between Russia and Ukraine and also know the condition of Indian students in Ukraine."
385,entertainment,"Synth Single Review: ""Waiting"" by Superdrift and Maisie May","Read on to find out why I feel that ""Waiting"" explores the struggles of trying to keep a relationship going through energetic synths and Maisie Mae’s effortless vocals."
386,entertainment,Zack Snyder's Justice League Review: Is It Better Than the Theatrical Cut?,"In ""Zack Snyder's Justice League,"" Bruce Wayne (Ben Affleck) is hell-bent on keeping his promise to the late Superman on putting together a team of Metahumans to fight against an incoming evil. As time goes on, Wayne realizes that the incoming evil is already upon them..."
387,entertainment,Should I Watch..? 'Mifune: The Last Samurai' (2015),"What was it about the Japanese actor Toshiro Mifune that made him an internationally recognised star? This documentary might not have all the answers, but that doesn't stop Benjamin Cox from recommending it."
388,entertainment,"Cartoon Review: ""Batman: The Animated Series"" Season 1 Volume 2 (1993)","Batman and Robin continue to take down Gotham's criminals and Robin learns about the location of his parent's killer, Tony Zucco, and much more.  Is this classic ""Batman"" cartoon worth your time and money?  Let's find out!"
389,entertainment,Lauralee Bell and Her Legacy on the Young and the Restless,The actress comes from soap opera royalty but has made her own name in daytime.
390,entertainment,My Little Pony: New Generation Theory 2,Another Round of Theories sit back and enjoy
391,entertainment,"Artillery, ""By Inheritance"" Album Review",By Inheritance is the 1990 studio album by Danish thrash metal band Artillery. It is one of the best metal releases in 1990 ever and is recommended for any thrash metal fan!
392,entertainment,Top 10 Best Bluegrass Guitar (2022),"best martin guitar for flatpicking
best collings guitar for bluegrass
best bluegrass guitar under $1000
best flatpicking guitar
best bluegrass acoustic
best bluegrass guitar reddit
best om guitar for bluegrass
martin guitars"
393,entertainment,Top 10 Best Eyelash Extension Tweezers (2022),"best professional eyelash extension tweezers
best eyelash extension tweezers 2020
best eyelash extension tweezers 2021
best eyelash extension tweezers uk
best lash extension tweezers on amazon
lash isolation tweezers
eyelash extension tweezers set
volume lash tweezers"
394,entertainment,Top 100 Sad Depressing Songs of All Time (2022),"sad songs that make you cry
sad songs
depressing songs 2020
sad songs 2019
sad songs 2021
sad songs about life
sad love songs"
