,category,header,contents
115,technology,Azure DevOps Yaml FileTransform,Azure DevOps — Replace tokens/key in JSON using File Transform in YAML Pipeline.
116,technology,10 Crazy-Cool Products That Will Change Your Life,"Whether you’re trying to get healthier, save money or just have more fun, these 10 products are designed to change your life for the better without requiring much time, money or effort from you at all!"
117,technology,Top 10 Best Laptops Under 30000 in India (2022),"best laptops under 30000 in india 2020
best laptops under 30000 in india 2021
best laptop under 30000 in india july 2020
laptops under 30000 with i5 processor
best laptop under 30000 with i7 processor
laptops under 30000 with 8gb ram
best laptop under 30000 with i7 processor and 8gb ram
best laptop"
118,technology,Top 10 Best Eyelid Tape (2022),"best eyelid tape for aging eyes
best eyelid tape for droopy eyelids
eyelid tape ruined my eyes
invisible eyelid tape
best eyelid tape for asian eyes
best eyelid tape reviews
eyelid tape flipkart
eyelid tape sephora"
119,technology,The Top 10 Innovations That You Didn't Know,Many innovations have changed the world but are unknown to most of us. Today we have come up with some innovations which you would be interested in knowing about and will definitely like.
120,technology,Futurist: The Future of Machine-Based Intelligence Is Interesting!,"Futurist: The reality of Machine Intelligence is huge, so let's wander down one path and see where we end up!"
121,technology,6 Effective Tips to Use When Looking for a Job as a Self-Taught Developer,
122,technology,Top 5 Social Media Marketing Trends to Look Out for in 2022,"The blog’s aim is to bring to predict the five most probable social media marketing trends of 2022, based on the current and previous years’ situation."
123,technology,Top 10 SmartPhones of All Time,
124,technology,Will Brain Chips Make Us Superhumans?,Neuralink and the Future of Humanity
125,technology,What Are the Best Smartphones in 2022?,Below are comparisons of the best smartphones of the moment. You just have to choose the device that suits you!
126,technology,5 New Gadgets to Keep on Your Radar,"Including Sonus faber's fancy wireless speaker, Spotify's Car Thing and Astell&Kern's first Bluetooth speaker."
127,technology,How Does a Jet Suit Work?,The Jet Suit Has Become Very Popular and Has Many Applications but How Exactly Does It Work?
128,technology,Canon PIXMA MG2500 Printer,I just needed printer ink...but I bought a newer printer instead.
129,technology,Shift Left Testing in Agile Development,"Shift-left testing[1] is a method of software and system testing in which testing occurs earlier in the lifecycle (i.e. moved left on the project timeline). It is the first half of the adage ""Test frequently and early."" Larry Smith coined the phrase in 2001."
130,technology,Envelope Encryption in AWS KMS Made Easy,"If you are preparing to take the AWS Certified Developer Associate (DVA-C01) certification exam, it is important to understand how envelope encryption using KMS and Customer Master Keys works"
131,technology,Understanding the Common Android Security Vulnerabilities,Android is an open-source platform that tends to be more vulnerable to malicious actors and hackers than other mobile operating systems.
132,technology,The 7 Biggest Threats To Metaverse,"Metaverse has faced a lot of criticisms in the past, but none of them have been able to stop its growth. Even though many different factors could threaten Metaverse's future, it is still one of the most promising projects in the blockchain space today."
133,technology,How Will Voice Search Affect SEO?,"The volume of voice searches is increasing more and more as the months go by. Really, you should be asking, “How is voice search affect seo."
134,technology,Smart Contract and BlockChain,"A computer application, a crypto contract, or a smart contract automatically and directly reigns digital assets in transit among parties in specific scenarios."
135,technology,"Futurist: We Can Dig Trenches for Cable Modems Now, and Then Again and Again. or Deploy 5g Once and Be Done.","2-3 billion people don't have the internet today. Before you go investing in a backhoe to dig a trench to every home in the world, let's think about what we need."
136,technology,What does sales tracking software measure?- 3 Indispensable Types of Business Metrics.,Are you evaluating your sales performance and business growth with the right metrics?
137,technology,"Tribit’s Got Audio - MoveBuds H1 True Wireless Earbuds, StormBox Micro 2 and XSound Mega Portable Wireless Speakers",Tribt’s got what your ears need closeup (MoveBuds H1) and farther away - Stormbox Micro 2 and XSound Mega for portable wireless speakers
138,technology,How to Make Money Through the Metaverse,"This article talks about, how one can make money in real life with the help of metaverse."
139,technology,How to Discern a Scam Website From a Real One,"Website scammers are out there, and we want to make sure we aren't tricked by any of them. Here are some tips to stay safe from scams that are after your money, identity, or information."
140,technology,7 Most Important Reasons to Use WordPress in 2022,"1.	WordPress is Free and always will be 
2.	Community Support
3.	WordPress Is SEO Friendly
4.	WordPress Is Easy to Use
5.	WordPress Is Safe and Secure
6.	WordPress Is Completely Customizable
7.	WordPress 5.9 is new and fresh"
141,technology,Is Cyberpunk 2077 Still Broken on PS4?,"A picture from Cyberpunk 2077 portraying a doctor with the PlayStation logo for a head attempting to revive a PS4 duplicate of Cyberpunk 2077. Come on, PS4 Cyberpunk 2077, work with me here."
142,technology,What You Need to Install Fiber Optic Blades,
143,technology,Digital Marketing Trends to Look Out for in 2022,"Today, digital marketing has become a necessity rather than just an option for the growth of a business and keeping up with trends also became equally crucial. This blog covers the top 5 digital marketing trends that can help your business grow in 2022."
144,technology,The Chipolo CARD Spot Wallet Finder Makes Finding Your Wallet Easy,Misplacing your wallet becomes a thing of the past once you place the Chipolo Card Spot inside. Providing you using iOS
145,technology,WordPress 5.9 - What's New? WordPress 5.9 Update,"With this new version, WordPress brings you many new features including blocks & intrinsic web design, navigation menus, interface for theme . json, refining editing flows for blog themes, new default theme, additional design tools"
146,technology,The Top 10 Most Advanced Fighter Jets In The World,
147,technology,How to utilise Zoom on the Echo Show,
148,technology,"What Is a Virtual Assistant, How Does It Work and Am I Ready to Hire a VA?",Virtual assistants are causing havoc in the world of internet business. Virtual assistants have assisted many people in completing assignments in record time and can handle just about anything you throw at them.
149,technology,Futurist: Dealing With Two It Camps,"There are two camps in IT, neither is wrong but neither is completely right either!"
150,technology,Publii: a Static Site Generator with a GUI,Publii combines the speed and security of static websites with the ease-of-use of CMS like WordPress. You can easily create a blog or portfolio without any coding and host it for free using services like Netlify or GitHub Pages.
151,technology,The Metaverse: Why It Is Important (a Beginner's Guide),"Coined from Greek roots, ""metaverse"" is one of these words, which is in itself, a reflection of how it impacts our daily lives. The internet has already become the bread and butter of our daily lives and we are all deeply connected. Hence, it is critical to understand it and its importance."
152,technology,The Power of Likes on Social Media,"Have you wondered if it really matters to ""like"" social media posts? Not just one, but any or all? This article delves into the power of likes in our social media world. After reading it, perhaps your ""likes"" will be more meaningful and be made more conscientiously, intentionally, and thoughtfully."
153,technology,AWS Lambda Reserved Concurrency Versus Provisioned Concurrency,Analogies to remember the differences between reserved concurrency and provisioned concurrency in AWS Lambda
154,technology,Background Check & Fingerprint Check: The Difference,What is the difference between a background check and a fingerprint check will help companies make well-informed hiring decisions?
155,technology,Maintaining Water Quality in Aquaculture under IoT System,"Maintaining water quality is an important factor in a healthy aquaculture environment. Its main objectives are: water temperature, pH, dissolved oxygen (DO), salinity, turbidity, ammonia nitrogen, chemical oxygen demand (COD), biochemical oxygen demand (BOD)."
156,technology,The Tribit Soundbar Wireless Home Speaker Gives Your TV A Cinema Sound Boost,Don’t call it a “starter soundbar” because the Tribit Soundbar Wireless Home Speaker has a lot of good sound going for it
157,technology,The Carsifi Wireless Android Auto Adapter Don’t Need No Cables,"Wired Android Auto users wish they could get rid of that pesky USB cable. Using the Carsifi Wireless Android Auto Adapter, they now can"
158,technology,Reconciliation Explained,An explanation of how the reconciliation process works in the back office of a (capital markets) financial institution
159,technology,Order Matching and Execution Explained,"An explanation of how the Order Matching and Execution processes work in financial markets, from a business and technology perspective"
160,technology,Collateral Management Explained,"An explanation of the Collateral Management function - Collateral, Rehypothecation, Mark-to-Market (MTM), Settlement, Reconciliation - in the capital markets"
161,technology,Clearing Process Explained,"An explanation of how the clearing process works in financial markets - CCP, novation, margin"
162,technology,Future of Wearables & User Acceptance,This article explains about what is the Future of Wearables with User Acceptance
163,technology,Why Facebook Lost More Than $230 Billion,This article talks about the reason why and how Facebook lost more than $230 billion and is meta ever going to dominate the market as it once did?
164,technology,Best Android Apps Sites In 2022,
165,technology,eWOM Through Social Networking Sites and Its Influence on Purchase Intention in China,
166,technology,Will Magic Links Quickly Kill the Conventional Passwords?,"The problem with the convention passwords is that they can be hacked, guessed, or coerced out of users through phishing or social engineering attacks; going passwordless is becoming the need of the hour."
167,technology,Top 10 Best Bluetooth Earbuds For Running in 2022,The best Bluetooth earbuds are comfortable enough to wear all day long and deliver powerful sound quality with a good battery life.
168,technology,Best Practices to Manage Dedicated Software Development Teams Remotely,
169,technology,Does the Cash Back App Rakuten Really Give You Free Money?,Find out if the cash back app Rakuten is a good way for you to get free money for your online purchases.
170,technology,Futurist: The Rise of Bite-Sizes (Right-Sized) Applications,The two big evolutions in technology in the last 15 years. The 2007 launch of the iTunes store and Serverless computing.
171,technology,What is redirect error in google search console? And How to fix redirect error in google search console?,These article explains what is redirect error in google search console? And How to fix redirect error in google search console?
172,technology,Top 10 Best PC Cases Under 100 (2022) Budget Friendly,"A case is an essential part of a computer's system. A good case will protect your investment from damage and dust, while still being able to breathe. The best PC cases under $100 are sleek, lightweight, and offer great protection."
173,technology,How Close Are We to Technological Singularity?,
174,technology,10 Ways to Prevent Identity Theft,"Identity theft is a serious crime, and it can happen to anyone at any time. There are many methods of protecting yourself from identity theft, and one of them is simply being aware of the steps you can take to prevent it."
175,technology,Getting Started with Apache Kafka and Spring Boot,Welcome to another Spring Boot tutorial. Today let’s have a look on how to get started with Apache Kafka on Spring Boot. This tutorial is fully based on Getting Started with Apache Kafka and Spring…
176,technology,CircuitMess’ Spencer Is the Build & Code Your Own Voice Assistant,For a young person to learn to code by assembling their own voice assistant is not only cool but informational. That's a great combo
177,technology,The Future of Metaverse and Their Components,"Virtual worlds, such as elements of Fortnite, which can be accessed via PCs, game consoles or even mobile phones it might be metaversal."
178,technology,Rocketing Powers of Quantum Computing,"Applying the principles of quantum physics, a quantum computer delivers much faster, cheaper to use, and more powerful results than any supercomputer. How do does it work?"
179,technology,The Best Features of Ios Advice That’s Seared Into My Memory,"We'll guide you through a variety of less-known functions in iOS 3, including how you can use your camera to scan text, transfer your iCloud data to someone else in the event that you pass away, and Focus mode."
180,technology,Best Tech Skills to Master Trends You Absolutely Must Try in 2022,"Information technology, also known as IT, is an extremely flexible field of study, with rapid growth, and studies show that being proficient in the field of high-demand technology can boost your salary. If you're seeking to move or progress in your career, with the help of the latest tech and skills"
181,technology,How Artificial Intelligence is Transforming Businesses,"Artificial Intelligence has been playing a key role in transforming businesses, increasing efficiency."
182,technology,Futurist: Is There Anything Beyond Email?,"I average more than 300 emails every day. I read less than 100 due to sorting and rules. But, what lies beyond email?"
183,technology,How Automation Will End Work as We Know It.,
184,technology,What Does an RF Amplifier Do,
185,technology,Everything You Need to Know About Linux Phones.,This article talks about Android and iPhone alternatives present in the market and briefly talks about their benefits and the challenges they face.
186,technology,Futurist: The Technology Evolution We Are in Now!,There is an evolution going on in technology right now.
187,technology,The 5 Most In-Demand Skills for 2022,"According to Global Knowledge, cloud computing will be the most in-demand skill in 2022. artificial intelligence is also in high demand. If you are an engineer, a data scientist, or a programmer, you should keep up with the trends."
188,technology,Astropolitics: What Stands Behind Space Exploration?,"Space exploration is the next frontier in the race for world dominance. Even though it brings a lot of benefits, humanity must be cautious about possible consequences."
189,technology,How to Build a Personal Website?,"The personal website looks good. Everyone want to know, how to build a personal website. This article is answer of the question."
190,technology,How To Clear Your Browser Cache & Why You Should Do It,"Caching is a technology useful for optimizing the navigation experience on the web, still it may be good to clean your cache sometimes. This article will show you why and how to do it."
191,technology,The Screen Age,Everybody should educate themselves about the Internet and devices.
192,technology,Facebook - Changing Password After Being Hacked,...something about friend requests I didn't send...
193,technology,Advantages of Managed IT Support for SMBs,Outsourced IT Services have grown rapidly during and after the pandemic. Here is why IT support and Managed IT are essential to Small and Medium Sized Business Owners
194,technology,What You Need to Know and Be Able to Work as an Android Developer,
195,technology,Emails - Deleting from Gmail - One Method,I have to start deleting emails...
196,technology,Internet in Africa,
197,technology,Alternative for Google Voice,"Recently, businesses are reporting that google voice is not helping their business. One of the main issues that have been reported by businesses is that google voice doesn’t offer customer service even if you report any issue."
198,technology,Introduction of Data Science in Detail,"Do you know in the tech world there is a high demand for jobs related to machine learning and data science? Well, at the time of writing this article there is a plethora of jobs in the market but there is a lack of skilled manpower."
199,technology,The Sick Truth of Web 3.0,"The blockchain-based technologies that are designed to increase privacy and security, such as Web 3.0 and decentralized autonomous organizations, many are exploring what they see as the new internet frontier"
200,technology,Top 10 Most Expensive Cameras in the World,Here are the Top 10 Most Expensive Cameras In The World
201,technology,What is Blockchain Technology? How will this technology change our lives in the future?,
202,technology,Futurist: The Process and Tools I Use to Build My Articles.,There are a number of tools I use to build and share my articles. I go through my process and the tools in this piece!
203,technology,Tesla’s Entry to India and What Does It Mean for Us,"In this article, we discuss the advantages of Tesla coming to India and what are the advantages that both parties will be getting with this."
204,technology,Review and Rate - Razer Enki,The Chair that changed my mind about gaming chairs.
205,technology,Review and Rate - RAZER KAIRA Headphones,A great generation of headphones dedicated to current devices..
206,technology,The Truth About the Metaverse,"VR, AR World, don't get trapped in The Metaverse. It is a trap."
207,technology,AI and the Future of Technical Video Editing,"AI will change the way we do things, from the way we work to how we interact with each other. AI is changing our world in unimaginable ways and it's important that we pay attention to what's going on around us."
208,technology,An Outline of Computer Security,"Computers and laptops are a part of everyday life and many cannot manage without them but there is a flipside as these devices hold sensitive information, personal data which if compromised can harm you greatly."
209,technology,Here's why you probably don't need to rely on a VPN anymore,
210,technology,"Futurist: Application Migration Myths, and the Enterprise Resource Triangle","The ERT helps you build applications for tomorrow, today."
211,technology,What Goes into Making a Strep Test,
212,technology,"What Is the Metaverse, Its Possibilities, and Who Drives It?","The Metaverse is a virtual world that we will use to connect multiple devices that make us think, we are actually within it, interacting with all the elements within it. It's like teleporting to a whole new world through virtual reality glasses and other accessories with which we can interact."
213,technology,Deepfake: The Technology of Imitation Explained,"There is a new technology of imitating someone to create synthetic media, and it is growing rapidly."
214,technology,How to Create a Free Blog Without Hosting,Here we will learn how we can create our blog without hosting and earn from it.
215,technology,How to Make Your Desktop Look Clean and Professional,A clean and professional-looking desktop is the key to enhance your digital experience.
216,technology,usmanseopoint.com,"Today I will tell you. Assuming you don't be aware of App web 3.0 with Examples Metaverse. So most importantly, thinking we check out Web 3.0. We want to know Web 1.0 and 2.0. Suppose we go to the two of them. So we will see later without hardly lifting a finger of Web 3.0."
217,technology,"10 Facts About Social Communities Everyone Thinks Are True, Here Is One Startup Making It Possible For The Universe",
218,technology,Features of Best Master Reseller Hosting that Help a Business,"Best Master Reseller Hosting provider significantly influences the speed with which your pages load. The websites that load faster have better search engine rankings, lower bounce rates, and reasonable conversion rates as well."
219,technology,Futurist: The Three Great Application Performance Myths,"In this piece, we will wander three great myths or assumptions in the Information technology world."
220,technology,Answering 10 Random Questions - Part 1,Answering 10 randomly generated questions - part 1
221,technology,Advantages of having a Multifunction Printer,Advantages of having a Multifunction Printer.
222,technology,"A Paleostress Inversion and AMS Research of the Neogene Kinematics of the Potwar Plateau and the Salt Range, NW Himalaya",
223,technology,How does cloud computing effect your business?,
224,technology,What are some of the most typical errors made by IT management teams?,
225,technology,ClickLeak: Keystroke Leaks in Cyber-Physical Social Networks through Multimodal Sensors,The nature of social settings allows numerouThe findings of the evaluation revealed that key recognition accuracy can exceed 83 percent when large scale data harvests from public social contexts are used.
226,technology,An Ecological Assessment of Age-Related Changes in Writing and Tremor Features Using a Smart Ink Pen,"The capacity of our smart ink pen to combine the advantages of digitizing tablet technology with the natural ""feel,"" convenience of use, and ecological validity of the classic pen-and-paper technique is its greatest achievement. The proposed solution is a significant step toward a simple, ecological"
227,technology,Key Ideas on how to Identify a Fast Charging Charger for Phone,A  fast charger will help you to cope with busy day when you need your phone most. Fortunately it's possible to choose one before you buy. Reading the label  on the charger is one of the ways of identifying a fast charger as detailed in this article
228,technology,digitalmarketing,
229,technology,ISE DIRECT POTENTIOMETRY BASED ATmega8535 MICROCONTROLLER BLOOD SODIUM ANALYZER,A low cost microcontroller based Sodium analyzer is developed to measure the concentration of sodium in blood serum
230,technology,How to Use the Internet to Make Money Without Really Working,"Have you ever been interested in making money, but don’t know where to start? The internet can be a great place to begin. There are many online opportunities that help you make money."
231,technology,Natural Language Sentiment Classification Algorithm Based on Deep Learning for Identifying User Feelings Concerning Resi,"Residents can now submit subjective ratings, which are extremely valuable as subjective assessments and suggestions for architects, thanks to recent innovations in real estate brokerage systems."
232,technology,Enhance Your Social Media Accounts With Multi Factor Authentication {mfa/2fa},Protect your online presence on social media accounts with Multi factor authentication / 2FA
233,technology,The SoloQi 360 Charging Bundle Gives Your Phone A Wireless Power High,"Because having to run a cable from your phone is a pain - the SoloQi 360 Charging Bundle provides magnetically connected wireless charging at hone, the office or in your car"
234,technology,How to Choose Between Email Marketing Tools?,Email marketing is one of the best promotional campaigns to help you reach out to and acquire more customers. You can create successful email campaigns to drive more traffic to your website with robust email marketing tools.
235,technology,"Which Is Better: Ui/Ux Designing, Programming or Copywriting?","Don't you know what is UI/UX, Programming/Development or Copywriting. I will describe them all, and I will try to explain which can be best for you."
236,technology,Futurist: Tech that will be big in 2022!,It is finally here. My top 3 2022 tech categories!
237,technology,Create Full-Stack Web App Without Writing Single Line of Code Using these No-Code Tools,"There are several no-code technologies available to help developers with their work. Without writing a single line of code, anyone could create meaningful apps and websites."
238,technology,"What Is 6G, and How Fast Will It Be?",
239,technology,How Wind Energy Helps to Revitalize Communities.,"Wind energy is a way of generating electricity that is eco-friendly, with no harmful emissions and without contributing to global warming. Wind farms have created jobs for more than 400,000 people worldwide and are in rural communities where they would not be able to afford them otherwise."
240,technology,How to Monetize Instagram & Make a Profit From Your Popularity,Platforms like YouTube offer the ability to monetize content through ads. Can you make a profit also from an Instagram profile? This article will highlight some ways a profile on the popular photo sharing app can generate earnings.
241,technology,How to Deactivate or Completely Delete a Facebook Account,"Facebook has been the most popular social network for years. If you are not interested in using it anymore, this article is going to tell you how to deactivate your profile or even permanently delete it."
242,technology,How to Completely Delete or Deactivate an Instagram Account,"Instagram is one of the most popular social networks. Despite this, there may be some reasons why you would like to delete your profile. This article will help you through the steps you have to take in order to get out of the popular app."
