,category,header,contents
130,entertainment,The Hidden Review: Cobra Kai Season 3 TV Series Review,"""The enemy of your enemy is your friend"""
131,entertainment,The Hidden Review: Safety Film Review,"""What does sacrifice mean to you?"""
132,entertainment,The Hidden Review: Soul Film Review,"""What do you want to be remembered for?"""
133,entertainment,The Hidden Review: Psych TV Series and Film Review,“Hello I'm Shawn Spencer and this is my partner Radio Star. I'm afraid your video will kill him.”
134,entertainment,The Hidden Review: Cobra Kai TV Series Review,"""Strike first, strike hard, no mercy"""
135,entertainment,The Hidden Review: Bubu Killer King Theatre Review,
136,entertainment,The Hidden Review: Palindrome Film Review,"""I am destiny in perpetual repetition..."""
137,entertainment,The Hidden Review: Windrush Theatre Review,"""After all we've suffered together, you still wanna tell me I'm worthless and you are not"""
138,entertainment,The Hidden Review:  Complicite’s The Encounter Theatre Review,"""We are always mistaking stories for reality"""
139,entertainment,The Hidden Review: Jim and Andy Documentary Film Review,Jim Carrey: How far should I take this? How far would Andy take it?
140,entertainment,The Hidden Review: Barber Shop Chronicles Theatre Review,
141,entertainment,The Hidden Review: Homeless Ashes Film Review,"""Homeless not invisible """
142,entertainment,The Hidden Review: Lucifer TV Series Review,"""Tell me your deepest desire"""
143,entertainment,The Hidden Review: Bad Boys For Life,"""We ride together, we die together, Bad Boys for life"""
144,entertainment,The Hidden Review: Spenser confidential Film Review,"""Judge: Before I sentence you, is there anything further that you would like to add?
Spenser: Yes. That guy deserved it."""
145,entertainment,The Hidden Review: Ford v Ferrari Film Review,"""It was a hell of a drive"""
146,entertainment,The Hidden Review: Doctor Sleep Film Review,"""HEEEERRRRREEE’SSSS JOHNNNYYY!!!"""
147,entertainment,The Hidden Review: Birds of Prey Film Review,"""The Joker left me"""
148,entertainment,Twenty Truly Awful Oldies With Embarrassing Lyrics,"Baby boomers, Gen Xers, and even millennials are constantly bashing the songs that radio stations play for Gen Zers.  They insist that music sounded better back in the day.  However, the 20th century also brought us some really oddball songs that everyone just assumes forget.  Let's hear them."
149,entertainment,The Hidden Review: Star Wars - The Rise of Skywalker,"""May the force be with you!"""
150,entertainment,The Hidden Review: Onward Film Review,“It’s not fair to call me a screw up if you don’t give me a chance to do something right.”
151,entertainment,The Hidden Review: Spies in Disguise Film Review,
152,entertainment,The Hidden Review: Venom Let There Be Carnage Film Review,"""They Can't Take You From Me. You're My One Bright Light!"""
153,entertainment,Should I Watch..? 'The Ladykillers' (1955),"This timeless English farce has become one of the landmark pictures produced at Ealing Studios. But why is it still so well regarded, even in the face of a modern remake? Benjamin Cox takes a look."
154,entertainment,How Can I Be Rich؟,"—

For a long time, people have been trying to figure out how to make money online. But the problem is that the Internet has not provided any clear and easy way for people who want to earn money online.

So, there are many different ways how you can earn money from the Internet. Some of them are t"
155,entertainment,Tribute to Amy Winehouse,This is a tribute post for Amy Winehouse a singer of extraordinary talent. Amy had her own distinctive singing style which made her popular with so many people.
156,entertainment,10 Shows To Watch If You Liked Game Of Thrones.,"Wondering what to watch next after ""Game Of Thrones""? Well, here's a list."
157,entertainment,“Catch The Fair One” (2022) Review: The Good and The Bad,"Kaylee, a Native American boxer, embarks on the fight of her life when she goes in search of her missing sister. Starring Kali Reis as Kaylee, alongside a solid group of actors, including Lisa Emery, Tiffany Chu, Kimberly Norris Guerrero, Daniel Henshall, and others."
158,entertainment,"Bon Jovi 2022 Tour: Concert Review in St. Paul, Minnesota","Bon Jovi is one of the most well-known rock bands in the world. They have been performing live in concert since 1986. On April 3rd, they played at the Xcel Energy Center in St. Paul, Minnesota, which was the second stop of their long-awaited 2022 Tour."
159,entertainment,Death on the Nile: A Major Disappointment and Here's Why,"Death On The Nile, a big hit or a big miss? Find out in this review!"
160,entertainment,What to Name Your Pet Roaches,"This is a satirical article highlighting typical, arbitrary government regulations."
161,entertainment,All About Singer and Actress Toni Braxton,"Toni Braxton wears many hats: singer, songwriter, pianist, television personality, producer, and actress. Having been the lead character in two back-to-back Lifetime movies, this article will focus on her being an actress."
162,entertainment,A Movie Review: God's Not Dead (2014),"The matter of God's existence and different opinions people have regarding faith in God, makes the story of God's Not Dead movie of 2014."
163,entertainment,How a Simple Japanese Anime Worried Marcos,"It was a simple pleasure, until a dictator butted in."
164,entertainment,"Album Review: ""Greater Art"" by Swedish Doom and Death Metal Band Lake of Tears",Greater Art is the 1994 debut album by Swedish doom and death metal band Lake of Tears.
165,entertainment,K-Drama Review: Twenty-Five Twenty-One,"Twenty-Five Twenty-One is a romantic comedy drama, and coming-of-age South Korean television series about first love, friendship, family, and career on fencing and journalism."
166,entertainment,‘Dancing With the Stars’ Will No Longer Air on the ABC Network,"After 30 seasons, ""Dancing With the Stars"" is leaving the ABC network and will be streamed."
167,entertainment,Should I Watch..? 'Body Heat' (1981),"Looking and feeling like a legitimate film noir, this steamy thriller saw a sparkling debut from one Kathleen Turner. Benjamin Cox gets hot under the collar bringing you his assessment."
168,entertainment,Umma (2022) Movie Review,This Umma (2022) Review Will Umma Let You Finish! Starring Sandra Oh and Fivel Stewart! Directed by Iris K. Shim!
169,entertainment,"""Sonic the Hedgehog 2 (2022): Faster and Better Than Ever""","""Sonic the Hedgehog 2"" is the sequel to the 2020 film based on the SEGA video game character. With more elements from the source material, non-stop action, and great performances, this sequel is a major improvement that overshadows its predecessor's flaws."
170,entertainment,The Slap Seen Around The World,"Will Smith needs to be made an example of when he assaulted Chris Rock, while 15 million watched. Will Smith, should have been arrested and handcuffed like other criminals. His apology was weak, he didn't mean a word he was saying."
171,entertainment,Bands Who Never Topped the First Song on Their First Album,
172,entertainment,"Synth Single Review: ""Above In Our Love"" by eLxAr & Liquid Modern","Read on to learn about how ""Above In Our Love"" is about an enduring relationship featuring gleaming synths and strong vocals."
173,entertainment,"Synth Single Review: ""Easy"" by Infra Violet","Read on to find out how ""Easy"" explores the challenges of self-realization in the midst of life’s complexities."
174,entertainment,"Synth Single Review: ""Close To You"" by Elevate The Sky & Starmadman","Read on to learn why i think that ""Close To You"" is about the hard work and struggle that it can take to make a relationship succeed."
175,entertainment,The Life and Times of Freddie Mercury,
176,entertainment,Should I Watch..? 'Top Gun' (1986),"With hype building for a long-awaited sequel, Benjamin Cox looks back at the original - and can't quite see what all the fuss was about."
177,entertainment,10 Facts About Jensen Ackles You Didn't Know,"Did you know these facts about Jensen Ackles? Well, find out here!"
178,entertainment,The Best State for Doing Business,This is a short-form satire about California's arbitrary and unfeasible business laws.
179,entertainment,Lost Gold from the Beatles' Get Back Sessions,"The Beatles' Get Back\Let It Be sessions in 1969 ended in a fiasco of sorts, except for their final rooftop performance. These sessions produced over 70+ songs. However, only a few were standouts, which are they?"
180,entertainment,"Synth Album Review: ""Électrique"" by L'Avenue","Read on to learn why i feel that ""Électrique"" combines the artist's signature smoothness with dark shadows and a more intense feeling than his previous albums."
181,entertainment,Hallmark Actor: Daniel Lissing,"Many people know Daniel Lissing for being a leading character on ""When Calls the Heart"" on the Hallmark Channel. However, there are other interesting things about the Australian actor."
182,entertainment,Children of Disaster: Brothers and Sisters (Part 1),Part 2 in the Children of Disaster series. The Shelby's set the bar too high since these siblings can't compare.
183,entertainment,Friday Film Fest: Paul Rudd,Spend spring break and two holidays with the never aging actor
184,entertainment,Who Is Bobby Caldwell? (What You Won't Do for Love),"Blue-eyed soul singer Bobby Caldwell struck gold when he recorded classic R&B hit ""What You Won't Do For Love"" in 1978, but even though he hit Billboard's top 10 in three categories, many fans of the song still do not know much about the singer..."
185,entertainment,Anime Movie Review: 'Fate/Grand Order Final Singularity Grand Temple of Time: Solomon' (2021),"The last Singularity, the final battle of the Grand Order.  Mash Kyrielight and Ritskua Fujimaru head to the Grand Temple of Time to stop Solomon before he finishes incinerating proper human history.  Is this adaptation of ""Fate/Grand Order"" worth your time and money?  Let's find out!"
186,entertainment,Should I Watch..? 'Eternals' (2021),"With the Avengers going their separate ways, Marvel gives us another team of super-powered heroes to enjoy. Unfortunately, Benjamin Cox isn't quite sure they've managed to pull it off."
187,entertainment,"A Review of the Album ""Blood to Water"" by German Death and Thrash Metal Band Toxic Trap",Blood to Water is the 2019 studio album by the one man death and thrash metal band Toxic Trap.
188,entertainment,The EnterPAINment Industry:Rick Ross,"The rapper/mogul released bad habits and replaced them with the Boss Habits he always had. Now, he is helping others develop those same Boss Habits."
189,entertainment,Morbius: Sony's Next Antihero on Dry Blood,"""Morbius"" is a 2022 superhero film based on the Marvel Comic character of the same name. Though Jared Leto and Matt Smith made compelling performances, this potentially interesting film misses its mark with a cliched story, mixed visual effects, and an underwhelming payoff."
190,entertainment,Kris Kristofferson's Final Concert (and Other Media Myths),"Kris Kristofferson's retirement, lockdown and ""fake news"" fever heralded 2020. Which concert was Kris Kristofferson's last one before he retired? An internet search won't give you the right answer. How can we check which online information is reliable?"
191,entertainment,"Satyricon, ""The Shadowthrone"" Album Review",The Shadowthrone is the second studio album released by Norwegian black metal band Satyricon. It came out in 1994 and it is considered to be one of the most influential releases in the black metal genre.
192,entertainment,The Tears of Walt and Mickey,
193,entertainment,"Synth Single Review: ""Space Sailing' by Tioux79","Read on to learn why I think that ""Space Sailing"" is reverent and floating as it draws powerful auditory images of the majesty of deep space."
194,entertainment,Top 10 Biographical & Historical Films You Should Watch,"There are many types of movies which are based on history of different people and different countries. But some of them are made with a motive to keep the actual history, the true history in front of you."
195,entertainment,The Top 10 Sexiest WWE Wrestlers,"This article examines and ranks the 10 sexiest WWE wrestlers of all time. It provides a brief overview of each lady's background, style, and general appearance."
196,entertainment,Hallmark Canadian Actors and Actresses,"If you read the background of Hallmark actors and actresses, you will see that a lot of them are Canadians."
197,entertainment,"Review and Analysis of the Album ""Unlocked"" by Meisa Kuroki","Unlocked is the second solo album released by actress, fashion model. and singer Meisa Kuroki. The album was released on February 15, 2012. It is an album that both hits and misses the mark musically. Read on to find out why."
198,entertainment,The Infamous Oscar Slap Was a Display of Toxic Masculinity,
199,entertainment,"Synth Album Review: ""Mind Pictures"" by Maxx Silver","Read on to learn about why I feel that ""Mind Pictures"" is a shadowed, nuanced synthpop album with a well-crafted musical environment, emotive vocals and interesting lyrics."
200,entertainment,Here Is How Klaus Mikaelson Could Have Been A Tribrid,Why couldn't Klaus Mikaelson become a Tribrid like his daughter Hope? This article answers such questions!
201,entertainment,Tips for Arranging Instrumental Music,This article discusses effective ways of arranging the different parts of instrumental music while in the production process.
202,entertainment,Run BTS: Water Splash Episodes,"For ARMYs who want to re-watch all episodes of Run BTS where our precious BTS members are playing games in the water, or simply getting splashed by water as part of the game, this article serves as an episode guide."
203,entertainment,Finding Your Place in Songwriting,This article discusses how aspiring musicians can obtain a sense of direction when beginning the journey of songwriting.
204,entertainment,How to Write Alluring Melodies,Learn to write melodies that make people want to hum along.
205,entertainment,Drummers Who Made Memorable Solo Albums,
206,entertainment,Disaster Porn Saturday Night: Drive-In,It's Friday night and Disaster '76 is the hottest movie in town
207,entertainment,"The Lone Wolf's Editorial: Will Smith Is a Jerk, and Ruined His Own Career",Thoughts on the situation involving Will Smith slapping Chris Rock at the Oscars in 2022.
208,entertainment,"A Review of the Album ""The Great Acceleration"" by Danish Death and Thrash Metal Band Terminalist","The Great Acceleration is the 2021 debut album by Danish Death and thrash metal band Terminalist, a good young band to come out of Denmark."
209,entertainment,"Synth Single Review: ""In Your Dreams"" by Furry Logic","Read on to learn why I feel that ""In Your Dreams"" is a journey from depression to strength through interlocking synths, well-crafted lyrics and an expressive vocal performance."
210,entertainment,"Synth Single Review: ""Stranger Times (Darklands Mix) by Machina X","Read on to learn how ""Stranger Times (Darklands Mix)"" combines a tremulous piano melody with emotive singing and engaging lyrics."
211,entertainment,Billie Eilish Wins Best Original Song at Oscars 2022,"Oscars 2022, NO TIME TO DIE from by Billie Eilish"
212,entertainment,Video Rewind: April Fool's Day,"When pranks go bad on April Fool's Day, someone has to pay the price"
213,entertainment,Friday Film Fest: Alec Baldwin,1988 was a good year for Alec Baldwin.
214,entertainment,For the Love of Movies,"Do you love watching movies whether it's at home or the movie theater? Did you used to go to the movies all the time but not since the pandemic hit? Tune in for some insight from a movie lover who started a movie club and watches movies with anyone she can. If you love movies, let's get inspired."
215,entertainment,Imran Khan Refuses to Resign,"Pakistan Prime Minister Imran Khan, who has been reduced to a minority in parliament and is struggling to keep his job, refused to resign today, claiming that a foreign conspiracy is working against his administration."
216,entertainment,Did the Titanic Never Sink?,Is all that we know about the famous mega-ship a lie?
217,entertainment,"Synth Single Review: ""Subject 22"" by Channel Dark","Read on to learn why I feel that ""Subject 22"" is imbued with hopeful emotion as rich layers of synth sound intertwine."
218,entertainment,"""Anne with an E"" Review",
219,entertainment,How Hard Is It to Say Goodbye to the Drummer Legend Taylor Hawkins,"Taylor Hawkins completes one of the most difficult missions in rock history. If the Foo Fighters' story were made into a film, it would have an all-star cast. A brilliant protagonist who shared the stage with the ideal match."
220,entertainment,Who Is The Strongest Mikaelson Sibling?,"Fans have often wondered over the years about the Mikaelson siblings as to which one of them is the strongest? Well, this article answers those questions."
221,entertainment,"Synth EP Review: ""Stradale"" by WarePredator","Read on to learn about ""Stradale's"" surging slice of high-octane synthwave that snarls and accelerates ferociously."
222,entertainment,"Synth Album Review: ""Idiot Brain"" by Sensoren","Read on to learn why I feel that ""Idiot Brain"" is a heavy-hitting, layered and mind-bending slice of complex synth sound."
223,entertainment,The Life and Times of Travis Fimmel,
224,entertainment,"If You Like Horror, Go See 'X'","'X' is made for fans of the slasher genre, and any fan should be able to see that 'X' is doing what it does very well."
225,entertainment,Ukraine's Zelenskiy Believes That Harsher Russian Sanctions Are Urgently Required.,"""Isn't an oil embargo justified by what the Russian military has done so far?"" ""Do phosphorous bombs not justify it?""

On Monday, Ukrainian President Volodymyr Zelenskiy encouraged Western nations to impose tougher sanctions against Russia, including an oil embargo, to prevent Moscow from escalating"
226,entertainment,Let's Talk About the Oscars,
227,entertainment,The Next Big Thing in Avoid off Limits Joke,"It's impossible that anyone still thinks comic Chris Rock's ""joke"" at the Oscars last night was funny. For those who are unaware of the most recent Oscars controversy, the host, who is known for his politically incorrect comedy, made a joke about actress Jada Pinkett Smith, who suffers from alopecia"
228,entertainment,"Spider-Man, Daredevil, and The Search for Purpose","In this article, I wanted to explore my connection to two of my favorite superhero stories, and why they mean as much as they do to myself."
229,entertainment,"Synth Single Review: ""Lack of Access"" by Liquid Modern","Read on to learn about how ""Lack of Access"" calls out those in power and advocates active  change over an emotive synth backdrop."
230,entertainment,"Synth Single Review: ""You & I Remix"" by Sequenza & Marc Matthews","Read on to learn how ""You & I"" creates a dynamic Italodisco reworking of the original tune."
231,entertainment,The Best Results Women Nomination Thought History Burnout Is Real.,"The women's edition of the 94th Academy Awards nominations, whose ceremony took it to place this Sunday (27), might be considered a search for a more equitable representation of Hollywood genres."
232,entertainment,Why Did Jensen Ackles Not Play These 2 Marvel Characters?,"Can you imagine the macho Dean Winchester playing a marvel character? Well, he could have played two instead if things went accordingly. Here's why he did not play these two Marvel characters!"
233,entertainment,"Review of the Album ""Metal Discharge"" by Destruction",Metal Discharge is the 2003 studio album by German thrash metal band Destruction. It is a more experimental kind of album with the snare drum sound but it is still a good album overall.
234,entertainment,Rock Duo Had 2525 Vision At the End of the Sixties,
235,entertainment,"Synth EP Review: ""Odyssey"" by Tim Woodruff","Read on to learn about how ""Odyssey"" takes listeners on an emotional, image-rich synth journey as it unfolds."
236,entertainment,Hallmark Actor: Michael Rady,Michael Rady was a well-known actor before he began acting on the Hallmark Channel. He became even better known after working on the Hallmark Channel and Chicago Med at the same time.
237,entertainment,Run BTS: School Episodes,This article contains all the Run BTS episodes with a school theme.
238,entertainment,You Are Not My Mother (2021) Movie Review,This You Are Not My Mother (2021) Reveals Who Is Not Your Mother! Starring Irish People like Hazel Doupe and Carolyn Bracken! Directed by Kate Dolan!
239,entertainment,The Roadie 3 Automatic Guitar Tuner Has Your Guitar Strings Tuned,
240,entertainment,“No Exit” (2022) Review: The Good and The Bad,"Released on February 25, 2022, on Hulu. No Exit is a movie that had an interesting premise with a good cast of actors, but ultimately failed in its execution."
241,entertainment,All the Flash Speedsters From Slowest to Fastest,
242,entertainment,Disaster Porn Saturday Night: A Night to Remember,The first story of the sinking of the Titanic
243,entertainment,Friday Film Fest: Kurt Russell,"From Disney kid to leading man, Russell found some stellar roles and love along the way"
244,entertainment,"""Lucifer"" Review",
245,entertainment,“Investing Anna”: Netflix Promotes a Con and It's Not Comic,This whole article is completely made up. Except for all the parts that are totally true.
246,entertainment,10 Fun Facts About Soap Operas,"Many people watch them day in and day out. Yet, there are some fun facts about soap operas that would be interesting to viewers."
247,entertainment,The Kingsmen,"Kingsmen from British lore are those loyalist who serve the King. These Kingsmen are loyal to the musical roots of Rap, Hip-Hop and Soul, the King's of the music industry."
248,entertainment,"Synth Single Review: ""On The Run"" by Lyn Rajah","Read on to learn why I feel that ""On The Run"" weaves together well-chosen synth sounds to create music full of delicate smoothness and flowing energy."
249,entertainment,"Why I Love That Danhausen and You Should, Too",What the hell is a Danhausen and why should you care?
250,entertainment,"Synth Single Review: ""The Void"" by Bycemaster","Read on to learn why I feel that ""The Void"" has an ethereally drifting, delicate sensibility which carries listeners on a gliding journey."
251,entertainment,"Synth Single Review: ""Downpour"" by Midnight Hi-Fi","Read on to learn about how ""The Void"" has an ethereally drifting, delicate sensibility which carries listeners on a gliding journey."
252,entertainment,"Synth Single Review: ""The World"" by Thought Beings","Read on to lean about how ""The World"" combines energy, lyrical expression and strong vocal performances with engaging retro synth sounds."
253,entertainment,All Of Us Are Dead- Review,"All of Us Are Dead is a supernatural horror series set in a South Korean area beset by a fatal virus that converts all infected into mindless monsters, as well as the high school that acts as the pandemic's epicenter."
254,entertainment,The Life and Times of Michael Poulsen,
255,entertainment,Video Rewind: The Oscar,"Five men, one gold statue. Who's going to win the prestigious Oscar?"
256,entertainment,Why The Originals Is Better Than TVD,"Fans have always involved themselves in debates regarding these two shows, as to which one is better? The Originals has often come out victorious between the two, well, here are 5 reasons why it is as such!"
257,entertainment,Teen Wolf Creatures,
258,entertainment,Website Review: HiDive.com Streaming Service,HiDive.com is an anime streaming service that Sentai Filmworks owns.  They stream their licensed anime in Japanese and English and have an integrated online store.  is this streaming service worth your time and money for $4.99 a month?  Let's find out!
259,entertainment,Michael Baldwin Returns to Genoa City on the Young and the Restless,"Lauren will be reunited with her spouse at Crimson Lights and Chloe and Kevin will join the celebration,"
260,entertainment,"Review of the Album ""The Antichrist"" by German Thrash Metal Band Destruction",The Antichrist is the 7th studio album released by German thrash metal band Destruction in 2001.
261,entertainment,Sonic The Hedgehog 2 speeds to Theatres in April 2022,My blog regarding the upcoming Sonic The Hedgehog 2 film.
262,entertainment,Video Rewind: For Your Consideration,That time when Hollywood made fun of itself
263,entertainment,Alex T. Wolf: Top 20 Facts You Need to Know,
264,entertainment,From the Soundboard to the Stage: The Journey to Shooting Music’s Who’s Who,
265,entertainment,Rick and Morty The Complete Seasons 1-5 Blu-Ray Says It All,Rick and Morty are an unlikely pair — a Grandpa with a G-d complex and an underachiever grandson. Together they share adventures most others would rather not
266,entertainment,The Black Eyed Children,
267,entertainment,Should I Watch..? 'What Women Want' (2000),What appears to be a fluffy rom-com is actually a disturbing expose into Hollywood gender bias and looks even more outdated in the current climate. Benjamin Cox can't quite believe it.
268,entertainment,"Synth Album EP: ""Undefeated"" by Depth Cruiser","Read on to lean how ""Undefeated"" is an emotive expression of opposition to the Russian war on the Ukraine."
269,entertainment,"Sedos Presents “The Mystery of Edwin Drood” at the Bridewell Theatre, London","Sedos presents “The Mystery of Edwin Drood” a lively, hilarious musical, at the Bridewell Theatre, London."
270,entertainment,Hallmark Actor: Chad Michael Murray,Chad Michael Murray is a popular Hallmark actor. Learn some interesting things about him.
