,category,header,content
0,sports,"Stats of the Series: Phillies at Mariners, 5/9–5/11",
1,sports,5 Incredible Ways To Get Fit,
2,sports,Crocodile Tears,
3,sports,"How to buy $PS1 on MEXC, QuickSwap & PancakeSwap",
4,sports,I Don’t Think Kyrie Is Returning to Brooklyn Next Season,
5,sports,"Every Season of The Challenge, Ranked: #10 — War of the Worlds",
6,sports,When Does Real Life Begin?,
7,sports,Is MoveToEarn the new crypto mining?,
8,sports,"Stanton, Judge Drive in 10 in 15–7 Wallop of White Sox",
9,sports,Philadelphia 76ers guard Danny Green was carried to the locker room in Game 6 against the Miami…,
10,sports,The Trends That Will Reshape Sports Fandom Over The Next Decade,
11,sports,Tay Gowan Has Already Overcome Being Homeless and Covid; The Eagles CB Depth Chart Could Be Next,
12,sports,Should Athletes be Required to go to College before the Pros?,
13,sports,Predicting the Results of Every Remaining Premier League Game (as of May 13th),
14,sports,The Paradigm Shift That 10x’ed My Swimming Time In One Day,
15,sports,Build muscle faster with consistency,
16,sports,The Analytical Revolution Continues — Data & Basketball,
17,sports,"My Pain, My Gain",
18,sports,Behind-the-scenes at NU sporting events: crafting the fan experience,
19,sports,Heat v. Sixers — Game 6 Preview,
20,sports,You Can Never Keep Me Away From Sports,
21,sports,The Largest Sports Betting Wins In History — Gambling Money,
22,sports,Data is the new Oil— Sportradar: A $10 Billion Data Business,
23,sports,Tom Brady Is Quietly Building A Billion-Dollar Company,
24,sports,Why Meditation Is the Important Key to Unlocking Next-Level Athletic Performance,
25,sports,"Derrick Rose, What Could Have Been",
26,sports,Top 10 Miami Heat,
27,sports,ESBC Preview,
28,sports,Mindset to Help Athletes Perform in the Zone,
29,sports,The Post-Pandemic Return of the Legendary “Letterboxes” of Dartmoor,
30,sports,Formula One Finally Has Serious American Fans,
31,sports,Finding Reebok’s $2.4 Billion Buyer,
32,sports,Penn State lands 2023 commitment from 4-star WR Ejani Shakir — The Athletic : Sports Best News,
33,sports,My 2022 NBA Mock Draft: Part 2,
34,sports,The Key Differences Between NFL & NBA Contracts,
35,sports,2023 NFL Draft Quarterback Prospect Rankings,
36,sports,93 Datasets That Load With A Single Line of Code,
37,sports,"Lakers Get Permission to Interview Kenny Atkinson for Coaching Vacancy, per Report",
38,sports,Struggling With Pain? Here’s What To Do & What Not To Do!,
39,sports,Cristiano Ronaldo wins April Premier League Player of the Month,
40,sports,The Challenge All Stars 3 Player Preview: Yes Duffy,
41,sports,Match 59: CSK v MI Preview,
42,sports,The Beauty of Football,
43,sports,How Important Is Draymond Green To The Warriors’ Success?,
44,sports,Does Max Strus’s Emergence Mean Duncan Robinson Gets Traded?,
45,sports,The Biggest Names Likely to be Traded This Offseason,
46,sports,RadishNFT Announces Exciting Future Baseball NFT Giveaways,
47,sports,BBC continues to help manufacture transphobic culture war over sports,
48,sports,A Special Trip to Jerome Bettis’ Restaurant in Pittsburgh,
49,sports,Apple Is Coming For Major League Baseball — Changing streaming forever,
50,sports,The Top 10 Oklahoma Sooner Quarterbacks of All Time,
51,sports,ONE Championship All in On Martial Arts,
52,sports,What are DAO’s and How They Will Change Sports Forever,
53,sports,Sports and Sweat,
54,sports,WTA Tour Records,
55,sports,Big Money — Fenway Sports Group: The $7 Billion Sports Company,
56,sports,Edmonton Oilers defenseman Darnell Nurse has been suspended one game for head-butting Kings forward…,
57,sports,My Sports Bets for May 11th,
58,sports,Shirtum v2 Staking Is Live!,
59,sports,The World’s First $150 Million Tennis Player — Novak Djokovic,
60,sports,The Most Valuable Sports Franchises In The United States,
61,sports,How do teams break a title drought?,
62,sports,Aston Villa 1 Liverpool 2,
63,sports,"Chris Paul is the NBA’s most underrated investor. In 9 years, he’s hit a net worth of $160M. CP3’s 4 best investments",
64,sports,Fan Tokens Are Coming To The NFL & MLS — Blockchain Revolution,
65,sports,Liquiditeam: The Platform Empowering Athlete Ownership with Blockchain,
66,sports,How Do Professional Sports Leagues & Teams Make Money?,
67,sports,Sixers v. Heat — Game 5 Preview,
68,sports,$1000 Walking Rewards Program: Get Paid to Walk! Available Worldwide,
69,sports,"Yankees Win Wild, Feisty Game Vs Blue Jays",
70,sports,I.A.O. - Inicial Atleta Oferta,
71,sports,The Autobahn: Demystifying the Legendary German Roadway,
72,sports,Top 5 Move2Earn Projects + Bonus,
73,sports,Trans People Don’t Owe You Weakness,
74,sports,Data is the New Oil — Especially in Sports,
75,sports,Advanced Stats Will Change Basketball (And Sports) Forever,
76,sports,NCAA Teams Greatly Outpace Pro Teams In Operating Profit,
77,sports,"Bob Lanier, Detroit Pistons legend and 8-time All-Star, dies at 73",
78,sports,The Horse Race,
79,sports,The Rise of Roseman,
80,sports,"Own Shares of Athletes (Like Stocks): Fantasy Sports, But For Real Life",
81,sports,Creating Culture in the Hybrid Sports Workplace,
82,sports,4 Characteristics of “G.O.A.T” Athletes (#3 Might Surprise You),
83,sports,Match 58: RR v DC Preview,
84,sports,Do the Mets Have an Actual Catching Crisis?,
85,sports,KO’s of the Day #186: Best Farewell Matches,
86,sports,Tom House Is (Still) Reinventing Pitching With Mustard App,
87,sports,Health and Happiness,
88,sports,Steven Gerrard has hailed the current Liverpool vintage as the best to watch in the club’s history.,
89,sports,What is the true value of a college athlete?,
90,sports,Top 6 Cardio Exercises to Make Your Heart Strong,
91,sports,VFC joins the rapidly growing roster of Zetly partners./ VFC dołącza do szybko rosnącego grona partnerów Zetly.,
92,sports,Top web3 Headlines This Week,
93,sports,Rams to host Broncos on Christmas,
94,sports,Futbolda Yapay Zekanın Kullanımı,
95,sports,Check the Standings in Each Major Soccer League,
96,sports,The Challenge All Stars 3 Player Preview: Roni Martin,
