,category,header,content
0,sports,“Let’s build the biggest football club on the planet”,
1,sports,"Mayor Johnson creates new Dallas City Council committee devoted to attracting, retaining pro sports franchises",
2,sports,"Every Season of The Challenge, Ranked: #7 — The Inferno II",
3,sports,10 Foretelling's The Crystal Ball Has Revealed For The Eagles 2022 Season,
4,sports,How Does Ja Morant Stack Up Against Allen Iverson Statistically?,
5,sports,The Challenge All Stars 3 Power Rankings — Week 2,
6,sports,Brett Favre Allegedly Scammed $7M From The State of Mississippi,
7,sports,Emotional Pendulum Calibration (EPC) — The Superpower You Didn’t Know You Have,
8,sports,4 Tricks to Convert Your Walking Routine Into a Full-Body Workout,
9,sports,Own a Real Basketball Team?,
10,sports,Previewing the Eastern Conference Finals,
11,sports,"Pay That Man; Judge, Yankees Handle Orioles",
12,sports,WIN 2x Tickets to The Champions League Final!,
13,sports,Join The Community,
14,sports,Multiple Conferences? How UConn can thrive with two homes.,
15,sports,How sports memorabilia went digital,
16,sports,Corner Lots Baseball,
17,sports,A Recap of the 2022 Stanley Cup Playoffs: Round 1,
18,sports,"The Miami Heat took Game 1 of the Eastern Conference finals Tuesday night at home, winning 118–107…",
19,sports,"Sports Card Strategy Show: NBA Playoffs, Timing The Market, Baseball Veteran Plays, MLB Call-Ups",
20,sports,Four Dream starters hit double-digits in a 101–79 blowout win over Fever,
21,sports,"Pay That Man; Judge, Yankees Handle Orioles",
22,sports,More Yellow in My Life,
23,sports,Here’s How To Stop Negative Self-Talk,
24,sports,The Perfect Gift,
25,sports,Как получать вознаграждения в Dustland Runner. Механика игры.,
26,sports,A New Era for Haas F1 in 2022,
27,sports,The NBA is eyeing a rule change to the “transition take foul” that would award the offensive team…,
28,sports,Running for a better life,
29,sports,KO’s of the Day #193: MMA Legends In WWE,
30,sports,Is There About To Be A Breakout In The DraftKings Stock,
31,sports,Previewing the Conference Finals Series,
32,sports,Match 66: KKR v LSG Preview,
33,sports,The NBA’s Game 7s couldn’t hold up against the NHL’s Game 7s,
34,sports,Official Announce: partnership with The STA Group,
35,sports,Requiem for a Process,
36,sports,Is Chris Paul’s last chance of Winning a Title come to a ‘Devastating’ End?,
37,sports,The running revolution — some thoughts,
38,sports,"$50,000 For College Athletes Could Be The Minimum",
39,sports,Why Retired Athletes Will Become CEO’s of Million Dollar Collectives,
40,sports,"Health, Fitness, and Sports Degrees/Courses",
41,sports,"Severino, Trevino Lift Yankees Over Orioles",
42,sports,Five Years Later Colin Kaepernick Welcomed to NFL,
43,sports,The Suns Season Is Over and My Feelings Are Hurt,
44,sports,Hawks On Top!,
45,sports,Michigan State&#x27;s Max Christie will remain in NBA Draft — The Athletic : Sports Best News,
46,sports,An injured athlete’s reflection,
47,sports,The Rugby World Cup Is Headed To The United States,
48,sports,Suspense in Italy,
49,sports,Match 65 : Mumbai Indians v Sunrisers Hyderabad Preview,
50,sports,KO’s of the Day #192: Best UFC Merch,
51,sports,Fun Class Warm-Up Exercises You’ve Never Heard Of,
52,sports,The Top 5 Most Expensive NFL Stadiums,
53,sports,My Sports Bets for May 16th,
54,sports,"Nasty Nestor Dominates, Yankees Take 3/4 Against White Sox",
55,sports,3 College QB’s to Watch in 2022,
56,sports,The Ryan Express,
57,sports,The Undervalued Asset That Turned Into A $6 Billion Sports Giant,
58,sports,"Yesterday’s Heros, Sports Quiz 2",
59,sports,I Don’t Think Kyrie Is Returning to Brooklyn Next Season,
60,sports,I Have A Basketball Jones,
61,sports,Jurgen Klopp’s “Mentality Monsters” triumph again,
62,sports,Wilmington University earns NCAA DII East 2 Regional title and advances to their first-ever Super Regional,
63,sports,EPL 2021/22 — More Drama As We Approach Matchday 38,
64,sports,Penny Hardaway: Where Is He Now?,
65,sports,Winning Is About The Spirt Show,
66,sports,The $3 Billion Saudi-Backed Super Golf League,
67,sports,Raiders succeed at filling needs in 2022 NFL draft,
68,sports,Algorand becomes first US blockchain sponsor of FIFA World Cup : Free Crypto Coins Tips,
69,sports,"Every Season of The Challenge, Ranked: #9 — War of the Worlds 2",
70,sports,Three Burnley fans were arrested on Sunday following their loss to Tottenham.,
71,sports,The Russia-Ukraine War Puts A Global Sports Asset Worth Nearly $4 Billion Up For Sale — Chelsea FC,
72,sports,"Liberal Arts Blog — Mike Kryzyzewski, Duke’s Basketball Coach for 42 years, one of the Greatest Ever, aka “Coach K”",
73,sports,Corner Lots Baseball,
74,sports,Does Sport MB Fund Non-Inclusive PSOs?,
75,sports,Dribble With the One Who Brung You,
76,sports,My Sports Bets for May 14th,
77,sports,Stats of the Series: Phillies at Mariners 5/9–5/11,
78,sports,It’s Way Too Early in the Season to Worry About the Recent Blue Jays Slide,
79,sports,A-Rod’s New $500 Million SPAC,
80,sports,Naomi Osaka Is Launching Her Own Sports Agency,
81,sports,Grateful to have published 100 articles on Medium,
82,sports,Giannis vs. Kobe in Their Primes,
83,sports,KO’s of the Day #189: Most Successful Fighters Outside of the Promotion,
84,sports,Saudi Arabia’s $400 Million Takeover Of Newcastle United,
85,sports,The Carolina Hurricanes advanced to the second round of the Stanley Cup playoffs on Saturday…,
86,sports,Braves star outfielder Ronald Acuña Jr.,
87,sports,Motivation — Why falling behind leads to success,
88,sports,Drafting Mentors for the Future: The NFL’s Inspire Change Superstars and Their Community Partners Share Their Thoughts and Experiences,
89,sports,5 Incredible Ways To Get Fit,
90,sports,The Grizzlies Season Comes to an End but They Have a Bright Future,
91,sports,KO’s of the Day #188: Biggest Missed Weight-Ins,
92,sports,How Love for Volleyball Made Me a Better Woman,
93,sports,A Special Trip to Jerome Bettis’ Restaurant in Pittsburgh,
94,sports,Canelo Alvarez: The $365 Million Deal,
95,sports,The Rise of the Unicorns…,
96,sports,Crocodile Tears,
97,sports,Soccer Player Removed from Team for Excessive Farting in the Locker Room,
