,category,header,content
0,business,"To Quit Your Job and Reach Financial Freedom, All You Need Is Two Clients from DMs",
1,business,RIP LUNA/UST— Here are 7 Lessons We Have Learned From This Epic Crash,
2,business,Productivity Boosters: My Top Five Developer Tools Worth The Money,
3,business,How Startup Leaders Become Quick Experts At All the Skills,
4,business,Two Megatrends Transforming the World: Electrification and Digitalization,
5,business,The Many(!) Flaws of Net Promotor Score and What to Do Instead,
6,business,#28. How To Go From YouTuber To $3M+ Annual Revenue w/ Sam King,
7,business,Under New Ownership: The Community Collective for Houston Purchases The Power Center,
8,business,Female Founders: Staci Wanichek of Wine Away On The Five Things You Need To Thrive and Succeed as a Woman Founder,
9,business,The Business of Screenwriter: Get a damn good lawyer!,
10,business,How Rich Kids Can Spend $4935 to Look Like Crack Addicts,
11,business,"Earn $73,244.33 In Passive Income",
12,business,States of sustenance,
13,business,"Before Investing in Crypto, You Need to Understand What DeFi Is and How It Works",
14,business,Turning Side Projects into profitable startups,
15,business,Money in Politics,
16,business,What is the Generation Effect?,
17,business,How Boomer Mark Tilbury Makes $50K+ per Week in Passive Income,
18,business,15 Business Lessons from Coca-Cola,
19,business,3 Societal Pressures You Should Not Give A F*ck About,
20,business,"What Should the Mint Price Be When Launching a Set of 10,000 Generative NFTs on the ETH Blockchain?",
21,business,"Sugar, Caffeine, and Informed Consent at Panera Bread",
22,business,What I Have Learned About Affiliate Marketing From the Pros,
23,business,Microsoft Just Handed Sony Another Holiday Season Win,
24,business,I’ve Been Working For Myself For 30 Days. Here Are The Mistakes I’ve Made…So Far.,
25,business,Our Real Issues Are Bigger Than Inflation Lets On. Why Doesn’t Anyone Care?,
26,business,High-performance medicine,
27,business,How to Best Design Short-Term Loyalty Programs,
28,business,How To Fix iPhone Battery Issues,
29,business,You Shouldn’t Pay for Convertkit or Mailchimp,
30,business,Why Big Companies “Fail” To Adopt Disruptive Technologies: The Netflix Vs Blockbuster Case Study,
31,business,"Finally, I Empty My Mind Like Bruce Lee",
32,business,Netfix,
33,business,3 More Productivity Tips I Learned Working at Google,
34,business,5 things that will keep your partner happy,
35,business,Business and Money Are A Test of Your Ability to Enact a Story,
36,business,"12 Best Side Hustle Ideas To Make An Extra $1,000 Per Month",
37,business,7 Signs You’re Working on the Wrong Side Hustle For You,
38,business,The Definitive Guide To Getting Started With Affiliate Marketing: Part 1,
39,business,6 sexy pieces of writing advice from dead authors,
40,business,Kraken NFT marketplace opens waitlist for beta : Free Crypto Coins Tips,
41,business,Gen Z Needs Our Help,
42,business,Why I find the Metaverse so interesting,
43,business,DaS™ — Research Section,
44,business,A Guide To Building A On-Demand Mobile Messaging App Like Snapchat,
45,business,"How To Increase Your Earnings With +$10,000 Every Month",
46,business,The 1.7 million workers hired in the first quarter produced negative output,
47,business,10 Things To Scrutinize In Stock Markets,
48,business,"Talking TV, Streaming, and Segmentation with Fariba Zamaniyan of Xperi Corporation",
49,business,New to Social Media Marketing?,
50,business,Ideas in the Wild: Matt Hulett is Helping Leaders Change Their Business Destiny,
51,business,Your iPod is Selling for Upwards of Six Thousand!,
52,business,Don Muir of Arc On The Future of Money and Banking,
53,business,Hitting 6-Figures in Less Than 90 Days Selling Products With No Inventory Is Not a Pun,
54,business,The New York Times Is Buying The Athletic For $550 Million,
55,business,3 Overlooked Steps For Growing Your Profits,
56,business,"You May Have Until June 15 to File Your Canadian Personal Income Tax Return, but You Should Pay Now",
57,business,jeen-yuhs,
58,business,Collective Channeled Message — 5/12/2022 —,
59,business,How You Can Start Getting the Most Out of Your Team,
60,business,Season Four Of Bloomberg’s “The Pay Check” Premieres,
61,business,Swiss privacy startup Nym Technologies announced it has secured $300 million in commitments from…,
62,business,The Importance Of Thrift,
63,business,Gatorade trademark applications hint at joining the metaverse : Free Crypto Coins Tips,
64,business,Chad Osinga On The Five Things You Need To Be A Highly Effective Leader During Turbulent Times,
65,business,Why I’m Never Going To Freelance Again,
66,business,Two Things Every Leader Should Be Asking Themselves,
67,business,Women Leading The Finance Industry: Casey Halliley of Sqwire On The 5 Things You Should Do To Increase Your Financial Literacy,
68,business,The One Word That Can Help Us Break Our Tech Addiction,
69,business,"Homes Of The Future, With Cory Halbardier of Spacial",
70,business,Why Adding Value Changes Your Business Model,
71,business,8 Tips to Successfully Find Good Stock Images in 2022,
72,business,"Entrepreneurs: Work Smarter, Not Harder",
73,business,I Bought Some Stocks Today,
74,business,Slow and Steady Wins the Race: The Value of Consistency,
75,business,Andy Macdonald Of Consilio On The Five Things You Need To Be A Highly Effective Leader During Turbulent Times,
76,business,Female Founders: Sumana Jayanth of Damn Gina On The Five Things You Need To Thrive and Succeed as a Woman Founder,
77,business,Kayla Ihrig Of Writing From Nowhere: Five Things I Learned As A Twenty-Something Founder,
78,business,Justin Buck of Pearl Rolling Papers: 5 Things I Wish Someone Told Me Before I Started Leading a Cannabis or CBD Business,
79,business,Investing Trends in Metaverse.,
80,business,"How To Assess Tradition-Directed, Other-Directed, and Inner-Directed Character Traits As An Entrepreneur",
81,business,HR Trends in 2022: Part 1,
82,business,"Day One Of The IAB Upfronts: Ad Revenue Up, NPR Shines, iHeart has A Heart",
83,business,How to Bulletproof your Ecommerce Business for Demand Volatility,
84,business,The Case for Investing Over Paying Off Debt,
85,business,5 ways to handle difficult people,
86,business,Want to Move to Japan? — 6 Questions to Carefully Consider First,
87,business,How to Land Your First 5-Figure Writing Client in Under A Month,
88,business,Female Disruptors: Dr Zeenia Kaul of ReHeva Biosciences On The Three Things You Need To Shake Up Your Industry,
89,business,How a proper decision-making process can boost you and your business?,
90,business,Why EVERY Single Business Needs a Copywriter,
91,business,Female Founders: Veronica H. Speck of VHS Ventures On The Five Things You Need To Thrive and Succeed as a Woman Founder,
92,business,The Worst Boss I Ever Had,
93,business,Paparazzi Accessories’ Class Action Lawsuit,
94,business,"Erick Haskell Of Arteza On The Top 5 Ways To Market, Advertise & Promote An Ecommerce Business Today",
95,business,"Buy for a Buck, Sell For Two!",
96,business,3 things I learned from journaling for 100 days,
97,business,Start with the Market in Mind — Then Create Your Offer,
98,business,How to Scale Your Business in Less Time and With Less Stress,
