,categories,headers,contents
55,entertainment,Ashley Judd Filled With ‘Incandescent Rage’ in Emotional Mother’s Day Essay Dedicated to Late Mom Naomi Judd,"As Mother’s Day approaches this weekend, actress Ashley Judd has her mother, Naomi Judd, on her mind more than usual after she passed away last Saturday. Both of Naomi’s daughters are mourning the loss of their mother at 76 years old due to suicide. As they continue to grieve during their first Mother’s Day without their mom, Ashley has written a heartfelt essay dedicated to their mother."
56,entertainment,"The real life ""Young Sheldon""","A 13-year-old boy is on track to graduate college, at an age when his peers haven’t even begun high school. CBS Minnesota’s Caroline Cummings has the story."
57,entertainment,Colin Firth 'The Staircase' Performance Has Fans Sounding Off,"Colin Firth's performance in The Staircase is earning praise from critics and HBO Max viewers. The Oscar-winner plays author Michael Peterson in the limited series, which debuted on HBO Max with three episodes on May 5. Peterson was convicted of murder in the death of his second wife, Kathleen Peterson, but a judge later reduced the charge to voluntary manslaughter."
58,entertainment,‘Little House on the Prairie’ Star Melissa Gilbert Reveals the ‘Greatest Things’ Her Husband Told Her,"Former classic TV star Melissa Gilbert is living her best life in a cabin in the Catskill Mountains of New York, but it took a little bit to finally get there. She lives with her husband, Timothy Busfield, and the two fixed up the cabin together, grow their own food, and raise chickens far from Hollywood life."
59,entertainment,'SNL' Takes on Supreme Court Abortion Draft Decision with Medieval Skit,"'SNL' did a really smart cold open Saturday night ... challenging what appears to be the Supreme Court's notion that tradition should stand in the way of change. It was pretty brilliant ... the host Benedict Cumberbatch, along with Andrew Dismukes, Alex Moffat, Kate McKinnon, Chris Redd and Cecily Strong played characters back in 1235, when the laws were incredibly draconian. The point -- these ideas have no place a thousand years later."
60,entertainment,Rapper Benzino Threatens To Leave Coi Leray’s Life After Defending Eminem,"Rapper Benzino clashed with his daughter, rapper CoiLeray, on Twitter after she defended rapper Eminem’s induction into the Rock and Roll Hall of Fame. “I’m about love, equality, respect and forgiveness. I have nothing against Eminem, 25 years of my life all I know is he a very talented artist and actor ! (8 Mile was great) Let’s build bridges and get over them before you burn the bridge and burn with it.”"
61,entertainment,‘The Pioneer Woman’ Fan-Favorite Leaving Food Network Cooking Show,"Ree Drummond has found a massive fan following on her cooking show, “The Pioneer Woman.” However, recently, The Food Network icon shared major news with fans. Earlier this week, she announced the departure of a fan-favorite cast member. Coincidentally, he also happens to be her nephew—Stuart Smith."
62,entertainment,'RHONJ' Star Teresa Giudice Reveals Who Will Be Her Maid Of Honor When She Marries Fiancé Luis Ruelas,"The Real Housewives of New Jersey star Teresa Giudice is spilling the beans on who will be in her wedding party in her upcoming nuptials with fiancé Luis ""Louie"" Ruelas. In an appearance on The S— Pig podcast hosted by Housewives expert Christian Gray Snow, Giudice addressed the rumors spread by costar Kim DePaola (A.K.A. Kim D.) that her Maid of Honor will be none other than Dina Manzo. It all started back in March, during an episode of Behind the Velvet Rope with David Yontef, when DePaola bragged about having an ""inside scoop"" on the wedding. ""I found out..."
63,entertainment,Netflix is adding 17 new movies and shows this week,"May is a big month for Netflix this year and now that we are in the second full week of the month, they are really starting to add some of their biggest new movies and shows to their lineup. That includes a new movie featuring two actors who played Mr. Darcy in Pride and Prejudice, a new series based on a popular book, and a new Netflix Original comedy."
64,entertainment,Look: Former Duke Star Got Engaged On Campus Yesterday,"San Antonio Spurs guard Tre Jones had quite the special day on Saturday. The former Duke star basketball player got engaged to his longtime girlfriend Maddy Torres on the Blue Devils campus. Jones and Torres have been dating since they both went to Duke, so it makes perfect sense that..."
65,entertainment,‘Jeopardy!’: How Mattea Roach Plans to Spend Winnings After Show Provided ‘Pathway to Financial Security’,"Mattea Roach might have concluded her impressive 23-game winning streak on “Jeopardy!” this week. However, just because her reign came to an end doesn’t mean she doesn’t get to take home a heaping reward. After nearly two dozen impressive games, Mattea Roach won a total of $560,983. And while she’s unsure of what that amounts to in Canadian dollars, her run on “Jeopardy!” has provided her with “financial security” in her youth nonetheless."
66,entertainment,Look: Paige Spiranac's Tweet About Max Homa Is Going Viral,"Paige Spiranac is best known for her social media presence, so it's not a surprise that the former Division I golfer can appreciate a PGA Tour member who enjoys the medium as well. Max Homa, who won this weekend's Wells Fargo Championship, is pretty online himself. It turns out Spiranac..."
67,entertainment,Prince William and Kate Middleton's Moving Plans Could Ignite Feud With Andrew and Eugenie,"Prince William and Kate Middleton are reportedly moving to a new residence where they will be closer to Queen Elizabeth. However, the move is reportedly sparking some drama between them and Prince Andrew, per The Mirror. The drama ties back to the royals' residence Adelaide Cottage, as both the Cambridges and Andrew's daughter, Princess Eugenie, have their sights on the location."
68,entertainment,Kylie Jenner Reveals What ‘Being a Young Mom’ to Stormi and Her Son Means to Her In Sweet Mother’s Day Message,"The bright side. Kylie Jenner celebrated Mother’s Day with a sweet message to daughter Stormi. “Being a young mom just means we met a little early and I get to love you a little longer,” Jenner, 24, captioned a series of photos and videos from the beach on Sunday, May 8, via Instagram."
69,entertainment,Britney Spears Gives 1st Sneak Peek Of Wedding Dress & Introduces New Kitten,"Britney Spears, 40, is getting prepared for her upcoming wedding to fiance Sam Asghari and her latest Instagram post shows it! The singer, who is expecting her third child, shared a snapshot of her new cat Wendy sitting on the veil of her wedding dress on May 7 and added a caption to let her fans know it was a sneak peek of the epic piece. “Introducing Wendy 🐈 !!! It’s MEOW time boys and girls 😬 And yes, this is the veil to my wedding dress 👰🏼‍♀️ !!!” she wrote."
70,entertainment,Janet Jackson Flashes Her Signature Smile As She Rocks Sweats After Kentucky Derby: Photos,"Janet Jackson proved that she can pull any outfit off! On May 8, the legendary singer and dancer was seen outside the JFK Airport in New York City after a performance in Louisville, Kentucky after the Kentucky Derby. In the candid photos, Miss Jackson looked laid back as she rocked..."
71,entertainment,"Bruce Willis Helps Daughter Evelyn, 8, Learn To Rollerskate Amid Aphasia Battle: Watch","Bruce Willis, 67, recently spent some quality time with his daughter Evelyn, 8, as she learned to rollerskate in their garage. The actor, who retired from acting due to a battle with aphasia, appeared in a video that his wife Emma Heming shared to Instagram on Saturday and he can be seen slowly walking beside the energetic little girl as she held his hand and glided on cement. Emma added a smiling emoji surrounded by hearts to the clip."
72,entertainment,"Cardi B Longs for 'Thick' Post-Pregnancy Body as She Shares Sweet, New Throwbacks with Baby Boy Wave","Cardi B is championing the mom bod. The Grammy Award winner, 29, held baby boy Wave Set, 8 months, in some sweet throwback photos she shared Saturday to Twitter, putting her curves on full display. ""I wanna be this thick again,"" Cardi wrote. She and husband Offset announced that they..."
73,entertainment,Odell Beckham Jr. and Von Miller Working With Celebrity Jeweler to Craft Los Angeles Rams’ Super Bowl Rings,"Odell Beckham Jr. and Von Miller are working closely with a celebrity jeweler to help design the Los Angeles Rams’ Super Bowl rings. TMZ Sports reports the pair are collaborating with Jason of Beverly Hills, who’s made a name for himself in the championship ring market, making six of the NBA Championship rings since 2009 (Lakers, 2009, 2010, 2020; Warriors, 2015, 2017, 2018)."
74,entertainment,Here Are the First Week Numbers for Future’s Chart-Topping Album ‘I Never Liked You’,"Future’s latest album I Never Liked You is his eighth No. 1 on the Billboard 200 chart, per Billboard. I Never Liked You earned 222,000 album equivalent units, of which 214,000 consisted of streaming units, equaling 283.75 million on-demand streams of the set’s tracks. The remaining units were split between 6,500 coming from album sales and 1,500 from TEA units. It also outperformed early projections, which were sitting between 175,000 to 200,000 units."
75,entertainment,"How the Kardashian-Jenners Celebrated Mother’s Day 2022: Pete Davidson, Travis Barker and More Send Kris Jenner Flowers","Celebrating the moms. The Kardashian-Jenner family has many mamas to honor on Mother's Day — and no one could forget about the family matriarch, Kris Jenner. ""I am so blessed with beautiful grand babies who fill my life with more joy than I could have ever dreamed of,"" the momager, 66, wrote via her Instagram […]"
76,entertainment,Victoria Beckham Strikes a Pose in Slit Leggings and Sharp Pumps Ahead of Mother’s Day,"Click here to read the full article. Victoria Beckham took to social media to showcase the power of single-tone style.
In a new mirror selfie shared on Instagram, the former Spice Girl struck a side profile pose with hand on hip to showcase her new XS—XXL shapewear collection, VB Body. Beckham’s ensemble featured a pair of sleek, slim-fitting black leggings with lightly flared hems and small front slits for greater movement. For an effortless twist, her look was finished with stud earrings and a quick updo — plus a black turtleneck top that will be released soon.
“If you love VB Body then..."
77,entertainment,Kate McKinnon Mocks Amy Coney Barrett Over 'Plopping' Babies On Ferris Wheels On 'SNL',What's “more traumatic?” McKinnon asked. “Safely ending an early pregnancy or giving full birth to a baby you can never see again because you put it on a Ferris wheel?”
78,entertainment,"Two Years After Her Divorce, Tisha Campbell Officially Drops 'Martin' From Her Name","Tisha Campbell has been divorced for a couple of years now, but in the time that has passed since, she’s decided to drop ex-husband Duane Martin’s last name (she’s gone by Tisha Campbell-Martin for years). She recently took a trip to the social security office where she reclaimed her maiden name."
79,entertainment,Nick Jonas and Priyanka Chopra share 1st photo of baby after 100 days in NICU,"Nick Jonas and Priyanka Chopra Jonas have shared the first photo of their daughter, Malti Marie. On Instagram, the couple shared the same image of Chopra Jonas cradling their infant daughter to her chest while Jonas leaned over her shoulder to hold Marie’s hand. In the caption, they penned a lengthy message about their parenthood journey after announcing in January that they welcomed their first child via surrogate."
80,entertainment,‘Wheel of Fortune’s Vanna White Posts Adorable Then vs. Now Photos With Her Kids to Celebrate Mother’s Day,"Wheel of Fortune star Vanna White finds herself in a celebratory mood on Mother’s Day by sharing a sweet throwback photo. White has two children, Giovana and Nicholas, from her marriage to George Santo Pietro. People can see her still at the letters board on the famed game show along with Pat Sajak. Today, though, we let Vanna honor moms and take time to celebrate her children, too."
81,entertainment,How John Travolta Honored Late Wife Kelly Preston on Mother's Day,"Watch: John Travolta Honors Late Son Jett on His 30th Birthday. John Travolta posted the ultimate Mother's Day tribute to his late wife Kelly Preston on Instagram on May 8. Beginning with the words ""From me To you,"" the 68-year-old old shared a heartwarming video montage set to the song ""That Face"" by Barbara Streisand."
82,entertainment,'Handmaid's Tale's' Margaret Atwood Calls Enforced Childbirth Slavery,"Margaret Atwood -- who penned 'The Handmaid's Tale,' inspiring the TV show -- just let everyone know how she feels about banning abortion ... calling it literal enslavement. The renowned author and poet wrote a brief but powerful op-ed in The Guardian this weekend -- and it's all about the prospect of the Supreme Court overturning Roe v Wade, which was made public last week after a draft opinion leaked to the press."
83,entertainment,Jennifer Lopez Celebrates Mother’s Day With Cute Throwback Video Of Her And Ben Affleck,"The second age of Bennifer has been with us for some time now, and fans are still relishing it. Since getting back together, Jennifer Lopez and Ben Affleck have once again become one of Hollywood’s hottest couples. So many were downright ecstatic when Lopez confirmed their engagement by showing off her ring. Amid the renewed relationship, JLO has shared some sweet posts on social media and, to celebrate Mother’s Day this year, the entertainer dropped a cute throwback video of her and Affleck."
84,entertainment,"Jennifer Lawrence, Priyanka Chopra, Jeannie Mai and More Stars Celebrate Their First Mother's Day as Moms","For some stars, this Mother's Day weekend has extra special meaning. Over the past 12 months, Jennifer Lawrence, Priyanka Chopra Jonas, Jeannie Mai Jenkins and Allison Williams are just some of the celebrities who have added the role of ""Mom"" to their already impressive resumes. Clearly, these new mamas deserve to be spoiled on May 8."
85,entertainment,Molly Bloom Says Struggles with Infertility 'Brought Me to My Knees' Before Welcoming Daughter,"From Olympic-class skier to multimillion-dollar underground poker host, Molly Bloom has taken on many roles in her life — and now she's adding one more to the list: Mom. The Molly's Game author, 44, welcomed her first child, daughter Fiona, on Feb. 8, and is opening up to PEOPLE about her difficult journey to become a mom, detailing her experience with infertility and in vitro fertilization (IVF) and offering advice to other women facing similar challenges."
86,entertainment,How Harry and Meghan Misinterpreted Diana's Royal Exit,"""Diana always saw the power of changing within the structure of the monarchy,"" said royal commentator and former editor of Vanity Fair, Tina Brown."
87,entertainment,"A family of 5 renovated a 2-story RV that's complete with a secret doorway, hidden projector, and fireplace","Since buying a 400-square-foot RV, the Garcias estimate that they've spent about $13,500 adding a loft, a door disguised as a bookshelf, and more."
88,entertainment,Matt James Reflects on Clare Crawley’s ‘Bachelorette’ Shade 2 Years Later: I’ve Still ‘Never Spoken to Her’,"As Bachelor Nation waited for Clare Crawley’s season of The Bachelorette to start filming amid the coronavirus lockdown, there was far from a lack of drama leading up to production — including the season 16 star throwing shade at Matt James. “If you are doing interviews and creating Cameo accounts before you are even on […]"
89,entertainment,Eva Mendes Holds Back Tears Revealing Heartbreaking Mother's Day News About Mom,"Eva Mendes shared an update on her mother's health during a stop on Today with Hoda & Jenna on Friday. Mendes teared up as she revealed that her mother is ""not doing too well."" The Hitch star, 48, also spoke about raising her daughters Esmeralda, 7, and Amada, 6, with Ryan Gosling."
90,entertainment,Uncle Anderson Cooper meets Andy Cohen’s new baby girl,"Anderson Cooper finally met Andy Cohen's newborn daughter, Lucy!. On Saturday, May 7, Cohen shared an adorable photo of Cooper interacting with Lucy on his Instagram. In the snap, Cooper appeared to be holding his hand out to the newborn while she reached one of her hands up to him."
91,entertainment,Marvel Releases Ms. Marvel One Month Teaser,"Sure, Moon Knight just wrapped up on Disney+ and Doctor Strange in the Multiverse of Madness is in theaters now, but there's another exciting entry in the MCU on the horizon: Ms. Marvel. We're exactly one month out from the debut of the Disney+ series and to mark the countdown, Marvel Studios has released a new one month teaser for the series reminding fans that we'll soon be witnessing the beginning of a new marvel. You can check it out for yourself below."
92,entertainment,"TV Icon Donna Mills on Becoming a Mom at 54, Taking an 18-Year Acting Hiatus: 'I Went After It'","Donna Mills is a woman who knows what she wants and goes for it. The actress, best known for her iconic role as vixen Abby Fairgate on the hit Dallas spin-off Knots Landing, spoke to PEOPLE in the latest issue about how she paved her own unique career path in Hollywood, as well as a full life off-screen, which included becoming a mother in her 50s."
93,entertainment,"WWE star calls out Snoop, Mariah, 50 Cent before 1st pitch","If you dub yourself the Legit Boss, you better bring it when you throw out a first pitch. Even more so when the pitch is coming in your hometown of Boston and you call out Snoop Dogg, Mariah Carey and 50 Cent before climbing the mound. But WWE superstar Sasha..."
94,entertainment,Britney Spears Shares a Peek of Her Wedding Veil on Instagram,"21 of Britney Spears’ Amazing Stage Outfits Through The Years. Britney Spears gave us another glimpse at her wedding planning process. In her latest Instagram post, the pop star shows a peek of an important wedding accessory while also introducing her new furry friend. The pic shows Wendy, the ""Stronger"" singer's new kitten, as she sits on a white veil that's covering a multi-colored carpet."
95,entertainment,Blake Lively Gives a Rare Glimpse Inside Her Home on IG (& That Chandelier!),"Blake Lively stole the show at the Met Gala last week with her Statue of Liberty-inspired Versace gown, and now, she's grabbing our attention yet again by showing off some selfies she took the night before she hosted the big event (while giving her followers a rare glimpse into her home along the way)."
96,entertainment,'SNL': Benedict Cumberbatch Can't Get Cecily Strong to the Fainting Couch in Time,"Benedict Cumberbatch came back to Saturday Night Live with musical guest Arcade Fire and with him came an entire episode filled with great sketches. Just when you think one is just ""okay"", it ends up having a great ending or a joke that stays with you even after the show as moved on, and it was just an all-around fun episode of the comedy series."
97,entertainment,‘NCIS’ Alum Emily Wickersham Receives Moving First Mother’s Day Tribute From Boyfriend James Badge Dale,"Emily Wickersham of NCIS fame is celebrating her first Mother’s Day as a mom and her boyfriend James Badge Dale is honoring her. Not that he doesn’t honor her in some way every single day. Still, Sunday is a special day worth remembering and honoring moms. As you can see, Wickersham is holding her child closely while on the beach."
98,entertainment,U2 Performs Surprise Concert In Kyiv Bomb Shelter As Ukraine Fights For Freedom,"U2 is showing their support for Ukraine with what they do best: performing music. Two members of the Irish rock band, including Bono and The Edge, surprised residents of Kyiv with a 40-minute performance at the Khreshchatyk metro station on May 8. Photos, which can be seen here, show the musicians smiling, playing guitar, and singing as they wore black outfits in front of the gathered crowd."
99,entertainment,Scott Disick Spotted Leaving Miami Restaurant With Mystery Girl,"Scott Disick, 38, may have a new female friend in his life! The Kardashians star was photographed leaving Papi Steak restaurant in Miami, FL with a mystery woman who walked beside him and got in his car at one point. The duo reportedly left the eatery around 2AM and appeared relaxed and content as they showed off fashionable outfits. Scott wore a black hoodie, tan pants, white sneakers, and a black baseball cap during the outing while the unidentified blonde gal wore a crop top under a black leather jacket, a black and white patterned mini skirt, and white chunky heels."
100,entertainment,"Jewell Caples, Death Row Records Singer Who Worked With Dr. Dre, Tupac Shakur and More, Dead at 53","Former Death Row artist Jewell Caples has passed away. She was 53. Caples’ manager, Timothy Beal, confirmed the death of the late R&B singer in his statement to Entertainment Tonight on Saturday (May 7). ""Jewell was a very special woman with a big heart. She had been a guest..."
101,entertainment,Kris Jenner Shares Trove of Family Throwbacks in Honor of Mother's Day: 'My Greatest Joy in Life',"The Kardashians star, 66, took a stroll down memory lane and celebrated the annual Spring holiday on Sunday by reflecting on her role as a mother in a candid Instagram post. Sharing a selection of throwback photographs of herself, her children, and her grandchildren from throughout the years, Kris began the caption of her post, writing, ""Being a mother and grandmother is my greatest joy in life."""
102,entertainment,"Password sharing isn't killing Netflix, streaming fatigue is","Quality over quantity and better discoverability are never a bad idea. Netflix took the world by surprise when it announced its first-ever drop in subscriber counts earlier this month. Dropping 200,000 subscribers after a decade of growth is no joke. The poster child of streaming services has been on a spree of content creation, acquisition, and subscriber growth for years. However, even if you leave aside the COVID-induced growth in memberships, and its subsequent slowdown, a drop in viewership was a long time coming. Call it subscription fatigue or a flawed content strategy, Netflix’s dip could be a cautionary tale and learning lesson for practically every streaming service. Here’s why."
103,entertainment,Anna Nicole Smith’s daughter wears Janet Jackson’s outfit to Kentucky Derby gala,"Ms. Dannielynn if you’re nasty.

Anna Nicole Smith’s daughter, Dannielynn Birkhead, got a chance to wear one of Janet Jackson’s iconic outfits Friday night.



The 15-year-old attended the Barnstable Brown Gala in the black pantsuit, oversize belt and newsboy cap that the “Rhythm Nation” singer wore to the same pre-Kentucky Derby event in 2003.

“It was purchased as a part of Janet’s @juliens_auctions benefitting charity,” Dannielynn’s father, Larry Birkhead, explained in an Instagram post, adding the hashtag “#prouddad.”



The father-daughter duo also had a chance to meet and take a picture with Jackson, 55, at the gala.

“What a night! … Janet was so gracious..."
104,entertainment,SNL’s Michael Che jokes about 1000-year-old Alabama cave drawings,"Comedian Michael Che offered up his opinion about recently-discovered cave pictures in Alabama during this weekend’s Saturday Night Live show:. “Archaeologists have discovered thousand-year-old drawings in caves in Alabama. Guys, they’re bad,” he joked during his segment of Weekend Update. Researchers recently shared images and findings about..."
105,entertainment,Kanye West Facing Yet Another Lawsuit,"Kanye West is being sued by Bishop David Paul Moten, who claims that Ye used a recording of one of his sermons without permission. The sample was used in Ye's new song ""Come to Life"" on the album Donda, and it does include a long sermon. A copy of the lawsuit was obtained by TMZ."
106,entertainment,Elizabeth Olsen: ‘I think throwing Marvel under the bus takes away from the talented crew’,"Elizabeth Olsen is covering her eyes. “I can’t look at the screen. I’m sorry.” The cause of the actor’s dismay is not, as you might think, my face, but her own. It’s midway through our interview and I’ve switched off my laptop camera to evade internet issues, leaving Olsen alone, staring back at herself. She spends the rest of the chat with her eyes modestly directed to the right. “We should have caught up in person,” she says.This isn’t the behaviour you’d expect from a bankable Hollywood star of Marvel movies – and one who comes from an acting dynasty...."
107,entertainment,"Jared Padalecki Car Crash Details Revealed, Family Member Involved","New details have emerged about the car accident that Jared Padalecki was involved in. According to TMZ, the incident was incredibly serious and involved one of the actor's family members. The accident took place a couple of weeks prior and left Padalecki unable to attend a fan convention alongside Supernatural co-star Jensen Ackles."
108,entertainment,Priscilla Presley Says Seeing How Much Daughter Lisa Marie 'Loved' Elvis Movie Brought Her to Tears,"Lisa Marie Presley has given the upcoming Elvis movie her seal of approval. Priscilla Presley revealed in an Instagram post on Friday that her daughter, 54, is thrilled with the way the drama, which focuses on Elvis Presley and his relationship with his manager Colonel Parker, has turned out. Elvis..."
