,categories,headers,contents
109,entertainment,"Bono, Jill Biden & Justin Trudeau Visit Ukraine","Here's a sign that the tide might be turning in Ukraine -- Bono, First Lady Jill Biden and even Prime Minister Justin Trudeau paid a visit this weekend ... a very pleasant surprise. The trio don't appear to have traveled together, but they were all on hand Saturday and Sunday..."
110,entertainment,Prince Harry and Meghan Might Be Planning Another Sitdown Interview with Oprah Winfrey,"Tina Brown’s newest book, The Palace Papers, has apparently touched such a nerve with the Sussexes that they are looking to do a second sitdown interview, OK! reports. “These latest claims have really gotten under Meghan’s skin,” reports from Heat, per OK!, claim. “She’s told her team that something needs to be done. She’s so sick of the negative headlines and she’s desperate to come out fighting with some major damage control. Meghan feels as though doing another chat with Oprah is the best way to change the narrative and counter all the negative claims she’s read about herself recently.”"
111,entertainment,Snoop Dogg's Son Cordell Broadus' Car Stolen,"Snoop Dogg's son, Cordell Broadus, got his brand new whip jacked ... but the car was recovered pretty quickly ... this according to cops who were hot on the trail. LAPD sources tell TMZ ... Cordell's 2022 BMW X6 was jacked Wednesday in L.A. We're told a tracking company located it, passed the info on to the LAPD and cops rushed to retrieve it."
112,entertainment,"Dannielynn Birkhead, 15, Looks Just Like Mom Anna Nicole Smith In Colorful Kentucky Derby Dress: Photo","Looks like Anna Nicole Smith’s daughter is in touch with her mother’s southern roots! Dannielynn Birkhead, 15, was spotted getting ready for the 2022 Kentucky Derby with her father, Larry Birkhead. In photos shared to his Instagram on May 7, the teenager looked exactly like her late supermodel mother, as she donned a colorful dress for the extravagant occasion."
113,entertainment,‘The Cowboys’ Star A Martinez Reflects on the John Wayne Classic 50 Years Later,"Actor A Martinez happens to be part of the cast put together for the John Wayne classic film The Cowboys and he’s looking back at it. Recently, the actor did go on Instagram and shared some interesting thoughts. “#TheCowboysMovie is turning 50 this year, and celebrations are in order,”..."
114,entertainment,"Dream Kardashian, 5, Dances With Cousin True Thompson, 4, In Matching Swimsuits: Watch","The Kardashian kid cousins clearly have the most amazing family bond, as they are consistently spotted having a blast with each other in videos shared by the famous brood. In the latest clip posted by Khloe Kardashian on Friday (May 7), her daughter True Thompson is seen dancing up a storm with her adorable cousin, Rob Kardashian’s daughter Dream."
115,entertainment,'SNL': Weekend Update Tackles a Horrific Week in News,"Saturday Night Live brought back host Benedict Cumberbatch to promote his film Doctor Strange in the Multiverse of Madness and while he had a great show, it was also marred by the fact that this week news broke about the SCOTUS leak from Justice Samuel Anthony Alito Jr.. The show as a whole brought it up quite a bit, but it took over Weekend Update, with jokes from Kate McKinnon as Justice Amy Coney Barrett and segments all about the ruling and the ensuing protests around the country."
116,entertainment,"Elizabeth Olsen Cameoed On Benedict Cumberbatch’s SNL Episode, And Of Course The Multiverse Came Up","One of the most exciting things about Saturday Night Live is you never quite know who else might show up. There’s always a sense that anyone in the host’s personal or professional orbit could potentially make an appearance. It doesn’t always happen. Sometimes you get no one, and sometimes, when you’re least expecting it, you get Elizabeth Olsen."
117,entertainment,Young & Restless Preview: [Spoiler] Calls Out Diane When She Says She Only Wants Kyle’s Forgiveness,"Ashley casts her vote to kick Diane off the island. In a Young & Restless preview for the week of May 9 – 13, Kyle seeks his family’s advice regarding Diane. Read what happens and watch the preview below. After finally meeting his mother, Diane explained she planned..."
118,entertainment,SNL star Colin Jost compares Supreme Court to Amber Heard,"Saturday Night Live star Colin Jost took aim at Supreme Court Justice Samuel Alito’s controversial leaked draft opinion onRoe v Wadeduring the Weekend Update segment on 7 May, making reference to actor Johnny Depp’s ongoing defamation trial against ex-wife Amber Heard.Jost opened his monologue by pointing out that: “Tomorrow is Mother's Day, whether you wanted to be one or not.” He went on to explain that: “In an unprecedented move that could cause lasting damage to the Supreme Court, a draft opinion was leaked which indicates that they intend to overturn Roe v Wade. So the court is usually careful,..."
119,entertainment,Joey Swoll Reacts to TikToker Who Called a Gym Worker ‘Karen’ After She Asked Man to Leave Closed Gym,"Hostile gym interactions and toxic encounters have become all too normal on streaming platforms like TikTok, but fitness influencer Joey Swoll is determined to fix that. In a recent video, Swoll reacts to a disrespectful TikToker and voices the importance of treating everyone in the gym with respect, including the staff."
120,entertainment,‘The Lincoln Lawyer’ Series Based on ‘Bosch’ Creator Michael Connelly’s Novel Is Coming to Netflix in May,"The Lincoln Lawyer, the movie, gave Matthew McConaughey’s career a much-needed spark more than a decade ago. And now a TV series about an attorney with a messy life is hitting Netflix. The Lincoln Lawyer drops May 13. And it certainly has some heft behind it. It’s based on..."
121,entertainment,'SNL's Cold Open Tackles the Supreme Court's Roe v. Wade Leak,"When in doubt, Saturday Night Live is here to poke fun at our current political climate in a way that makes us laugh despite wanting to cry. Host Benedict Cumberbatch kicked off his second hosting gig in the cold open, which is strange for a host to do. But the sketch was a hilariously dark look at men making decisions for the bodily autonomy of others and watching as Cumberbatch, Andrew Dismukes, and James Austin Johnson sat around making a decision on abortion in 13th century England."
122,entertainment,‘Ozark’ Season 4: Here’s Where You’ve Seen the Actress Who Plays Camila Before,"There’s a lot to take in with the fourth and final season of the hit Jason Bateman-led Netflix series, Ozark. With so much going on in the dramatic series, Ozark has brought in multiple characters during its massively successful run on the streaming service. Among these is one surprising player, Veronica Falcón’s Camila."
123,entertainment,'SNL' imagines origin of abortion laws from the Middle Ages,"""Saturday Night Live"" traveled back to 1235 and imagined the origin of abortion laws, where men from centuries' past discussed punishment for women breaking the law. ""Weekend Update"" hammered down on conservative members of the Supreme Court following the Politico report that suggested the high court could overturn Roe v. Wade.May 8, 2022."
124,entertainment,"Snoop Dogg’s Son Cordell Broadus Reportedly Had BMW Stolen, Retrieved in Los Angeles","Cordell Broadus, Snoop Dogg’s 25-year-old son, saw that first-hand this week when his car was stolen on Wednesday, per TMZ. The entrepreneur’s 2022 BMW X6 was swiped, but not for long, because a tracking company narrowed down the search and passed information over to the Los Angeles Police Department after the car-jacking, the publication shares. Then, the LAPD reportedly retrieved the vehicle and arrested the alleged robber—who already had an active warrant and was booked on a charge of burglary of a motor vehicle. TMZ reports that the vehicle’s keys were left inside the BMW, and stolen items were also found inside when it was recovered."
125,entertainment,"Tekashi 6ix9ine’s Daughter Saraiyah, 6, & Ex GF Sara Molina Hospitalized After Terrifying Car Crash","Tekashi 6ix9ine‘s daughter Saraiyah, 6, and his ex-girlfriend Sara Molina, Saraiyah’s mother, were involved in a car accident after being rear-ended on an expressway in New York City, TMZ reported. The terrifying crash, which also apparently involved Sara’s sister, led them to being hospitalized in the ER with some serious injuries, the outlet also reported. The accident reportedly happened after the driver of their minivan was cut off and Saraiyah was scared."
126,entertainment,"Like Matthew McConaughey's Family, James Van Der Beek Opens Up About Why Leaving Hollywood Was The Right Decision","Hollywood may be the place to be if you’re trying to break into the industry or work as much as possible. However, increasingly a slew of celebrities have shifted away from the California Mecca to call another place their home. In fact, Varsity Blues, Dawson’s Creek and Don’t Trust The B—- star James Van Der Beek opened up about leaving Hollywood for Texas, similar to Matthew McConaughey, Camila Alves and their kids. He also shared why leaving Tinseltown was the right call for himself, his wife Kimberly and their six children."
127,entertainment,Priyanka Chopra & Nick Jonas Share 1st Baby Photo Of Daughter Malti: ‘Our Girl Is Home’,"Priyanka Chopra and Nick Jonas have shared the first photo of their baby Malti Marie Chopra Jonas! The Quantico star, 39, and “Jealous” singer, 29, shared the image via Instagram on Mother’s Day (Sunday, May 8) and reflected on their “rollercoaster” journey as baby Malti was in the NICU for “100 plus days.”"
128,entertainment,Nick Jonas and Priyanka Chopra Share 1st Photo of Their Daughter Malti After Her Months-Long NICU Stay,"Showing off their sweetie for the first time! Nick Jonas and Priyanka Chopra Jonas debuted their daughter on Sunday, May 8, and they explained that the little girl only came home recently after 100 days in the newborn intensive care unit. ""On this Mother’s Day we can’t help but reflect on these last few months […]"
129,entertainment,Anna Nicole Smith’s Daughter Dannielynn Birkhead Gets Glamorously Loud in Psychedelic Dress & Daisy Jelly Sandals at Kentucky Derby 2022,"Click here to read the full article. 	
		
			If you purchase an independently reviewed product or service through a link on our website, Footwear News may receive an affiliate commission.		
	
	Dannielynn Birkhead is noted for her Kentucky Derby style, attending the event every year with her adoring father Larry Birkhead. For the 2022 event, the 15-year-old daughter of the late Anna Nicole Smith wore a vibrant dress crafted out of a loud ’60s-inspired fabric, daisy platform jelly heels and a bold baby blue hat. Needless to say, the end result was perfect for the iconic racing event at Churchill Downs.

  










View..."
130,entertainment,Gabby Barrett Reveals She's Pregnant with Second Baby on Mother's Day: 'My Son',"Gabby Barrett has an extra special reason to celebrate this Mother's Day: she's about to become a mom again!. The ""I Hope"" singer, 22, announced on Sunday that she's expecting another baby with her husband, fellow American Idol alum Cade Foehner, whom she wed back in 2019. Sharing the big..."
131,entertainment,Ross Mathews Marries Fiancé Wellinthon García in Mexico — with Flower Girl Drew Barrymore!,"Ross Mathews married fiancé Dr. Wellinthon García in a beachside ceremony on Saturday, he tells PEOPLE exclusively. The RuPaul's Drag Race judge and his husband tied the knot at Almar Resort in Puerto Vallarta, Mexico — the same place where the couple met two years ago. Wearing custom grooms' tuxedos from Robbie and Co., the newlyweds exchanged vows in front of 110 guests."
132,entertainment,Country Singer Mickey Gilley Dies,"Mickey Gilley, who helped launch the Urban Cowboy movement in country music and had hit songs including “Stand By Me,” “Room Full of Roses” and “Lonely Nights,” died Saturday in Branson, Missouri. Gilley, 86, had just played 10 shows in April, and passed away..."
133,entertainment,Jennifer Lopez and Ben Affleck Twinned in Couple's Button-Downs,"Jennifer Lopez and Ben Affleck are continuing to search for their forever home, and in the process, have proved that not only their hearts, but also their style is in sync. Yesterday, the couple looked at a $68 million dollar mansion in Bel Air wearing his-and-hers button-downs for the daytime tour."
134,entertainment,"SNL Fans Applaud Weekend Update for Amber Heard, Supreme Court Jokes","""Weekend Update"" often finds itself as one of the most divisive sketches on Saturday Night Live, with fans judging entire episodes by the quality of the flagship bit. Sometimes the masses rail against hosts Colin Jost and Michael Che and other times, SNL watchers can't get enough. The latest iteration of the sketch falls into the latter category, with the segment quickly trending on Twitter due to the cutthroat jokes handed down by Jost and Che."
135,entertainment,"Tiger Woods, 23 million dollars to the Us IRS","As the GolfMagic site reports, Tiger Woods would have earned around $60 million in 2021. An amount that makes you dizzy when you know that the Tiger, victim of a very serious car accident fifteen months ago, has not played in any tournament during the calendar year. These 60 million..."
136,entertainment,Lindsey Vonn Gets Sporty in White Gucci Sneakers and Cargo Dress With Max Verstappen at F1 Grand Prix,"Click here to read the full article. Lindsey Vonn jetted to Miami to cheer on Max Verstappen for the Formula 1 Crypto.com Miami Grand Prix.
For the occasion, Vonn posed with Verstappen in a black minidress in a photo on Instagram. Her utilitarian Gucci style featured capped sleeves and a collared silhouette. For added edge, the piece was covered in Gucci’s “GG” house logos and included a long gold front zipper and two large front pockets. Vonn finished her look with a men’s Gucci “G” logo belt, plus a gold watch, sparkling creeper earrings and a pendant necklace.
When it came to..."
137,entertainment,Selling the OC,"The Selling universe just keeps growing. Following the smash reality hit Selling Sunset and its women of color-centered spin-off Selling Tampa, Netflix is bringing fans a new group of luxury real estate brokers and a whole new world of drama. Selling the OC will follow the realtors of the Oppenheim Group's Newport Beach office, which was announced as the brokerage's second location at the end of Sunset's fourth season."
138,entertainment,Young & Restless’ Christel Khalil Sends a Powerful Message to the ‘Force to Be Reckoned With in Your Heart’,"The Daytime Emmy winner also took a moment to wonder “how this little human can drive you crazy like no other.” Pretty sure that was a rhetorical question, though!. As Mother’s Day rolled around this weekend, Young & Restless leading lady Christel Khalil grew reflective. “Mothers have a special role in a person’s life,” she noted on Instagram. And who could argue with that?"
139,entertainment,Celeb First-Time Mamas,"It's definitely all about the mama's out there this weekend, but these celebs are celebrating Mother's Day as first-timers with their little ones ... so they deserve a little mom shoutout!. Halsey, Naomi Campbell and Lauren Lane are just a few stars to name that have taken you through their..."
140,entertainment,‘I turned up as a snotty kid who looked right’: Tom Felton’s life after Harry Potter,"Tom Felton wants to make it clear that he is embracing his inner meltdown. It’s almost the first thing he says, after sitting down opposite me at a Canary Wharf restaurant holding a small block of Cathedral City Cheddar in his hand. We’re meeting for a brief 45 minute..."
141,entertainment,Wynonna Judd Had Special Request for Carly Pearce at Country Music Hall of Fame Ceremony,"Wynonna Judd made one special request for Carly Pearce before her performance at The Judds Country Music Hall of Fame induction. According to Taste of Country, Pearce was asked to perform ""Grandpa (Tell Me About the Good Old Days)"" at the event at the request of Wynonna herself. ""I got..."
142,entertainment,Golf World Reacts To Charles Barkley's New Swing,"Charles Barkley's golf swing is the stuff of legend (or nightmares). But, in a recent clip posted by the PGA's Champions Tour account, the Hall of Famer's new motion looked noticeably smoother. The golf world gave Chuck's new-look swing some encouragement over the weekend. ""Charles Barkley was great NBA player…he’s..."
143,entertainment,Kylie Jenner and Travis Scott Enjoy Beach Vacation Nearly 3 Months After Welcoming Their Son: Photos,"Life’s a beach! Kylie Jenner and Travis Scott took their love — and their growing family — on a sweet vacation to Turks and Caicos. “Happy girl 🦋🙏🏼🧿🌊,” the Kylie Cosmetics founder, 24, captioned a Friday, May 6, Instagram snap as she posed on a surfboard in a bikini. Jenner and the 31-year-old “Highest in the […]"
144,entertainment,"Gabby Barrett Is Pregnant, Expecting Baby No. 2 With Cade Foehner","Gabby Barrett is having herself one amazing Mother's Day. On Sunday, the 22-year-old country singer took to Instagram to share she's expecting baby number 2 -- a boy. ""My son. 💙 Another LIFE we get to love and cherish. Happy Mothers Day,"" she wrote. Alongside the sweet announcement, Barrett shared a video from her ultra sound, giving her followers a closer look at her son."
145,entertainment,Mickey Gilley Dead at 86,"Mickey Gilley, who shot to country stardom with a string of iconic hits and helped launch the Urban Cowboy craze of the 1980s, has died. According to a statement from his publicist, Gilley died ""peacefully"" on Saturday (May 7) in Branson, Mo., ""with his family and close friends by his side."" The country legend had just returned from the road, where he played 10 dates in April. He was 86 years old."
146,entertainment,"Pete Davidson’s Reached The Point In ‘Feud’ With Kanye West He’s Telling Jokes During Stand-Up, And Netflix Released Video","Pete Davidson is performing stand-up comedy for the first time in three years, and you better believe he has stuff to talk about. He did not shy away from the dramatic turn his life has taken this year when he got on stage at Netflix Is A Joke: The Festival. The Saturday Night Live actor began dating Kim Kardashian after she guest hosted on the NBC sketch comedy show last October. This drew the ire of Kanye West, who held out hope for reconciliation with his now-ex-wife, and Ye launched a social media “civil war” against Davidson. Netflix released a video of part of the comedian’s set, where he talked about his “really weird year.”"
147,entertainment,"Happy Mother's Day! Michelle Obama honors mom with new exhibit, Gabby Barrett announces baby No. 2","Michelle Obama, Joe Jonas, Sophie Turner, Gabby Barrett, Jenna Dewan and more have been honored or paying tribute to their moms for Mother's Day."
148,entertainment,Charles Barkley Sounds Off On Tiger Woods: Fans React,"Charles Barkley sounded off on Tiger Woods in an upcoming book about Phil Mickelson. The legendary NBA star claims that Woods is not fun to be around, while Mickelson is a good time. “Sure, Tiger is a better golfer. You’re just in awe of his talent. But it’s not fun..."
149,entertainment,"ABC Cancels a Pair of New Series, Confirming Rumors","ABC has decided to cancel one series from rumor to reality, tossing another series in for good measure. Queens, starring Brandy, Eve, Naturi Naughton and Nadine Velazquez, won't see another season. Joining it in cancellation is Promised Land, a Latinx family drama that seemed to want to connect to the popularity of shows like Yellowstone."
150,entertainment,Photos: How Tiger Woods Reportedly Met His Longtime Girlfriend,"Tiger Woods and his longtime girlfriend, Erica Herman, have been dating for several years now. Herman has often been spotted at Woods' tournaments, including the recent Masters, where the legendary golfer made his comeback from the devastating car injury. But how did Tiger and Erica meet?. According to reports, it..."
151,entertainment,Serena and Venus Williams sneak into starry Carbone Beach party in Miami,"Dinner is served.

Serena Williams and Venus Williams were among a swarm of A-listers who partied during night two of American Express Presents Carbone Beach in Miami on Friday.



An insider tells Page Six exclusively that the tennis champions “just showed up” at the dinner party’s “Second Course” soirée in partnership with The h.wood Group and Sports Illustrated.

“They ended up being snuck in through the back door,” the insider says, adding that four extra tables had to be added to accommodate more guests.



The evening’s surprise performer, Wyclef Jean, spotted Venus, 41, and gave her a shout-out before greeting her with a big..."
152,entertainment,Doctor Who: Ncuti Gatwa is replacing Jodie Whittaker as new Doctor in 2023," Ncuti Gatwa has been announced as the new star, the Fourteenth Doctor, in Doctor Who.The 29-year-old, who was born in Rwanda and raised in Scotland, is best known for playing Eric in Netflix comedy Sex Education.Gatwa had previously teased his casting with a series of symbols on Instagram, with showrunner Russell T Davies replying: “The future is here.” Davies shared the same set of images.Speaking about his casting, Gatwa said he was “deeply honoured, beyond excited and of course a little bit scared”.He continued: “This role and show means so much to so many around the world, including myself,..."
153,entertainment,Travis Scott Performs At Miami Club After Romantic Mother’s Day Getaway With Kylie Jenner,"Travis Scott, 31, wowed on stage this weekend in his first public performance since the tragedy that happened at his Houston, TX Astroworld concert in Nov. The rapper put on quite a show at E11EVEN during the Miami Grand Prix in Miami, FL at 3 AM on Saturday, and reportedly told the crowd that they “better lose their motherf***ing minds!” The sold-out audience followed his words and seemed to thoroughly enjoy his time in the spotlight."
154,entertainment,"Loretta Lynn Remembers Her Mom on Mother’s Day With Emotional Message: ‘If You Have Yours, Hug Her Today’","As everyone across the nation celebrates all the amazing moms out there this Mother’s Day,…
The post Loretta Lynn Remembers Her Mom on Mother’s Day With Emotional Message: ‘If You Have Yours, Hug Her Today’ appeared first on Outsider."
155,entertainment,Celebrities take over Formula 1 2022 Miami Grand Prix,"MIAMI — It’s nearly lights out at the Formula 1 Miami Grand Prix and the inaugural race has attracted a slew of A-listers. 

Bad Bunny, who dropped a new album over the weekend, was spotted with Red Bull driver Sergio Pérez, while supermodel Karlie Kloss was seen chatting with Mercedes team members. Kloss was later seen holding hands with husband Joshua Kushner on the grid.

NFL star Patrick Mahomes spent some time in the Ferrari hospitality suite, while soccer legend David Beckham walked into the paddock looking dapper in a double-breasted white suit jacket.

Beckham was joined by his son Romeo, who..."
156,entertainment,Netflix Is Adding Commercials,"Netflix is officially going where they haven't gone before. While the service has long gone without any commercials or ads, Netflix is reversing its course on that front. In April, Netflix co-CEO Reed Hastings said that ads would soon be incorporated into the service, per Deadline. Hastings' comments come shortly..."
157,entertainment,Christina Hall Says She Likes the Month of May Again Thanks to Husband Josh: 'Unconditional Love',"Christina Hall has a new reason to love May. The Christina on the Coast star, 38, shared an Instagram post on Saturday evening, where she revealed that her husband Josh Hall has allowed her to find a new appreciation for the springtime month. ""May has never been a great month..."
158,entertainment,‘Little House on the Prairie’ Star Melissa Gilbert’s Husband Recalls Meeting Her for the First Time in a Bar,It appears love strikes home when it comes to Melissa Gilbert of the classic TV show Little House on the Prairie and husband Tim Busfield. Both are veteran actors from the show business world. Busfield has been on shows like Thirtysomething and The West Wing. He also had a role in the Kevin Costner movie Field of Dreams. Yet he’s got a story to tell about the first time he actually met Gilbert and it’s one for the books.
159,entertainment,"Star Wars: Mark Hamill, Carrie Fisher Interview Resurfaces From 1980 With Unused Details of Prequel Trilogy","Last week, fans around the world celebrated Star Wars Day on May 4th, which means lots of fun social media posts went viral. Many folks involved with Star Wars celebrated the special day and many others shared throwback videos and photos. The BBC Archives account on Instagram posted an interview of Mark Hamill (Luke Skywalker) and Carrie Fisher (Princess Leia) from 1980 in which they talk about the future of the franchise. Even then, Hamill had some idea of the prequels that would be released almost 20 years later. However, the story clearly changed over time."
160,entertainment,Charles Barkley's Admission On Tiger Woods Is Going Viral,"Charles Barkley's admission on golf legend Tiger Woods went viral earlier this week. While Woods is arguably the greatest golfer of all-time, he might not be the best ""hang"" off of the golf course. Barkley made that clear this week. “Sure, Tiger is a better golfer. You’re just in awe..."
