,categories,headers,contents
53,science,Experimental ALS drug may be more effective than existing ones,"New research on the experimental drug NU-9, invented and developed by two Northwestern University scientists to treat ALS (amyotrophic lateral sclerosis), shows it is more effective than existing FDA-approved drugs for the disease. More importantly, NU-9 has an enhanced effect when given in combination with those drugs, riluzole and edaravone...."
54,science,Accidental discovery that scallops love ‘disco’ lights leads to new fishing technique,"An unusual technique for catching scallops that was stumbled upon accidentally by scientists could potentially reduce some of the damage caused to our seabeds by fishing. The marine scientist Dr Rob Enever and his team at Fishtek Marine, a fisheries consultancy based in Devon, designed small underwater “potlights” to help protect fish stocks by replacing the need to use fish to bait crab and lobster pots."
55,science,Chemists skew the odds to prevent cancer,"The path to cancer prevention is long and arduous for legions of researchers, but new work by Rice University scientists shows that there may be shortcuts. Rice chemist Anatoly Kolomeisky, lead author and postdoctoral researcher Hamid Teimouri and research assistant Cade Spaulding are developing a theoretical framework to explain how cancers caused by more than one genetic mutation can be more easily identified and perhaps stopped."
56,science,Fossilized tooth proves extinct Denisovans lived in southeast Asia,"May 17 (UPI) -- A fossilized tooth dug from a mountain cave in northern Laos is the first evidence to show the extinct human species, the Denisovans, lived in southeast Asia. Scientists published their findings Tuesday in the journal Nature Communications and said the large ancient molar, found in Cobra Cave, appears to be from a young Denisovan girl who died between 164,000 and 131,000 years ago."
57,science,Japanese Study Suggests That Cats Can Remember Each Other’s Names,"Cats may appear distant and act as though they are on a different level of presence over poor mortal, however, cats seem to be more ubiquitous than humans realize. Researchers have determined that cats form strong bonds with living creatures in current history. These intelligent organisms might converse with us, and they could potentially follow human motions while humans are not present."
58,science,Officials say more areas of US may see mask recommendations,"WASHINGTON, D.C. (AP) — The COVID-19 pandemic could get worse in the U.S. in the weeks ahead, officials said Wednesday, and more people could be advised to again wear masks indoors. Increasing numbers of COVID-19 infections and hospitalizations are putting more of the country under guidelines issued by the..."
59,science,Scientists see signs of traumatic brain injury in headbutting muskox,Scientists at the Icahn School of Medicine at Mount Sinai saw for the first time hallmarks of concussions and other head trauma in the brains of deceased headbutting animals—muskoxen and bighorn sheep. The results published in the journal Acta Neuropathologica may contradict the commonly-held belief that ramming animals do not suffer brain injuries and support the notion that studies on animals with brains evolutionarily similar to those of humans may help researchers understand and reduce traumatic brain injuries.
60,science,This Green Sea Turtle Named Harbor Is Adorable and Is Getting a Second Chance,"At Pittsburgh's PPG Aquarium, this 8-year-old turtle is getting a second chance."
61,science,"Stone Age Hominids: Unearthed Fossil Tooth in Laos Cave Possibly from a Denisovan Girl 160,000 Years Ago","Stone age hominids called Denisovans have long been speculated to be close Neanderthal relatives. With a new study's discovery of a possible Denisovan girl's fossil tooth in Laos, scientists may soon confirm that ancient humans lived as well in Southeast Asia hundreds of thousands of years ago. The ground-breaking finding..."
62,science,Amazing Up Close Whale Footage ,Follow us for more amazing content also if you don't mind please like and share this video. 
63,science,The laws of physics do not prohibit counterfactual communication,"It has been conjectured that counterfactual communication is impossible, even for post-selected quantum particles. We strongly challenge this by proposing precisely such a counterfactual scheme where-unambiguously-none of Alice's photons that correctly contribute to her information about Bob's message have been to Bob. We demonstrate counterfactuality experimentally by means of weak measurements, and conceptually using consistent histories-thus simultaneously satisfying both criteria without loopholes. Importantly, the fidelity of Alice learning Bob's bit can be made arbitrarily close to unity."
64,science,Researchers Make Breakthrough Discovery That Might Help Reverse Memory Loss,"A new study on elderly mice might provide a new way forward, something that could target dementia and take steps in correcting it. Researchers from Stanford University have made a breakthrough discovery regarding memory loss. They discovered it was possible to reverse memory loss in mice, animals that have a similar genetic makeup to humans. If all works well, these results could translate to humans and provide alternate ways of treating the condition."
65,science,Prehistoric fossil in Peru sheds light on marine origin of crocodiles,"LIMA, May 17 (Reuters) - The discovery of a prehistoric crocodile fossil in Peru from around 7 million years ago has given paleontologists more clues as to how modern crocodiles, all freshwater creatures in the Andean country, first came to land from the sea. According to a Peruvian research team..."
66,science,Dragonhunters are a Rare Species Found in Indiana,"If you have never heard of a Dragonhunter, you're not alone. Before this morning, when my friend tagged me in a comment on Facebook, I had never heard of one either and despite the scary-looking creature in the photo my friend was drawing my attention to, it turns out it isn't quite so scary after all - at least not for humans."
67,science,"Colorless ‘rainbow’ over Alaska park is actually another phenomenon, rangers say",It might look like a rainbow — but park rangers said that’s not exactly it.
68,science,Type-I interferon stops immune system from 'going rogue' during viral infections,"McMaster University researchers have found not only how some viral infections cause severe tissue damage, but also how to reduce that damage. They have discovered how Type I interferon (IFN) stops the immune system from ""going rogue"" and attacking the body's own tissues when fighting viral infections, including COVID-19. Their..."
69,science,10 Amazing Facts About Black Bears!,This is 10 amazing facts about Black Bears!
70,science,Waterfall in Southern Kentucky is One of Only Two Places in the World to Regularly See a Moonbow,"You have very likely seen a rainbow before. Heck, I just recently saw a full double rainbow on a recent trip to Illinois, but what about a moonbow? If you're thinking to yourself, ""What on Earth is a moonbow?"" you're not alone but there is a place in Kentucky where you can see one."
71,science,Newly Identified Ancient Chinese Incense Ingredients Reveals Distance Of Early Trade Routes,"Incense used at ancient China's largest Buddhist temple, the Famen Royal Temple, has been determined to be composed of mixtures of Elemi resin, agarwood, and frankincense. All are native to regions thousands of kilometers away, and the find confirms the importance of incense to the creation of trade routes to and from China."
72,science,"Seafloor animal cued to settle, transformed by a bacterial compound","Most bottom-dwelling marine invertebrate animals, such as sponges, corals, worms and oysters, produce tiny larvae that swim in the ocean prior to attaching to the seafloor and transforming into juveniles. A new study published in the Proceedings of the National Academy of Sciences (PNAS) and led by University of Hawai'i (UH) at Mānoa researchers revealed that a large, complex molecule, called lipopolysaccharide, produced by bacteria is responsible for inducing larval marine tubeworms, Hydroides elegans, to settle to the seafloor and begin the complex processes of metamorphosis."
73,science,ROV observations reveal infection dynamics of gill parasites in midwater cephalopods,"Gill parasites of coleoid cephalopods are frequently observed during remotely operated vehicle (ROV) dives in the Monterey Submarine Canyon. However, little knowledge exists on the identity of the parasite species or their effects on the cephalopod community. With the help of ROV-collected specimens and in situ footage from the past 27Â years, we report on their identity, prevalence and potential infection strategy. Gill parasites were genetically and morphologically identified from collected specimens of Chiroteuthis calyx, Vampyroteuthis infernalis and Gonatus spp. In situ prevalence was estimated from video footage for C. calyx, Galiteuthis spp., Taonius spp. and Japetella diaphana, enabled by their transparent mantle tissue. The most common parasite was identified as Hochbergia cf. moroteuthensis, a protist of unresolved taxonomic ranking. We provide the first molecular data for this parasite and show a sister group relationship to the dinoflagellate genus Oodinium. Hochbergia cf. moroteuthensis was most commonly observed in adult individuals of all species and was sighted year round over the analyzed time period. In situ prevalence was highest in C. calyx (75%), followed by Galiteuthis spp. (29%), Taonius spp. (27%) and J. diaphana (7%). A second parasite, not seen on the in situ footage, but occurring within the gills of Gonatus berryi and Vampyroteuthis infernalis, could not be found in the literature or be identified through DNA barcoding. The need for further investigation is highlighted, making this study a starting point for unravelling ecological implications of the cephalopod-gill-parasite system in deep pelagic waters."
74,science,Got Milk: Bronze Age Population Soared Thanks to Livestock,Got Milk: Bronze Age Population Soared Thanks To Livestock
75,science,Surprise Litter of Rare Red Wolves Born at the Woodlands Nature Station,"A surprise litter of endangered red wolf puppies were born at the Woodlands Nature Station in Land Between the Lakes National Recreation Area on April 26, 2022. Golden Pond, KY- On April 26, 2022, an unexpected litter of critically endangered American red wolves were born at the Woodlands Nature Station in Land Between the Lakes National Recreation Area. Once prevalent throughout the southern United States, red wolves are now the most endangered canine in the world and are only found in captivity and eastern North Carolina. The Woodlands Nature Station is home to the only captive breeding pair in Kentucky and has been involved with the Red Wolf Recovery Program since 1991."
76,science,"A new drug could solve the problem of cataracts, without surgery","Researchers at the Anglia Ruskin University (ARU) in the U.K. have made significant progress in treating cataracts using a drug compound, paving the way for new treatment methods, a university press release said. A cataract is a medical condition where the eye's lens becomes clouded over some time and affects..."
77,science,The Amazing Amount Of Meat Eaten On The Lewis And Clark Expedition,"The Meriwether Lewis and William Clark expedition set out in 1804 to explore and chart new areas west of the Mississippi River recently bought by the United States as part of the Louisiana Purchase during Thomas Jefferson's presidency. It was an exhausting, two-year journey spanning more than 8,000 miles that necessitated a tremendous amount of preparation and planning (via History.com). If the secret history of breakfast was intriguing, this case is so tenfold."
78,science,Could Earth exist without oceans?,"Almost 97% of Earth’s total water is in the five oceans. It’s one of the most important substances in the universe, necessary to support all life that we know of. Withoutwater, a human will die within three days. But what if that life source didn’t exist on our planet?"
79,science,New material can 'capture toxic pollutants from air',"Researchers at University of Limerick have developed a new material that has the ability to capture toxic chemicals from the air. The material is capable of capturing trace amounts of benzene, a toxic pollutant, from the air and crucially use less energy than existing materials to do so, according to the researchers."
80,science,830 million-year-old organisms found locked in ancient crystals could be resurrected,"Salt crystals from Central Australia hold ancient microorganisms that became trapped 830 million years ago, new research finds. And there's a chance that some of the microorganisms might still be alive. The single-celled organisms are locked in tiny fluid pockets — smaller than the width of a human hair —..."
81,science,Why We Can't Actually See A Black Hole,"We now have definitive proof that black holes exist, even though we can't see them -- and ironically, that proof comes in the form of photographs."
82,science,From the archives: Inside the tantalizing quest to sense gravity waves,"
                    “The tantalizing quest for gravity waves” by Arthur Fisher appeared in the April 1981 issue of Popular Science. Popular ScienceIn the April 1981 issue of Popular Science, we explored the many initiatives and techniques used in the exciting hunt for sensing gravity waves, then out of reach."
83,science,"Using CAR T-cell therapy, scientists seek cure for cancer at the molecular level","In the fight against cancer, a new tool has emerged that's shifted the treatment landscape. CAR T-cell therapy, first approved for clinical use in 2017, uses a patient's own re-engineered immune cells to attack cancer. It has proven to be particularly effective against certain types of lymphoma. Its success represents..."
84,science,Towards a microwave single-photon counter for searching axions,"The major task of detecting axions or axion-like particles has two challenges. On the one hand, the ultimate sensitivity is required, down to the energy of a single microwave photon of the yoctojoule range. On the other hand, since the detected events are supposed to be rare, the dark count rate of the detector must be extremely low. We show that this trade-off can be approached due to the peculiar switching dynamics of an underdamped Josephson junction in the phase diffusion regime. The detection of a few photons' energy at 10""‰GHz with dark count time above 10""‰s and the efficiency close to unity was demonstrated. Further enhancements require a detailed investigation of the junction switching dynamics."
85,science,Scientists identify characteristics to better define long COVID,"A research team supported by the National Institutes of Health has identified characteristics of people with long COVID and those likely to have it. Scientists, using machine learning techniques, analyzed an unprecedented collection of electronic health records (EHRs) available for COVID-19 research to better identify who has long COVID. Exploring de-identified EHR data in the National COVID Cohort Collaborative (N3C), a national, centralized public database led by NIH's National Center for Advancing Translational Sciences (NCATS), the team used the data to find more than 100,000 likely long COVID cases as of October 2021 (as of May 2022, the count is more than 200,000). The findings appeared May 16 in The Lancet Digital Health."
86,science,For All Mankind sets its alternate timeline sights on Mars in S3 trailer,"The fictional battle for the domination of space between the US and Russia shifts its focus from the Moon to Mars for the third season of For All Mankind. Ars staffers have dubbed this relatively underappreciated gem ""Moon Show,"" and Apple TV+ has now released the official trailer for the show's third outing on the streaming platform."
87,science,The gut microbiome may influence how people respond to statins,Researchers investigated the effects of gut microbiome composition on people’s response to statins. They found that microbiome composition affects statin response and metabolic measures such as glucose resistance. The researchers say that further investigation into microbiome composition and statin response could inform personalized statin treatment. Between 25% and 30%...
88,science,"Discovery of Late Triassic bivalves from Jurassic deep-water deposits in Riganpeicuo area, Tibet and their geological significance","The Jurassic sequences in the South Qiangtang Basin of Tibet are essential for understanding the paleogeography and tectonic evolution of this basin and the Bangong-Nujiang Meso-Tethys Ocean (BNMO). However, the partial absence of fossils hinders the study of the stratigraphic distribution and tectonic paleogeography of the basin. Late Triassic bivalves, including nine species in nine genera, were identified for the first time in olistostromes from the SÃªwa Formation in the Riganpeicuo area. Based on detailed geological field surveys and sedimentary facies analysis, the lower-middle part of the Rigenco section is a deep-water turbidite fan deposit and the upper part is a shallow sea mixed shelf deposit, which differs distinctively from the carbonate platform facies of the Jiebuqu Formation. Therefore, the strata formerly assigned to the Jiebuqu Formation (Rigenco section) is formally reassigned to the Lower-Middle Jurassic SÃªwa Formation and Middle Jurassic Shaqiaomu Formation. These results not only provide further understanding of the sedimentary infill history of the South Qiangtang Basin, but also further support that the BNMO was already open in the Late Triassic and formed a mature ocean in the Early-Middle Jurassic, with subsequent rapid subduction. Both the opening and subduction processes were completed in a relatively short time interval with a large number of attendant olistostromes."
89,science,"No One, Not Even You, Can Avoid Mercury Retrograde Anymore","If your life, like mine, seems to be falling apart in an increasingly chaotic manner recently, I have some good news: you can probably blame it all on a planet. That’s right, the astrological phenomenon known as Mercury Retrograde is once again upon us, and this time no one, not even you die-hard astrology haters, can escape it."
90,science,Study: Astronauts’ brains continue to undergo prominent changes long after they come back home,"When in space, our body gets acclimatized to free fall. Because of being in a constant state of free fall, the human body undergoes specific permanent changes that cause prominent health concerns in the long run. For example, a recent study on microgravity and its warping effect on the human body has shown noticeable changes in the blood vessels surrounding the brain among the astronauts long after they return to Earth."
91,science,Chinese rover makes surprise discovery about liquid water on Mars,"A Chinese rover has found evidence that there was liquid water on Mars far more recently than we thought — a discovery that could affect plans to one day colonize the Red Planet. Liquid water on Mars: Based on past research, scientists believed there was liquid water on Mars..."
92,science,Nuzzling T. rexes and grappling sauropods: Dinosaurs on 'Prehistoric Planet' will astonish you,What would happen if you put Sir David Attenborough and a specialist team of wildlife filmmakers in a time machine and set the dial to 66 million years ago — to the end of the Cretaceous period and the final days of the dinosaurs? An upcoming documentary series aims to provide visually stunning answers to that intriguing question.
93,science,Meet the climate and energy wonks in Biden’s embattled science office,"President Joe Biden has stacked his White House science office with veteran researchers charged with expanding the government’s climate science and renewable energy research expertise. On his first day in office, Biden sought to raise the profile of the Office of Science and Technology Policy after it was a..."
94,science,Extraterrestrial Stone Found in Egypt May Be First Evidence on Earth of Rare Supernova,"'Standard candle' (or type Ia) supernova explosions are some of the most energetic events in the Universe, happening when a dense white dwarf star subsumes another star. Now, scientists think they're found the first evidence on Earth of such a supernova. The claim comes after a careful study of the..."
95,science,"An intelligent quantum sensor that simultaneously detects the intensity, polarization and wavelength of light","A team of researchers has built an intelligent sensor—the size of about 1/1000 of the cross-section of a human hair—that can simultaneously detect the intensity, polarization and wavelength of light, tapping into the quantum properties of electrons. It's a breakthrough that could help advance the fields of astronomy, health care, and remote sensing."
96,science,Alzheimer's Disease: Vaccine Clinical Trial for Humans Underway for the Brain Disorder,"Alzheimer's disease has long plagued elderly people, especially those who are 65 years old and above; as it is for this age group where the notorious brain disorder is common. Characterized by gradual or sudden memory loss, there is no known cure or vaccine against Alzheimer's disease. However, various researchers..."
97,science,Co-infection with SARS-CoV-2 Omicron and Delta variants revealed by genomic surveillance,"Co-infections with different variants of SARS-CoV-2 are a key precursor to recombination events that are likely to drive SARS-CoV-2 evolution. Rapid identification of such co-infections is required to determine their frequency in the community, particularly in populations at-risk of severe COVID-19, which have already been identified as incubators for punctuated evolutionary events. However, limited data and tools are currently available to detect and characterise the SARS-CoV-2 co-infections associated with recognised variants of concern. Here we describe co-infectionÂ with the SARS-CoV-2 variants of concern Omicron and Delta in two epidemiologically unrelated adult patients with chronic kidney disease requiring maintenance haemodialysis. Both variants were co-circulating in the community at the time of detection. Genomic surveillance based on amplicon- and probe-based sequencing using short- and long-read technologies identified and quantified subpopulations of Delta and Omicron viruses in respiratory samples. These findings highlight the importance of integrated genomic surveillance in vulnerable populations and provide diagnostic pathways to recognise SARS-CoV-2 co-infection using genomic data."
98,science,Koala Saved From Forest Fires Keeps Snuggling With His Savior,"Bill Blair saw something interesting while photographing a charred ground following the bushfires that raced through Australia using his drone. On Kangaroo Island, there was a small newborn koala curled up at the foot of a tree, alone, afraid, and bewildered, and searching for rescue. Bill had already started snapping..."
99,science,The first tangible evidence of a supernova explosion: Egypt's Hypatia stone,"Researchers from the University of Johannesburg and others have revealed some new insights about the Hypatia stone found in Egypt, including its cosmic origins, according to a press release published by the institution on Monday. Their hypothesis about Hypatia’s origin is that it is believed to have come from a..."
100,science,Infrared imaging to measure glymphatic function,The glymphatic system facilitates fluid exchange in the central nervous system and clears dissolved wastes. This anatomically organized movement occurs primarily during sleep and is supported by astroglial neural cells via water channels called aquaporins. These channels line the perivascular pathways and facilitate cerebrospinal fluid and interstitial fluid exchange throughout the brain.
101,science,The Psychology of Non-fungible Tokens,"Tokens have long been used to govern people’s behavior. Significantly longer in the case of economics than psychology. Tokens allow efficient behavioral control, as they are easier to deliver immediately than many primary rewards. An NFT does not stand in the same relationship as currency with its betokened, but..."
102,science,Team develops automated platform for plasmid production,"Plasmids have extensive use in basic and applied biology. These small, circular DNA molecules are used by scientists to introduce new genes into a target organism. Well known for their applications in the production of therapeutic proteins like insulin, plasmids are broadly used in the large-scale production of many bioproducts."
103,science,"United States' ocean conservation efforts have major gaps, analysis shows","More than 98% of U.S. waters outside the central Pacific Ocean are not part of a marine protected area, and the ones that are tend to be ""lightly"" or ""minimally"" protected from damaging human activity, research led by Oregon State University shows. Published today in Frontiers in Marine Science, the..."
104,science,Bill Nye Is Begging You to Not Use Oil on Your Scalp,"I've had the pleasure of interviewing a lot of celebrities over the years, and many of them, most people would say, are natural fits to be featured in a beauty magazine. But every now and then, the opportunity to interview someone I never could have predicted will present itself. Most recently it was Bill Nye. Anyone familiar with the Science Guy knows he can wax educational about all sorts of scientific topics, so I don't know why it didn't occur to me that he might know a thing or two about dandruff."
