,categories,headers,contents
0,science,Spectacular ceiling frescoes discovered in the Temple of Khnum at Esna,"In the Temple of Khnum at Esna, Upper Egypt, German and Egyptian researchers have uncovered a series of vibrantly-colored ceiling frescoes. The relief images in the central section of the ceiling, Professor Christian Leitz from the University of Tübingen reports, make up a total of 46 depictions of the Upper-Egyptian vulture goddess Nekhbet and the Lower-Egyptian serpent goddess Wadjet. Both are depicted as vultures with outspread wings. While Nekhbet bears the head of a vulture and the white crown of Upper Egypt, Wadjet can be recognized by the Lower-Egyptian crown topped with a cobra."
1,science,A new law unchains fusion energy,"Physicists at EPFL, within a large European collaboration, have revised one of the fundamental laws that has been foundational to plasma and fusion research for over three decades, even governing the design of megaprojects like ITER. The update shows that we can actually safely use more hydrogen fuel in fusion reactors, and therefore obtain more energy than previously thought."
2,science,Zinc is a metal essential to life – scientists have discovered a protein that helps keep cells alive when zinc levels are low,"All living things, including people, need zinc in their diets. Getting too little of this essential metal can impair growth and cause immune dysfunction, neurological disorders and cancer. Unfortunately, over 17% of the world’s population is at risk for zinc deficiency. The World Health Organization considers this kind of micronutrient-related malnutrition a leading contributor to disease and death.

After you eat a meal, zinc is taken up by the cells of your body. Inside each cell, zinc binds to proteins to support their structure and function. Researchers estimate that up to 10% of all proteins need zinc to properly function. In..."
3,science,The Many Myths of the Man Who ‘Discovered’—and Nearly Destroyed—Troy,"When German businessman Heinrich Schliemann discovered a cache of ancient artifacts in the place now known as Hisarlik, Turkey, in 1873, he was quick to identify the gold jewelry, silver vases and other precious objects as the treasure of Priam, the legendary king of Troy. An amateur archaeologist with a penchant for embellishment, Schliemann smuggled the trove out of Anatolia and touted it as proof of his claim that Hisarlik and Troy, the besieged city immortalized in Homer’s Iliad, were one and the same."
4,science,Octopuses torture and eat themselves after mating. Science finally knows why.,"Many animal species die after they reproduce. But in octopus mothers, this decline is particularly alarming: In most species, as an octopus mother's eggs get close to hatching, she stops eating. She then leaves her protective huddle over her brood and becomes bent on self-destruction. She might beat herself against a rock, tear at her own skin, even eat pieces of her own arms."
5,science,Scientists are developing patch that warns of oncoming drug overdose,"With the United States facing an epidemic of drug overdoses, researchers are developing a wearable patch that can detect an oncoming opioid OD and deliver doses of a drug that could save lives. The Indiana University Bloomington research team has received a three-year, $3.8 million grant from the U.S. National..."
6,science,"A Man Knocked Down His Basement Wall, Discovering Ancient Underground City That Housed 20,000 People","In 1963, a man in the Nevşehir Province of Turkey knocked down a wall in his basement and ended up discovering a gigantic underground city. The man (not named in reports from the time) sledgehammered his wall and found a tunnel behind it, and beyond that, more tunnels. Exploration would later reveal it was an underground city up to 18 stories deep, complete with chapels, schools, and stables."
7,science,Horrifying Discovery: Scientists Find That DNA Mutations Are More Common Than Previously Thought,"Researchers at EMBL Heidelberg found that inversions in the human genome are more common than previously thought, which impacts our understanding of certain genetic diseases. Our DNA serves as a blueprint for the cellular machinery that allows cells, organs, and even whole organisms to work. However, mutations in our DNA can cause genetic illnesses. Point mutations at a single site, as well as deletions, duplications, and inversions, are examples of such DNA mutations."
8,science,"The longstanding Neanderthal Mystery concerning 40,000-year-old bones has finally been solved","The first time the ancient bones of the two-year-old child were discovered was in the late twentieth century. These bones belonging to ancient humans are estimated to be 41,000 years old and were uncovered in the southwestern region of France, La Ferrassie. However, most researchers believed the bones to be intentionally buried by the Neanderthals when the bones were discovered."
9,science,Tomb Saviors: 2 Giants Found in Ancient Graveyard Could Have Been Bodyguards,"Giant statues crafted more than 3,000 years ago could have been guardians of an ancient graveyard, say experts."
10,science,Scientists Figure Out Why Female Octopuses Self-Destruct After Laying Eggs,"After a female octopus lays a clutch of eggs, she does what any new parent would: carefully watch over her progeny. She stays with them in her den, protects them from predators and blows water over them to keep them oxygenated, writes Nicholas Bakalar for the New York Times. But..."
11,science,This Extraterrestrial Stone Found in Egypt Could Be the First Concrete Evidence of Rare Supernova Explosion on Earth!,"There are billions of celestial objects that promenade around the observable universe, and a fraction of them manage to make it to Earth — full of the mystery of their origin and journey. One such object is a stone named Hypatia. Named after the fourth-century female mathematician and philosopher,..."
12,science,Scientists challenge claims that the biblical cities of Sodom and Gomorrah were destroyed by a comet ,Photographic Reproduction of Public Domain Work of Art; Painting by John Martin. Tall el-Hammam is an ancient settlement near the Dead Sea. It is an archaeological site in Jordan that has been the subject of much debate among scientists.
13,science,Scientists find new and mysterious DDT chemicals accumulating in California condors,"When Christopher Tubbs joined an ambitious multinational effort to save California condors from the brink of extinction, he knew the odds of success were long. There were wind turbines that could strike the giant birds and lead bullet fragments in hunted animals that could sicken and kill. But Tubbs, who..."
14,science,These weird marine critters paved the way for the ‘Cambrian explosion’ of species,"Around 540 million years ago, Earth’s life underwent a burst of evolution that gave rise to the major groups of animals alive today, including those with backbones and those that hunt prey. This bonanza is known as the Cambrian explosion. Based on the fossil record, animal life appeared to be comparatively sparse and looked very different from the creatures that emerged later in the fossil record."
15,science,Carbon-12 is an Essential Building Block for Life and Scientists Have Finally Figured Out How it Forms in Stars,"Each of us is, as it says in Max Ehrmann’s famous poem “Desiderata”, a child of the universe. It speaks metaphorically about our place in the cosmos, but it turns out to be a very literal truth. Our bodies contain the stuff of stars and galaxies, and that makes us children of the cosmos. To be more precise, we are carbon-based life forms. All life on Earth is based on the element carbon-12. It turns out this stuff is a critical gateway to life. So, how did the universe come up with enough of it to make you and me and all the life on our planet? Astrophysicists and nuclear physicists think they have an answer by using a supercomputer simulation of what happens to create carbon. As it turns out, it’s not very easy."
16,science,Drug treatment for cataracts moves a step closer,"A revolutionary new treatment for cataracts has shown extremely positive results in laboratory tests, giving hope that the condition, which currently can only be cured with surgery, could soon be treated with drugs. The results have been published today in the peer-reviewed journal Investigative Ophthalmology and Visual Science. Cataract is..."
17,science,Tooth from Laotian cave sheds light on enigmatic extinct humans,"A young girl’s tooth excavated from a cave wall in northeastern Laos is providing new insight into the mysterious extinct human species called Denisovans and revealing their resourcefulness in adapting to both tropical and chilly climes. The tooth is one of the few physical remains known of Denisovans, a..."
18,science,"The First Animals Were Adapting, Not Dying, Before The Cambrian Explosion","A study of the first animal communities has concluded that what some paleontologists have considered the first mass extinction was something very different, with animals specializing and forming more complex relationships. Some 540 million years ago animals suddenly and dramatically diversified, not only in species but in basic architecture, a..."
19,science,There’s a Meteor Shower Shooting Over Your Head Right Now,This month has already been really generous in terms of beautiful sky shows. We’ve had the flower Supermoon and a total lunar eclipse to watch already (that occurred at the same time!). But that’s not the last of the viewings from above. It turns out there’s a meteor shower happening right now — but you might not be able to see it. Here’s what you need to know.
20,science,"An ancient tooth found in a cave proves an extinct species of archaic humans lived in southeast Asia over 130,000 years ago",Scientists were looking at how humans in southeast Asia today have some genes of an ancient human species mostly recorded in Siberia.
21,science,Evidence of slash-and-burn cultivation during the Mesolithic,"As early as 9,500 years ago, people in Europe used slash-and-burn methods to make land usable for agriculture. This is shown by environmental data generated by scientists from the Senckenberg Center for Human Evolution and Paleoenvironment (S-HEP) at the University of Tübingen on the basis of two drill cores from the Ammer Valley. The data were then correlated with results from the Mesolithic scattered finds from Rottenburg-Siebenlinden excavated by the Baden-Wuerttemberg Landesamt für Denkmalpflege (State Office for Monument Preservation). In their study, published in the Journal of Quaternary Science, the scientists investigate to what extent climate or anthropogenic factors played a role in the development of the vegetation landscape of the Ammer Valley over the past 11,500 years. The researchers paid particular attention to fires used by Stone Age hunters and gatherers."
22,science,Friendly fungi announce themselves to their hosts,"For many years after discovering a diverse population of sometimes dangerous microbes constantly living in our intestines, scientists described the situation as a form of living with the enemy. But when it comes to commensal populations of the fungus Candida albicans, the dreaded invader may be better seen as a helpful friend arriving with gifts."
23,science,New study claims alternate reality could exist beside our own,"An unexplained signal has been flagged by scientists as a potential window to an alternate reality.

A lab experiment on graphene layers – tiny sheets of carbon atoms – found uncanny signs that our universe is just a half of the whole.

Multi-verses have been plot lines in some of the most popular modern media – from Rick & Morty to the Marvel Cinematic Universe, audiences love a neighboring reality.

Signs of an alternate reality outside of fiction have been found by scientists and expanded upon in a published journal.

Physicists at the University of Maryland learned that electrical charge behaves oddly when two graphene layers..."
24,science,Invasive crayfish found in Oregon waterway,"An invasive crayfish, native to the Midwest and parts of eastern and central Canada, has shown up in Oregon for the first time. The Oregon Department of Fish and Wildlife reported Monday Northern crayfish were found in the Ashland Canal. The canal links into Bear Creek the Rogue River basin."
25,science,"Tonga Eruption Was Loudest Sound On Earth Since 1883, With A Wave Reaching Higher Than The ISS","New research has highlighted just how powerful the Hunga Tonga-Hunga Ha'apai eruption on January 15 was. It was not just the most powerful in this century, it also released atmospheric waves with an energy that has not been seen in 139 years. It was the loudest sound on Earth since the Krakatoa eruption of May 20, 1883."
26,science,Image: Hubble reveals a river of star formation,"This newly revised NASA Hubble Space Telescope image of the Hickson Compact Group 31 (HCG 31) of galaxies highlights streams of star-formation as four dwarf galaxies interact. The bright, distorted clump of young blue-white stars (top-right of center) is NGC 1741. Although it appears to be a single galaxy, NGC 1741 is actually a pair of colliding dwarf galaxies. Another dwarf, cigar-shaped galaxy to the pair's right joins their dance with a thin, blue stream of stars that connects the trio. HGC 31's fourth member is revealed by a stream of young blue stars that point to the galaxy (bottom-left of center) and indicate its interaction with the other three. The bright object in the center of the image is a star situated between Earth and HCG 31."
27,science,"After mapping out the inside of Mars, NASA's InSight mission ends this year","NASA's InSight Mars lander will end its scientific mission this summer and will be entirely inoperable by the end of this year after it loses power, NASA said Tuesday. While the mission is ending, the legacy of the lander is just taking shape, as scientists study the ""unprecedented"" data that Insight collected on the deep interior of Mars, as well as its weather and magnetic field."
28,science,Here's How The Next 5 Years Might Look: Scientists Outline 3 Likely Pandemic Outcomes,"
The global pandemic is not yet over. Public health experts suspect it will last at least another five years, but how this ongoing crisis plays out is ultimately up to us.
A new report from the International Science Council (ISC), an international organization who's aim is to unite scientific bodies around the world, has laid out three scenarios that could occur by 2027.
The report was written by a panel of 20 experts on public health, virology, economics, behavioral science, ethics, and sociology.
While their commentary isn't an attempt to predict the future, their report helps narrow down and illustrate some of the possible..."
29,science,Dragonhunters are a Rare Species Found in Indiana,"If you have never heard of a Dragonhunter, you're not alone. Before this morning, when my friend tagged me in a comment on Facebook, I had never heard of one either and despite the scary-looking creature in the photo my friend was drawing my attention to, it turns out it isn't quite so scary after all - at least not for humans."
30,science,"Feral Pigs May Have Helped Boost Crocodile Numbers in the Northern Territory, Australia","Saltwater crocodiles in the Northern Territory, Australia, are eating more feral pigs than in the past, which may be why populations are thriving in the area, a new study in the journal Biology Letters suggests. Researchers compared the bones of museum specimens that lived 40 to 55 years ago with contemporary crocodiles to see how their diet has shifted over the years."
31,science,Enormous Great White Shark Is Now Just 20 Miles From North Carolina Coast,"The shark, called Breton, has travelled thousands of miles up and down the North American coast after being tagged in 2020 weighing 1,400 pounds."
32,science,Vision of Mars and Neptune,"ARIES (March 21-April 19). Does it all seem to be happening all at once? Maybe so, and it's all the more reason to narrow your focus to one manageable section of the scene. You got this!. TAURUS (April 20-May 20). While nothing in life is free, sometimes (in the moments..."
33,science,"'We're done with COVID, but COVID is not done with us': Doctors warn of new sub omicron variant wave",A summer surge could be coming as a new sub omicron variant begins to infect people. A Houston health expert said the variant is the most infectious yet.
34,science,Melting glacier allows researchers to make ‘exceptional’ prehistoric discovery,"The researchers, who braved fierce winds, heavy rain and snow at their excavation site, hope the fossilized remains of a pregnant creature they named Fiona can provide clues into what life was like 139 million years ago. The ""exceptional"" 130-million-year-old fossilized remains of a pregnant ichthyosaur with several fully intact..."
35,science,Child's tooth could offer clues to ancient human relative,"A child's tooth at least 130,000 years old found in a Laos cave could help scientists uncover more information about an early human cousin, a study said on Tuesday. Researchers believe the discovery proves that Denisovans—a now-extinct branch of humanity—lived in the warm tropics of southeast Asia. Very..."
36,science,"Scientists provide more than 57,000 camera trap images for massive study on Amazon wildlife","Wildlife Conservation Society (WCS) scientists working in the vast Amazon Basin have contributed more than 57,000 camera trap images for a new study published in the journal Ecology by an international team of 120 research institutions. The study consists of over 120,000 images taken in eight countries, representing the largest..."
37,science,A fossil tooth places enigmatic ancient humans in Southeast Asia,"What do a finger bone and some teeth found in the frigid Denisova Cave in Siberia’s Altai mountains have in common with fossils from the balmy hills of tropical northern Laos? 

Not much, until now: in a Laotian cave, an international team of researchers including ourselves has discovered a tooth belonging to an ancient human previously only known from icy northern latitudes – a Denisovan.

The find shows these long-lost relatives of Homo sapiens inhabited a wider area and range of environments than we previously knew, confirming hints found in the DNA of modern human populations from Southeast Asia and Australasia.



..."
38,science,Connecting fragmented wolverine habitat is essential for their conservation,"Present day wolverines, which emerged during the ice age, have been declining globally despite their many adaptions to live in challenging, rugged environments. 

These large land-dwelling weasels evolved to scramble up trees and climb steep, snowy mountains. Wolverines’ snowshoe-like paws, heavy frost-resistant fur and powerful muscles let them thrive in some of the coldest places on Earth. Their sharp claws and strong jaws allow them to feast on carcasses and hunt species of all sizes from ground squirrels to elk.  

While wolverines have been filmed hunting caribou in Norway and observed battling black bears over food in Yellowstone, they..."
39,science,Researchers Find Tooth in Cave That May Belong to Extinct Human Group,"When a team of researchers headed into the mountains of northern Laos, an area known for harboring fossilized human remains, they made a startling discovery—a tooth buried within hard sediments in a small cave. They assessed that it likely belonged to a child from a group of extinct humans..."
40,science,"Child’s 130,000-year-old tooth could offer clues to extinct human relative","A child’s tooth at least 130,000 years old found in a Laos cave could help scientists uncover more information about an early human cousin, according to a new study. Researchers believe the discovery proves that Denisovans – a now-extinct branch of humanity – lived in the warm tropics of southeast Asia."
41,science,Caterpillar web blankets cover Norfolk hedgerows,"An amateur photographer has described a stretch of hedgerow covered in web-like blankets as an ""incredible"" sight. Jonathan Orland, from Loddon in Norfolk, said the webs, covered in caterpillars, stretched over a 5m (16ft) section of hedge on the A146 between Chedgrave and Thurton. ""It's quite incredible to look at;..."
42,science,The 'twin paradox' shows us what it really means for time to be relative,"Einstein's theory of special relativity teaches us that time is relative. But what does it mean for time to be relative? How can we live in a universe where nobody can agree on when events start, when they end and how long they last? The infamous ""twin paradox"" showcases what living in a truly relativistic world is like."
43,science,Scientists discover why female octopuses self-mutilate to death after laying eggs,"A drastic change in steroid hormone levels in female octopuses after they lay eggs causes them to mutilate themselves to death, a new study has revealed. Cephalopods, a group that includes octopuses and squids, have the largest central nervous systems and the greatest brain-to-body mass ratios among spineless creatures. However, cephalopods are unusually short-lived, unlike other big-brained animals.After laying a clutch of eggs, mother octopuses quit eating and waste away, explain researchers, including those from the University of Chicago. By the time the eggs hatch, the mother octopuses are dead. This bizarre maternal behaviour is linked to the optic gland..."
44,science,Look What Appeared In A Central Maine Driveway!,"A South China resident got quite a shock when they discovered a crustacean in their driveaway, despite the fact that they live miles from the nearest body of water. In a Facebook post, the finder explains that it is too small to be a lobster, unless it is a very young lobster. The creature measures about 5 or 6 inches in length."
45,science,Kansas Man Finds Hatchet Head In Yard — With A Tree Root As A Handle,"The object discovered by Matthew Decker looks like an intricately carved wooden ax — but it's actually a quirk of nature. After sitting with a strange find he unburied in his yard for over a week, Matthew Decker decided to share it with the world. On Reddit, he posted a picture of what looked like an elaborately designed ax — but what actually turned out to be an old hatchet head with a tree root through it."
46,science,Why the James Webb Space Telescope will 'profoundly change' your universe,"Last week, NASA released even more images from the James Webb Space Telescope, as it continues to test its instruments before science missions begin. But now, NASA's James Webb Telescope is moving forward with its next and last series of preparations, called science instrument commissioning, according to a NASA blog post. And the test images that come from this — like the collection from last week, are highly notable."
47,science,First animals developed complex ecosystems before the Cambrian explosion,"Early animals formed complex ecological communities more than 550 million years ago, setting the evolutionary stage for the Cambrian explosion, according to a study by Rebecca Eden, Emily Mitchell, and colleagues at the University of Cambridge, UK, publishing May 17th in the open-access journal PLOS Biology. The first animals evolved..."
48,science,Are aliens here? A US House panel holds the first public hearing on UFOs,"On Tuesday, the U.S. House panel held a public hearing on ""unidentified aerial phenomena,"" known as UFOs, that will hopefully help bring legitimacy to a subject that has long been too stigmatized for many alleged accounts to come forward and for many discoveries to be made. The hearing was convened by the House Intelligence Committee's Counterterrorism, Counterintelligence, and Counterproliferation subcommittee."
49,science,New Kind of 'Solar' Cell Shows We Can Generate Electricity Even at Night,"Conventional solar technology soaks up rays of incoming sunlight to bump out a voltage. Strange as it seems, some materials are capable of running in reverse, producing power as they radiate heat back into the cold night sky. A team of engineers in Australia has now demonstrated the theory in..."
50,science,New Monoclonal Antibody May Neutralize Future COVID-19 Variants,"Stage 2/3 trials are underway to test the efficacy of J08, a potent monoclonal antibody, to prevent and treat current and future COVID-19 variants. After monoclonal antibodies were proven less effective against the highly infectious Omicron COVID-19 variant, the US Food and Drug Administration (FDA) rescinded their approval of the therapy."
51,science,Astronomers Discover Mysterious Circular Ring – Likely of Intergalactic Origin,"Western Sydney University researchers, together with an international team of experts, have discovered a mysterious circular ring near our neighboring galaxy that could be the first known case of an intergalactic Supernova Remnant – remains of an exploded star that could be up to 7,000 years old. Dubbed a..."
52,science,Celebrated Mexican archaeologist wins major Spanish award," Eduardo Matos Moctezuma, a celebrated Mexican archaeologist who led the excavation of the Great Aztec Temple in Mexico City, won this year’s Princess of Asturias award in the social sciences category, the Spanish foundation behind the prizes announced Wednesday.The dig at the shrine, which was discovered by accident in 1978 after being buried under the city’s main plaza since the 16th century, was a landmark event in the archaeological world and drew intense interest as it proceeded for more than 20 years.That excavation, and others, represent “exemplary episodes of the scientific development of archaeology and a fruitful dialogue with..."
