,categories,headers,contents
0,entertainment,Look: Top Ronda Rousey Sports Illustrated Swimsuit Photos,"Saturday night was a big night in the fighting world, with a premier boxing match and a slate of UFC events taking place. Ronda Rousey is no stranger to a big fight night. The former UFC standout turned wrestling star has been a part of several notable fight nights over the course of her career. She's been a part of some cool things outside of the fighting ring, too."
1,entertainment,Mary Trump slams Susan Sarandon as a 'moron' for suggesting it's pointless to vote for the Democratic party,"Mary Trump criticized longtime activist and actress Susan Sarandon, who has become increasingly critical of the Democratic Party."
2,entertainment,[WATCH] Wendy Williams Reveals To Fat Joe ‘Unfortunately I Only Have $2’,"Rapper Fat Joe reunited with talk show host Wendy Williams and she revealed she only has $2. Wendy Williams admitted during a sit-down interview with Fat Joe that while she misses being on The Wendy Williams Show, she won’t be tuning in to Sherri anytime soon. “I wish I..."
3,entertainment,"Anna Nicole Smith's Daughter Dannielynn Birkhead, 15, Snaps Colorful Photo with Dad Larry at Kentucky Derby","Dannielynn Birkhead brought some color to the Kentucky Derby!. The 15-year-old daughter of the late Anna Nicole Smith dressed up for the event, wearing a vibrant and multi-colored Celia B dress with a pair of Betsey Johnson shoes. Dannielynn and her dad Larry Birkhead snapped a sweet photo together, as..."
4,entertainment,Everyone's Saying Same Thing About Danica Patrick Today,"Danica Patrick was on the scene in Miami, Florida this weekend, for the first-ever Formula 1 race in South Florida. The former IndyCar and NASCAR driver was a part of the network coverage for the Formula 1 event, which featured the sport's top drivers competing in front of a packed Miami crowd, which included some notable celebrities (like Michael Jordan, Tom Brady and David Beckham)."
5,entertainment,Paige Spiranac's Hot Dog Tweet Goes Viral: Fans React,"Paige Spiranac brought the trolls out on social media with her admission earlier this week. ""There is nothing better than a hotdog at the turn on the golf course,"" the former professional golf star turned social media tweeted this week. Unsurprisingly, there were a lot of, well, inappropriate comments in..."
6,entertainment,"Tom Brady Admitted To 1 ""Issue"" In His Marriage","Tom Brady and his wife, supermodel Gisele Bundchen, have a pretty picture perfect marriage. However, not everything is perfect for the prominent couple. Last season, Brady admitted to one ""very difficult"" issue in his marriage to Gisele. While Brady wants to keep playing in the NFL - and he'll be..."
7,entertainment,"Report: Why Aaron Rodgers, Shailene Woodley Ended Relationship","Aaron Rodgers and Shailene Woodley are no longer a couple. The Green Bay Packers quarterback and the Hollywood actress got engaged earlier in the pandemic. Rodgers stunned the football world when he announced his engagement during his MVP acceptance speech in January 2021. However, Rodgers and Woodley called off the..."
8,entertainment,Carrie Underwood Rocks Purple Daisy Dukes For 2022 iHeartCountry Festival In Austin: Photos,"Country queen Carrie Underwood stunned yet again at the iHeartCountry Festival with some daisy dukes! She channelled some serious Y2K vibes with her outfit thanks to denim and sequins galore at the event in Austin, Texas on May 7. She rocked a bedazzled jean jacket with cutoff sleeves, point denim knee high boots, dangly rhinestone earrings, and an assortment of rings on her fingers. But perhaps the best part of her getup was the super short jagged purple daisy dukes, showing off her toned legs and making her look like a true southern star."
9,entertainment,LisaRaye McCoy Clashes with Judy Dupart over Baby News,"Da Brat’s relationship with LisaRaye McCoy has been tested. “Growing Up Hip Hop Atlanta” star Da Brat took a major step when she opened up about her romance with Jessica “Judy” Dupart. For Brat, she was terrified about being more vocal about her personal life. She worried people would judge her. However, she knew Judy was the one for her. So she decided to no longer allow her fear to hold her back from sharing her happiness with the world. Judy made some appearances on GUHHATL, and eventually, the couple got their own spinoff on WE tv. Now fans can watch “Brat Loves Judy” to get updates on Brat’s romance with the successful entrepreneur."
10,entertainment,The CW Show Canceled After 7 Seasons,"Legends of Tomorrow is officially a thing of the past. It was recently reported that The CW canceled Legends of Tomorrow after seven seasons on the network, per Deadline. The news may come as a shock to fans, especially as the most recent and, now, final season ended on a cliffhanger."
11,entertainment,William and Kate Plan to Go by Their First Names and Not Titles as Part of Modernizing the Monarchy,"Change may very soon be coming to the royal family, ushering in a new modus operandi colloquially known as the “Cambridge Way” which could include the Duke and Duchess of Cambridge scrapping those titles and being called simply William and Catherine. Shakeups in royal protocol are apparently underway..."
12,entertainment,Paige Spiranac Admitted There's 1 Topic She Won't Touch,"Former professional golfer turned sports media personality Paige Spiranac is a pretty open book on most topics. Whether it's golf, the media world, other sports, pop culture...you name it, Spiranac is probably going to be open about it. There's one topic the former University of Arizona and San Diego State..."
13,entertainment,Surprising Robert Downey Jr. Movie is the #1 Film on Netflix,"A movie starring Robert Downey Jr. being incredibly popular in 2022 probably doesn't come as much of a surprise to anyone. After anchoring the Marvel Cinematic Universe for more than a decade, Downey is one of the most popular stars on the entire planet. One of his films was recently added to Netflix and quickly soared through the Top 10 rankings on the service, but it surprisingly wasn't one of his recent efforts."
14,entertainment,"Nick Jonas and Priyanka Chopra Share First Photo of Their Daughter, Reveal She Spent '100 Plus' Days in NICU","Introducing Nick Jonas and Priyanka Chopra's daughter! On Sunday, the “Remember This” singer and actress took to their respective Instagram accounts to officially introduce the world to their daughter, Malti Marie Chopra Jonas, and share her inspiring story. “On this Mother’s Day we can’t help but reflect on..."
15,entertainment,"Someone Farted On The Stand During Johnny Depp And Amber Heard’s Trial, And There’s Video",There are two types of people in the world: liars who deny they were the one who farted and heroes who immediately own up to letting it rip. Let the record show a woman testifying in the Johnny Depp and Amber Heard trial is a member of the second group. She let out a rager while on the witness stand in court the other day and immediately owned up to it.
16,entertainment,Priyanka Chopra and Nick Jonas Share the First Pic of Their Daughter Malti,"Priyanka Chopra and Nick Jonas have introduced their adorable baby girl to the world. The Quantico actress has shared a photo of her and the pop star's first child on her Instagram, along with an emotional Mother's Day tribute reflecting on the baby's first months of life. In the pic, Chopra holds her infant daughter, named Malti Marie Chopra Jonas, while the baby is dressed in an adorable dusty-pink dress and a matching bow headband, with a white heart obscuring her face."
17,entertainment,Mariah Carey Celebrates Mother's Day with Sweet Photos of Twins Monroe and Moroccan: 'Blessings',"Mariah Carey is celebrating blessings times two this Mother's Day. Honoring ""all the Mommies out there"" with a new celebratory Instagram post, the pop star shared a slideshow of sweet photos of her 11-year-old twins, son Moroccan and daughter Monroe, on Sunday. The series of photos show Carey enjoying some..."
18,entertainment,"Two Months After Whoopi Goldberg's The View Suspension, RHOBH Star Who Tried Out Opens Up About The Other Stars’ Behavior On Set","Following her controversial on-air take about the Holocaust back in February, Whoopi Goldberg was put on a two-week suspension from co-hosting duties at The View. The situation ruffled quite a few feathers, but one current Real Housewives of Beverly Hills star who tried out for the daytime talk show in 2015 has since claimed there’s even more drama behind the scenes. Two months after Goldberg's suspension, in fact, the Bravo star opened up specifically about the seasoned TV vets’ behavior on set."
19,entertainment,Mattea Roach Final Jeopardy Question Ends in Heartbreak,"Mattea Roach just lost Jeopardy! by one dollar, ending her 23-game streak as one of the top 5 players of all time. Roach has won a total of $560,983 in her time on the trivia show, making her one of the game's longest-running and highest-earning champions all at once. She was finally dethroned in a ""Final Jeopardy"" round where she started with a considerable lead."
20,entertainment,‘Jeopardy!’: Ken Jennings Leaving Hosting Duties ‘for a Few Months’,"You will have to do without Jeopardy! host Ken Jennings for a bit as he’s stepping away from the famed game show right now. Jennings, who hosts the show along with Mayim Bialik, has announced on Twitter this news. From what we know, this departure is not forever so we’ll ease your minds, Ken fans."
21,entertainment,"Country Singer Engaged to Longtime Boyfriend, Reveals Sweet Proposal","Country singer Kassi Ashton has some exciting news to share. According to PEOPLE, Ashton is engaged to her longtime boyfriend Travis Myatt. He made the proposal all the more special for Ashton by proposing in the same place where they first met. Ashton told her Instagram followers that Myatt proposed..."
22,entertainment,Photos: Meet The Wife Of NASCAR Legend Dale Earnhardt Jr.,"Dale Earnhardt Jr. has gone from having a great career on the track to an incredible one off of it. The legendary NASCAR driver has become a major force in the broadcasting world, getting major praise from fans across racing sports. This weekend, Dale Jr. took part in covering the..."
23,entertainment,Casey Anthony Makes Clear Where She Stands on Tell-All Documentary Regarding Death of Daughter Caylee,"Casey Anthony is reportedly planning on making a ""tell-all"" documentary about the death of her daughter, Caylee Anthony, but only on her terms. The search for Caylee became a national obsession in 2008, and her body was discovered in December 2008. Anthony, 36, was arrested and later tried for murder and manslaughter in 2011, but was infamously acquitted of both charges. She was only convicted on four counts of lying to police."
24,entertainment,Photos: Meet The Longtime Wife Of Kirk Herbstreit,"ESPN college football analyst Kirk Herbstreit is going to have a crazy fall. The former Ohio State Buckeyes quarterback will be covering both college football and the National Football League. Thankfully, the Herbstreits have a solid family foundation. Kirk has been married to his wife, Allison, since 1998. Hopefully they're..."
25,entertainment,Jennifer Garner’s Latest Workout Video on TikTok Is Beyond Intense,"Everyone stop what you're doing and watch Queen Jennifer Garner crush an intense box jump workout in a new video she just posted to TikTok. The 50-year-old does not mess around when it comes to her fitness goals, but somehow she makes even the toughest workouts look...really fun?!. Jen works..."
26,entertainment,‘Love Story’ Actress Ali MacGraw Underwent a ‘Life-Changing Experience’ to Make Peace With Her Past,"Ali MacGraw begins her days by rising with the sun. After she feeds her pets, she likes to take a walk outdoors near her longtime home in Tesuque, New Mexico. “Walking is my meditation,” she says. “Forty-five minutes of gratitude for all I have been given.”. It’s..."
27,entertainment,HBO Max Officially Orders Spinoff of Hit Show,"HBO Max has officially ordered a spinoff of its hit animated series Harley Quinn, and more details on the project have come to light. Harley Quinn series co-creator Patrick Schumacker announced the news at SXSW in March along with other news about Harley Quinn Season 3. Now Warner Bros. has given more details on the show, which will possibly be called Noonan's."
28,entertainment,Man finds March 2020 calendar and photos of his ex-wife after returning to office: ‘Pre-Covid time capsule’,"A man has documented his experience returning to his office after two years of working from home during the Covid-19 pandemic.Jason Dempsey, who goes by the username @thejasondempsey on TikTok, revealed this week that his company requested he return to working from his office, which he last worked in in March 2020.The return meant that Dempsey discovered what he described as a “pre-Covid time capsule,” with the video showing some of the things he left on his desk two years ago, including photos of his now-ex-wife.“They brought me back to the office, aka pre-Covid time capsule,” Dempsey wrote in a..."
29,entertainment,Melissa Etheridge Cancels Major Concert,"Melissa Etheridge has canceled a major performance due to a COVID-19 outbreak in her crew. On Thursday, the singer-songwriter announced that her Saturday performance at the New Orleans Jazz & Heritage Festival was canceled. She joins a string of other high-profile cancellations at the festival -- and around the country."
30,entertainment,Bold & Beautiful’s Next Move for Thomas Is Clear — and It’d Just About Make Bill and Deacon’s Heads Explode,"A woman from Thomas’ past should play a big role in his future. The Bold and the Beautiful looks to be entering kind of a new era. Steffy is, sadly, single again. Eric is sleeping with Donna behind Quinn’s back. Sheila is about to get her comeuppance. And Ridge… Well, he, Brooke and Taylor are probably destined to remain on the marry-go-’round forevermore."
31,entertainment,Rachael Ray And Her Husband John Cusimano Renamed A Cocktail For Mother's Day,"If being known primarily as ""Rachael Ray's husband"" bums John Cusimano out, he doesn't show it. Cusimano is a lawyer-slash-musician and — while perhaps not as eternally bubbly as the Ray of sunshine herself — certainly has been a steady, positive presence since they married over 16 years ago, according to an interview Ray gave to People magazine last year. ""We're very good with giving each other space to work on our passions,"" the chef said then, of the couple's dynamic and their sense of optimism after the pandemic dealt them one harsh blow after another. Having to figure out the work-from-home dynamic was only the first of many challenges for Ray and Cusimano, who both value their private home life; they also lost their beloved dog, and then their own home to a fire. Add to that the fact that Cusimano was never interested in being on television, and due to Covid-19 Ray was forced to bring her film set home with her each day, and you couldn't blame the pair for being a bit grumpy."
32,entertainment,Look: Anna Kournikova's Best Sports Illustrated Swimsuit Photos,"Over the years, several notable athletes and sports figures have posed for the iconic Sports Illustrated Swimsuit issue. The 2022 Sports Illustrated Swimsuit issue is set to hit newsstands later this year. Perhaps we'll see another sports figure or two posing for this year's issue. There have been some big-time..."
33,entertainment,Priyanka Chopra and Nick Jonas Share First Photo of Their Baby Girl on Mother's Day 2022,"Watch: Nick Jonas and Priyanka Chopra's Baby Name REVEALED. Priyanka Chopra is celebrating her first Mother's Day as a mom and she and husband Nick Jonas marked the occasion in a special way. The two shared their first public photo of their first child, daughter Malti Marie Chopra Jonas, on..."
34,entertainment,Leah Remini Achieves Major Life Goal 'After Living Most of My Life in a Cult',"Actress Leah Remini marked a major life milestone on Saturday -- the end of her first semester at New York University. The King of Queens star made a celebratory post on Twitter noting that she had spent ""most of my life in a cult and only"" achieved ""an 8th grade education"" before taking on this challenge. She urged others to pursue their dreams no matter their age."
35,entertainment,'Teen Mom 2': Jenelle Evans Alludes to Possible Marriage Trouble With David Eason,"Teen Mom 2 alum Jenelle Evans may be experiencing trouble in her marriage to David Eason yet again. Monsters and Critics noted that Evans recently alluded to needing time alone on social media. When one of her followers told her that she should take some time for herself and Eason, she replied that it would be better for her to spend time alone instead."
36,entertainment,Ron Howard Announces Family Is Unable to Gather on Mother’s Day Due to ‘COVID Hiccup’,"A lot of families will gather together on Mother’s Day and celebrate the time but Ron Howard and his crew will not be doing so. Howard takes to social media on Sunday morning and says a “COVID hiccup” is happening. In this video clip he shares, Howard does say that everything will be OK."
37,entertainment,Anna Nicole Smith's Daughter Dannielynn Wears Janet Jackson Suit to Kentucky Derby Party,"Anna Nicole Smith's daughter Dannielynn Birkhead kinda took a page from Kim Kardashian, wearing an iconic getup to a big, fancy event. The 15-year-old daughter of Anna Nicole and Larry Birkhead showed up at the Kentucky Derby's Barnstable Brown Gala in the same outfit Janet Jackson wore to the exact same event back in 2003. The outfit included a black pantsuit and an old-fashioned cap."
38,entertainment,"Yes, Queen Elizabeth Was Once Fondly Known as “Gary”","You may know her as Queen Elizabeth II. The Queen. Her Majesty. Ma’am. Her Royal Highness. Even Lilibet. But Gary?. Yep—at one point, the Queen’s nickname was Gary. And it’s all thanks to a little boy named Prince William. It’s Mother’s Day in the U.S., so..."
39,entertainment,Anthony Anderson Graduates from Howard University: '30 Years in the Making',"The former Black-ish actor, 51, earned his diploma from Howard University in Washington D.C. on Saturday. Anderson celebrated the exciting moment on Sunday with an Instagram post, in which he called his graduation ""a full circle moment"" that was ""30 years in the making."" He also shared several photos from..."
40,entertainment,"Anna Nicole Smith's daughter, Dannielynn, honors Janet Jackson by wearing her Kentucky Derby suit","Anna Nicole Smith's daughter, Dannielynn, wore Janet Jackson's 2003 Kentucky Derby outfit and met the singer at the Barnstable Brown Derby Eve Gala."
41,entertainment,Ben Affleck & Jennifer Lopez Visit Mega Mansion On House Hunt With Her Sister Lynda: Photos,"Ben Affleck, 49, and Jennifer Lopez, 52, could soon be living in an impressive Los Angeles mega mansion! The lovebirds were photographed looking at a home that reportedly cost a whopping $68 million on Saturday afternoon and were joined by Jennifer’s sister, Lynda. They appeared relaxed and happy during the outing as Ben wore a white button-down top and tan pants and Jennifer wore dark green button-down top and jeans."
42,entertainment,This Is the Best Revenge Movie of All Time,A 24/7 Tempo analysis reveals that this spaghetti western is the best revenge movie of all time.
43,entertainment,Chuck Todd's MSNBC Show Suffers Major Downgrade,"MSNBC just moved Meet the Press with Chuck Todd from its network platform to its streaming platform, and some fans see this as a major downgrade. NBC News announced on Friday that Todd's regular weekday show would be one of several shows moving from MSNBC and NBC News over to NBC News NOW -- the streaming service that launched in 2019. The network claims this is a way of expanding its investment in the platform."
44,entertainment,Ross Mathews Marries Wellinthon García and Drew Barrymore Is Their Flower Girl,"Category is: wedding realness. Ross Mathews tied the knot with his fiancé Dr. Wellinthon García in a Mexican beachside ceremony on May 6. ""It was a destination wedding,"" Mathews told People. ""So we invited 130 people, thinking maybe 50 people would come. But 110 people came and I'm thrilled."""
45,entertainment,Opinion: Handwriting Analysis of Amber Heard,"Per Time Magazine, a high-profile trial involving actors Johnny Depp, 58, and his ex-wife Amber Heard, 36, began April 12 in Fairfax, Va. The trial revolves around a defamation lawsuit Depp filed against Heard in 2019 about an op-ed she wrote about domestic abuse in 2018. Depp says the article irreparably damaged his career."
46,entertainment,Cardi B Shares Sweet Throwback Photos of Her Son Wave,"Cardi B shared a sweet throwback to her early days with her son, Wave. Weeks after introducing her eight-month-old son Wave Set Cephus to the world, the ""Money"" rapper has posted new-to-us pics of herself and the infant, with a caption reflecting on her post-pregnancy bod. In the photos, the..."
47,entertainment,This Is The One Artist Mick Jagger Said ‘Outperformed Everyone’,"Mick Jagger is the mega-successful artist whose place of relevance within the music industry has been undeniable for the past six decades. Needless to say, he first came to prominence back in the 1960s as part of The Rolling Stones. Not surprisingly, given his experience, he has an uncanny ability to predict who among upcoming artists would likely achieve success. No matter the genre — country, pop, rap, reggae or whatever it might be — he has had an innate feeling for quality music."
48,entertainment,"Johnny Depp vs. Amber Heard: What Their Body Language In Court Says, According To Expert","Johnny Depp appeared confused by Amber Heard's story about an alleged fight between them during the actor's ongoing defamation trial against her, a body language expert has claimed. During an appearance on HLN TV, Janine Driver — the founder and president of the Body Language Institute who reportedly ""trained thousands..."
49,entertainment,How Anna Nicole Smith's Daughter Dannielynn Birkhead Honored Janet Jackson at the Kentucky Derby,"During her annual father-daughter date at the Kentucky Derby, Anna Nicole Smith's daughter Dannielynn Birkhead paid tribute to Janet Jackson and her late mom at the same time. On May 6, the 15-year-old joined her dad Larry Birkhead at the Barnstable-Brown Gala, the biggest of the horse race's pre-parties, wearing a black pantsuit with a large, double studded belt. ""Dannielynn is wearing Janet Jackson's personal outfit that Janet wore to the 2003 Barnstable-Brown Gala,"" Anna Nicole's ex wrote on Instagram. ""It was purchased as a part of Janet's @juliens_auctions benefitting charity."""
50,entertainment,Kyle Richards loses best friend to mental illness: ‘The system failed her’,"Kyle Richards announced Saturday that her best friend Lorene Shea died on May 1 after a battle with mental illness. She was 52.

“I never imagined I would be posting something like this …this is my best friend Lorene … my best friend since I was 7 years old. My other half,” the “Real Housewives of Beverly Hills” star captioned a series of photos on Instagram of the pair as children and adults.

Richards, 53, wrote that she and Shea “spoke every day” and “did everything together,” from losing their baby teeth in elementary school to having babies of their own.

“She was..."
51,entertainment,'The Pioneer Woman' Favorite Is Leaving the Show,"Things are about to be changing for The Pioneer Woman clan on Food Network. Ree Drummond celebrated the departure of her nephew, Stuart, sweetly before he headed off to a summer internship in Chicago ahead of college in the fall. The Food Network star shared the news on her Instagram..."
52,entertainment,'The Neighborhood' Rocked With Major Change Ahead of Season 5,"The Neighborhood is going through a major behind-the-scenes change for Season 5. Deadline reported that The Neighborhood's current showrunner, Meg DeLoatch, is leaving the series. DeLoatch served as both an executive producer and showrunner for Season 4 of the comedy series. This marks yet another major change for The Neighborhood..."
53,entertainment,"Anna Nicole Smith’s daughter, 15, celebrates Kentucky Derby in rare photos","Anna Nicole Smith’s daughter, Dannielynn Birkhead, made her annual, rare appearance on her father’s Instagram to celebrate the Kentucky Derby this weekend. On Saturday, May 7, Larry Birkhead posted a series of photos on Instagram with his 15-year-old daughter, who he shared with the late Smith. While Birkhead has been raising his daughter away from the spotlight, the two have a decade-long tradition of attending the Kentucky Derby together as father and daughter."
54,entertainment,Bill Maher And Michele Tafoya Debate Abortion Rights on ‘Real Time’: “I Never Thought Life Itself was Particularly Precious”,"Last night on Real Time with Bill Maher, the HBO host tackled an extremely hot topic at the moment, women’s reproductive rights. Since abortion is nothing to joke about, the comedian took the topic to his panel discussion where he could be frank with his guests.

Maher presented both sides of the coin, starting with a few quips before launching into a serious discussion on the ultra-sensitive issue.

He began with a nod to drunken Cinco de Mayo celebrations – “If you can’t remember what you did last night, you might want to get an abortion now” – Maher noted several states..."
