,category,header,contents
413,food,Jam - Strawberry and Rhubarb,"Strawberries, rhubarb, sugar, sure jell, water. Pretty simple path to delicious.."
414,food,Peppers - Sweet and Pickled with Mrs. Wages Mixes,"Garden fresh sweet peppers, dill and polish pickle mixes, some vinegar, water and a spoonful of alum and citric acid per jar... voila, a pepper somewhat like store bought pepperoncini peppers."
415,food,Mouthwatering BBQ Chili Beef.,"Among all of us, tried beef chili to some extent of our lives. But today I made it to a new manner and it turned out amazing everyone who eats up bbq beef chili is about to eat their fingers. So I decided to share this idea with you so you can make this delicious food ."
416,food,Cheesy Potato Balls,Delicious cheesy potato bites that you will surely enjoy.
417,food,Cheese & Honey Pie,"If you are a pie lover, I suggest you this delicious, easy to make, and no-oven  cheese and honey pie."
418,food,10 Famous Middle Eastern Foods,"Since I am born and raised in Saudi Arabia, I have a deep love for the Middle Eastern cuisine. So, I thought to share my liking for the Arab culture through this article. So, let's get started."
419,food,Do Away With Dry BBQ Chicken,
420,food,Eggplant - Deep Frying,"Pick, peel, slice. Then coat, dip and coat again. Then fry..."
421,food,Frozen Lemonade to The Rescue,"Yes! Frozen lemonade. If you haven't tried it, then try it now."
422,food,Pot Brownie Cookies,"Fudgy Cookies made from a box of brownie mix?!                        
         Mmmmmm, Yes, Please!!!"
423,food,Be Ready for the 2021 Football Season With This Tasty Recipe; It's Easily-Made Too,"At game time, you do not want to cook."
424,food,3 Best ways to Make Puree at Home,Purees are easy to prepare and most of the ingredients readily available. Purees are especially good for growing kids and ailing adults who have a problem eating solid food. Save money by making puree at home. Avoid consuming processed puree. Stay healthy.
425,food,3 Delicious Iced Coffee Recipes to Try at Home,Here are three delicious iced coffee recipes that you can try at home.
426,food,Moist and Fluffy Black Forest Cake Recipe,This article is about baking a delicious black forest cake. The aspect that differentiate black forest cake from other cakes is the use of alcohol to soak the fruits and spread them on top of the cake. This recipe will expand your knowledge on black forest baking.
427,food,Is It Worth It to Make Your Own Bread?,
428,food,How to Make a Perfect No Flip Over Easy Egg,Here is my easy method to make a fried egg/no flip over easy egg A basic cooking recipe for beginners. Recipe video included.
429,food,"I Want Beef, Not to Eat The Lawn",Time to speak-up and have our REAL burgers!!!
430,food,Pickles - Bread and Butter Flavor - Mrs. Wages Mix,"Making bread and butter pickles with sliced cucumbers and teeny, tiny little cucumbers..."
431,food,Cucumber Sorting for Pickle Making,"Once you pick your cucumbers, they will need to be sorted by size..."
432,food,Salmon Balls - Deep Fried,"A little like Hush Puppies, a little like crab cakes... and really easy to make!"
433,food,Top 5 Foods to Eat While You Are in Pakistan,Pakistan-a relatively young state-has a rich and diverse taste in food. Pakistani cuisine is a palatable fusion of various cooking traditions from its neighboring countries. The cultural impact of various traditions is deeply impregnated in the roots of Pakistani cuisine.
434,food,Things to do in Kenosha Wisconsin,"Mars Cheese Castle on the west side of I-94 in Kenosha is one of those must see at least once. Located almost smack in the middle of Chicago and Milwaukee, you can not miss it from the roadway."
435,food,Fluffy Vanilla Cake Recipe,This article features baking a tasty vanilla cake. The ingredients combination produces a fluffy and delicious cake which can be used as a snack any time of the day. A side hustle business can be started using this recipe because of its palatable taste.
436,food,Egg Omelette Recipe Indian Style,Easy Indian style egg omelette. A basic cooking recipe for beginners. Recipe video included.
437,food,Humans And Meat Eating,All humans started their lives eating the products of the earth. When did we start to eat meat?
438,food,The Frugality of 50s Appliances and Canning,Many of the appliances and equipment from the 50s are still available and in use today.  My canning equipment is one of those.
439,food,Indian Recipes,Indian Recipes - Vegetable Pulao Recipe Indian Recipe
440,food,Thai Artist Bakes Bread Shaped as Severed Body Parts,Let’s see if you can stomach this!
441,food,Delicious Turkish Dessert,incredibly yummy turkish rolls
442,food,Beef Curry Recipe,The beef curry recipe is very easy to cook.  Anyone can cook beautifully by following the rules given in the recipe.
443,food,Strict Budget Whisk(e)y: The Glengarry Highland Blended Scotch Whisky,"Many of us like to enjoy a fine dram at night, but not everyone has the money to afford those expensive bottles like Johnnie Walker: Blue Label. This does not have to be a problem, however, there are great whiskies out there at much more affordable prices."
444,food,Sweet Chocolate Pudding,easy mouth-watering chocolate pudding
445,food,What you don't know about Cardamom,A deep-dive into the difference between herbs and spices. A detailed explanation of green and black cardamom and their uses in modern cooking and baking.
446,food,Advantages of Using the Best Food Storage Containers for Leftovers,"Food containers are the solution to this as they keep food well-packed, clean, and free from outside pollution and other things."
447,food,Green Beans - Freezing Fresh without Blanching,Pick. Cut off ends. Wash. Put on sheet. Freeze. Bag.
448,food,Kids Special Recipes,"Today children like to eat cutlets. So I have prepared. I have thought of making the children's favorite cutlet, it is delicious as well as good for health. I make it from the vegetables I have at home. So let's make cutlets."
449,food,ROHU FISH FRY/SORISH BATA MACHA BHAJA/TAWA FRIED FISH FRY,Mustard fry fish is one of the authentic dish or i can say pure my mother hand made food. Mustard fried fish or sorish macha bhaja (fry) is  crunchy outside moist inside coated with mustard sauce and  glazed when drizzling with mustard oil.
450,food,Cold Brewed Sugar from Spice,Infusing Sugar is a nice way to add an herbal flavor to any drink or treat!
451,food,Delicious Bihari Qeema Recipe,
452,food,Mayonnaise Sauce - Basic cold kitchen sauce.,
453,food,Differences Between an Allergy and a Cold,"Allergies occur when your body has a negative reaction to an allergen. Allergies are explained, along with the statistics, the common allergens, symptoms and the diagnosis. Treatments are also discussed. The difference between an allergy and the common cold is also explained."
454,food,Takeaway - Unboxing Food,Michelin stars are the most coveted awards for chefs all over the planet. Why? Because these ‘stars’ are considered as the hallmark of gastronomical prowess.
455,food,Phool Makhana Curry,Makhana curry with out onion garlic is one of the delectable dish with the good ness of makhana the puffed lotus seeds sheer with rich poppy seeds and creamy coconut milk.
456,food,Fall In Love With Lentils: They Will Love You Back With Their Benefits,Lentils have long been a secret of the health conscious because of their powerhouse of health and nutritional properties along with the added ease of versatility in cooking.
457,food,Easy and Delicious Fish Balls,How to make a delicious traditional Moroccan fish tajine
458,food,Oats Pineapple Stuffed Omelette,Oats pineapple stuffed omelette is fluffy filled with goodness of oats and fruitiness of pineapples. Its littles cheesy and prepared out of refreshment of mint.
459,food,How to Make South Indian Fish Curry at Home,"I am here to explain the process of making South Indian fish curry. My Sunday’s wont feel satisfied without making this mouth watering fish curry. It goes well with rice, idly and chapati too. Try this recipe for your loved ones. Lets find out to make the curry."
460,food,Crispy Hotdog Nuggets,Do you love hotdogs? Try this simple recipe of crispy hotdog nuggets at home.
461,food,Dill Pickles - Canning Using Mrs. Wages,"Cucumbers, jars, lids, mix, vinegar and water..."
462,food,Delicious Ginger Chicken Recipe,
463,food,How to Make a French Toast?,
464,food,Who Doesn't Like Baked Pork Chops--This Recipe?,"This main dish has been around for years, but is still as delicious as ever."
465,food,6 Secrets on How to Make a Stir-Fry Successfully,"How to do a good stir fry? Check these Chinese stir fry secrets and stir fry techniques for subtle flavors in vegetables, meat, and seafood"
466,food,Does Eating Jackfruit Increase Weight?,"The fragrance and taste of ready jackfruit is unique. Be that as it may, crude jackfruit curry is likewise not less in taste and nourishment. Crude jackfruit is as successful in restoring sicknesses all things considered in boosting the body's resistance many occasions over."
467,food,Bountiful Bistro: Not Your Normal Food Hub,A perfect example of farm-to-table dining.
468,food,Filled Krumkake Cookies,Using a Krumkake iron..
469,food,Peach Ice Cream Recipe is Delicious Great to Eat on Hot Summer Days,"Watch out, hot summer days! Cool peach ice cream has this."
470,food,Brussels Sprouts Sauteed with Corned Beef Hash,"Not a vegetarian dish, beware..."
471,food,How to make delicious Nargasi kofta?,
472,food,Egg Soup - Floating Egg Ribbons,An easy way of creating a soup that hits the spot without being heavy or creamy - but has potential...
473,food,Delicious Summer Salad,easy fresh summer salad
474,food,Your Favorite Subway Subs Just Got Newer & Better !,"Subway ""updates"" core menu!"
475,food,My Mother's Secret Hand Pie Recipe,"Many times, the older staples are the best."
476,food,Delicious Fried Fish With Butter Sauce,
477,food,"Mouth-Watering, Hot Chili's Great Anytime of Year Homemade Recipe","Mild, warm or super-hot, people love homemade things."
478,food,You Are Invited to Try My Ultimate Super Cheeseburger Recipe,"If you eat one of these burgers, you will be hooked. Be forewarned."
479,food,Noodle Bacon - Long Potstickers,"Chinese cooking, fried turkey dumplings as inspired by the Benedictine Sisters of Peking..."
480,food,"Oysters Are Perfect For Date Night, Any Night or Occasion (Recipe)","This food is not for everyone, but everyone who tries them, likes them."
481,food,Yummy Custard Buns You Should Make,delicious homemade custard buns
482,food,Delicious Mutton Korma Recipe,
483,food,Chicken And Dumplings: Yeah! Yeah! Yeah! (Recipe),This dish is so delicious to be so good.
484,food,"Ham, Macaroni and Pea Salad",My hubby's favorite salad...
485,food,Bread Slicing - One Method,I like to use an electric knife to cut my bread...
486,food,Cantaloupe Cutting - One Method,You do not eat the peel nor the seeds of a ripe canteloupe...
487,food,Favourite Dutch Recipe - Zuurkool,"How to make the Dutch recipe Zuurkool, sauerkraut. It is so delicious and easy."
488,food,"Creamed Corn--Tasty, Fast 'n Easy","Creamed Corn is good. Homemade creamed corn is even better. One day not long ago I realized that I had never made creamed corn from scratch, even though I've been cooking for many, many years. I was stunned. Okay, not exactly stunned but surprised...."
489,food,One Pot Meal: Chicken Fricassee,"Chicken Fricasee--we call this one Smothered Chicken, but whatever you call it, it's still delicious. It's a hearty chicken meal that has vegetables, too. All you need is a garden salad to make this meal complete.  
 I used a 3-4 pound fryer in this..."
490,food,Green Juice Recipe for Detox and Weight Loss,All-natural homemade detox and weight loss juice. Recipe video included.
491,food,Pakistani nawabi Fish Karahi,"As beef and chicken karahi is a popular food in Pakistan. Therefore, fish lovers have tried to use the same recipe to make fish karahi. Thus, the experience of fish snoring has proved to be an ideal recipe for a new idea and most fish lovers have welcomed the traditional snoring using fish karahi."
492,food,Peaches and Fake Cream Salad,"Peaches, yogurt, instant pudding mix, cool whip....nope, no cream here, but tastes super amazing!"
493,food,How to make Afghani Kebab with Tomato  gravy,"Afghan kababs are made by cooking beef or goat meat and making it into a cigar. After frying until brown, the kebabs are cooked in a tomato sauce with spices over low heat for four to five minutes. ۔ This dish was very spicy and delicious."
494,food,Cook The Temperature You Want Using The Thermapen ONE Cooking Thermometer,Cooking by temperature works better than cooking by time. That is if you have a really good cooking thermometer. The Thermapen ONE is a really good cooking thermometer
495,food,Deep Fryer Oil - Clarifying with a Raw Potato,Sometimes the fryer oil needs cleaning...
496,food,How to Make Instant Ramen Better and Healthier,"Follow these instant ramen hacks to upgrade instant ramen or instant noodles to taste better and healthier with protein, fiber, and probiotics"
497,food,Traditional Pakistani Food; You Should've to Try,Food additionally one thing that connects the people of various religions and cultures in one bond. People belonging to any culture and country are die-heart fans of traditional Pakistani dishes and foods.
498,food,"Bael"" fruit healthy juice",Today I am going to tell about the recipe of Bael Juice. It is very beneficial for our health. It is a traditional juice. Which has been made since years.
499,food,Coconut Shrimp - Quick and Easy Seafood to make,
500,food,The Perfect Spicy Chicken Pizza You'll Ever Make,"We choose for you a spicy chicken pizza dish like no other, dedicated to hot sauce lovers."
501,food,Crab Curry - Truly Odia,"If you ever hang out to coastal odisha must have had spicy Kankada Jhola (where Kankada means crab and Jhola means gravy, in odia) from a take away or odisha restaurant, you will know how incredibly scrumptious it is."
502,food,Cookieteaux,"Baking was developed during the early Roman Empire where it rose in prominence as an art. Roman citizens loved baked goods in the form of breads, cakes, and pastries all of which led to a constant demand for them being present at important occasions such as feasts and weddings."
503,food,Top 5 Natural Foods That Fight Infections,"Regular food sources contain every single vitamins, minerals, minor components, and different constituents, wherein they are to a great extent missing in refined food varieties."
504,food,Quick Garlic Soup With Toast You Must Try,delicious and super easy soup.
505,food,Yummy Mango pudding ready in just 15 minutes,
506,food,Mango Kesari Halwa,mango keasri halwa is the best recipe .sauth indian sweet dish.
507,food,"Beetroot cutlets,grated beetroot cutlet","Today the children said, Mumma, make something different. Today we feel like eating something special like pakodas or bhajiyas or cutlets. Mama, you make beetroot cutlets and started laughing.

I also said that oh yes I make this today.             Beetroot cutlet...for breakfast...yummy food."
508,food,Yummy Tuna Baguettes,delicious stuffed baguettes
509,food,Crispy chicken  Donut,
510,food,Delicious chicken Haleem ready in just 30 minutes,
511,food,Food Review: McDonald's BTS Meal,"My review of McDonald's BTS Meal, which was launched in the Philippines on June 18, 2021."
512,food,kulfi ice cream,Kulfi is similar to ice cream. Only the method of preparation is different. Kulfi is creamier and thicker than ice cream.
513,food,"""Kaju Katli indian sweets""",
514,food,Perfect Italian Focaccia Bread,Easy Focaccia flavored with rosemary.
515,food,MACHHA CHAD-CHADI / CHOR-CHORI,Machha chadchadi/chor chori is a simple odia cuisine of small fish coated with dried mustard sauce tempered odia spices.
516,food,"""Rabadi "" Dessert","Rabri is a delicious dessert. It is a famous dessert. It is found everywhere. We can make it easily at home.
 Rabri can be eaten with Jalebi. Or just like that. It tastes very tasty as it is eaten."
517,food,Dhokala Indian Recipe,
518,food,"""Mango Smoothie""","as soon as the mango season arrives, it is everyone's favorite fruit. There are so many types of mangoes. Many types of recipes are made from mangoes. It is also very easy to make. One of these is Mango smoothie"
519,food,Three Hot Dog Recipes to Impress Your Guests at Your Next Cookout,Planning a cookout? Transform your normal ho-hum menu into one of shock and awe by adding a few over the top gourmet hot dog selections. Your barbecue will be the talk of the block after you serve up a dog to remember.
520,food,Most Gross Foods in the World,The most grossest foods on earth. A look at the absolute worst cuisines imaginable.
521,food,different style chicken sindhi biryani with mint and yogurt raita,
522,food,Chinese Regional Cuisines,
523,food,Onion Box - Perennial Onion Growing,"Winter onions, walking onions, french onions, all names for onions that spread by dropping onion sets onto the ground..."
524,food,"Festive Fettucine in a Mole Sauce with Corn, Beans, and Chicken Recipe","Delightful spicy chocolate flavored mole sauce pairs with a rich festive mixture of corn, beans, and chicken with the comforting bulk of fettucine noodles to make a surprisingly quick but delicious pasta recipe."
525,food,Heavenly Pancake Recipes,"Pancakes can become boring, but you can liven them up by adding chocolate chips, fruit chunks, chopped nuts, or even candy bits as they cook.

So here are the recipes for Heavenly Pancakes that I usually cook at home."
526,food,Residents of a Kenyan Town Surviving on Dirty Water as Water Crisis Persists.,
527,food,Baked Bread on the Grill - Rhubarb and Banana,The smell wafting from the grill is wonderful. The bread is almost done...
528,food,Top 4 Delicious Pakistani Halwa and Their Recipes,
529,food,Recipe of Stuffed Brinjal Dry Vegetable - Microwave Version,This stuffed Brinjal dry vegetable is a delicious dry vegetable using Indian spices and in this recipe we will be learning the microwave version of preparing this dish.
530,food,Antny's South Philly Favorite Italian American Recipe Collection,A collection of regional favorite recipes from South Philadelphia or South Philly for those who know. These Italian American dishes are the definition of comfort food. From homemade pasta to authentic Sunday Gravy. This recipe collection will surely have you coming back for more.
531,food,Chicken N Yogurt Curry,Chicken and yogurt gravy is extremely delicious and the  touch of turmeric gives it a pleasantly vibrant in colour
532,food,Favorite Recipes in 2021,"Favorite Recipes in 2021,This is one of all-time favorite dinner recipes. It's super fast and easy to dress up or down. Add a green salad and you have a complete meal"
533,food,The Fascinating British Story of the French Champagne,The origins of champagne have long been disputed between England and France. Was Dom Pérignon really the first man to taste the sparkling wine? Or is it possible somebody else (maybe the English) beat him to it?
534,food,Kung Pao Chicken Introduction,
535,food,One of the Most Popular Snack and Dessert Tofu Brains --Douhua,
536,food,Traditional Chinese Snack -- Stinky Tofu,
537,food,One of the most representative of Wuhan Delicacy: Doupi,"Doupi is one of the main foods ""GuoZao""(breakfast) for Wuhan natives, and it is also a very characteristic traditional snack among the natives of Wuhan. Its shape is square and thin, its color is golden and yellow, and is fragrant."
538,food,Wuhan Hot dry noodles introduction,"Needless to say, love in words for Wuhan people have the affinity for it. Furthermore, it is an integral part of Wuhan's folklore and food culture."
539,food,Delicious Homemade Mortadella,Easy homemade mortadella
540,food,Grilling Out Secret: Frozen to Fully Cooked,Can you add more charcoal before the old charcoal burns out completely and continue to grill? Learn the secret to grilling out from frozen to fully cooked.
541,food,"Pork Chops, Onions, and Potatoes Mustard-Dill Roast Recipe","This wonderfully savory but also sweet recipe melds together almost haunting notes from the mustard, with tender pork sandwiched between succulent sautéed onions and sautée and baked potatoes richly imbued with mustard and sauce flavor."
542,food,Mirchi Bada - Stuffed Chilli Fritters,"It's a typical North indian spicy starter,mostly eaten in Jodhpur, Rajasthan."
543,food,Soft Lemon Biscuits Easy to Make Recipe,Are you looking for a delicious & healthy Lemon Snack? You have come to the right place. With my Foolproof Recipe you will bake mouthwatering snacks that ease every stomach. Have you made them yet? Let me know what you think in the comments!
544,food,9 Amazing Facts About Essential Everyday Sweet Cream Butter,"This knife-cut tub of butter is a creamy, delicious choice. It's made with premium cream. Butter has 0g trans fat per serving and 0mg cholesterol per serving."
545,food,Things to Consider When Designing a Restaurant,"Here we elaborate on some points that you need to consider while designing the restaurant. Although the customers feel enjoyable if your restaurant is well maintained. It consists of the interior as well as the exterior designs. Some factors like the way of delivering food, adjusting the tables and"
546,food,Sloppy Joes Made an Old Fashioned Way,Sloppy joes made with chicken and gumbo soup...
547,food,Pursue Better Coffee With Melitta’s 10-Cup Aroma Enhance Glass White Coffee Maker,"Brewing an optimal cup of coffee, make that more that one. Melitta’s Pursue Better Coffee With Melitta’s 10-Cup Aroma Enhance Glass White Coffee Maker."
548,food,Peanut Butter Espresso Cookie Bites,The perfect treat to celebrate National Peanut Butter Cookie Day!
549,food,Warm Your Soul With These Soup Recipes,"I've compiled a list of soup recipes that you can make at home. These are more delicious than most soups, but there's no reason you can't eat any soups you want. Just remember to reduce the amount of seasoning you put in every soup you make."
