,category,header,contents
123,food,7 Plant-Based Foods You Should Be Eating,"If you’re thinking about switching to a plant-based diet, there are several misconceptions out there. One such misconception is that you’ll be limited to only eating salads and vegetables all day long. Not only plant some of the healthiest things to put in your body."
124,food,How Many Carbs in a Apple?,"How Many Carbs in a Apple? All you need to know

Including apples in your diet can help you eat healthier, but did you know that there are carbs in an apple? Depending on the variety, an apple can have as few as 5 grams of carbs and as many as 17 grams of carbs."
125,food,Tomato & Beetroot Soup,"This soup is made with tomatoes, carrots, beetroots, onion, and garlic. Check out this tasty & flavourful soup recipe to enjoy in this winters."
126,food,Chicken Korma or Indian Shahi Korma,"This chicken korma recipe is a north Indian dish that is made of ghee, yogurt, nuts and it is flavored with a lot of spices. The main ingredients would be onions that are fried until it is dark brown in color and gravy is creamy and delicious due to the thick paste made of cashews and almonds."
127,food,Top 10 Best Chef Knives Under $50 (2022),"A chef knife is an essential tool for any kitchen, whether you're a professional or just someone who occasionally cooks at home. The best chefs knives usually have a long blade with a sharp edge, which makes them perfect for slicing through tougher ingredients like meat and vegetables."
128,food,Top 10 Best Bone Saw for Deer (2022),The best bone saw for deer is the one that is going to provide you with the best results. The best bone saw for deer comes with a sharp blade that will be able to cut through bones effortlessly.
129,food,Cookbook Collecting: the Storage Saga,I have collected cookbooks for 47 years...
130,food,Roast Beef - Cooking with Imbedded Garlic Cloves,This is a fun recipe...
131,food,How to Clean a Mouldy Fridge (Step by Step),"Are you looking for a simple step by step solution how to clean a mouldy fridge? Then take a look right here on how to do just that, we'll guide you through."
132,food,Jam Cookies - Thumbprints They Call Them,These are the converts cookies taken one step further.... Filled with homemade mixed berry jam.
133,food,Carrot Pudding or Gajar Ka Halwa,"Carrot pudding or Gajar ka halwa is an Indian dish made from carrots, milk, sugar, and dry fruits. It is a sweet pudding dessert mostly eaten in winter or mostly reserved for festive occasions. It is a very tender and juicy dessert that can be made in batches and can also preserve for a long period."
134,food,How to Make Quick and Healthy Banana Bread,"If you want a healthy alternative for eating and loves banana then this recipe for you. This banana bread recipe is super moist , tasty and super healthy. It  can be easily made at home with whatever ingredients you have .It is great for binge eating or healthy snacking."
135,food,How Is It to Be a Vegetarian?,Vegetarianism should be a chosen lifestyle. Combining it with sport and healthy choices allows you to reach your maximum potential. Use applications like Pinterest and Yazio to help you discover recipes and count your calories.
136,food,5 Healthy Foods That Are Not so Healthy,"Our daily choices can profoundly affect our lives, and this is especially true when it comes to what we eat. There's no denying that eating pizzas, burgers, and french fries regularly is probably not the best thing to do— but what about the healthier foods?"
137,food,Apple - Autumn Glory - Sweet,"They are crisp, sweet, juicy..."
138,food,Eggs - Fresh Farm Does not Mean Clean,Fresh from the chickens butt...
139,food,Bagel Snacks - Olives - Ham - Cream Cheese,"Mini bagels, toasted, covered, tossed in mouth. Repeat..."
140,food,Coffee Bombs - Repurposing Lindors Chocolate Balls,"The ball melts into my coffee, leaving a hint of the flavor..."
141,food,Choco Banana Icebox Cake (No bake),Enjoy a satisfying cake without baking. Make this Choco Banana Icebox Cake at home.
142,food,Easy and Healthy-ier Beef Meatballs with Different Sauces,"Here's an easy and healthy-ier beef meatballs recipe that you can cook in big batches, freeze and serve in different ways. This recipe is also perfect for kis"
143,food,Grocery Store Curbside Pickup Pros & Cons,"It seems as if grocery store curbside pickups are becoming more popular during the COVID-19 pandemic. Here are some pros & cons of using this service, if you are deciding whether or not to do so."
144,food,Simple Bread Milk Toast Recipe,This crisp on the outside and creamy soft inside sweet bread milk toast is simple and quick to prepare. Recipe video included.
145,food,Frying Pan Made of Glass,My only regret is that I did not fry two eggs..
146,food,"If You Want to Understand Russian Culture, Start by Trying Their Food","When we look at Russia, food is not the first thing that comes to mind, but during the nineteenth century, Russian food was one of the world’s great cuisines. Russia is far from the stereotyping of potato eating and vodka drinking Russians too many associate this huge country with today."
147,food,Sweet and Spicy Glazed Salmon with Veggies Recipe--Healthy and Easy,Here is a delicious sweet and spicy glazed salmon recipe for you to try at home
148,food,Pork Nuggets and Potato Wedges in Oven,"Like chicken, but pork..."
149,food,French Chocolate Bûche De Noël Recipes for Christmas,"In this article, you will find three traditional chocolate Bûche De Noël recipes and some simple cake decoration ideas for Christmas."
150,food,How to Make Tuna and Rice in the Egyptian Way,"Fish is a delicious, useful and easy to cook meal, so I brought you a delicious Egyptian recipe for tuna fish with rice and green salad."
151,food,PAKHALA-A Regional Food from Odisha,A fermented bowl of rice  which  is a comfort food for everyone. It gives a Viagra kick when eaten in hot summer afternoons. A recipe for the fiesty
152,food,Ahi Tuna - Breaded and Deep Fried,"Thaw. Cube. Flour, egg wash, cracker crumb, deep fry. Mouth."
153,food,Spatulalove - I Got it Bad,"So, I got two rubber Spatulas.."
154,food,Smelt Frying - it's Little Fish,I bought 2 bags of frozen smelt...
155,food,Cheaper Ways to Get the Equipment You Need for Your Restaurant's Kitchen,
156,food,7 Ways You Can Grow Your Food Truck Business,Food Trucks are the spirit of America. They were invented in the US and have been successful business model since then. Here are the Seven Proven ways you can grow your Food Truck Business.
157,food,Scallops - Flour Egg and Cracker Crumbed,"Deep fried scallops are okay, but the coating takes over the flavor..."
158,food,Materials to Make Your Food Prep Areas out Of,
159,food,Crispy Butterfly Shrimps,"This is a starter and snack recipe, prepared by shaping a butterfly like figure from the shrimp. Shrimps are seasoned with garlic powder, red chilli podwer, salt and lemon juice. Further, they are coated with flour, egg and breadcrumbs. Then they are deep fried."
160,food,How to Eat for Free or Obscenely Cheap Year-Round,The best tricks and deals you don't have to wait for.
161,food,"Peach Pie with Italian Brandy, Ginger and Jello","Frozen peaches, crust, sugar, and some other stuff..."
162,food,Unripe Plantain Benefits Your Sex Drive and Sexual Health,"Musa paradisiaca is a tropical and sub-tropical unripe plantain or cooking banana. It can be prepared as food or herbal aphrodisiacs' to enhance sexual health. Eat it boiled half in the raw state, roasted, or fried. You can barbecue it to improve your libido"
163,food,Scallops - Wrapped in Bacon in Oven,Wrapped in bacon and drizzled with cheesy butter...
164,food,Easy Chicken Parmesan Casserole,
165,food,Marvelous Foods of Rajasthan,Blog enlists the royal and really delicious food or recipes one should try on a visit to Rajasthan
166,food,Lost Foods Nobody Remembers But You,"They were here, they were delicious, they were gone and nobody seems to remember them. Do you?"
167,food,California Burgers - Slider Style in Minnesota,"A small burger, with vegetables..."
168,food,"Marmite, Do You Love It or Hate It?","Love it or hate it, marmite has been around for more than 100 years.  But what is the history of this sticky spread?"
169,food,Chocolate Caramel Cups,
170,food,Fast and Favorite Peanut Butter Cookies,Gluten free - No flour needed - 4 ingredient Recipe
171,food,How to Make Mashed Potatoes,"How to make mashed or smashed potatoes.  I love potatoes and I like them mashed, smashed, baked, boiled, scalloped, you make it I'll eat it.  Here is how I make fluffy mashed potatoes for my family's dinner.  This is an easy step by step tutorial to help you make delicious potatoes for dinner."
172,food,Halwa Sweet Dessert Recipe,
173,food,Sweet & Spicy Cauliflower With Pesto,A recipe that takes humble cauliflower to the next level !
174,food,A Crunchy Coconut Cutlets Testy And Awesome Recipe For Fasting There is a lot of desire to eat delicious food during..,A Crunchy Coconut Cutlets Testy And Awesome Recipe For Fasting
175,food,Dinner Rolls - Frozen to Stomach in 5 Hours,"Frozen balls...thaw/rise, bake, eat."
176,food,Popcorn Indiana - Drizzled and Addictive,"....intones ""my name is Char, and it's been 10 hours since my last drizzled popcorn""..."
177,food,Sinus Buster - the Salty Hot Brew that Steams Through the Crud,"Sometimes, you just need something salty and steamy..."
178,food,Peanut Butter Converts Cookies,It's a twist on an old thing...
179,food,10 Best Herbs and Spices for a Healthy Heart Diet,"Herbs and spices are used to flavor or garnish foods-meat, fish, tea, salads greens, and porridges. Including soups, stews, and many others. They are medicinal. Used in safe combinations, they can promote heart health, and prevent heart diseases."
180,food,Three-Ingredient Cauliflower Pie,This is a quick and easy nutritious and delicious side dish perfect for a lunch in the office or school.
181,food,Special Occasions Recipe Mawa Malpua Delicious and Healthy Sweet Indian Recipe To Prepare At Home,"Special Occasions Recipe Mawa Malpua Recipe For any special occasion like festival, special sweet dish Mawa Malpua can be prepared to make everyone's mouth sweet. Delicious and healthy sweet indian recipe to prepare at home."
182,food,Squirrel - Cooked and Reheated,We have been invited to try squirrel...
183,food,Holiday Peppermint Bark,"The Gardener and the Cook share their favorite candy recipe for the Christmas holidays, and some changes they made this year."
184,food,Kosha Mangsho Recipe an Indian Bengali Recipe A Delicious Indian Bengali Recipe,"Kosha Mangsho Recipe is an Indian Bengali recipe.  Which Bengali community as well as other communities like it.  Mostly sweets are used in Bengali vegetable recipes, so these vegetables taste somewhat sweet."
185,food,Potato Balls - a What if You Mix Such and Such Together,"Like a tator tot, but home made, and stuffed..."
186,food,Mystery Meat Pie,"Ever wonder what the mystery meat is in a mystery meat pie? Is it random pieces of specific animals, or left over pieces from random animals? Or worse, is it humans ground up ala Sweeney Todd? What if, the mystery in the mystery meat pie is that there is no mystery at all?"
187,food,Classic German Side Dish for Christmas,"Goose is a traditional German Christmas meal, but what side dish best compliments the meat? In this recipe I'll show you how to make Rotkohl, red cabbage."
188,food,7 Christmas Treats to Make Your Christmas Extra Sweet,"The most joyous time of the year is here, so you know what that means; It’s time to go to the kitchen and whip up as many Christmas treats as possible."
189,food,"Sweet Potato Tuna Croquettes With Moringa, Turmeric and Bell Pepper",Here is an easy to prepare appetizer or snacks. Just mix and fry or bake.
190,food,Blueberry Coated with Almond Bark and Chocolate,"Someone said blueberries coated with chocolate, but Queen Anne's are not available..."
191,food,Easy Beef Rump or Tip Roast Cooked in an Instant Pot-Easy Filling Dinner,"Recently, with Hamburger running $5 or more a pound, our local supermarket has been running specials on Rump or Tip Roast. This is a quick and easy way to make a good meal that could make a good dinner or a Sunday Dinner without a lot of effort."
192,food,Meatloaf Burgers Under the Broiler,"This was a compromise, I suggested burgers, hubby suggested meatloaf, so we met in the middle...."
193,food,Tian with Rosemary Pork Tenderloin Recipe,"This elegant looking tian combines the wonder of Provençal cooking with a fragrant and tender pork tenderloin, whose juices seep into and give even more flavor to the wonderful vegetables and onions beneath;"
194,food,Should You Keep Nutella in the Fridge or At Room Temperature?,"Nutella is one of the most popular spreads. You can eat in many ways, but what about its storage? This article is going to explain how you should store your Nutella jar after purchase."
195,food,McDonald's Giving Away Free Food Until Christmas Eve Paid for by Mariah Carey,You don't have to be a regular customer of McDonald's to stop in for free food every day until Christmas Eve. The free food is courtesy of singer Mariah Carey. Here is all the information you need to know to get something from Mariah's menu.
196,food,Eggnog for One,Double the time and ingredients for a cozy drink with two .
197,food,Great Party (Non-Alcoholic) Drinks,"Recipes for punch and great ""party"" beverages that are fun for all ages"
198,food,Gravy Infused with Meat and Vegetables,Sawmill gravy is the proper name for this dish...
199,food,Taco Dinner Kit - Old El Paso,"It's not deep fried, and we had chicken last night, kind of night..."
200,food,Pasta In white And Red Sauce - Easy To Make Italian Style Pasta With Indian Twist,Pasta In white And Red Sauce - Easy To Make Italian Style Pasta With Indian Twist  how to make pasta mix sauce pasta
201,food,Creating New Culinary Trends & Inventive Menus: French Chef Margot Amzallag Continues to Innovate,"Innovative fusion foods are the new craze for high profile catering events, and chef Margot Amzallag continues to come up with innovative dishes inspired by international cuisine."
202,food,Instant Pot Pumpkin Soup,"Creamy Pumpkin Soup made in the Instant Pot for a simple, wholesome one-pot meal ready for a quick, fulfilling, and delicious soup."
203,food,Persimmons  - an Acquired Taste for Me,Fear of the unknown..
204,food,Say “Cheese” for the Holidays: A Quick and Easy Guide to a Savory Cheese Board,Creative cheese boards are a welcome addition to your holiday appetizer and hors d'oeuvre menu. Your guests are sure to enjoy this delicious variety of cheese selections for party starters.
205,food,The Reasons Why Fast Food Restaurants Are So Popular,Fast food restaurants are very popular. This article will highlight some of the most common reasons why do these places are so successful nowadays.
206,food,Delicious Soya Chunk Curry - Indian Style,Soya chunks are derived from soybean and are a healthy food item. This article gives a detailed method of making Indian style soya chunk curry using a microwave oven.
207,food,Pork Cutlets - Coated and Fried,"Pork cutlets, coated and fried to a golden brown..."
208,food,Kaszka Breakfast Recipe,"A tasty and nutricious breakfast made with Polish kaska, a rice powder used to mix with milk"
209,food,Spicy Masala Rice In Cooker Recipe,Very simple without any complecated steps yet filling and wholesome onepot meal. Ideal breakfast and lunch box recipe.
210,food,GraniteStone Cookware - Buying a Frying Pan,"Dollar General has a As Seen on TV section, and I bought a pan..."
211,food,Stuffed Lobster Tails,I love seafood!  If you love seafood as much as I do this is a great recipe for you.  Wonderful date nigh dish for you and someone special.
212,food,Essential Wines for Your Holiday Table,"Best wines for holiday meals featuring turkey, poultry, beef, pork, or seafood as well as a variety of appetizers and side dishes."
213,food,Sensational Seafood Fra Diavolo,"If you love seafood as much as I do, this is for you.  It's spicy, it's delicious and easy to make.  This is my go-to seafood dish for our major holidays and always a hit."
214,food,Salmon Steak ala CeeCee,"This a delicious, heart-healthy meal that will leave you satisfied and craving more."
215,food,Quick Empanadas,This is a super easy empanada filling that is sure to please.  My 12 year old is a picky eater and he loves these.
216,food,Shrimp - Frozen to Deep Fried,"Shrimp, deep fried..."
217,food,Quick and Easy Christmas Breakfasts Your Kids Will Love,Check out these super yummy Christmas breakfasts that your kids will absolutely love! They're all really easy to make and super delicious and they'll make the holiday season all that more special.
218,food,Pork Heart Fried in Garlic Butter with Onions,"When you butcher a pig, you cut up the heart and fry it..."
219,food,Seared Tuna Tataki,"Seared ahi tuna can seem intimidating to make at home but if you love it at a restaurant, you should try making it at home! It's a fast and easy recipe that comes together quickly. The flavors and simplicity will have you making this recipe often!"
220,food,The Biggest Foods Ever Made in the World,"Many people pride themselves on their huge appetites. From buffets to eating contests, Most people enjoy gorging themselves. But some foods are so enormous they overwhelm even the biggest appetites. Continue to read us, The biggest foods ever created in the world."
221,food,How to Cook Lentils in Spinach Gravy with Veggies,"There are days when I just walk into the kitchen and treat it like the lab of a cartoon chemist discovering a new drug. I don't go with a plan. I just let my mind do what pleases it. On one such day, I made this simple, quick, and healthy meal."
222,food,Easy Meal-Prep Breakfast Recipes,"Easy and nutritious breakfast recipes you can prep in advance, and enjoy on the go! Perfect for a busy week."
223,food,How to Make the Perfect Cup of Ramen,"The best way to cook Ramen noodles, step-by-step."
224,food,7 Vegetables With Vitamins and Minerals That Will Increase Your Energy,"The importance of vegetables
If you're trying to improve your energy levels, these are some of the main vegetables that can help. Green vegetables

Greens like spinach, kale, and broccoli are low in calories and high in nutrients and minerals. 

People who ate 30 grams of raw kale per day had much l"
225,food,Marriage of Western Dessert with Indian Sweet,"Marriage – is an official name for a bond of love between two people which lasts a lifetime. Marriage brings together individuals with different personalities in terms of thoughts, physical appearance, mental ability, culture, country, region, etc. Together, both become more than their selves."
226,food,Cheesy Hashbrowns,Do you love hashbrowns?  Do you love cheese?  This is a perfect addition to your breakfast table.
227,food,Thinking About Going Vegan? Here's a Vegan Beginner's Guide,
228,food,Shrimp Scampi over Spaghetti,Delicious & easy recipe in under an hour. This is a perfect dish a beginner cook doesn't a lot of time to spare.
229,food,Shrimp in Yogurt Curry,"I craved shrimps. I craved curry. I wanted it quick to fill my tummy after work. So I invented this quick, easy and creamy recipe :-)"
230,food,Amazing Mashed Potatoes,Perfect side for any Thanksgiving meal and my personal favorite side.
231,food,Palmini Hearts of Palm Lasagna,"Palmini Hearts of Palm  lasagna is a perfect low carb, rich and hearty pasta dish with Italian flavor. Heart of palm is a white vegetable obtained specific varieties of palm tree. It has small amounts of small amounts of several other nutrients, including iron, calcium, magnesium, and folate."
232,food,Lip Smacking Lasagna,"Don't order out, make it at home.  You will not regret it!"
233,food,A Easy Way to Bake Asparagus,"Do you hate asparagus? I used to until I tried this way of baking it. Asparagus is a common food that isn't anyone's favorite by all means, but maybe you might like this recipe?"
234,food,Portuguese Beef Stew,Simple Beef Stew for Beginners
235,food,Simple Tomato Sauce,Perfect sauce for beginners!
236,food,Mama's Meatballs,Must Try!  You will love the simplicity and deliciousness of this recipe.
237,food,Go Nuts for Nuts as a Healthy Snack,Nuts are healthy for you when you want to eat a snack. They are delicious and filled with disease-fighting nutrients.
238,food,Cheesy Mushroom Spam Sandwich,How do you eat your SPAM? Check out this simple but tasty cheesy mushroom spam sandwich recipe at home.
239,food,Yams - Candied and Delicious,I love candied yams..
240,food,Pork Cutlets - Battered and Fried,"Normally, I would coat them with flour, egg and ground crackers. Today, flour, egg and rice..."
241,food,How to Make Delicious Muttun Paay,
242,food,Mediterranean Couscous Salad,"This is the recipe of Mediterranean couscous salad. I have given the complete instructions, cooking time, methods , its nutrition's and benefits and the changes you would like to make."
243,food,Cabbage Carrots and Corn Combine - a Dry Vegetable Recipe,"Dry vegetable dishes is one of the areas where a large number of combination of vegetables is possible and people go on trying different variations in this across the globe. The present recipe uses cabbage, carrots, and corn for making a delicious dry vegetable using Indian spices."
244,food,Almond Dates Wheat Pistachio No Sugar Biscotti,A snack is a delight to almost everyone. We often restrict ourselves to this simple pleasure with a greater intention of protecting and improving our health. What if you can munch on some goodness of health and flavours!! Read to know how that is possible :-)
245,food,Healthy And Delicious Mango Kheer A Summer Season Recipe Specially For Children,"Mango Kheer Specially prepared in the summer season, Mango Kheer, children like it very much.  You can serve it cold or hot as you wish.  Its taste looks good in both the aspects."
246,food,Cheese Curds Beer Battered and Deep Fried,"Ooey, gooey, nummy... Warm, squishy delicious."
247,food,"Coffee Is a Luxury, Not a Staple",Coffee connects the world. Humans consume over 2 billion cups of coffee every day. The whole world joins in the daily morning ritual of drinking coffee. This ritual is seen as basic and not at all the luxury it is.
248,food,Cooking Indian Food in Clay Pots,Indian food is the best. I love to cook Indian dishes in clay pots.
249,food,Lip-smacking  Bong Indian Snacks to Make and Try,"Are you a foodie?  Do you like having snacks during evening hours? Or are you puzzled about what to make for your dear ones while they are away in school or office.. Love to try out various recipes, then this article might interest you."
250,food,Cheese Corn Momos Recipe a Delicious and Healthy Recipe You Can Easily Make at Your Home,Make Sweet Corn Cheese Momos at home and serve it with chutney or sauce and make the elders along with the children happy.
251,food,Delicious Makhana Curry - Indian Style - Microwave Version,Makhana (lotus seeds) is not a very common item for making a vegetable dish but it can be effectively used in vegetable curries and this recipe is about one such popular and established vegetable curry dish being prepared and consumed in India.
252,food,Chocolate Expresso Macaron,Delicious Chocolate Expresso Macaron recipe!
253,food,Yummy Chocolate Brownie Recipe!,Yummy chocolate brownie recipe!
254,food,"Good Friends, Hot Wings, and Football: What a Great Mix","Regular or hot-flavored, hot wings are hardly turned down."
255,food,Eggs - Deviled and Darn Delicious,"Boiled, cut, scooped, mashed, miracle whipped and mustard-ed. Then, scooped into egg white halves. Garnished with half of a green olive and a dash of seasoned salt."
256,food,Unique Coffee Recipes,"I am offering two coffee recipes. One is a warm and invigorating, yet comforting beverage on a crisp fall morning. The other is a cool refreshing beverage for a hot summer day."
257,food,3 Weird Dishes in China That Are Actually Delicious,Chinese cuisine features several delicious dishes that are still considered weird and bizarre by many Westerners: this article will show 3 of them.
258,food,History of Bread,
259,food,Strawberry Jello Dessert Recipe,Easy and quick to prepare strawberry jello dessert. Recipe video included.
260,food,How to Cook Frozen Hamburger Patties With the George Foreman Grill,"Are you ""hangry"" for a burger and don't feel like standing outside next to the grill? Fire up the George Foreman Grill for a quick and ""healthier"" hamburger in minutes. From frozen burger patties to a delicious meal in minutes, the George Foreman grill does it again. Stop ""hanger"" in its tracks!"
261,food,Coffee Beans: Harvesting and Processing,
262,food,Cookies - Chocolate Chip Infused,What are grandma's known for besides love...cookies!!
263,food,What is cork made of?,
264,food,Pecans,
265,food,Make Your Thanksgiving Complete With This Old-Fashioned Pumpkin Pie,"To my knowledge, no one would dare turn-down this treat."
266,food,The Importance of Good Nutrition,
267,food,TABLE ETIQUETTES,"Guests in the hospitality business, especially those who dine in fine dining restaurants or other dining establishments, must be well versed in table etiquettes."
268,food,Jelly - Mixed Berry,"A cleaning the freezer moment. Kinda like dump cake, but with berries... Everything goes in.."
269,food,What is Cheese?,
270,food,Taco in a Bag,"Like a regular taco, but in a snack size Dorities bag..."
271,food,Duck - Roasted over Potatoes and Onion,"Duck. Duck. Grey duck...oops, different game."
272,food,Curd Chutney Very easy,
273,food,History of the Bean,
274,food,Fried Potatoes - from Duck Fat Infused Potatoes,"When I roasted the duck, I put potatoes and onions in the pan instead of water. Now, to fry the potatoes..."
275,food,Cheese Dip - Quick and Yummy,"Precooked taco burger, white cheese sauce, medium salsa, and voila...."
