,category,header,contents
0,food,Primanti Brothers Home of the Working Man's Sandwich Pittsburgh's Best,"I've heard so much about Primanti Brothers sandwiches through the numerous TV shows, social media posts, and articles, that I had to try it myself. On a recent trip West to the outskirts of Pittsburgh, I was finally able to sample this iconic Pittsburgh sandwich. This is my review of Primanti Bros."
1,food,1938 Lemon Chiffon Pie,"My Great-Grandmother Sistrunk gave this recipe to my Grandmother Knight. It was written in 1938 in pencil--so naturally it was faded and difficult to read. However, I managed to read it. I am a Lemon Lover---so I might try this recipe. Written in 2013."
2,food,Nutritious Carrots: Multiple Course Recipes,"Learn some particulars about the nutritional value of consuming carrots, and I hope you enjoy these tasty recipes."
3,food,Can You Guess the Breakfast of Greek Champions in Thessaloniki?,"Bougatsa is the traditional breakfast pastry of Greek Champions typical to the cuisine in Thessaloniki. Over the years, the origin has been debated… is it Greek or Turkish?"
4,food,Focaccia Bread Recipes With Olive Oil for Lunch,This article contains 8 different Focaccia Bread Recipes with olive oil.
5,food,Sukhadi (Gol Papadi) - a Quick-N-Easy-to-Make and Delicious Gujarati Sweet,"Sukhadi is a Quick-n-Easy-To-Make, Delicious Gujarati Sweet, made from Wheat Flour, Jaggery & Ghee as key ingredients. Different versions of Sukhadi are popular, with additions to main ingredients, adding flavors and nutrition to it. Let us explore its simplest form to its tasty, healthy variations."
6,food,The Best Cream Cheese Souffle You Have to Try,"This souffle is like having a small, super light and fluffy cheesecake served in a bowl."
7,food,15 Foods You Didn't Know You Can Cook in an Air Fryer,"You might know some of the things you can make in your air fryer such as French fries, tater tots, and chicken nuggets, but there are so many other things you might not know you can also make in an air fryer. Take your air fryer off unemployment and put it to work."
8,food,Do You Want to Eat Like They Do in Crete? Then Try Dolmades!,"Each country and within each country, often each region, is known for certain specific foods/diets. Today, I'd like to discuss Crete and share one of my favorite Cretan recipes with you- Dolmathes: Stuffed Grape Leaves."
9,food,"Ooh La La! How to ""Let Them Eat Cake!"" Traditional Buche De Noel Recipe","As many of you know, I recently returned from my Christmas in Paris adventure. It was fabulous and this being the Holiday Season, I'd love to share with you the recipe for a traditional French Christmas show-stopping dessert- Buche de Noel or Yule Log cake recipe."
10,food,Thai Coconut and Chicken Soup Recipes for Winter,This article contains 11 different Thai Coconut Chicken Soup Recipes with various cooking styles like slow cooker and instant pot.
11,food,Why I Will Never Use Uber Eats Again,"I will never use Uber Eats again because it's not worth the money, your food takes so long to arrive that it's cold, and the delivery time is very inconsistent."
12,food,Little Debbie Snacks: A Power Ranking,Our podcast recently ranked Little Debbie Snacks.  Here is our definitive power ranking of the snacks.  Which one is your favorite?
13,food,Mushroom Production Farming,Mushroom growing is becoming one of the most profitable business nowadays due to the sophisticated horticultural technologies which are applied which makes the operation more efficient.
14,food,How to Grow Sweet Potato: Sweet Potato Cultivation Farming,"Sweet potato farming, is a rewarding business which give high profit under good agronomic practices. Sweet potato performs well in tropical and subtropical lowland areas and is considered as a perennial plant."
15,food,Ground Turkey and Cheddar Cheese Sliders,"I am telling you these ground turkey sliders are juicy, cheesy and bursting with flavor, it everything my family love in a great slider and most of all they are super healthy These turkey sliders are really quick and easy to put together and are great even when you have to re-heat them."
16,food,Doughlicious and the Rise of Cookie Dough,
17,food,Fish and Chips Recipes for Dinner,"This article contains twelve different recipes about how to make battered fish, crispy chips and tartar sauce."
18,food,Easy Way to Make Nigerian Egg Rolls,
19,food,Salmon Tacos Recipes For Dinner,"This article contains nine different Salmon Tacos recipes with mango salsa, cabbage slaw and pineapple salsa."
20,food,Delicious Food for Healthy Minds,"The world is in the midst of a food crisis. We are facing a food shortage and an increasing demand for food. This is because we are living longer and eating more. People are consuming more calories than ever before, which means that our bodies need to store more energy for long-term health."
21,food,The Hilarious Ceremonial Shooting of the National Drink of South Africa!,"Do you like your cocktails to be colorful? Do you enjoy your cocktails having some type of significance? If you answered yes to either or both questions, then the Springbokkie, the national drink of South Africa, is right up your alley!"
22,food,Why and Where to Eat the Strange but Traditional Nshima?,"Like with many cultures, eating is a huge part of social interaction in Zambia. Whether it be family mealtime or large gatherings, the meal is always the focal point. Nshima is synonymous with Zambia when it comes to traditional food."
23,food,Mixed Vegetable Pulao,Very simple and easy recipe full of nutrition. This is a one dish full meal loaded with the goodness of a full meal with high nutrition value.
24,food,Pizza - from a Wal-Mart Box,It's huge. It's now got our own personal touch...
25,food,Step by Step Instructions to Properly Hydrate When Losing Weight,"Weight reduction is something that nearly everybody in our general public tries to accomplish. There are many purposes behind weight reduction, the vast majority of them having to do with fearlessness and a feeling of achievement."
26,food,Sensible Portions Veggie Straws: A Review,Veggie straws sure seem like a sensible option.  Especially when they are produced by a company called Sensible Portions.  But are these healthy?  Are they really made of vegetables?  Lets find out
27,food,Air Fryer - Baked in Shell Eggs,These turn out like boiled in the shell eggs... Just peel and use as normal.
28,food,Mashed Potato Pancakes - Uffda Puffda,"Left over mashed potatoes, egg, thinly sliced bunch onions...fry in butter."
29,food,Chapati Seafood Quesadillas,Quesadillas comes from the regions of Mexico and were first made with corn masa but things have really changed because they are made from so many things and can be prepared in so many ways. Today I going to share with you a recipe for Chapati Seafood Quesadillas that is really tasty
30,food,Review of Jennie-o Turkey Breast,"Turkey is pretty good.  You may not need a full bird though.  Or you just want a small portion of white meat.  Jeannie-o turkey breast is one of the available options.  Smaller portions that cook up quick, light colored meat if that's your preference and it's pretty tasty."
31,food,Purple Rabbit Cookies with Buttercream Frosting,"Big recipe, no measurements.."
32,food,The Drink You Need in Your Fridge for Summer 2022,
33,food,Pork Chops - Fried in Butter with Onion Slices,"Tender, flavorful. Just yummy."
34,food,10 Simple Ways to Become a Better Cook,Tips for the average cook in the home to keep a clean and healthy kitchen and cook healthy meals at the same time.
35,food,Maki Sushi Recipes For Dinner,This article contains six different maki sushi recipes and two sushi sauces recipes.
36,food,Best Foods and Diet Plan Tips for Healthy Skin,"With the increasing demand for healthy skin, there is more and more focus on diet plans and skincare.

—

There are many factors that influence the look of our skin, and some of them are diet, exercise, and lifestyle.

—

We all want to look good and feel good. We all want to be healthy. And we also"
37,food,How Can I Be Happier?,"We are all born with a certain amount of happiness. It is up to us to nurture that happiness in the right way.

—

With AI writing assistants, you can create content that is more relevant and engaging. You can be more productive while using the same time and energy you’d normally spend on content"
38,food,Boiling and Drinking Black Tea Daily,"Tea is a complex chemical substance. It has some 30,000 molecules. It required heat to break down its components. In the first-ever natural experiment, the tea leaf falls into a pot of boiling not steaming water."
39,food,"The Best Food to Maintain the Eyes, Luster, Health and Luster","The best food to maintain the eyes, luster, health, and luster is something that you need to know. The best food for the eyes is not only about nutrition but also about aesthetics.

—

There are many health benefits of eating the right food. Some of them are:

—"
40,food,Ricotta Pasta Recipes For Dinner,This article contains nine vegetarian ricotta pasta recipes and one non vegetarian ricotta pasta recipe.
41,food,Can an Asian Dish Really Be the National Dish of South Africa?,"South Africa has a number of inhabitants from all over the world. The population includes indigenous tribes, immigrants, and those locals native to the country. The cuisine of the country reflects this same diversity. In fact, the national dish, Bobotie originated in Asia."
42,food,Lemon Poppyseed Cake Recipes For Dessert,This article contains six different lemon poppyseed cake recipes
43,food,Chocolate Turtle Cake Recipes For Dessert Time,This article contains seven different chocolate turtle cake recipes.
44,food,Braised Oxtails,"There is nothing to me that can impress me quite the way Braised Oxtails do? They seem like a really fancy dish to make and it is, but here's a secret is these Braised Oxtails are very easy to make. This is a great dish to prepare for company on those cool weather days, either in the winter, spring,"
45,food,Love Ice Cream?Learn How to Make It,
46,food,Presto Popcorn Popper - Orville Redenbacher's Hot Air,Bowl. Popcorn popper. Plug in. Catch popcorn in bowl. Butter and salt ..
47,food,Noodles Coated With a Maximized Tomato Sauce,Sometimes a person craves a spaghetti type noodle dish...
48,food,West Coast Sourdough Sandwiches: a Review,"This is a review specific to West Coast Sourdough in Bakersfield, CA.  However, it is a chain restaurant, so chances are there may be one near you.  It's pretty good I think.  What makes it special is their bread"
49,food,Good Health Veggie Straws,"Veggie straws.  What exactly are they?  These are a fairly new snack that provides a tasty - but are they healthy - alternative to the potatoe chip.  Lets take a look at this one put out by Good Health.  With a name like that, you know these must be good and healthy......"
50,food,Kunafa Recipes: How to Bomb the Diet,"kunafa is a dessert prepared with sherbet and unsalted cheese. kunafa, which takes its place especially at the Ramadan and feast tables, is served with additional products such as buffalo milk, mango, pistachio and almond. In addition, cream or ice cream is added to the kunafa."
51,food,Pressure Cooked Butter Beans with Onions,"Many people don't use pressure cookers as much as they should but for certain things, they are really perfect like making a nice pot of Butter Beans and believe me they are perfect for this type of protein,  Because the pressure cooking the beans translates into less vitamin and mineral loss, Making"
52,food,Why Most Restaurants are Going to Die,"What Covid started, the economy and politics will finish. Restaurants as we know them are doomed."
53,food,Review of Poppables: Southwest Ranch Flavor,"Poppables is a new product that calls itself  the ""perfectly poppable crispy potatoe bites"".  They come in many varieties.  The Southwest Ranch is a ""new"" flavor.  I personally think you'll like these the best."
54,food,Lemon Cream Cheese Pound Cake Recipes for Dessert,This article contains ten different lemon cream cheese pound cake recipes for dessert.
55,food,Braised Octopus Seafood Recipes For Dinner,This article contains six different braised octopus recipes along with couscous recipes to serve as side dishes.
56,food,"Tequila Marinated Centered Cut Pork Chops - 
  Cooking with, liquors is something I love to do.","Cooking with, liquors is something I love to do, And Tequlia is one of them, Now there are many other uses for Tequila in cooking like making barbecue sauces and glazes and really awesome in a fruit salad, and great with steak and seafoods, I have one to share with you today."
57,food,Peanut Butter Cake Recipes For Dessert,This article contains six different peanut butter cake recipes with frosting cream for a quick yet tasty dessert.
58,food,Cocktail Traifel,Delicious cocktail traifel indulge in cream and milk flavor.
59,food,Pink Passion Anti-Inflammatory Smoothie,"The perfect smoothie, if you're fasting,  meal replacement, or just because. It boasts a host of benefits from anti-inflammatory to digestive health."
60,food,Seafood Paella Recipes For Dinner,This article contains four Seafood Paella Recipes and basic information about the origins of Seafood Paella.
61,food,Tarqa Daal,In Desi ghee onions are fried and give the daal a unique flavor.
62,food,Lay's Layer's: Three Cheese Flavored,"Lay's has come out with a new chip, the layer.  Kind of a play on their name, but also a very good description of what the snack itself is.  It's kind of like a rolled potato chip, but not quite.  Is this what it promises to be? Well you can form your own opion on that.  Here is my take"
63,food,"Quick & Easy Recipe for Delicious BUBBA BURGERS With Fried Egg, Onions & Cheese","Bubba burgers are my favorite brand of frozen burger product to prepare at home. A little bit product review, a little bit recipe, this hub will discuss one of my favorite ways to prepare Bubba burgers. Plentiful toppings such as fried egg are used to make a delicious burger with ""the works""!"
64,food,Product Review of Frozen Pizza Product : California Pizza Kitchen Crispy Thin Crust Pizza,"Product review of the frozen pizza product, California Pizza Kitchen Crispy Thin Crust Pizza."
65,food,"Review of Datz In Tampa, Florida","Datz has two locations, one in Tampa and the other in Saint Petersburg, Florida. Datz serves very unique American food."
66,food,Homemade Mango Soda,Enjoy a cold and refreshing homemade mango soda this summer season!
67,food,Strawberries Is Neccessory for Health,"Advantages, and disadvantages of strawberries"
68,food,This History of Bloomington-Normal & What's to Come,"What did the beginnings of Bloomington-Normal look like? How did it become the home of several corporate headquarters, restaurants, and universities? Read more here to learn about the history of Bloomington-Normal, Illinois and the new restaurants coming to town!"
69,food,Bloomington-Normals Best Dinner Spots,"This article includes several dinner options located in Bloomington-Normal, Illinois. Home to Illinois State University, Illinois Wesleyan University, and Heartland Community College, Blono offers several local and unique restaurant options!"
70,food,Easy Cinnamon Roll Layer Cake Recipes,This article contains four different classic cinnamon roll layer cake recipes with cream for dessert.
71,food,Steak Breakfast Burrito with Gary's Quick Steak,"A breakfast burrito may sound a bit fancy, even foreign; however, with its basic ingredients, it makes it one of the most complete and convenient meals around.  Most usually include a potato, an egg, a meat choice and some cheese.  All this wrapped up in a form of bread - usually a flour tortilla."
72,food,Grilled Chicken Sandwich with Gary's Quick Steak Chicken,"In the mood for a quick and easy chicken sandwich?  Well, try this one with Gary's Quick Steak.  It's one of the better products I've tried out there.  And delicious and easy too.  And much cheaper than eating out."
73,food,The Svalbard Vault of the End Time,"Humanity's greatest challenge today is hunger. Climate change has worsened the situation. It is not surprising that March is named National Food Month. The danger before us forces us to pause, reflect and pay attention to steps taken We applaud efforts to establish the Global Seed Vault for food sec"
74,food,Fresh Green Bean Almondine,I’m dreaming of the seasonal produce. And the one veggie that really comes to mind is Green Beans fresh or frozen because there are so many ways you can use the so follow me while I share this quick tip.
75,food,How to Make Kinnow Orange Marmalade,"Try my artificial colour, flavour & preservative free orange marmalade recipe. Video included."
76,food,How to make Chocolate Ice Cream Cake And Pineapple Cake At Home,There is nothing more delightful than enjoying a big slice of ice cream cake on a hot summer day.
77,food,Reducing Wastage of Food as Chef,"At every level of the global food chain,  there are several macro and micro-level drivers of food wastage across all industries, including hospitality, packaged food, and our homes."
78,food,Try This Breakfast Instead,Breakfast that grows on trees with more fibre than a cardboard box.
79,food,Herb Window Box,"Box, jars, dirt, seeds, time..."
80,food,Top Easy Banana Pies Recipes for Any Occasion,This article contains both vegetarian and non vegetarian banana pie recipes for a quick dessert.
81,food,Fantastic Steak Marinade,Playing around in my commissary I made I really nice marinade follow this recipe you will love it if you try it
82,food,Easy Chicken Ramen Noodle Soup Recipes,"This article contains eight different recipes about how to cook chicken ramen noodle soup using several versions like thai ramen, creamy chicken ramen and miso noodle."
83,food,Make Yummy Egg Caremel Pudding And Chocolate Pudding,"Pudding is the type of dessert. The creamy, rich pudding dessert we think of today is more closely related to custard."
84,food,Basic Strawberry Smoothie Recipe,A basic healthy strawberry smoothie recipe everyone will like. Recipe video included.
85,food,How To Make Delicious Chocolate Cake,Cake is a form of sweet dessert that is typically baked. Cake is a form of sweet dessert that is typically baked
86,food,The World Top Unique Dishes In Pakistan,"With a local supply of fresh produce, mounds of spices often found spread out on market stalls, and the availability of highly experienced and skilled cooks, Pakistan is a haven of rich and flavorful foods. Pakistani cuisine is among the best in the world."
87,food,Make the Best Salad for Your Health,"When I eat a salad, it is not a side dish. Instead, it is healthy, delicious, and healthy enough to be the entire meal. It is loaded with all the recommended foods for the day. You can learn to make your own healthy salads just as I do."
88,food,Tomato Pickle Lips Smacking Recipe,"A very easy to follow lips smacking recipe for all age groups. Remains good with shelf life of one month at room temperature and for three months if refrigerated.Great aroma and great taste. Also a great appetizer. Rich in fiber and easily digestible. Good with rice, bread and in sandwiches too."
89,food,Pop Culture For Pop-Tarts,"No, there's no dog food flavor for Pop-Tarts, but there is some eye-popping pop culture surrounding the fruit ravioli!"
90,food,Easy Shrimp Appetizers Recipes For Dinner,"This article contains eleven different shrimp appetizer recipes using various ingredients like avocado, lemon, orange and honey."
91,food,Mix Vegetable Soup,Highly nutritious recipe with high fiber content. Very good for convalescents and weak persons. Easily digestible dish with a rich red color from beetroot. Its iron content facilitates blood formation. A great eat and drink dish.
92,food,Coffee Cream Pie Recipes for Dessert,This article contains seven different coffee pie recipes using baked cooking style.
93,food,Moroccan Lamb Dishes Recipes,"This article contains eight different Moroccan Lamb Recipes like how to make lamb meatballs, stew and tagine."
94,food,Chinese Chicken Pockets,"Easy Picture Explanatory recipe for yummy and delicious Chinese chicken pockets with less ingredients, a wonderful companion with your evening tea. If you are not an expert cook or you are feeling lazy ,this is the recipe for you. Hope you will like it."
95,food,How to Cook Fish and Vegetables in Cellophane Wraps.,Fish is delicious food to prepare in the oven. The vegetable can be so enjoyable when they are mixed with fish. Flavoring the food is important to favor the taste. There are no limits to picking the correct vegetables to the wrap. Harder vegetables are good for better results after cooking them.
96,food,Pickling Spice for Making Pickled Fish,The things that go into pickling spice... For great tasting pickled fish
97,food,Easy Cholocate Pies Recipes for Dessert,"This article contains eight different chocolate pie recipes with various ingredients like hazelnuts, chocolate chips cookies and coffee. It contains both vegan and non vegan chocolate pie recipes."
98,food,Make Delicious Mutton Briyani At Home,"The dish is made with a blend of aromatic spices, Basmati rice and a choice of meat: lamb, chicken or fish in a rich sauce."
99,food,Top 10 Best Salad Spinner (2022),"oxo salad spinner
oxo steel salad spinner
best salad spinner amazon
best salad spinner uk
best salad spinner 2022
best salad spinner 2021
large salad spinner
best salad spinner reddit"
100,food,Top 20 Best Mushroom Knife (2022),"opinel mushroom knife
vintage mushroom knife
mushroom knife amazon
maserin mushroom knife
where to buy mushroom knife
japanese mushroom knife
italian mushroom knife
opinel mushroom knife with brush"
101,food,The Equipment You Need for an Efficient Food Processing Plant,
102,food,Top Vegan And Non Vegan Cranberry Ice Cream Recipes,This article contains both vegan and non vegan cranberry ice cream / sorbet recipes.
103,food,"Sweet Potato, Black Bean and Goat Cheese Pastries",These sweet and savory pasties are a great meal prep breakfast to make ahead for busy days. They reheat well and freeze beautifully.
104,food,Acorn Squash - Baked and Sweet,"It's lightly sweet, tender and I think I will make twice..."
105,food,Brussels Sprouts Baked to Browned - Asian Style,"Coated, baked at high heat, then eat..."
106,food,Cherry Pepper Cobbler with Spiced Streusel,"If you are a fan of sweet and spicy pepper jelly, you are going to love this cobbler. It features juicy fresh cherries, Hungarian hot peppers, and a sweet streusel topping."
107,food,Why it Makes Sense to Return to Traditional Cookware,"Bronze, brass, cast iron, and clay cookware are no more considered as a thing of the past or previous generations. Many in our country have shown a renewed interest in traditional cookware mainly due to health reasons. Read on to understand the reasons of switch to Traditional Cookware in detail."
108,food,"National Chili Day: What Is It, Why Should You Celebrate it?","National Chili Day, which is held on the fourth Thursday in February, is devoted to the ultimate winter comfort food. This spicy dish is traditionally known as chili con carne, and it is prepared with mincemeat, beans, chili peppers, tomatoes, garlic, and onion, but many people bring their own.."
109,food,Oats Papaya Yoghurt.... a savoury summer porridge,"Oats papaya yoghurt is a simple ,easy summer breakfast satiate you in the hot weather where you want to spend less time in  kitchen .Also this savoury porridge will keep you energies for long time in your work.."
110,food,Yummy Chicken With Wine Sauce Recipes,This article contains seven different chicken main course recipes with white sauce.
111,food,French Bean and Potato Dry Vegetable - Indian Style,Dry vegetables are a delight on the dining table and this article details a dry vegetable made with french beans and potatoes and is a common dish in many parts of the globe. The Indian version with microwave cooking is presented here.
112,food,The Best Soft Keto Chocolate Chip Cookie Recipe (Only 4 Ingredients!),These are the best soft keto chocolate chip cookies I have ever made so far. These cookies ate super easy to make requiring only four ingredients! This is my original recipe (I have created it on  my own) so I am sharing it for anybody looking for a great cookie without sacrificing flavor.
113,food,Buffalo Chicken Calzone,This buffalo chicken calzone has been one of my most requested recipes - great for weeknight dinners as well as Superbowl parties.
114,food,Juicy Roasted Turkey Recipes for Dinner,"This article contains six different turkey recipes with different ingredients like oranges, lemon, wine and maple glaze."
115,food,What Is Sparkling Wine?,"Sparkling wine contains carbon dioxide, which is answerable for the air pockets in the item. Typically portrayed as fresh and invigorating, these wines are known for their dry organic product tastes of apple, pear, and citrus."
116,food,No Bake Coconut Carrot Cookies,This guilt free sweet treat is sure to please!
117,food,Apples with a Hodge Podge Crust,"It's not a pie, it's not a crisp, but it is a mess.."
118,food,Banana Juice or Banana Puree for 6 to 24 Month Babies,Bananas are excellent source of nutritions. Great first food for babies. Provides instatnt energy for growing babies.
119,food,Lemon Pepper: All You Need to Know,Interesting facts about this spice that is found in many kitchens.
120,food,Five Classic Beef Stew Recipes For Winter,This article contains five beef stew recipes with different cooking styles.
121,food,Sausage - Farmer or Ring Cooked to Yummy Perfection,"This meat is uncooked, in a casing, like a round hotdog..."
122,food,Top 10 Muscle Building Foods,food that helps you to build muscle
