,category,header,contents
276,food,Cultivating Coffee Beans,
277,food,How Is Chocolate Made?,"The last 100 years western Europe and the United States are by far the world's largest consumers of chocolate and cocoa. Tropical countries where the entire supply of cocoa beans is grown, consume very little of the finished product, owing to the difficulty of preserving chocolate in a hot climate."
278,food,Why Is Coffee so Amazing?,
279,food,Where Does Coffee Come From?,
280,food,Coffee Roasting and Grinding,
281,food,Facts About Coffee,
282,food,Cornbread: The Universal Table Dish,Everyone loves cornbread.
283,food,CREAMY POTATO CROQUETTES,
284,food,4 Different Types of Equipment That Are Essential to Have On the Farm,
285,food,Traditional Indian Sweets For Festivals: Thekua or Khajur Recipe,"The traditional Indian food and culture is influenced by many factors, such as the region, season, and festivals. The traditional Indian recipes are rich in aroma and taste. Traditional recipes must be passed on to the next generations, as they have been passed on to us, by our mothers, grandmothers"
286,food,"Pineapple – Healthy, Nutritious & Delicious!",The pineapple is a tropical fruit that has a range of significant health benefits. Learn why pineapples are such a healthy and nutritious fruit.
287,food,Medicated Margarita - Apple Cider,A medicated twist on fall flavor!
288,food,How to start a Food Truck Business,"The information contained here is very concise and is the result of lots of research and personal experience. We discuss choosing the right vehicle, customising the interior, planning the menu, food storage, hygiene, pricing and trading suggestions."
289,food,The Shocking Truths About Italian Food Explained by an Italian,"Italian food is loved in every part of the world, still there are many things you should be aware of when you are planning to go eat Italian somewhere or even on a trip to Italy."
290,food,EASY CHEESY CHICKEN DOUGHNUTS RECIPE,
291,food,"VERY HEALTHY, TASTY & EASY SALAD RECIPE",
292,food,NO SUGAR NO MILK NO CREAM 5 MINS ICE CREAM RECIPE,
293,food,'Why Is Bubble Tea Expensive?' & Other Trivial Facts Explained by a Bubble Tea Shop Manager,"Bubble tea is one of the most popular and trendy beverages of the last years. Still, many things are unclear about this funny and delicious drink. This article is going to answer some popular questions about bubble tea, from the point of view of the owner of a bubble tea shop."
294,food,Nettle Beer Recipe,Nettle beer is a great homebrew for those who are just starting off with homebrew
295,food,No Kneading No Rollling Tasty Pizza Recipe,
296,food,Peanut Butter Oreo Stacks Recipe,"Now somewhere inside me, there is that child that wants to divulge on cookies, cakes, brownies and cupcakes. So..  I’d seen a recipe for some cookie/brownie things and I thought it was genius. Of course, it wasn’t my favourite cookies and didn’t contain peanut butter."
297,food,No Flour No Sugar Chocolate Cake in 5 Mins,
298,food,Lemon Grass - Chopping and Storing for Later Use,Lemon grass is used for its lemon flavor...
299,food,Healthy Diet Low Calorie Breakfast Snack Biscuits,Are you in need for healthy biscuits as a snack or for breakfast? This foolproof recipe is what you need to eat delicious biscuits soon!
300,food,Oats Almond Dates Coconut Milk Cake,"I craved for a piece of cake but wanted to eat healthy too!!. Then an idea struck, why not make the cake healthy?! So then I researched on ideas to bake a cake with oats and almond flour. That lead to me creating this unique recipe. Read on and make this yumminess!!"
301,food,Chicken Dum Biryani Recipe In English/Urdu,"Today I brought you a very easy recipe of Chicken Dum Biryani. This is the traditional food of Pakistan, India etc. I hope you enjoy it."
302,food,How to Make Flourless Chocolate Oreo Cheesecake,Are you the type of person who always finds room for dessert after every meal? I personally have trouble resisting an offer for dessert especially if it is chocolate cheesecake. Here is a recipe that will give you a luxuriously smooth and dense cake. Give it a try and thank me later!
303,food,Ways to Make Great Tasting Coffee at Home,
304,food,Rice Flour - Fine Cut Rice,It's almost easier to just buy rice flour...
305,food,Cooking Green With Kids for Health and Our Environment in Eco-Friendly Cookbook,Cooking is a wonderful activity for kids to engage in.  Simple recipes that are healthy for kids' bodies and healthy for the environment are creative and tasty.  Cooking green gets kids interested in new foods and ways to care for our environment.  Get your young chef into the kitchen to cook green.
306,food,Jason Arnold’s List of Missouri’s Best Wineries,"Missouri was once the third-largest producing wine region in the world. Today, it's making a comeback attracting visitors from all over. When you visit, what are the must-visit wineries producing the regions finest wines?"
307,food,Missouri Wine Tasting For Beginners,"Missouri offers unique wine varietals to experience, but how does one approach a wine tasting? What grapes are grown in Missouri? This is an introduction to wine tastings in an often-overlooked region."
308,food,Classic Vanilla Cake,Every time I see a classic Vanilla Cake I think about how my grandmother used to bake them. Are you looking for a simple & fast recipe to bake a delicious vanilla cake? Keep reading and eat one in no time!
309,food,Foolproof Delicious Chocolate Biscuits,Are you craving delicious chocolate biscuits but you don't want to spend hours in the kitchen? These foolproof cookies are super easy to make & finger licking good!
310,food,Black Walnuts - Picking the Nutmeats,Nutmeats from black walnuts have to be picked out...
311,food,Bread - Quick Thawing Frozen (Seasonal) Bread,"Cranberry rice bread is seasonal, so we freeze it for eating later, so here's how I thaw it..."
312,food,Shortcut to Making Tasty Low-calorie Pizza Using Indian Flat Bread,"Pizzas are truly the best party foods that are great for sharing and also a pretty good movie time munchie. However, pizzas have a lot of empty calories contributed by the dough alone. So, here is an easy ‘lazy man’ method to a low-calorie pizza for your next Netflix binge."
313,food,Egg - Poached in Water,"Salt, water, egg. Simmer 4 minutes..."
314,food,Reuben Balls - Deep Fried,"Reuben: sauerkraut, corned beef, Swiss cheese, thousand island dressing, but deep fried..."
315,food,Sweet Bell Peppers - Deep Fried,"These are cooked like onion rings, but, with one subtle difference... they are peppers."
316,food,National Coffee Day,"Coffee has quickly become one of the most popular drinks in the world, even as the second most traded commodity in the world after crude oil."
317,food,Gluten Free Chicken Stew - Fast!,"Delicious, quick and healthy! Totally gluten free stew on the stove!"
318,food,Best Frozen Foods-Brands Made Easy,Are you looking for great tasting frozen foods that is easy to prepare? Here are the best frozen food options to try and devour.
319,food,Key Lime Bars with Graham Cracker Crust,"Key limes are different than limes, but don't ask me the difference..."
320,food,How to Boil Peanuts Without Shell,Try my easy method of boiling raw peanuts without shells in a pressure cooker to a crunchy texture. Recipe video included.
321,food,Nutritional Cooking,"Nutritional cooking is a cooking style that uses only foods and ingredients that are healthy, whole, and natural. Nutritional cooking is based on eating foods that are nutrient-dense but have no added unhealthy fats or harmful ingredients."
322,food,The Delightful History of Lobsters,"The story of how the ubiquitous lobster once called with disdain as the “cockroach of the ocean” went from a poor man’s food to an expensive, gourmet delicacy."
323,food,Pineapple Banana Iced Dessert for those Hot Days,"What a wonderful Iced Dessert for a balmy day sharing with friends, around the pool, or at your holiday cottage at the seaside."
324,food,Easy Potato Bake With Bacon and Cheese,Such a no fuss recipe that can be served with a fresh garden salad or sliced tomato on the side.
325,food,Vanilla Syrup Recipe for Starbucks Coffee Recipes,Here is a simple vanilla syrup recipe for Starbucks coffee recipes.
326,food,Best Coffee Spots in Dubai for All Your Caffeine Fixes:,"On the lookout for a caffeine hit but are tired of trying the same old Starbucks, Costa, and Tim Hortons?"
327,food,Black Tea Recipe,Black tea is a simple to prepare healthy tea. Recipe video included.
328,food,Peach Crisp - Nom de Nom Nom,"It came about one day. We had peaches in the refrigerator, and hubby asked if they could be cooked somehow..."
329,food,Gluten Free: Chicken Lasagne From Scratch!,"A delicious easy-to-cook, healthy economical meal."
330,food,Review of Farmers Fridge,"Much like everyone else during the pandemic, I decided to try some at home meal delivery services. Hello Fresh, Goldbelly, and Farmers Fridge we’re just a few that I’ve decided to try. If you have thought about getting a meal delivery service but are on the fence about it, this article may help."
331,food,How to Make Tasty and Creamy Nasi Lemak at Home,"In conjunction with Malaysia Day last week, my wife and mother-in-law decided to make a special dish to commemorate the day. We had a hearty serving of ‘nasi lemak’ that was packed with flavors and interestingly well-complimenting textures. Here is the recipe if you want to give it a try!"
332,food,Protein Oatmeal With Fruit,"This breakfast is both sweet and satisfying while being fairly good for you. It has protein packed ingredients; the oats will keep you feeling full and if you have a sweet tooth, both those chocolate squares and pieces of fruit will have you feeling like you're eating dessert instead of breakfast!"
333,food,Rich and Nourishing Cookies,"The recipe of the cookies I am about to share comes from Surat, a city in the state of Gujarat, India. These cookies have a very diversified rich history as they have some Dutch, Persian and Indian origins and hence the exotic, rich flavorful taste."
334,food,Telangana’s most popular tribal carnival,"Festivals and religious gatherings with a huge number of people are common in India. However, huge festivals with no Vedic or Brahminic influences, not so much. This is what sets the Sammakka Saralmma Jatra apart."
335,food,How to Make Chicken Kabuli Palao,
336,food,Jalapenos - Filled then Grilled,Filled with a mixture of cheeses and sausage...then grilled.
337,food,Tamales - Steamed Stuffed Corn Dumplings,"Delicious, firm, filled..."
338,food,You Have to Try These Delicious Oat Brownies!,"Love brownies but would love a healthier option? These delicious oat brownies are for you, then! Oat flour is a great alternative to plain, wheat flour. This is an easy recipe you can make in no time at all. Enjoy!"
339,food,The Authentic Spanish Tortilla Recipe: Easy and Delicious!,"A traditional Spanish omelette is actually really easy to make and you only need three ingredients: potatoes, eggs and vegetable oil. Are you ready to break some eggs? Then take a look at my recipe! I promise you'll love it!"
340,food,Empanada - Making with Dinner Roll Dough,"A filled, deep fried dinner roll..."
341,food,Baked Southern Style Mac n' Cheese (With Egg),Here's how to make an old-fashioned baked mac n' cheese for the ultimate Southern comfort food.
342,food,Classic Chocolate Cake,"This classic chocolate cake is moist, tender and rich. The cake melts on your mouth with soft ganache slathered on the layers."
343,food,Fluffy Sunday Coffee Cake,"This versatile cake works with a range of fruits. Tart berries and crunchy, spicy nut topping interplay for a sublime duo."
344,food,Peach-Almond Cake,"Try this delectable all-round coffee cake at home. This cake is perfect for breakfast, mid-afternoon or as a dessert."
345,food,Moist Swiss Carrot Cake,Swiss carrot cake is a delicious dessert anyone can make at home. This article will teach you to bake Swiss carrot cake. No more buying expensive desserts. Try this recipe.
346,food,Carrot Cake: Simple Steps to Bake Carrot Cake,Enjoy cooking this carrot cake which is full of nutritious ingredients. Nothing beats this cake and the ingredients are easily available. This week cannot end without trying carrot cake.
347,food,5 Popular Igbo Soup Recipes,"Preparing a sumptuous soup is a necessity, expected to be done effectively. In Igbo Land the most popular soups are Egwusi, onugbu, ofe-akwu, ogbono, and nsala soup. Each of our festival or occasion has a specific soup made for it."
348,food,Bloomin' Onions - Deep Fried and Delicious,"Sliced, coated, deep fried...."
349,food,Pecan Pie with Tuaca Brandy,"Pecan pie, nutty, caramel, need I say more..."
350,food,Kebabs - a Sharp Stick and Some Variety Food,"Skewers with veggies, fruit and meat, marinated for an hour or so, then grilled..."
351,food,Recipe of Stuffed Capsicums - Microwave Version,Stuffed dry vegetables are a favourite worldwide and people relish them in various forms. This article is about the recipe of stuffed capsicums which is quite common in the Indian peninsula but can be relished in other parts of the globe also.
352,food,Easy to Make Vegan-Friendly Crunchy Tofu Bombs for Healthy Snacking,Are you looking for a simple healthy snack to satisfy your cravings? Most fast food and snacks seems far too unhealthy with loads of preservatives and additives. Why not indulge on something simple yet nutritious like this vegan-friendly tofu bombs and munch away without the guilt.
353,food,How to Sprout Moong (Mung Beans) and Matki (Moth Beans),Here is an easy way to sprout sabut moong/mung beans and matki/moth beans at home. Recipe video included.
354,food,Autumn With Fig Jam,"Jam-making is fun. It needs a lot of care to prepare and preserve the jam well. Fig Jam is something everyone enjoys due to its unique flavor. So today, allow me to teach you how to make my favorite fig jam with my special recipe."
355,food,Saunf (Fennel Seed) Water Recipe,"Natural home remedy for abdominal discomfort due to indigestion, gas and bloating, detox and weight loss. Recipe video included."
356,food,Rasmalai Sweets Recipe,
357,food,Heart-Winning BBQ Chicken Cheese Loaded Lasagna Recipe.,"Lasagna was originated in Italy. The lasagna I'm at found to be delicious enjoyable food for many, containing pasta sheets, heavy cheese, savory tomato sauce, and several vegetables or meats."
358,food,These New Vegan Snack Cheese Wedges Taste Exactly Like Laughing Cow,GOOD PLANeT Foods recently launched their first vegan cheese wedges. They beat the owners of Laughing Cow Cheese to it by creating these snacking cheese wedges that taste exactly like Laughing Cow.
359,food,Great Information About Mushrooms,"Either people will love mushrooms or they will hate them. Then there are people in between who know nothing about mushrooms and stay clear of them. If you are in that last group, give mushrooms a try and discover why you should eat them every chance you get."
360,food,Yummy Potato Pie You'll Never Regret,You need to try this easy potato pie
361,food,How to Prepare Pani Puri at Home?,I love to share easy recipes and connect with my readers through this medium.
362,food,How to Make Instant Jalebi at Home?,I love to share easy recipes and connect with my readers through this medium.
363,food,The Taste of India - Culinary Arts,India is a country that spreads over 3.28 million km² with a population of 139.70 crores. The Indian constitution recognizes 22 major languages and 29 states with different cultures.
364,food,Delicious Stuffed Buns,Easy home-made stuffed buns
365,food,Marble Cake Easy Recipe Fast Foolproof Dessert Snack Birthday,Do you remember the marble cake from your childhood like me? Here is a super easy recipe so you can create a delicious marble cake for your friends & family. Let me know what you think in the comments and don't forget to follow me to stay tuned.
366,food,"Country Foods Can Be Intrepid as Manna, Food of the Angels","Best get your fork, spoon, and appetite along."
367,food,10 Unordinary Pizza Toppings,Wacky and wonderful pizzas around the world might blow your mind or get your taste buds tingling. Explore some crazy pizza toppings from comforting macaroni and cheese to creepy and crunchy cicada topped pizza.
368,food,Foolproof Easy Recipe Vegan Light Cupcakes Muffins Perfect Breakfast Snack,Are you looking for a vegan & healthy snack for those snacking moods? These cupcakes are super easy to make and delicious. You can eat them after 6 simple steps that shouldn't take more then 30 minutes. Enjoy and let me know if you love them in the comments!
369,food,How to Improve Your Coffee Experience at Home - 5 Tips for Better Coffee,"If you are following any coffee professionals, coffee enthusiasts or cafes in any somek channel, then you have probably noticed that you can use some kind of aids and gadgets to make coffee nowadays. In many cases, these widgets can be very valuable. Maybe you've been bitten by a little hi-fi fly?"
370,food,"6 Tips for Better Coffee - a Filter Bag Tip to Help: “significantly Affects the Taste""!","Finns would always think that coffee brewing is in their possession, because they are the nation consuming the most coffee in the world. But no - they drink bad coffee."
371,food,"Edible Bird's Nest, Bird's Nest Soup, Bird's Nest Drink: What's the Difference? A Review","This article highlights bird’s nest benefits, its nutritional values, what to look for when buying ready to drink bird’s nest, their differences, and FAQs"
372,food,Bengal gram & Yam kabab(chana dal & suran ki Tikki),"It's a vegan and Gluten-free starter,made with Bengal gram and Yam, very delicious and nutritious."
373,food,"Simple, Savory, and Refreshing Peanut Butter Cold Noodles",Are you tired of ordering in but find yourself running out of ideas on what to prepare for your meals? The idea of enjoying home-cooked food seems appealing yet you hate spending hours in the kitchen making complicated meals? Here is one simple and wholesome dish that you might want to give a try.
374,food,Delicious chicken paratha Roll recipe,
375,food,Donuts - Deep Fried and Sugar Coated,"Fried then shaken in a bag of sugar and spices...cinnamon, nutmeg and ginger, oh, and some coated with powdered sugar too."
376,food,Easy Victoria Sandwich Cake Recipe,"Everybody knows the world famous Victoria Sandwich Cake. It's the typical cake to eat with the tea in a Sunday afternoon, and it's surprisingly easy to make! Can't wait to start baking? Follow my recipe here and enjoy in no time from this delicious sponge cake."
377,food,"Thank God for Cold Foods, and Mom",God bless my mother for feeding me.
378,food,Home Made Jackfruit / Kathal Biryani Recipe,Kathal or Jack fruit biryani is a specialty from Awadhi Cuisine. It is slightly spiced and delicately flavored vegetarian biryani.
379,food,Monster Combo Choco-Ore Milk Shake.,I think lots of us love to eat chocolate that's why we can see it in lots of sweets and desserts. Chocolate milkshake is the easy and delish recipe I ever had. This drink is very energetic and chocolate has a good effect on the body but one should be more careful if they have some health issues.
380,food,Rotis for Road Trips,"From the basket of Indian foods, rotis (Indian bread) is one such food item that is easy to prepare and pack for road trips. Homemade rotis are healthy, yummy and paired with different durable side dishes. Let us see 15 rotis from different Indian regional cuisines."
381,food,Italian lasagna,
382,food,"Health Drink Biogreen Pink Lady and Perfect Pink Lady Oat Milk Drink, Which is Better? A Review",Biogreen Pink Lady and Perfect Pink Lady Collagen Oatmilk drinks are nutritious and full of health benefits. Which health drink is tastier and a better buy?
383,food,Creamed Cucumber Chip Dip,"Creamed cucumbers, a chopper, potato chips..."
384,food,Creamy Burnt Cheesecake,A delightful super creamy cheesecake
385,food,4 Easy Strawberry Milk Shake Recipes You Should Try at Home,This article shares with you four different types of strawberry recipes. Your milkshake will never be boring again.
386,food,Delicious and Moist Fruit Cake Recipe,"Christmas and other family gatherings are not complete without a fruit cake. Thie article shares a simple fruit cake recipe that should be tried during Christmas, weddings or other family gatherings. Create a memory for your family by baking a fruit cake."
387,food,Ideas for Picnics in the Park or in the Country,Everyone loves a picnic. Here are some delicious ideas to pack into your picnic basket.
388,food,Diabetes Friendly Smoothie Recipe,"The epidemic of type 2 diabetes is plaguing the modern world due to the prevalence of highly processed, low nutrient foods. As a diabetic, I have reversed the disease by incorporating smoothies into my whole food based diet. Please consider including low sugar smoothies into your diet."
389,food,Do Restaurants Allow Someone to Wash Dishes as Compensation If They Cannot Pay?,Payback!
390,food,Plum Jelly from Windfall Fruit,"Pinkish, purple fruit on the grass. Firm, yet ripe... like pennies from Heaven."
391,food,Okra - Grilled and Slime Reduced,"Supposedly, soaking the okra in vinegar will reduce the slimy quality when you cook it..."
392,food,7 Delicious and Refreshing Lemonade Drink Recipe,Lemons are among the healthiest fruit in the world. Every serving of food should at least include a piece of lemon. It helps burn body fats and increase alkalinity in the body. This article shares with you ways of preparing a lemonade drink for every time meal.
393,food,When and Why Do We Drink Coffee?,"Coffee is the second most popular beverage in the world, behind only water. It's not just a pick-me-up, as many people think."
394,food,Salted Egg Recipe: Spicy Salted Egg Cornflakes,"The addictive spicy salted egg cornflake recipe — corn flake cereals buttered with salted egg powder, curry leaves and chili, a delicious recipe with photos to guide you"
395,food,"You Best Beware ""Food Wasters""",There's wasting food and people who waste.
396,food,5 Types of Healthy Juices You Must Try at Home,"Peanut is among the most nutritious nuts in the world. It can be consumed roasted or boiled, but one thing for sure is that most people love peanuts. This article is about making healthy juices using locally available fruits and peanuts. Please try the recipe at home it is healthy."
397,food,6 Unique Dals of Rayalaseema Cuisine,This article presents about 6 unique and ancient Dals of Rayalaseema cuisine. Let's see which dals of this regional cuisine are unique and why they are unique...
398,food,Salsa - a Five Minute Mrs. Wages Mix,"Tomatoes, Mrs. Wages salsa mix...."
399,food,"Killer Crispy, Hot, and Spicy Mayo Garlic Fries.","I think everyone on the planet love to eat French fries. French fries are a very nutritious and yummy snack serving with burgers, rolls, or any other fast food all across the world. By some addition to your fries can make your snack more delicious and yummy so can enjoy it a lot and share happiness."
400,food,Reasons Why I Love Coffee,Coffee is no doubt one of the most cherished and loved drink worldwide by so many people and of course who can blame them when there are a number of reasons to love this classical drink.
401,food,Moist Red Velvet Cake Recipe,This article is about baking a tasty Red Velvet cake. Red velvet cake can be consumed any time of the day and occasions. It is great for kids and adults. Try this recipe and your loved ones will like it.
402,food,Heart Healthy Smoothie Recipe,"Many adults are destroying their health at the dinner table.  Hippocrates said, ""Let food be thy medicine, and let medicine be thy food.”  This recipe will help people suffering with heart problems to become healthier and lead more productive lives."
403,food,Okra - Deep Fried and Delicious,"Okra. Known as gumbo in soup, has a dark side... Yes. Browned in a deep fryer."
404,food,Pizza - Mini Crusts Made with Dinner Roll Dough,"Dinner roll dough, smooshed flat. Marinara sauce, cheese. Broiler..."
405,food,Jalapenos - Pickled and Potent,"Sliced jalapenos, minus seeds.. brine leftovers, citric acid and alum..."
406,food,Kadi Patta Chai (Curry Leaf Tea) Recipe,"Kadhi patta or curry leaves do not only make the food tastier they offer a wide range of amazing health benefits as well, whether you make a tea, decoction, drink its water or use them in cooking. Recipe video included"
407,food,Food Saver Food Bagging System,It's easy to freeze extra food in food saver bags...
408,food,Popcorn - Made with Coconut Oil,Coconut oil works to make popcorn...
409,food,Tribal Food- Let us Discover Health Secrets of Tribals of India through their Food Habits,"Indigenous, native or aboriginal are synonyms used to define people, animals or plants living or growing in the place where they are from originally. Every culture recognized in the world today is governed by its social interaction, language, values, customs, gender roles and dietary practices."
410,food,Calories in Vs Calories out: Is It Really That Simple?,"If there is one industry that's caused more confusion, misunderstanding, and wasted money, it must be the fitness industry. Every article we read online, screams at you with the ""latest proven research"" that's guaranteed to get you results (like always). This article aims to set the record straight."
411,food,Green Beans - Preparing for Cooking,Trim both ends from green bean. That's it....
412,food,Bemba cuisine,"Zambia has a human history dating back at least 25,000 years. Home to some of the earliest humans, this part of Africa has cradled humanity into today’s species. Ever since humans have been around, sustenance has been vital. Food and cuisine have significantly evolved over the many millennia since,"
