,category,header,content
0,food,Plant Selection Tips for Your Garden,
1,food,Chocolate Peanut Butter Smoothie,
2,food,What I discovered speaking at TEDx,
3,food,Reflections on Our Voyage,
4,food,"When You Drink, Does Your Nutrition Go out the Window?",
5,food,The Top 10 Reasons to Visit Spain Rather Than Portugal,
6,food,Marshmallows and Me: Revisiting My Grandma’s Recipes,
7,food,"6 Underrated Reasons to Visit Estepona, Spain",
8,food,"Sugar, Caffeine, and Informed Consent at Panera Bread",
9,food,4 Simple Life Habits a Scandinavian Like Myself Find Great Joy In,
10,food,What Is French-Style Yogurt?,
11,food,5 of the Most Adulterated or Mislabeled Foods in Your Kitchen,
12,food,7 Reasons to Visit Sri Lanka’s Incredible Unawatuna Beach,
13,food,Collective Channeled Message — 5/12/2022 —,
14,food,Why Do Hotels Put Chocolate On Your Pillow?,
15,food,50 One-Sentence Tips to Help You Eat Healthier,
16,food,Gatorade trademark applications hint at joining the metaverse : Free Crypto Coins Tips,
17,food,How We Can End Up Overfeeding And Developing Fatty Livers — And The Underlying Factors At Play.,
18,food,"I Haven’t Eaten In Two Days, And I’m Not Hungry",
19,food,"More Antioxidants, Less Dementia?",
20,food,Ristorante della Fontana’s minestrone,
21,food,10 Facts About Fiber You May Not Know,
22,food,Why I Won’t Join the Slow Food Movement,
23,food,Chocolate Chip Banana Bread,
24,food,Eat One of These Powerful Fruits Every Day to Bring Spectacular Health Benefits,
25,food,The Relationship Between Food and Mental Health,
26,food,10+ Tips to Successfully Mulch Your Vegetable Garden,
27,food,I Tried Counting Calories for Two Months,
28,food,Food That You Need To Cook Now — 210,
29,food,What To Eat To Loose Weight,
30,food,Foods that affect better well-being? Every single one! But these foods in particular.,
31,food,"Dharam Mentor interaction with Manuel Fantin, International Trade Adviser, UK Gov. , Aahar 2022, Part_1",
32,food,Can a vegetarian navigate the milky way (of cheese)?,
33,food,Consume All the Calories,
34,food,"Dharam Mentor interaction with HyFun Foods, Aahar 2022 New Delhi, India",
35,food,How Being Boring and Lazy can Help You Lose Weight,
36,food,Improve Your Digestive Health by Adding this One Nut Into Your Diet,
37,food,What Drives The Price Differences Of 18/10 Stainless Steel Cookware Brands?,
38,food,Getting Rid of Your Weight-Loss Dreams,
39,food,SESAME + TAMARIND EGGPLANTS WITH CRACKED WHEAT,
40,food,You like the pain of sparkling water!,
41,food,5 straightforward guidelines for good-enough nourishment,
42,food,“Julia” Season 1: HBO Max Series Review,
43,food,You’ll Love Growing Sweet Cucumbers in Pots.,
44,food,Not All Fruits Taste Good,
45,food,We Love to Forage for Borage,
46,food,"What led to Sri Lanka’s economic crisis, and who is helping?",
47,food,Secret Foods Successful People Eat for Breakfast,
48,food,Cauliflower Salad Is a Prominent Picnic Pleaser,
49,food,Dim Sum Yum: The Chinese Egg Tart,
50,food,How Do You Increase the Yield of Hydroponic Potatoes?,
51,food,"Help To Feed The Poor, Homeless And Orphan Kids.",
52,food,Soul Food Is Killing African-Americans,
53,food,Global Report on Food Crisis — Severe Food Insecurity,
54,food,7 Best Snacks for the Workplace,
55,food,Restaurant Review : Entire French Dining,
56,food,Your Perfect Pairing,
57,food,Let’s Ignore What Happened,
58,food,Review: Starlight Coca-Cola Tastes Like Cotton Candy Mixed With Ass,
59,food,AI & ML in Food Industry,
60,food,Tomato And Rice Soup,
61,food,Bourdain Still Matters,
62,food,Weight Loss,
63,food,The Wonderful World of Completely Random Facts — Issue 45,
64,food,I Don’t Eat Shit That Farts,
65,food,The Commons Coffee House Review,
66,food,加州生活 |UCLA Restaurants Fastfood,
67,food,Review: Nitro Draft Pepsi Is Like Sub-Par Flat Normal Pepsi,
68,food,My Review — Health Delights Cafe’s “Tickle Me” Smoothie,
69,food,Do These 5 Things Before 8 a.m. To Perform at Your Best,
70,food,The Lazy Cook’s Tamarind Pork,
71,food,Why Someone Left a McDonald’s French Fries in the Toilet for 63 Years,
72,food,Abandoned a Blissful Wellness Routine? 3 Ways Spring Is the Perfect Time to Restore It (Part 1 of 3),
73,food,Recipe for Kale,
74,food,Food That You Need To Cook Now — 207,
75,food,COAL-SMOKED EGGPLANT CURRY,
76,food,Food Nostalgia-Part 2,
77,food,What are the two foods that the longest living person in the world indulges in?,
78,food,This Kind of Fat You Have Can Determine Your Chance Of Developing Diabetes,
79,food,PowerUp Podcast Ep5 with BodyweightBane,
80,food,How to Overcome Seasonal Allergies Without Taking any Medication,
81,food,Individual Grouper,
82,food,My collision with Indian cuisine,
83,food,Chocolate caramel brownie trifle,
84,food,New Fast Food Horrors,
85,food,The Keto Diet Is Neither Expensive Nor Hard to Maintain,
86,food,It’s A Cheesy Day,
87,food,I Can’t Eat My Deep Dish Pizza Because They Found Fossils In It,
88,food,Find Out Why People Are Loving This Probiotic For Healthy Digestion* : Health IKnow,
89,food,"The Truth about Fats, Sugars and Salts",
90,food,Lisbon: A (VERY) Quick Backpacker Guide With Not-So-Obvious Stuff,
91,food,Food That You Need To Cook Now — 206,
92,food,Putin’s invasion of Ukraine is causing a worldwide food crisis,
93,food,Story of Startbucks Gift Card Business — It’s wild!,
94,food,The Ideal Time To Eat Breakfast If You Want to Lose Weight,
95,food,6 Mistakes When Making Pesto And A Classic Recipe,
96,food,Does “Vegan” Food Taste as Good as “100% Plant-Based” Food? Apparently Not.,
97,food,Innovative Style Biryani,
98,food,The Bistroo Breakdown : Monthly Progress Report — April 2022,
