,category,header,content
0,food,What Happens If You Eat Tomatoes Every Day,
1,food,Can You Improve Your Heart with Vitamin K?,
2,food,The Green Door And Roadside Chow Mein,
3,food,Borshch is not soup,
4,food,I Can’t Exercise. Here’s What I Eat in a Day to Stay Healthy and Stave Off Weight Gain,
5,food,Top 6 Sources of Vitamin K,
6,food,Walmart Pulls Juneteenth Ice Cream To Celebrate Emancipation Amid the Social Media Backlash,
7,food,Creating Diversity on Your Plate,
8,food,How Controversial Dietary Guidelines Are Skewed By Conflicts Of Interest,
9,food,"Eight Days in CDMX; or, More Walking Means You Get to Eat More, That’s Just Science Bro",
10,food,A Remote Inuit Town Reveals The True Problem With the Food Industry,
11,food,Way Too Many Dishes for Eating Leftovers!,
12,food,Please support to feed the poor.,
13,food,Corn Flakes’ Surprising Origin,
14,food,The Feast,
15,food,Daily Habits That Could Destroy Your Stomach,
16,food,Land Tenure Rights are at the Heart of Fighting Hunger and Transforming Food Systems,
17,food,Unbungling Your Poorly Planned BBQ,
18,food,The Best Afternoon Snack,
19,food,4 Easy Health Guidelines Taken from the 3 Best Diets of 2022: Part I,
20,food,This Makes Writing On Medium Easy As Slurping Noodles,
21,food,Hunger as a Weapon — Vladimir Putin’s Underestimated Advantage Over the West.,
22,food,Healthy properties of sage and recipes for delicious dishes,
23,food,Why Bees Are So Important,
24,food,I Hate Diets but I’ll Try It,
25,food,How Would You Like A Big Mac Every Day for Fifty Years?,
26,food,TOMATO + CHICKPEA SALAD WITH A LIME TARKA,
27,food,Next: Sustainable Food Ventures,
28,food,Fantastical Ferns,
29,food,How to Cut Your Risk of Dementia Naturally,
30,food,I went back to the Food Industry,
31,food,I Broke My 680 Day MFP Streak for 7 Days,
32,food,13 Best Spaghetti Sauce Philippines 2022 (w/ Free Discount),
33,food,Burger King Is Entering Into The Royalty Empire,
34,food,There’s More to Chicago Pizza Than Deep-Dish,
35,food,13 Best Wasabi Philippines 2022 (w/ Free Discount),
36,food,13 Best BBQ Sauce Philippines 2022 (w/ Free Discount),
37,food,Did You Know Your Gut Health Can Help Influence Your Cholesterol Levels?,
38,food,Health Disadvantages of Taking Cake Rusk in Breakfast,
39,food,Homemade Blackberry Creamsicles,
40,food,Rainbow Ices,
41,food,We’re going to starve,
42,food,We’re Having Hasenpfeffer,
43,food,A Honeymoon We Will Never Forget!,
44,food,"Men, Meat, and the Marketing of Manhood",
45,food,4 Foods to Dip in Homemade Ranch Dressing,
46,food,3 Unsuspecting Signs It’s Time to Alter Your Diet,
47,food,This Cleanser Made My Skin Unbelievably Soft — Here&#x27;s How To Use It : Health IKnow,
48,food,One Thing You Can Start Doing at Home for Better Health,
49,food,The Omnivore,
50,food,Conscious Eating,
51,food,I Found A Taste Of Home,
52,food,Taco Bell’s Mexican Pizza Review,
53,food,Job’s Tears,
54,food,Commodity Report #52,
55,food,Sugar or Your Life,
56,food,Street Hawker Review : Brickfields Char Kuey Teow,
57,food,19 Everyday Items in My Kitchen That I Had Never Heard of While Growing Up in the ’70s & ’80s,
58,food,Canine Nutrition — Just Life Trends,
59,food,The Grieving Room,
60,food,What Did Babies Eat Before Modern Formula?,
61,food,Anda-Ghotala for Egg Lovers,
62,food,Restaurants Raising Their Prices And Not Updating The Menu,
63,food,"Believe it or not nutrition plays a big role in a persons overall health, surprise.",
64,food,The Day We Got Free Italian Ice Cream In Zürich,
65,food,"HOT GREEN BEAN, CASHEW, + COCONUT SALAD",
66,food,Additives: Beneficial Or Disturbing?,
67,food,Tofu Me for the Summer,
68,food,"The Mill; or, What We Have Lost",
69,food,Lose weight without eating a single thing,
70,food,Their Democracy Sausage Wasn’t Up To Scratch,
71,food,Sweets vs. Desserts,
72,food,The Magic World Of Vitamins,
73,food,4 Unhealthy worst foods to avoid: A detailed study,
74,food,加州生活 | UCLA Restaurants Century City,
75,food,Top 5 breakfast ideas to spice up your mornings!,
76,food,13 Best Chicken Gizzard Philippines 2022 (w/ Free Discount),
77,food,Unlock the secrets of intermittent fasting,
78,food,"Drunkorexia… Yes, It’s A Real Thing",
79,food,"Yellowstone National Park in the Winter — eating out — Big Sky, Montana",
80,food,13 Best Pork Siomai Philippines 2022 (w/ Free Discount),
81,food,Night Market Review : Taman Connaught Night Market,
82,food,Stepping Up to Prevent a Global Famine,
83,food,Snow Day Chili,
84,food,Three Superpowers of Networks,
85,food,My weight loss journey part 3 — I’m down 16 pounds,
86,food,5 Types of Restaurant Ownership Structures,
87,food,Win dull who?,
88,food,"Drama, Beauty, Käsespätzle and Love",
89,food,Foods That Lower Cholesterol Fast,
90,food,Responsible Hunting 101 — Eat What You Kill,
91,food,The Breakfast That Keeps Me Full And Happy For Hours,
92,food,7:30,
93,food,Grubhub’s Disastrous New York Promo is About More Than Just Bad Marketing,
94,food,How to pick the right cooking method for better nutritional benefit,
95,food,Build and Repair Muscle by Eating This One Thing Straight After Training,
96,food,13 Best Chicken Liver Philippines 2022 (w/ Free Discount),
97,food,"5 Days of No Added Sugar, Intermittent Fasting, and Exercise",
98,food,"Things that deserve more than a tweet, 5/20/22",
99,food,5 Foods to Relieve Constipation,
