,category,header,content
0,politics,Dead Russian Soldiers Are Stacking Up In Ukraine — With Nowhere To Go,
1,politics,The kids are not ok,
2,politics,This Is the Age Humanity Faces Its Greatest Test. Itself.,
3,politics,Matthew Dowd has a counterintuitive formula for Democrats to win the 2022 election.,
4,politics,"The Age of Cataclysm, II",
5,politics,My Time at the Alma Matter Society.,
6,politics,Putin was frustrated in both battlefield and love field,
7,politics,"Good Men and Women Are Doing Nothing, and It Shows",
8,politics,Why The Gender Binary is Impossible,
9,politics,Why “Defund the Police” Got Bad Press But “Defunding Public Schools” Didn’t,
10,politics,Capitalism is Killing Democracy,
11,politics,Climate Change is Probably Far Worse Than We Think,
12,politics,The Abortion Ban Is About Much More Than Just Abortions,
13,politics,"SF’s Strong Teachers Union, Burned By the Recall, Gets Ready to Flex in Next School Board Race",
14,politics,Want to Fix American Democracy?,
15,politics,The Truth About White Women,
16,politics,Candance Owens Checks BLM Founder Over Alleged Stolen $90 Million,
17,politics,The math shows how differences between Republicans and Democrats create an unstable American democracy,
18,politics,Cities Are Built for Men. Let’s Change Them!,
19,politics,"Dear Liberals, “Vote Blue No Matter Who” is Not Working.",
20,politics,Will China Go Further in Its Support of Putin’s Russia by Moving Its Payment System Closer to MIR?,
21,politics,What Republicans Do Better Than Democrats,
22,politics,Money in Politics,
23,politics,Jen Psaki dispatched two reporters trying to ding the president for calling some Republicans ULTRA MAGA,
24,politics,Shireen Abu Akleh & Western Media — Israeli Occupation Forces Kill Palestinian Journalist Shireen Abu Akleh!,
25,politics,"OAN Apologizes, Pays Settlement for Ruining Election Workers’ Lives",
26,politics,Inflation in America at 8.3% in April: The Optimistic View vs. the Pessimistic View.,
27,politics,Putin’s Map of the World,
28,politics,"Desperation, Democracy and Dog Whistles",
29,politics,The Triumph of the Marcos-Duterte Leviathan,
30,politics,Apple Turns Nasty and Greedy Toward Employees,
31,politics,Why We Won’t See a South American Euro,
32,politics,It’s Okay to Be Gray,
33,politics,Thousands of Taiwanese Civilians Were Massacred In The Country’s “Hidden Holocaust.”,
34,politics,THIS Is How You Steal an Election,
35,politics,Days Ahead of the Lebanese Election… a Plea,
36,politics,That Time Our Nation Took A Dump,
37,politics,Yesterday’s Queen Speech is further Proof of Why We Must Eat The Rich In Britain,
38,politics,Comment nous avons automatisé la production de vidéos de données,
39,politics,What do The Philippines and Sri Lanka have in common?,
40,politics,Worst Of The Worst,
41,politics,Roe v. Wade = Communism & Socialism,
42,politics,Alex Jones Chastises Audience for Not Buying More at His InfoWars Store,
43,politics,Living Through A Real-Life Crucifixion…Again,
44,politics,Have you Seen How Easy it is to Get Elected These Days?,
45,politics,How Self-Aware can a Country be?,
46,politics,Doug Mastriano Rally,
47,politics,It Has Never Been about Protecting Children,
48,politics,The mayor of Bristol takes on a fourth job,
49,politics,Another Thought About Abortion,
50,politics,The People of America Versus the Supreme Court and Its Enablers,
51,politics,On Bob Marley and Reggae Music: Letter to DJ Fireman,
52,politics,"To Save Roe in Congress, the D’s Must Change Their Strategy",
53,politics,Don’t Trust Anyone Without A Sense Of Humor,
54,politics,Is it OK to Abuse Moronic Politicians Online?,
55,politics,Will 2025 Be Like 1981?,
56,politics,The Intuitionist (Poems),
57,politics,Why Americans do not Need Freedom,
58,politics,Battlestar Galactica’s Poignent Arguments On Abortion,
59,politics,Trump Believed China was Secretly Creating Hurricanes to Hit the US,
60,politics,Fear of Roe’s Death is Greatly Exaggerated,
61,politics,Am I Stuck In A Mirror Universe Where Time Runs Backwards?,
62,politics,The Baby Formula Apocalypse,
63,politics,Trump and Oz: A Perfect Match.,
64,politics,Democratic Naysayers and Cynics Need to Knock It off!,
65,politics,"Yes, The Media is Lying About the War in Ukraine.",
66,politics,Something is Really Wrong With Tucker Carlson,
67,politics,In Praise of the Messy Compromise,
68,politics,A Federal Abortion Ban is Coming.,
69,politics,Do You Want to Feel Good or Do You Want to Win?,
70,politics,Red vs. Blue: The Neuroscience Behind Politics,
71,politics,Has The Time Come for a Basic Universal Income for All Americans?,
72,politics,Should Iraq declare climate emergency?,
73,politics,Roe v. Wade Should be Upheld Under the First Amendment,
74,politics,Exposing Thieves,
75,politics,Tennessee Rep. Jerry Sexton Wants to Burn School Books About Critical Race Theory and Gender Studies,
76,politics,Analysis by Fareed Zakaria: Blue America is Western Europe. Red America is Saudi Arabia & Nigeria.,
77,politics,More Blame than Solve,
78,politics,What’s Happening In Sri Lanka — The Protestors Strike Back,
79,politics,The Time When Aristocrats Fell Into A Cesspit,
80,politics,5 Reasons to Appreciate Finland,
81,politics,The Small Business of Democracy,
82,politics,Vlogs for Daily Blogs 127: Vlogs for Daily Blogs 127,
83,politics,Just Who is Running the Country?,
84,politics,Are Biden’s Economic Accomplishments Being Underrated?,
85,politics,On Madison Cawthorn and the Folly of Logic of Populist Foreign Policy,
86,politics,Submitting To My Husband,
87,politics,The Security Of Nigeria Women: A State Of Emergency,
88,politics,Overturning Roe V. Wade: An Angry Sleeping Giant,
89,politics,Is Vladimir Putin Afraid? Of Course.,
90,politics,What more do you want from Joe Biden?,
91,politics,93 Datasets That Load With A Single Line of Code,
92,politics,The End of Roe is Just the Beginning,
93,politics,Can Democracy be exported?,
94,politics,Dynamic Economies,
95,politics,How to Make Community Engagement Better,
96,politics,This Was Going To Be Everyone’s Inheritance,
97,politics,LGBTQ Pride in 2022 Should Be Transformed into Events Protesting Abortion Ban,
98,politics,LGBTQ-Ally Michigan State Senator: “We. Will. Not. Let. Hate. Win!”,
