,category,header,content
0,business,Startups Copying Startups: How To Protect Yourself From Intellectual Theft,
1,business,7 Passive Income Ideas To Easily Make $500/Day,
2,business,A New Daily Planner: Routine,
3,business,How Long Can I Earn Money For An Article I Post On Medium?,
4,business,What Juneteenth Reveals About Corporate America,
5,business,The “Garage Startup” Is Officially Dead,
6,business,"Creating experts in the world of crypto, enter Basil Atwani, a successful young crypto trader and educator taking the industry by storm.",
7,business,Why Elon Musk Fired Most of His Long-Term Employees Who Had Worked for Him for Over 5 Years,
8,business,大阪庶民料理串炸 為了讓藍領工人也能吃到洋玩意兒的小吃,
9,business,A Much Scarier Great Resignation,
10,business,Dare More Tortoise Than Hare,
11,business,How to Be More Likeable Online,
12,business,4 Mistakes I Made in my First Year of Freelancing,
13,business,How to Get Rich — 10 Best Ways to Build Passive Income,
14,business,How Mexico Built Cancun Using Computer Models,
15,business,5 reasons why it is worth working with a Ukrainian IT company.,
16,business,Hand-Picked Articles #123,
17,business,15 Truths I Want You to Know About Getting Rich,
18,business,I Refused To Sell My Small Agency For $50k — Here’s Why.,
19,business,How to Build a Professional Network,
20,business,How Elon Musk Became Elon Musk — His Top 10 $1.3 Trillion Inventions,
21,business,How My Startup Gave Its Customers What They Needed By Rejecting What They Wanted,
22,business,Broken Website Development And Management Mindsets,
23,business,Top 9 Reasons to Use a Payment Processor When Starting a Business,
24,business,Secret #1 — How to Make it Happen: 7 Steps to Get Yourself Going,
25,business,The Best Bits from Leaders for Humanity with Ed Freeman,
26,business,7 Passive Income Ideas to Generate $500 per Day or More,
27,business,The Best Quotes from Leaders for Humanity with Ed Freeman,
28,business,Improve the quality of your 1:1s,
29,business,E-mail vs Vilão Imortal,
30,business,The Fractal Dimension Index in Trading,
31,business,"10 Passive Income Ideas: How I Make $11,000/Week",
32,business,Surviving the Post-Covid Winter: Playing Defense and Offense at the Same Time,
33,business,Can Freelancing Be A Full-Time Career?,
34,business,"Aman Ghataura Of NUOPTIMA On The Top 5 Ways To Market, Advertise & Promote An E-commerce Business Today",
35,business,How to Make Money Online : 5 Creative Ways To Start,
36,business,Crafting the Marketing Mosaic: Shift Your Perspective & Unlock Better Results,
37,business,Stop with the Journey Metaphor — Use Your Imagination!,
38,business,How Much Does An MT799 Proof of Funds Cost?,
39,business,The Smart Entrepreneur Doesn’t Win,
40,business,Talent Crunch Rant Post: Personal Story,
41,business,Can’t find a CTO? Need to bootstrap your build? Can’t find developers?,
42,business,Currency Armageddon!,
43,business,"The United States Will Enter a Lengthy Recession This Year, Say the Experts",
44,business,5 things a designer in a startup must do.,
45,business,Is This The Single Greatest Predictor Of Stock Market Returns?,
46,business,How to Build A Personal Brand That Stands Out,
47,business,4 ways to deal with a dysfunctional leader in your organization,
48,business,Disrupting the disruptors and beating the big names!,
49,business,How To Create Powerful Agreements With Your Clients,
50,business,Loyalty to a fault,
51,business,"Sometimes the best ""side hustles"" are class projects that turn into businesses.",
52,business,Boosting Semiconductor Development,
53,business,WHY ‘RISK’ IS THE IMPORTANT FACTOR FOR SUCCESS.,
54,business,Are You Ready To Start Your Juicing Journey?,
55,business,The Cult of Busyness Do You Make Time For What Matters Most?,
56,business,How to shift 100% of your wholesale business online in just 24 hours,
57,business,Why Neurodiverse Teams Are The Way of the Future,
58,business,Freedom From Worry: A Lesson From the Humble Bumble Bee,
59,business,"Employees need an outlet to report poor, ineffective, dysfunctional leaders",
60,business,What’s your leadership style?,
61,business,Are you a serial meeting rescheduler?,
62,business,The Leadership Spotlight is Always On You — And It’s Really Bright!,
63,business,Dr Koyejo Oyerinde: 5 Things We Must Do To Improve the U.S. Healthcare System,
64,business,Let’s Strike Like The 70's,
65,business,#66 Weekly Charts — How US is becoming less attractive vs other markets,
66,business,8 Habits of Millionaires and How to Become One,
