,categories,headers,contents
0,weather,"Cyclone Asani to Intensify Into Severe Cyclonic Storm on May 9; Know All About Its Movement, Landfall, Deintensification","Sunday, May 8: During the early hours of Sunday, May 8, the potent system based in the Bay of Bengal intensified into a Cyclonic Storm, effectively transforming into Cyclone Asani. From here on, it is expected to gather more strength and evolve further in the next 24 hours. A rapid..."
1,weather,Wildfires Threaten All of New Mexico and Much of the Southwest,"The fifth-largest state in the nation (in terms of area) is currently under what its governor described as a “Critical Fire Weather Warning.” The state is New Mexico, the governor is Michelle Lujan Grisham, and the fires are numerous. Think that sounds worrisome? It gets worse from there. New Mexico isn’t alone in facing a heightened risk of wildfires — according to a new Washington Post article, pretty much the entire Southwest is."
2,weather,"Rain, snow and wind targets western US this week","AccuWeather meteorologists say the stormy weather pattern is likely to bring a host of travel disruptions across the western part of the country. All modes of weather are set to spread across the West this week, including snow despite the calendar reading May. The first of two major storms to..."
3,weather,US: Potent Storm System Can Develop Into a Tropical Depression Off the Coastal Atlantic,"A potent storm system over the Atlantic Ocean, off the East Coast of the United States, is reportedly possible to develop into a tropical depression or a low-pressure area (LPA), which can affect coastal areas from New York to Florida in the coming days. The said system may arrive a..."
4,weather,The window of opportunity to address increasing drought and expanding drylands is vanishing,"Chile, Argentina and the American West are in the midst of a decade-long, megadrought — the driest conditions those regions have seen in a century. And many areas in Western Canada and the United States are experiencing extreme drought — a once in 20-year event.   

Drought makes agriculture less productive, reduces crop yields and increases heat-related deaths. It adds to conflict and migration, as marginalized people are dispossessed of their land. In short, it leaves people more vulnerable. 

Drought is part of natural climate variability, but it is also one of the many outcomes of climate change that..."
5,weather,"Warm, dry weather set to spread into the Northeast","Much of the mid-Atlantic and Northeast have been gripped by a wet and chilly pattern in recent days as rounds of rainfall have swung through the area. However, AccuWeather forecasters say that a major shift is on the horizon as warm and dry weather is set to spread over the Northeast during the coming week."
6,weather,The World Has No Choice but to Care About India’s Heat Wave,"CHANDIGARH, India—Soon after I arrived in the eastern megacity of Kolkata in February, temperatures began climbing. They always do when India’s short winter turns into an early spring. But then they kept rising. After the hottest March in 122 years of record keeping, the scorching temperatures continued through..."
7,weather,"New Mexico wildfire scorches about 275 square miles, fueled by strong winds and high temperatures","Strong winds, high temperatures, and low humidity continued fanning the flames on Sunday of a devastating wildfire that has already scorched more than 275 square miles in northern New Mexico. ""An exceptionally dangerous and likely historic stretch of critical to extreme fire weather conditions will persist through the middle portion..."
8,weather,"Brighter, Warmer for Monday",Our warming trend begins tomorrow.
9,weather,"Heat, humidity, thunderstorms, and near-record temperatures ahead – Gary",The latest forecast from News 3 Now.
10,weather,Deadly ‘wet-bulb temperatures’ are being stoked by climate change and heat waves,"Parts of India and Pakistan have been sweltering for weeks under a record-breaking heat wave, exposing more than a billion people to dangerously hot conditions with little relief in sight. While temperatures in the region cooled slightly this week, blistering heat is expected to return in the coming days and..."
11,weather,An Unprecedented Heatwave in India and Pakistan Is Putting the Lives of More Than a Billion People at Risk,"KARACHI, Pakistan–More than 25 people have suffered heat-related deaths in the state of Maharashtra in India since the beginning of an unprecedented heatwave in the subcontinent that has put the lives of over a billion people at risk. For the past two months people in India and Pakistan have..."
12,weather,Alaska Declares Disaster Emergency Due to Flooding Caused by Ice Jam in Manley Hot Springs,Manley Hot Springs in Alaska has been experiencing severe flooding over recent days due to an ice jam along the Tanana River downstream. The natural calamity prompted the Alaskan state government to declare a disaster emergency. There were no immediate reports of casualties from the floods. With dozens of residents...
13,weather,Most Extreme Heatwaves Ever Recorded Globally – Revealed in New Research,"A new research study has revealed the most intense heatwaves ever across the world – and remarkably some of these went almost unnoticed decades ago. The research, led by the University of Bristol, also shows heatwaves are projected to get hotter in the future as climate change worsens. The..."
14,weather,"China's sea levels touched new high in 2021, govt study shows","SHANGHAI, May 9 (Reuters) - China's sea levels reached their highest on record last year, swelled by rising water temperatures and the melting of glaciers and polar icecaps, the government said in a report. Coastal sea levels were 84 mm (3.3 inches) higher in 2021 than the average over the..."
15,weather,"North-central US to be target of severe weather, flooding into early week","The northern Plains and Upper Midwest are in for an active stretch of weather, forecasters say, with a couple doses of soaking rain and severe thunderstorms in store on Monday. Following an unusually wet month in April featuring both soaking rain and heavy snowfall, the northern Plains dried out during..."
16,weather,New Mexico residents brace for extreme wildfire conditions," With the worst of the thick wildfire smoke having blown out of town, residents of this small northern New Mexico city tried to recapture a sense of normalcy Saturday as their rural neighbors hunkered down amid predictions of extreme fire conditions.Shops and restaurants reopened, the historic center was no longer just populated by firefighters, but there was a widely felt sense of anxiety, loss, and wariness of what lay ahead. “It’s literally like living under a dark cloud,"" said Liz Birmingham, whose daughter had persistent headaches from the smoke. ""It’s unnerving.” While the city for now seemed spared of..."
17,weather,New Mexico wildfire: Huge blaze could worsen this weekend,"""Historic"" and ""extreme"" weather conditions could fan a wildfire in New Mexico which is already the second biggest ever seen in the US state. The so-called Hermits Peak Fire has been burning for more than a month and has torn through an area larger than the city of Chicago. Many..."
18,weather,Dodgers sweep twin bill over Cubs; Betts drives in five in 6-2 victory,"The Dodgers silenced the Wrigley Field Faithful twice in the same day during their double header Saturday, after Friday's matchup was postponed by inclement weather. Coming off the heels of a 7-0 victory in Game 1, the Dodgers were led by a five-RBI performance from Mookie Betts. The Cubs struck first off of Los Angeles starter Tyler Anderson (2-0, 2.78 ERA), who made his third start in place of the injured Andrew Heaney. The run came on an RBI groundout from Ian Happ, after Betts was unable to make the tough play on a deep flyball off the bat of Willson Contreras,..."
19,weather,Under-the-radar early season Yankees narratives to keep an eye on,"The Yankees have gotten off to a great start this season, despite some scheduling complications. While the strength of schedule has been relatively easy, all things considered, the extended lockout forced the Yankees into a situation where they had to play 16 games in 17 days to begin the season."
20,weather,Yankees-Rangers series opener postponed again,"NEW YORK —  The series opener between the Texas Rangers and New York Yankees was postponed for a second straight day on Saturday because of a forecast for sustained rain in the area.The postponement was announced nearly four hours before game time. The Rangers and Yankees will make up the game Monday at 1:05 p.m.They had been scheduled to play Friday night, a game that was rained out nearly eight hours before the scheduled first pitch. That game will now be played Sunday as part of a single-admission doubleheader beginning at 1:35 p.m.This weekend marks Texas' only scheduled trip to Yankee..."
21,weather,SPC Issues Fire Weather Warnings for Southwest US and Southern High Plains: Wildfire Risks Possible,Fire weather warnings have been issued over the weekend for the Southwest US and the southern High Plains. These advisories entail the risk of either the formation of new wildfires or the continuance of existing ones this week. Abnormal heat and dry conditions are the main fuel of these fire...
22,weather,"NOAA Warns of Heavy Rain in the Mid-Atlantic, Prolonged Fire Weather in the Southwest US","Heavy rain in the mid-Atlantic region and prolonged fire weather in the Southwest US is likely this weekend into the early days of the coming week. Torrential rain is highly likely to cause flooding in affected areas, while fire weather is likely to trigger wildfires in areas affected by dry conditions."
23,weather,Clouds & mild temps overnight; a big warm up this week!,"We had a glorious Mother's Day out there today but we now we are seeing the return of clouds. Those will stick around overnight but will begin to thin out by early morning. Lows will probably fall into the upper 40s and low 50s for Monday morning, which is actually right near average for today. Wind will be calm overnight out of the east at 2 to 4 mph."
24,weather,Saturday's game against the Royals postponed to Monday,Tonight's Orioles game against the Royals has been postponed due to inclement weather. This is the second postponement for O’s this week.
25,weather,"Mother’s Day weekend East Coast soaker brings threat of high surf, rip currents, coastal flooding","Low pressure will spread a widespread area of soaking rain across the Ohio Valley and mid-Atlantic through Saturday, then move off the East Coast by Mother’s Day and create high surf, rip currents and coastal flooding along the Eastern Seaboard into next week.

This storm system will first trigger a threat of severe thunderstorms in parts of the Southeast before becoming an East Coast soaker into the start of the weekend.

Periods of rain and a few thunderstorms drenched the Ohio Valley and mid-Atlantic on Friday. The soaking rain will linger in the mid-Atlantic states for much of Saturday.

The heaviest rainfall along the Interstate..."
26,weather,"Cyclone Asani to Recurve Towards Northwest Bay of Bengal Next Week, Cause Heavy Rainfall in Odisha, Andhra, West Bengal","Saturday, May 7: After Amphan in May 2020 and Yaas in May 2021, this month is set to become the third successive May we see a cyclone in the Bay of Bengal, as Asani continues to amass strength in this cyclone hotbed. The India Meteorological Department’s (IMD) latest update indicates..."
27,weather,Plenty of sunshine to start off the week as a coastal storm spins in the Atlantic,"Overall, a cooler and sunny forecast is expected over the next few days. Some rain is expected towards the end of the week in the Midlands."
28,weather,Strong earthquake shakes Taiwan,A magnitude 6.1 earthquake has been detected off eastern Taiwan
29,weather,Temps Trending Up Through Mid-Week,"Sunday Night: Temperatures again dip into the upper 50s tonight under a mostly clear sky. The wind may pick up a bit this evening, with some gusts climbing as high as 20 mph. Monday: The temperature trends up a bit, with more of us making it into the 80s by mid-afternoon. It will be a bit breezy at times, with some wind gusts climbing as high as 25 mph."
30,weather,Sunday to set the stage for the potential of record high throughout the coming week,"This morning we experienced our last cooler morning for a while. Temperatures out the door started in the low 50s, but over the course of the day we will bounce back nicely, into the low 80s. A high-pressure system continues to dominate our forecast today making for a spectacular Mother's..."
31,weather,Cooler Monday with more chances for snow and rain,TONIGHT: Isolated rain and snow showers will continue to come through the region becoming more isolated out in the southern highlands and in western WY for the overnight hours. Winds will finally start to calm down to be only between 5-10 mph. Low's get all the way down to the 20's and low 30's for the early morning.
32,weather,Late spring “summer” like heat wave this week,Through out this week a minor blocking patter will form over the Eastern United States causing a warm upper level ridge to build up and bring well above normal temperatures to much of the central U.S. . To add to the incoming heat wave the Low Level Jetstream will become southerly and help to direct […]
33,weather,"Clear, Calm, Chilly Overnight With Some Fog; Warmer & Sunny Monday","Finally a break from the rain, blustery winds, and raw chilly weather! High pressure building from New England and southern Canada is pushing the system that brought more than two days worth of rain to our southeast. As a result, skies remain mostly clear this evening and tonight with lows down to near 40 degrees. Some patchy fog is possible tonight into early Monday morning."
34,weather,Wildfires Threaten All of New Mexico and Much of the Southwest,"The fifth-largest state in the nation (in terms of area) is currently under what its governor described as a “Critical Fire Weather Warning.” The state is New Mexico, the governor is Michelle Lujan Grisham, and the fires are numerous. Think that sounds worrisome? It gets worse from there. New Mexico isn’t alone in facing a heightened risk of wildfires — according to a new Washington Post article, pretty much the entire Southwest is."
35,weather,Summer sizzle marches on into a hot work week,"Well, if you were hoping we would head into the work week with some break from the heat, I do not have good news for you. In fact, we’ll be sitting in a more late June-like pattern for the entire week! That means steamy mornings in the mid to upper 70s and highs back in the low 90s."
36,weather,Kevin's Weather: VE Day Weather,"We don’t talk about it much these days, which is a shame, but today is VE Day, or Victory in Europe Day. On May 8, 1945, President Truman and General Eisenhower accepted Germany’s unconditional surrender. One of the many factors may have been several days of good flying..."
37,weather,Cyclone threat looms large over B’desh coasts,"Dhaka, May 9 (SocialNews.XYZ) Bangladesh has issued an alert over cyclone Asani that is heading towards its coasts. A bulletin of Bangladesh Meteorological Department (BMD) on Sunday said: ""The well-marked Low over Southeast Bay and adjoining South Andaman Sea moved northwestwards, intensified into a Depression, that further intensified into a Cyclonic storm ASANI over Southeast Bay and adjoining area,"" reports Xinhua news agency."
38,weather,Gary Brown: Talking about weather and whatnot,"I don't mean to depress all of us by considering reality, but have you ever thought about how much of our lives we waste talking about mundane things. We debate the weather with our loved ones from the moment we wake up in the morning. ""I see here on my..."
39,weather,5/8 – Brittany’s “Mother’s Day” Evening Forecast,"The main talk of the short term will be the heat, we will definitely have plenty of it to go around. Many areas will see the low 90s Monday through Wednesday, with the exception of coastal areas which will be sitting in the mid to upper 80s. On a somewhat bright side, the humidity won`t be horrible, with dewpoints in the mid 60s low 70s in some places. We`ll have a chance to beat some high temperature records, mainly on Tuesday, in some areas. Outside of that the weather will be pretty quiet with ridging aloft and high pressure dominating at the surface."
40,weather,Temperatures 20 degrees below average Sunday,"After seeing 2 to 3 inches of rainfall over the past three days, we will dry out as we head into this week. A few sprinkles early this morning with cloudy skies throughout the day. Highs Sunday will only be in the 50s, but with a breeze out there, temperatures will feel as if they were in the 40s. Clouds move out overnight, dropping temperatures into the upper 30s and lower 40s. No frost or freeze is expected. Highs rebound into the 60s Monday."
41,weather,"Sun and clouds for Mother’s Day, warmer temperatures",The Storm Team 11 Forecast: Look for a mix of sun and clouds for the Mother’s Day with a high near 68 degrees. High pressure will build into the area Sunday night through Tuesday which will allow for a warming trend. Partly cloudy skies are forecast for Sunday night...
42,weather,Yankees rained out for second day in a row,"In yesterday’s post about the Yankees’ rainout against the Rangers, we made sure to note that the forecast for rain wasn’t looking much better for Saturday and the threat of another postponement loomed large. Sure enough, the weather around Yankee Stadium has remained miserable, and the Yankees did not wait around long to announce that this Saturday matinee would be washed away."
43,weather,Bad news for the Yankees as inclement weather takes hold once again,"The New York Yankees postponed their second consecutive game against the Texas Rangers on Saturday due to inclement weather. The forecast showed consistent rain in the area, but things are starting to clear up on Sunday. The Yankees will enjoy a few well-deserved days off, which is a benefit at the very least."
44,weather,Royals game postponed for second straight day,"KANSAS CITY, Mo. — The Kansas City Royals announced Saturday afternoon the team's game against the Baltimore Orioles, set for 6:05 p.m., has been postponed due to inclement weather. The game has been moved to Monday with a first pitch set for 11:05 a.m. This is the second day..."
45,weather,New Mexico wildfire: Huge blaze could worsen this weekend,"""Historic"" and ""extreme"" weather conditions could fan a wildfire in New Mexico which is already the second biggest ever seen in the US state. The so-called Hermits Peak Fire has been burning for more than a month and has torn through an area larger than the city of Chicago. Many..."
46,weather,Blue Jays seek clutch hits in DH against Guardians,The visiting Toronto Blue Jays went 1-for-10 with runners in scoring position in their 6-5 loss to the Cleveland Guardians
47,weather,"Severe Thunderstorms, Including a Few Tornadoes, to Hit the South, Southern Mid-Atlantic on Friday","Parts of the South and southern mid-Atlantic will see severe storms to end the week. Damaging winds, large hail and a few tornadoes are possible. Severe thunderstorms packing damaging winds, hail and a few tornadoes will hit parts of the South and southern mid-Atlantic on Friday. Showers and storms are..."
48,weather,"Slow-Moving Atlantic Low Brings East Coast Wind, High Surf, Rip Currents","Low pressure formed off the East Coast Mother's Day weekend and will linger into the week ahead. Persistent winds will generate high surf, rip currents and some coastal flooding from Florida to the mid-Atlantic. There's a small chance this offshore low could become a subtropical system this week. Low pressure..."
49,weather,No exaggeration: Record lows at Lake Powell and Lake Mead call for drastic action,"
                        For weeks, we’ve been seeing media reports regarding conditions in the Colorado River Basin – specifically with regard to our country’s largest reservoirs, Lake Powell and Lake Mead, which have dropped to record low elevations.
                        The media have been reporting it accurately. The Colorado River Basin has been in a prolonged drought, exacerbated by climate..."
50,weather,O's postponed tonight against Kansas City,"For the second day in a row, the Orioles scheduled home game with the Royals has been postponed due to inclement weather. The clubs hoped to play the opener of what is now a two-day, three-game series tonight, but the game was postponed just after 4:30 p.m. ET. A straight..."
51,weather,Heat wave set to continue in the south-central US,"Residents of the central United States are no stranger to intense heat during the summer, however, a significant warmup arrived well ahead of schedule last week, featuring temperatures reminiscent of June or July in the central Plains, Ohio Valley and Great Lakes. On Friday, temperatures in Amarillo, Texas, shot to..."
52,weather,Wildfires are already incinerating southwestern states.,"We must come to understand what isn’t working, and what cost-effective tools are not currently being used. Only because they are literally free to the public. As bad as wildfires are, adding insult to injury are the so-called ‘controlled’ or ‘prescribed burns’. Time and time..."
53,weather,Footage captures massive tornado heading for tiny Texas town,"A massive tornado has been captured on camera tearing towards the town of Lockett, Texas, in the early hours of Wednesday.The sheriff’s department in Wilbarger County reported ""extensive structural damage"" in the small town that lies close to the Oklahoma border, according to news outlet Weather.com.Wilberger County Sheriff Brian Fritze told News Channel 6  that first responders could not assess damage or downed power lines overnight but said that several homes and barns appeared to suffer extensive damage. Sheriff Fritze also confirmed there were no significant injuries or deaths.The video showed a huge column of dust heading towards wind..."
54,weather,"Cyclone Asani to Form over Bay of Bengal on May 8; To Approach North Andhra-Odisha Coasts By May 10, Per Early Forecasts","Saturday, May 7: The first cyclonic storm of the 2022 North Indian Ocean cyclone season is now on the horizon, as the India Meteorological Department (IMD) has predicted the formation of Cyclone Asani in the Bay of Bengal on Sunday, May 8. According to its latest update, a well-marked low-pressure..."
55,weather,"Orioles, Royals rained out for 2nd straight day","BALTIMORE (AP) — A second straight game between the Baltimore Orioles and Kansas City Royals has been postponed because of rain. The teams also had a game Friday night called off, one of six games around the major leagues that were rained out that night. That was the most in a day because of inclement weather since 2018. This is Kansas City’s only scheduled visit to Baltimore this season. The Royals and Orioles will try to play a straight doubleheader Sunday, then another game Monday afternoon on what was a mutual off day."
56,weather,Blue Jays seek clutch hits in DH against Guardians,The visiting Toronto Blue Jays went 1-for-10 with runners in scoring position in their 6-5 loss to the Cleveland Guardians on Thursday. The Blue Jays hope for better success in key moments on Saturday when they play a traditional doubleheader in Cleveland. The teams’ scheduled Friday game was postponed due to inclement weather.
57,weather,Antarctica’s majestic underwater world is trying to adapt to a warmer planet,"Icebergs surrounded a team of researchers in January as they cruised toward Antarctica. The team had been studying a thriving underwater ecosystem near the continent for years, but thanks to new modeling and powerful instrumentation they were able to navigate through a crumbling landscape of ice to their destination. “We..."
58,weather,"Steady rain and wind today, drying out for Mother’s Day","TONIGHT: Rain Tapers To Drizzle. Lo 44. Wind: NE 10-15 mph. MOTHER’S DAY: Early AM Drizzle, then Slow Clearing. Hi 60. Wind: NE 10-15 mph. MONDAY: Mainly Sunny, Cool & Dry. Hi 64. Most areas picked up another 1-1.5″ of rain today. That adds on to roughly 2 inches..."
59,weather,What is a gustnado?,"What is a gustnado? I have heard the word, but do not understand its meaning. A gustnado is a brief surface-based vortex that forms within a surge of air blowing out of a strong thunderstorm. Most gustnadoes last from a few seconds to occasionally, a few minutes. They form as eddies within otherwise straight-line wind flow and as such, despite the name, are not related to tornadoes. Gustnadoes typically produce winds near 50 mph but occasionally become a bit stronger and may be capable of causing minor damage to structures, but injuries are very rare. Strong thunderstorms contain powerful downdrafts that, when striking the ground, spread outward and cause a rush of wind at the surface. If there is sufficient instability, a gustnado might form."
