,categories,headers,contents
193,sports,Bylsma Named Firebirds Coach,"In a milestone move for the brand-new 32nd franchise in the American Hockey League, the Coachella Valley Firebirds named Stanley Cup-winning Dan Bylsma head coach Tuesday. He joins Seattle's AHL affiliate after a season as assistant coach with the Charlotte Checkers, which won the AHL's 2021-22 regular-season Atlantic Division title with a split roster of developing pros from the Kraken and Florida Panthers."
194,sports,Former Purdue basketball star Caleb Swanigan dies at 25,"Former Purdue basketball star and first-round NBA draft pick Caleb Swanigan has died, according to the school. Purdue basketball announced on Tuesday that Swanigan has died at age 25. Swanigan died in Fort Wayne, Ind., on Monday. The Allen County Coroner’s Office confirmed to local news outlet WANE 15 that..."
195,sports,ESPN Predicts College Football's Top 5 Future Programs,"The ""Future Power Rankings"" from ESPN take into consideration the next three seasons for the top college football programs. With that said, the latest edition of these rankings have been unveiled. At the top of the list is none other than Alabama. Nick Saban's program remains in excellent shape, especially..."
196,sports,Cubs outright Sean Newcomb,"Cubs lefty Sean Newcomb went unclaimed on waivers following last week’s DFA and has been assigned outright to Triple-A Iowa, the team announced to reporters (Twitter link via Maddie Lee of the Chicago Sun-Times). As Lee points out, Newcomb has up to 48 hours to determine whether he will..."
197,sports,Klay Thompson asks Stephen Curry: ‘Who cries on the basketball court?’,"The Warriors trolled everyone — even one another — at the team’s championship parade in San Francisco on Monday. 

Klay Thompson called out Stephen Curry for his tearful reaction when the longtime duo won their fourth title in eight years against the Celtics last Thursday. 

“Who cries on the basketball court?” Thompson said in front of a packed crowd on the streets of San Francisco.



The team was reflecting on the star point guard’s uncharacteristic emotional moment on the court after the Warriors beat the Celtics 103-90 in Game 6 in Boston.

“There’s no crying in basketball,” Curry said, laughing. 

Cameras captured..."
