,categories,headers,contents
0,technology,Video shows 'kamikaze' drone's POV moments before striking Russian tank,"In the new video released by the Ukraine Armed Forces, cutting-edge, foreign-made drones are used to fight against Russian troops. A ‘kamikaze’ drone’s point of view is shown moments before it strikes a Russian tank. CNN’s Melissa Bell has more."
1,technology,'Kamizake' Drone Turns Russian Tank Into Ball of Smoke,Footage released by Ukrainian military officials reportedly shows a 'kamikaze' drone smashing into a Russian tank and turning it into a ball of smoke and fire.
2,technology,Internet Slams Man Who Let Friends Eat Pregnant Wife's Food and Insult Her,"""Offering the last plate of food he knows was for his wife out of peer pressure? Allowing his friends to s**ttalk his wife? [He's] a doormat,"" one comment read."
3,technology,Verizon Wireless Bills to Climb Even Higher with Increased ‘Administrative Fees’ Starting in June,"Bad news for Verizon Wireless customers. You better get ready to fork out more cash for your cellular bill. According to a recent report from Bloomberg, Verizon is raising the monthly administrative fee that it charges per line. It’s only a slight increase, but that doesn’t help when consumers are already stressed about their dwindling pocketbooks."
4,technology,Democrats urge Google to stop collecting location data that could be used to identify people seeking abortions,Democratic lawmakers urged Google CEO Sundar Pichai to stop collecting and keeping unnecessary or non-aggregated location data that could be used to identify people seeking abortions. The letter comes after a Supreme Court draft decision that would reverse Roe v. Wade was published by Politico. It follows a separate Democratic...
5,technology,Xbox Users Can Buy Controversial Xbox 360 Game Again After 12 Years,"Xbox users across Xbox One, Xbox Series S, and Xbox Series X can buy one of the Xbox 360's most controversial games again after 12 years. The Xbox 360 is Microsoft's best-selling console of all time, and it's not even close. And it's been the only Xbox console to give its PlayStation counterpart a run for its money. It did this with a plethora of great exclusives and timed exclusives ranging from the Gears of War series to Mass Effect. Beyond exclusivity, there was generally a large collection of great games and new IP during that console generation. Like every generation though, there were also some stinkers, such as Sonic the Hedgehog, more commonly known as Sonic '06."
6,technology,How To Clear Cookies On Safari,"Cookies are an important part of the modern browser experience, but there are good reasons why you might want to wipe them from your iPhone or Mac"
7,technology,"Russia Uses Mobile Game To Locate Ukraine Army, Checkpoints: Security Service","The Russian military is now turning to mobile applications to locate the Ukrainian army and strategic facilities in the country, according to Ukrainian officials. The Security Service of Ukraine on Tuesday revealed that Russians are using a smartphone game to recruit Ukrainian children and use them in sabotage activities. In the mobile game, participants are asked to look for ""boxes"" containing virtual prizes, which can later be exchanged for electronic money."
8,technology,UPDATE: Walt Disney World Annual Passholders Will Have to Show My Disney Experience for Dining and Merchandise Discounts,"We have now confirmed the rumor that Walt Disney World Annual Passholders will soon need to show their pass in the My Disney Experience app to prove eligibility for both dining and merchandise discounts. Currently, Annual Passholders can show their photo ID and physical pass. However, Annual Pass cards no..."
9,technology,Snap! Elon Musk has another Twitter excuse,"NEW YORK, May 24 (Reuters Breakingviews) - Snap (SNAP.N) could be Twitter’s (TWTR.N) raven. The disappearing-message app abruptly slashed its second-quarter forecasts, sending its shares spiraling some 40%. That’s an ominous sign for Twitter. Elon Musk has an additional reason to bail on buying the social media network."
10,technology,"A baseless conspiracy theory is brewing on China's Twitter, with social media users accusing the US of creating and leaking the monkeypox virus","People on China's Twitter-like Weibo posited, without evidence, that a US-linked terrorist group was spreading the virus as part of a larger plan."
11,technology,Google Maps Street View gets new features,"Google has announced that its Street View is now 15 years old and it is bringing some historic Street View images to Android and iOS. You will now be able to look at an address on Street View and then see how that address has changed over the last 15 years, there is more information from Google below."
12,technology,Ukrainian Special Operations Forces release video said to show a kamikaze drone taking out a Russian tank,Ukraine's military said that troops had routinely used kamikaze drones on the battlefield but that this was the first video to be released.
13,technology,Call of Duty: Modern Warfare 2 Release Date Revealed in First Trailer,"Call of Duty: Modern Warfare 2 officially has a release date and is scheduled to release on October 28th, Infinity Ward and Activision announced this week. The follow-up to 2019's Call of Duty: Modern Warfare that continues the reboot of the original Modern Warfare series made its big debut in a trailer shared on Tuesday following numerous leaks and rumors trying to predict when, exactly, the game would be revealed. The trailer shared this week was only a short one, but with summer gaming events set to get underway in the coming weeks, it's expected we'll see the game have a greater presence then if not sooner."
14,technology,How to Unlock a Samsung Phone Without the Password,"Forgetting the password or PIN to your phone can be quite frustrating. In the past, Android phones had a reputation of being relatively insecure, but that has changed quite a bit over the past few years. Both Samsung and Google have taken steps to make devices more secure, so if you forget the password to your phone, unlocking it is not a simple process."
15,technology,The Lord of the Rings: Gollum Release Date Revealed,"The Lord of the Rings: Gollum finally has a release date and thankfully, it's not too far away. The Lord of the Rings: Gollum is the first AAA Lord of the Rings game for consoles since the acclaimed Shadow of War. Shadow of Mordor and Shadow of War received tons of acclaim for the dark and original stories they were able to tell within the Lord of the Rings universe, taking advantage of the rich lore that Tolkien had created many years ago. They also managed to have incredibly innovative gameplay that allowed enemies to remember the player and create conflicts and small, dynamic stories. Although The Lord of the Rings: Gollum isn't related to those games, it does look like it'll tell its own original story and have really unique gameplay."
16,technology,Xbox Game Pass is knocking it out of the park this month,"If you spend a lot of time reading about video games on social media, you’ve probably seen this week’s instantly tiring discourse. It started with a couple of journalists harmlessly noting that they planned to unsubscribe from Xbox Game Pass for a bit, which escalated into a classic console war debate complete with angry fans on every side and brand clap backs."
17,technology,Walmart to begin drone delivery service to 4 million households,"As many as 4m American households will be able to get food, groceries and supplies from Walmart delivered by flying, remote-controlled drones by the end of the year, according to the retail chain. Walmart announced that its delivery service with the operator DroneUp will be rolled out in six states,..."
18,technology,Forget Streaming. McIntosh Just Debuted Its Most Ambitious CD Player Yet.,"Click here to read the full article. When conversations at cocktail parties stall, talk often gets kick-started by harmless subjects like automobiles or local restaurants. Musically aware folks, especially younger ones, might confess their newfound infatuation with vinyl. I always congratulate them, with the caveat that record collecting can be a slippery slope, and, like a baby pot-bellied pig, is manageable at first but can become a large, all-consuming burden.
It’s true, I always add, that the best analog rigs can be more rewarding to listen to than any other playback medium, sonically and certainly for the tactile and aesthetic perks..."
19,technology,What does putting your phone on airplane mode actually do?,"What is “airplane mode,” and how does pressing a button to use it on an iPhone affect a 160-foot long, 100,000-pound airplane?. Why it matters: All flight passengers are asked to switch their phones to airplane mode while traveling on an airplane. Airplane mode shuts off the phone’s transmissions, disabling the ability to connect to cellular networks."
20,technology,Google warns Android smartphones targeted by dangerous Predator spyware,"Android smartphones in a number of countries around the world have been targeted by powerful PREDATOR spyware, researchers from Google’s Threat Analysis Group (TAG) have warned. The company’s recent report says that the spyware, allegedly developed by a commercial entity - a company called Cytrox, headquartered in Skopje, North..."
21,technology,T-Mobile vs Verizon vs AT&T: same old 5G winner further extends lead in new tests,"The latest in a loooooong line of independent reports evaluating T-Mobile, Verizon, and AT&T's 5G networks based on several different performance indicators is today out, making this feel like an ideal time to change the order of the three top US wireless service providers a little in the headlines of our articles covering these in-depth studies and extensive nationwide tests."
22,technology,A new diamond mirror can withstand a 10-kilowatt Navy laser beam,"Researchers from the Harvard John A. Paulson School of Engineering and Applied Sciences (SEAS) built an incredibly durable mirror out of diamonds that can harness the immense power of high-power continuous wave (CW) lasers, a press statement reveals. It could lead to new state-of-the-art applications in semiconductor manufacturing and deep-space..."
23,technology,Best Buy has a 75-inch TV for $600 in its Memorial Day sale,"Memorial Day is less than a a week away, but if you’re already too hyped up for the TV deals that the holiday will bring, the good news is that you can start shopping as early as now because some retailers have already rolled out their Memorial Day TV sales. If you’re planning to take advantage of a discount for a massive screen, you might want to consider Best Buy’s offer for the 75-inch Hisense A6G Series 4K TV, which brings its price down by $110 to a more affordable $600, from its original price of $710."
24,technology,Forget your wallet: It’s time to start paying for everything with your phone.,"
                    Tapping your phone will make even the biggest purchases seem harmless. Clay Banks / UnsplashMoney is just a concept."
25,technology,Man Backed for Insisting on Showing 'Son' Paternity Test,"""Kid has to find out sooner or later. Shame on his mother to lying to him for so long,""  one user said."
26,technology,Internet Backs Dinner Host Not Catering To Vegan Request: 'Unreasonable',The host was supported online by people who said the vegan guests had waited too long to explain their dietary requirements.
27,technology,"Amazon Prime Day Apple 2022: Dates and best deals to expect on AirPods, Watch and iPhones","Can you hear that? It’s the rumble rumble of Amazon Prime Day. It’s the whisper in the wind of deals, deals, deals. It’s the sound of the second biggest shopping event of the year (sorry Jeff), chugging along, getting closer and closer.That’s right, bargain hunters, the two-day shopping bonanza is thumping on the door, and if you’re an Apple fan, you’re not going to want to miss it.While it’s difficult to know which Apple devices exactly will be in the Prime Day sales this year – Amazon keeps those hush hush until the big day itself – we expect to see AirPods, Apple Watches, iPhones, MacBooks,..."
28,technology,Unplug These Home Appliances to Save Money and Electricity,"When you turn a device or appliance off, you probably assume that it's truly off and no longer drawing power. But that's not actually the case. Many common household appliances -- from your laptop charger to your printer -- run certain functions when plugged in and use up electricity even if the device itself isn't on."
29,technology,What to Do With Old Computers,"Technology is moving at an extreme rate. While we try to stay updated with the newer versions of computers, your current system in use gets outdated fast. We might want to get rid of the old PC simply because something is new on the horizon or if the old computer is broken. It doesn’t matter what the scenario is, there are tons of things you can do with the old PCs."
30,technology,Samsung’s 49-inch 4K gaming monitor is $400 off for Memorial Day,"Looking for one of the best gaming monitor deals around? We’ve spotted it in the form of the Samsung Odyssey Neo G9 49-inch Gaming Monitor. Normally priced at $2,300, it’s down to $1,900 at Samsung right now, saving you $400 off the usual price. While still one of the most expensive monitor deals out there, the considerable saving of 17% makes this a great time to treat yourself to one of the most high-end gaming monitors around. A pleasure to use whether you’re gaming, watching a movie, working, or simply browsing the internet, it’s a true powerhouse of a monitor. Buy it now while stocks last."
31,technology,Democrats say Google must curb location tracking before Roe repeal,A group of more than 40 Democratic members of Congress has asked Google to stop collecting and retaining “unnecessary” location data out of fear that it could be used to identify and prosecute people who have obtained abortions. The request was made in a letter sent to Google...
32,technology,Hide the Windows 11 system requirements not met warning,A few months ago Microsoft added a new warning to its Windows 11 operating system alerting you if you have inadvertently or possibly on purpose installed Windows 11 on a system not meeting the minimum system requirements Microsoft has listed on its website. If you have built a computer or loaded Microsoft’s latest OS onto an older system and would like to hide the system requirements not met warning this quick guide will take you through the process and the commands you need to carry out.
33,technology,Assassin's Creed Valhalla Update Comes With a Few Big Surprises,"A new Assassin's Creed Valhalla update is live on PC, PS4, PS5, Xbox One, Xbox Series S, Xbox Series X, Google Stadia, and Amazon Luna. Alongside the update, Ubisoft has gone ahead and released patch notes that reveal and detail everything the update has to offer, including a couple of new features and some new content as well."
34,technology,How to drop a pin in Google Maps,"Google Maps comes with a range of useful features, one of these is the ability to drop a pin in Google Maps, which allows you to mark a location on the map. This is a useful feature as you will be able to refer to that location later on and this can be done on Google Maps on a range of different devices. You can mark a location you are at with a pin on Google Maps or you can also mark another location on the app by searching for that location."
35,technology,What are you doing under the bed again?,There is always something fun under the bed.
36,technology,Every iPhone Camera Mode Explained,"The iPhone has multiple different modes in its Camera app, letting you take photos and videos of various types. There’s much to explore, and each mode has its own unique features. To change a camera mode, just tap the options at the bottom of the screen in the Camera app."
37,technology,How to get more security out of Android Messages,"Nothing is 100% secure. Period. If you connect a device to any type of network, you cannot guarantee its security. That's just a fact, and it's only getting worse with each passing day. But you certainly can't disconnect your devices from all networks and expect to accomplish anything. This means..."
38,technology,How to Check History on iPhone,"Do you want to know what information your iPhone is tracking about you? Do you want to keep a record and modify your vital details? Well, a good way of doing that is by checking the history on your iPhone. Your iPhone stores history in multiple apps, like browsers, App..."
39,technology,This portable wireless charger can bring your phone from dead to 100 percent in 30 minutes,"In this world, nothing is certain but death, taxes, and your phone running out of power when you need it the most. No matter how big the battery capacity of your smartphone is, it’s bound to deplete quickly, especially if you depend on it for most of the day."
40,technology,The 5 best robot mowers: Smart hands-free lawn care,"Robot mowers are fairly new lawn care technology. They operate in much the same way as a robot vacuum or mop does: moving in randomized patterns, avoiding obstacles with sensors, staying within boundaries set up by guidewires, and allowing scheduling and monitoring via Bluetooth companion apps. But instead of cleaning up spilled popcorn and pet hair, they cut your grass. Robot mowers are perfect for smaller suburban lawns because they have very small cutting decks, often just 8 or 9 inches wide. The included reels of guidewire also are often just big enough to mark off the edge of a quarter acre to half acre lot or the same size area of much larger lawns. The appeal of a robot lawn mower is that they are fully autonomous. Once you set up a schedule, you don't have to worry about being home to mow your lawn; the unit will leave the base station and start cutting the grass all on its own once it is time to start."
41,technology,The Best Battery-Powered Lawn Mowers of 2022,"Let's face it, battery-powered devices make life easier and much more convenient. That's why battery-powered lawn mowers have changed the game for lawn care. Electric lawn mowers are cordless, quiet, and have automated speed to adapt on the spot to any of your lawn care needs. These machines come in..."
42,technology,Today's Wordle Is Perfectly Average,"Today's Wordle puzzle is the definition of an average puzzle. According to the New York Times, players should be able to solve today's puzzle in an average number of guesses. We'll dig into today's Wordle puzzle later in the article, for those looking for some hints or clues. However, if you haven't done the puzzle yet, you may not want to scroll to the bottom of the article as we'll eventually discuss the answer."
43,technology,Researchers use AI to predict cancer risk of lung nodules,"An artificial intelligence (AI) tool helps doctors predict the cancer risk in lung nodules seen on CT, according to a new study published in the journal Radiology. Pulmonary nodules appear as small spots on the lungs on chest imaging. They have become a much more common finding as CT has gained favor over X-rays for chest imaging."
44,technology,Apple May Be Bringing Back A Classic Internet Device,"Following the end of Apple's AirPort in 2018, Apple hasn't had a network adapter for sale. That appears to be changing, according to an FCC filing."
45,technology,"If You End up Receiving a Snapchat That Reads ""GNS,"" Here's What It Means","Nothing makes us feel older than reading the acronyms Gen Z children use to communicate with their friends on social media platforms, specifically Snapchat. From ""SSB"" to ""FAOTP,"" we honestly can't keep up with the modern-day teenage lingo. Article continues below advertisement. The latest Snapchat acronym to stump us is..."
46,technology,How To Clear Your Gmail Cache,"While keeping your data cached makes website loading and usage easier, there are times when it's good to clear your Gmail cache. Here's how to do so."
47,technology,"Samsung is investing $356 billion in chips, biotech and AI","Many folks mainly associate Samsung with smartphones and TVs, but the company is looking at other parts of its business for long-term growth potential. In the five years to 2026, it will plow 450 trillion won ($356 billion) into strategic areas, with a focus on things like semiconductors, biotechnology and artificial intelligence."
48,technology,This Asus Chromebook is $99 at Best Buy for Memorial Day 2022,"While retailers are preparing to launch their Memorial Day sales, impatient shoppers who are planning to buy a new laptop can actually already start availing discounts that have rolled out ahead of the holiday. For those on a tight budget, you might want to try looking at Chromebook deals, as they’re generally cheaper than traditional laptops. For example, Best Buy is offering the Asus 11.6-inch Chromebook for just $99, in an early Memorial Day sale that slashes $120 off its original price of $219."
49,technology,PlayStation Confirms Disappointing PS3 News for PS Plus Subscribers,"""Disappointing news"" and ""PS3"" go together like Ratchet & Clank. Arguably the most disappointing mainline PlayStation console to date, Sony got a lot wrong with the PS3. Only one of these mistakes has haunted Sony well beyond the PS3's years though and that's the architecture of the console. The PS3 boasts a hyper unique architecture that doesn't play nicely with anything. This unique architecture was notoriously hard to develop games for, and since then, it's given Sony a major headache in terms of backward compatibility. Put simply, games built to the architecture of the PS3 aren't easy to get running on other hardware, which is why PS3 backward compatibility has been limited to streaming. There are rumblings this could change in the near future, but it hasn't changed yet."
50,technology,Walmart is expanding its drone delivery service across six states,"For nearly two years, Walmart has been across parts of the US. Now the company says it’s ready to expand that offering. By the end of the year, the retailer to its existing DroneUp network. With the expansion, approximately 4 million households in Arizona, Arkansas, Florida, Texas, Utah and Virginia will have access to drone deliveries from the retailer. For a delivery fee of $4, you can order up to 10 pounds of groceries and household items. If you use the service, Walmart says to expect your package in “as little as” 30 minutes."
51,technology,"Amazon Alexa Guessing Game Calls Amber Heard 'Abusive,' 'Liar'","In the game, the Akinator virtual assistant asks a series of questions to identify Heard, including, ""Does she have borderline personality disorder?"""
52,technology,"Activision Blizzard workers vote to unionize, a first for a large U.S. video game company","Video game workers at a division of game publisher Activision Blizzard are waiting to find out if they've formed the first labor union at a large U.S. video game company. A count of ballots on Monday will reveal the results of an election affecting a small group of Wisconsin-based quality assurance testers at Activision Blizzard's Raven Software, which develops the popular Call of Duty game franchise."
53,technology,Hackers can pre-hack your online accounts before you've even registered,"Thanks to a few features that weren’t well thought-through, cybercriminals can break into online accounts (opens in new tab) on some of the internet’s biggest platforms, without ever knowing the passwords. All they need to know, according to researchers investigating the matter, is the victim’s email address, and that is hardly a problem these days."
54,technology,Latest Street View app update will send you back in time,Google Maps is celebrating its 15th anniversary by taking mobile Street View viewers on a trip down memory lane. Google announced on Tuesday that it is implementing a new feature that will allow people using the app worldwide to see historical imagery on their phones. Anyone using the desktop version...
55,technology,Save $200 on the LG C1 OLED TV in the Best Buy Memorial Day sale,"While it isn’t Memorial Day yet, big retailers like Best Buy have started slashing prices on top-rated TVs. You can find Memorial Day TV sales with massive discounts, making it a great time to upgrade your home theater setup. One of the best OLED TV deals you can find today on Best Buy is this offer on a 55-inch LG C1 OLED 4K TV. This gorgeous display is on sale for just $1,100, a $200 discount on the regular price of $1,300. Keep reading to discover why you should make the jump to OLED."
56,technology,Google Maps Has A New Street View Camera: Here's How To Spot It,"Google Maps Street View photo capture system just got an upgrade -- if you'd like to see one in the wild, here's what you're going to be looking for, soon."
57,technology,"EcoFlow Wave portable air-conditioner from $1,199 for a limited time","EcoFlow, well-known for its range of portable power stations, has this month launched its very first portable air-conditioner designed to be used in vehicles, tents, small buildings or apartments. To help keep your surrounding temperature at a comfortable level wherever you may be. The new EcoFlow Wave Portable Air Conditioner is now available to preorder priced at $1,199 for a limited time to celebrate the launch of the innovation."
58,technology,Call Of Duty: Modern Warfare 2 Finally Has A Release Date,"The next hotly anticipated installment in the ""Call of Duty"" franchise will be a sequel to 2019's ""Modern Warfare,"" and we finally know when it'll arrive."
