,categories,headers,contents
0,politics,Congressman Dan Crenshaw says Marjorie Taylor Greene is ‘going after that Russia Today slot’ in row over Ukraine vote," Representatives Dan Crenshaw and Marjorie Taylor Greene feuded on Twitter after the two Republican members of Congress took different votes on an aid package to Ukraine.On Tuesday, the House passed a $40bn aid package to Ukraine. Every Democrat present voted for the legislation, while 57 Republicans voted against the package, including Ms Greene. Other Republicans who voted against the legislation included Representatives Paul Gosar of Arizona, Matt Gaetz of Florida, Madison Cawthorn of North Carolina and Lauren Boebert of Colorado. But the feud began when Mr Crenshaw, a Texas Republican who lost an eye while serving in Afghanistan, tweeted..."
1,politics,"Fleeing Russian soldiers left behind key military documents that indicated Putin had plans to seize all of Ukraine, officials said",The military documents were discovered by Ukrainian forces who liberated the northeastern town of Trostyanets in Sumy Oblast.
2,politics,"Raphael Warnock's Chances of Beating Herschel Walker, According to Polls",The Georgia Democrat hopes to defend his hard-won Senate seat against the Trump-backed former NFL player.
3,politics,"Benjamin Ferencz is the last surviving Nuremberg prosecutor. He says Vladimir Putin is ""certainly"" a war criminal.","London — As Ukrainian authorities and the international community work to meticulously collate mounting evidence of Russian war crimes in Ukraine, the last surviving prosecutor from the Nuremberg trials of World War II-era Nazi officials told CBS News that Russian President Vladimir Putin is ""certainly"" a war criminal. Benjamin..."
4,politics,‘I became the abortion lady of Mississippi’: the mother of seven who devoted her life to the pro-choice cause,"Raised a fundamentalist Christian, Laurie Bertram Roberts grew up believing abortion was evil. Then a pregnancy put her life at risk – and she was denied the termination she desperately needed. When Laurie Bertram Roberts was 17, she was sent home from hospital and almost bled to death. Pregnant..."
5,politics,"Putin Has a Military Rebellion Problem on His Hands, Reports Say","""There are good reasons for low morale on the Russian side,"" an expert told Newsweek. ""The war isn't going well."""
6,politics,Lindsey Graham says most Democrats would 'jump out the window' if they had to vote on Medicare for All,"Graham urged Sanders to hold a vote on his signature policy idea, betting Democrats would splinter on single-payer healthcare."
7,politics,Video of Russian Tank Blowing Up in Ukraine Captured by China State Media,The dramatic footage was captured by a dashcam in a vehicle headed in the direction of the blast.
8,politics,‘They were furious’: the Russian soldiers refusing to fight in Ukraine,"When the soldiers of an elite Russian army brigade were told in early April to prepare for a second deployment to Ukraine, fear broke out among the ranks. The unit, stationed in Russia’s far east during peacetime, first entered Ukraine from Belarus when the war started at the end of February and saw bitter combat with Ukrainian forces."
9,politics,Russian military leaders ‘sacked and arrested’ amid heavy battlefield losses," Chief of the Russian general staff, Valery Gerasimov, has been suspended amid the Kremlin’s faltering invasion, a senior Ukrainian official has claimed.Oleksiy Arestovych, a military adviser to Ukraine's president, said “preliminary information” suggested Gen Gerasimov had been removed from his post while Vladimir Putin and his inner circle assessed whether he should be allowed to continue to lead the country’s armed forces. There has been no official confirmation of the reported sacking, although speculation about a purge of senior military commanders increased after Gen Gerasimov was absent from Russia’s annual Victory Day parade on Monday. Russian armed forces have..."
10,politics,Russia threatens ‘full-fledged nuclear war’ with NATO,"Deputy Chairman of Russia’s Security Council Dmitry Medvedev warned on Thursday that the North Atlantic Treaty Organization’s (NATO) continued support of Ukraine against Russian invasion forces raises the risk of the conflict “turning into a full-fledged nuclear war.”. In a post on the Telegram app, Medvedev accused..."
11,politics,Russian army ‘lose entire battalion’ trying to cross Ukraine bridge," The Russian army has suffered heavy losses, including the destruction of around three dozen tanks, after the Ukrainian army blew up a pontoon bridge over the Siverskyi Donets river in the Luhansk region, according to reports.Satellite images collected by geospatial intelligence firm BlackSky show that a pontoon bridge – used primarily but not invariably for military purposes – was destroyed on 10 May after Ukrainian artillery struck the bridge and surrounding area.The images show smoke emanating from the half-sunken bridge with destroyed armoured vehicles lying on the shores of the Siverskyi Donets river, running west to east between Russian rebel-controlled..."
12,politics,Joe Biden Jokes Republicans Are Going To ‘Storm Cinderella’s Castle’ Over Disney’s Opposition To FL Law,"President Joe Biden took aim at the Republican party’s recent attacks on the Walt Disney Corporation. During his speech at the Democratic National Committee fundraiser on Wednesday (May 11), Biden cited attempts from GOP members to dismantle Disney’s special tax district in Orlando after the company opposed the law prohibiting classroom discussions of sexual orientation or gender identity, dubbed the “Don’t Say Gay” bill. He also slammed Republicans trying to restrict speech via book bans in other states, such as Tennessee."
13,politics,Dramatic new videos show Russian tanks being blown sky-high in Ukraine,"Dramatic new videos show a column of Russian tanks being picked out and blown up — while another explodes in a massive ball of flames, with debris blown sky-high in front of watching motorists.

Ukraine’s 54th Mechanized Brigade, based in the Donbas region, shared footage Tuesday of a platoon getting destroyed — setting the clip to upbeat, patriotic music.

The clip shows the line of tanks driven by invading troops — whom the unit termed “tourists” — driven along an unidentified road as smoke from repeated airstrikes fills the sky.

Several of the military vehicles then suffer direct hits, bursting into balls of..."
14,politics,Legal expert finds “fatal flaw” in Samuel Alito’s leaked abortion opinion,"The leaked draft Supreme Court decision overruling Roe v. Wade has a fatal flaw, according to the off-air legal analyst for MSNBC's ""The Rachel Maddow Show."" ""Beyond the practical consequences of overturning Roe, however, then there are the legal analyses of Justice Samuel Alito's draft. Before detailing why that draft is so flawed legally, a brief outline of Justice Alito's approach is in order. In concluding that Roe and Casey 'must be overruled,' Alito reasons that because 'the Constitution makes no reference to abortion,' the right to abortion, like any right purportedly implicit in the Constitution, can be recognized only if it is 'deeply rooted in this Nation's history and tradition' and 'implicit in the concept of ordered liberty.'"""
15,politics,Ukraine conflict: Russian soldiers seen shooting dead unarmed civilians,"When Leonid Pliats and his boss were shot in the back by Russian soldiers, the killing was captured on CCTV cameras in clear and terrible detail. The footage, which was obtained by the BBC, is now being investigated by Ukrainian prosecutors as a suspected war crime. It was the height..."
16,politics,Ukraine hails key new victory as satellite pics show scores of blown-up Russian tanks,"Russia’s military has suffered yet another crushing defeat, with satellite images showing the burned-out shells of scores of tanks thwarted from crossing a key route near Ukraine’s second-largest city, Kharkiv.

Ukraine’s Ministry of Defense on Wednesday shared images of the destroyed military vehicles littered around the Siverskiy Donets River, an area Russia previously controlled around 25 miles east of Kharkiv.

Some of the still-smoking vehicles were right on the banks of the river, where at least two pontoon bridges appeared to have been blown up to halt the advance.

The Ukraine defense ministry gloated Wednesday that some of the destroyed tanks “bathed in..."
17,politics,"President Biden Orders Flags Be Flown at Half-Staff Until Monday, May 16","- - - - - - - BY THE PRESIDENT OF THE UNITED STATES OF AMERICA. Today, we mark a tragic milestone: one million American lives lost. to COVID-19. One million empty chairs around the dinner. table. Each an irreplaceable loss. Each leaving behind a family,. a community, and a..."
18,politics,Congressmen: Whistleblower evidence shows Biden’s DOJ is targeting parents with FBI investigations,"(The Center Square) – Despite sworn testimony by U.S. Attorney General Merrick Garland that the U.S. Department of Justice isn’t targeting parents after he directed the department to do so last fall, a whistleblower has come forward to the House Judiciary Committee providing evidence that the FBI is in fact investigating parents."
19,politics,"Former staff at Lauren Boebert’s restaurant call her a ‘monster’ who once pointed gun at Obama supporter, report says"," Former staff at the Colorado restaurant run by Republican Lauren Boebert have called her a “monster” and claimed that she once pointed a gun at an Obama supporter, according to a report. The GOP congresswoman owns Shooters on Main Street in Rifle, Colorado, along with her husband and she has promoted her business experience repeatedly during her political career.But progressive magazine Mother Jones has reported that several restaurant employees claim they had a less than stellar experience working at the diner, alleging that Ms Boebert at times failed to pay her employees in a timely manner. Several workers said..."
20,politics,Tax professionals ‘horrified’ by IRS decision to destroy data on 30 million filers,"The IRS destroyed data for an estimated 30 million filers in March 2021, according to the Treasury Inspector General for Tax Administration. The decision, prompted by a backlog of paper filings, has sparked anger in the tax community. “It just further damages the IRS’ reputation in the business community and..."
21,politics,Thomas Jefferson once secretly wrote to Congress that the US would try to drive Native Americans into debt in order to take their land,"The note to lawmakers in 1803 was referenced in a report on US Indian Schools, where Native American children were forcibly assimilated and abused."
22,politics,Psaki says she regrets comment about sending Covid tests to every American: ‘I had just hit my limit’," Outgoing White House Press Secretary Jen Psaki has said that she had hit her “limit” in terms of questions about Covid tests when she previously asked, “should we just send one to every American?” in response to a reporter’s question. In December of last year, Ms Psaki was repeatedly asked about the availability of Covid tests in the US, leading to her eventually responding in a tone some considered sarcastic or mocking.Almost two weeks later, the government bought 500 million tests to send to Americans.On Thursday, Ms Psaki took part in an event hosted by the Christian Science Monitor,..."
23,politics,Republican senator Rand Paul blocks $40bn aid package to Ukraine despite GOP move to pass it," Senator Rand Paul blocked the Senate’s attempt to pass a $40bn aid package to Ukraine despite the fact leaders from both parties wanted to pass it. Senate Majority Leader Chuck Schumer requested unanimous consent to pass the legislation on behalf of himself and Senate Minority Leader Mitch McConnell. “We have a moral obligation, a moral obligation, to stand with Ukraine in its fight against [Russian President Vladimir] Putin’s immoral war,” Mr Schumer said. Earlier this week, the House of Representatives passed the legislation, but Mr Schumer faulted Mr Paul, who serves as a Senator from Kentucky alongside Mr McConnell.“He..."
24,politics,Judge orders Steele dossier firm Fusion GPS to turn over 22 emails to John Durham,"Special counsel John Durham scored a victory Thursday when a federal judge ordered the research firm behind the infamous “Steele dossier” to turn over nearly two dozen emails regarding its work with Hillary Clinton campaign lawyer Michael Sussmann.

The 22 emails had not been turned over to the special counsel by research outfit Fusion GPS after the Clinton campaign asked them to assert attorney-client privilege and “work-product” privilege over the communications. 

The emails, which largely consist of internal communications between Fusion employees, don’t fall under those protections, in part because they show Fusion employees were planning to push their findings to..."
25,politics,Jan. 6 committee opens a Pandora’s box of retaliation,"The Jan. 6 committee's decision to issue five major subpoenas Thursday — two targeting potential House Speaker Kevin McCarthy and Judiciary Committee Chairman Jim Jordan — is likely to open a Pandora's box of retaliation. Why it matters: The GOP was already plotting revenge, and now the minority..."
26,politics,DARPA's hypersonic missile countermeasure has taken a major step forward,"The U.S.'s ability to counter emerging hypersonic threats has completed a major milestone as the Defense Advanced Research Projects Agency (DARPA) announced Phase 2 of the Glide Breaker Program. Among its other projects, DARPA is also focusing on the development of the hypersonic missiles which are currently under flight testing...."
27,politics,Russian logistics ship ‘on fire in Black Sea after Ukrainian strike’," A Russian logistics ship caught fire after after being struck in the Black Sea, forcing it to return to port, according to a Ukrainian official. Vsevolod Bobrov was apparently hit off the coast of Snake Island and was left “limping” back to Sevastopol. Serhiy Bratchuk, a spokesman for the Odesa Regional Military Administration, said: “As a result of the actions of our Navy, the Vsevolod Bobrov logistics ship, one of the newest in the Russian fleet, set on fire. They say she is limping toward Sevastopol.”However the spokesman added that “the information is yet to be clarified”, and The..."
28,politics,Ukraine news — live: Russian navy ship ‘on fire’ in Black Sea," Ukrainian forces have set a Russian navy logistics ship on fire in the Black Sea, it has been claimed.The reported strike is said to have occurred near Snake Island, which was made famous earlier in the war when a Ukrainian soldier stationed there told a Russian warship to “go f*** yourself”. The claim about the Vsevolod Bobrov was made by Serhiy Bratchuk, a spokesperson for the Odesa regional military administration. The Independent has been unable to independently verify the report. The development comes as the Kremlin threatened to take “retaliatory steps” if Finland joins Nato, following Helsinki’s announcement on..."
29,politics,Trainer Of Kentucky Derby Winner Grilled On Nasty Kamala Harris Tweet,"ESPN tried to corral Eric Reed, who trained long shot winner Rich Strike, about the sexist slur."
30,politics,"Russia-Ukraine war: Moscow warns of ‘retaliatory steps’ over Finnish Nato bid; Russia inflicting ‘pure evil’, says Ukraine – live",Kremlin says Nato expansion ‘will not make the world more stable’; Ukraine’s deputy condemns ‘endless human rights violations’ in address to UN
31,politics,House passes bill aimed at curbing the $2.9 billion seniors lose each year to financial scams,"Unsuspecting older Americans get duped by financial scams every year. Now, a bill in Congress aims to to increase regulators' abilities to help end that. ""No one from the IRS is going to call you and ask you to send money,"" one expert says. ""Only scammers do that."" Older Americans..."
32,politics,Children of Capitol riot defendant and Oath Keepers leader Elmer Stewart Rhodes said their father was once 'very critical' of Trump,Rhodes' adult children told SPLC's Hatewatch that their father changed his opinion as he became increasingly afraid a Democratic president would take power.
33,politics,Meatpackers convinced Trump officials to keep plants running during COVID crisis -U.S. House report,"May 12 (Reuters) - Top U.S. meatpacking companies drafted the executive order issued by President Donald Trump in 2020 to keep meat plants running and convinced his administration to encourage workers to stay on the job at the height of the COVID-19 pandemic, according to a report released on Thursday by a U.S. House panel."
34,politics,Rep. Marjorie Taylor Greene's campaign had one last hurrah at Trump's DC hotel just before it got sold,The campaign for the Trump ally dined at his hotel right before new owners took over.
35,politics,Russia warns NATO there’s a risk of ‘catastrophic’ conflict; Ukraine counterattack near Kharkiv continues,"This is CNBC's live blog tracking developments on the war in Ukraine. See below for the latest updates. The former president of Russia has warned NATO that military assistance for Ukraine risks sparking a wider conflict. Dmitry Medvedev, a close ally of President Vladimir Putin, said the supply of weapons..."
36,politics,Russia threatens 'retaliatory steps' if Finland joins NATO,"Russia has slammed Finland's announcement that it could apply to join the Western military alliance NATO in a matter of days. ""Russia will be forced to take retaliatory steps, both of a military-technical and other nature, in order to stop threats to its national security arising,"" the Foreign Ministry said in a statement."
37,politics,Rand Paul blocked a bill that would keep judges' personal information from showing up online. He wants the same protections for lawmakers.,"The Kentucky Republican has complained about threats to him and his family. More Paul blocking: A bill that would limit the posting of federal judges’ personal information to the internet hit a roadblock in the Senate again Thursday, after Sen. Rand Paul (R-Ky.) insisted that the measure be expanded to cover members of Congress."
38,politics,A Capitol riot defendant asked a court if he could have 2 guns confiscated from him returned so he can kill snakes on his property,"Lawyers for Charles Hand argued that he needs the two firearms to protect himself in ""the back country of rural Georgia,"" court documents say."
39,politics,Ukraine says it blew up Russian pontoon bridges over a key river — and units trying to cross it,"Ukraine’s military says it blew up a key Russian crossing on the Siverskyi Donets River on its eastern front, inflicting heavy losses in a potentially significant blow to the Kremlin’s designs on the regions of Luhansk and Kharkiv. Images shared by the defense ministry appeared to show a..."
40,politics,Clearview AI clears the final hurdle in its quest to undermine US democracy,"The ACLU and Clearview AI, a controversial facial recognition company, reached a legal settlement earlier this week that’s been hailed as a huge win by both parties. The big story here is that Clearview AI can no longer sell its databases to third party companies — but that’s not exactly news."
41,politics,"Conservative commentators, former Trump officials sign statement against American 'self-doubt'","Conservative figures including former Trump administration officials, current members of Congress, professors, and media personalities have signed onto a statement lamenting what they call ""an age of increasing national self-doubt"" in the U.S., blaming leftist ideologies for bringing down the ""national mood"" and vowing to ""reclaim"" and positive attitude about the U.S."
42,politics,Military Expert Gives Putin's Forces 90 Days in Ukraine,A military expert told Newsweek he feels Putin's forces are wearing thin and can't continue the war for much longer in Ukraine.
43,politics,Russia says Finland's race to join NATO poses threat,"Russia is lashing out after Finland said it is applying to NATO. Russia cut off gas supplies to Europe, a day after the Ukrainian government halted gas transfers through its territory. Charlie D'Agata reports."
44,politics,Russian troops are resorting to dishwasher and refrigerator parts to fix military equipment—and the U.S. is taking credit,"Sign up for the Fortune Features email list so you don’t miss our biggest features, exclusive interviews, and investigations. Russian troops are using parts from dishwashers and refrigerators to fix their broken military equipment in Ukraine, a top U.S. official has said. U.S. Commerce Secretary Gina Raimondo told lawmakers..."
45,politics,"Ukrainian forces prevented attempted Russian river crossing in the Donbas, Britain says","May 13 (Reuters) - Ukrainian forces successfully prevented an attempted Russian river crossing in the Donbas, the British defence ministry said in a regular Twitter bulletin on Friday. Images suggest that Russia has lost armoured manoeuvre elements of at least one battalion tactical group and the deployed pontoon bridging equipment..."
46,politics,Liberals Are Celebrating a New Book on Rural Trump Voters That Falls Apart Under the Simplest Inspection,"This past week, Maine Democratic state Sen. Chloe Maxmin has received glowing media attention for a new book about how to woo rural Donald Trump supporters. Maxmin, a 29-year-old first-term state senator and former member of Maine’s House of Representatives, and her campaign manager, Canyon Woodward, argue in their book “Dirt Road Revival: How to Rebuild Rural Politics and Why Our Future Depends on It” that the Democratic Party has “abandoned rural communities” and given up on trying to persuade people who disagree with them. Their book tour, which has stretched from the pages of the New York Times and Teen Vogue to the studio of Bill Maher, has focused on the insights she says she gleaned in flipping a rural state Senate district."
47,politics,The Far-Right Is Doxxing Judges and Calling For Their Assassinations,"As peaceful protesters camp outside the homes of Supreme Court justices after the leaked draft that would overturn Roe v. Wade, far-right activists are doxxing Democratic federal judges and calling for their assassination. The posts, which appear on a far-right Telegram channel, feature the names and addresses of federal court..."
48,politics,Panzerfaust 3: The Cold War weapon wrecking Russian tanks in Ukraine,"Editor’s note: This article was first published on HistoryNet, our sister publication. Subscribe to its newsletter here. Though the Russian Army was once vaunted as the second-best military in the modern world, the greatly underestimated Ukrainian military has showed it up again and again, seemingly with only national pluck and a hodgepodge of donated weapons from sympathetic Western countries."
49,politics,Israel’s Mossad says it stopped Iranian plot to assassinate US general,"Israel’s Mossad spy agency has claimed it recently thwarted an Iranian assassin’s plot to murder a US general stationed in Germany, an Israeli diplomat in Turkey and a journalist in France. 

Mossad agents said the man they apprehended late last month on Iranian soil is an alleged gang member with ties to Iran’s elite Islamic Revolutionary Guard Corps, the Jerusalem Post reported Thursday. 

The suspect, Mansour Rasouli, 52, admitted during the April 30 interrogation that he’d been assigned to carry out the triple assassination, the outlet said.

Iran was reportedly willing to pay more than $1 million for the targets. 

Rasouli,..."
50,politics,Kathy Barnette's Chances of Beating Dr. Oz in Pennsylvania Primary,The political newcomer has seen a poll surge in recent weeks and now stands a good chance against the celebrity heart surgeon endorsed by Donald Trump.
51,politics,Russian Soldier Says Body Armor Supplied by Military Is 'Terrible',One Russian soldier reportedly asked his mother to send money so he can purchase better protective armor.
52,politics,Experts: Arizona executioners took too long to insert IV," The first execution in Arizona in nearly eight years was carried out more smoothly than the state’s last use of the death penalty, when a condemned prisoner who was given 15 doses of a two-drug combination gasped for air hundreds of times over nearly two hours.The lethal-injection death of Clarence Dixon on Wednesday at the state prison in Florence for his murder conviction in the 1978 killing of 21-year-old Arizona State University student Deana Bowdoin appeared to follow the state’s execution protocol: After the drug was injected, Dixon’s mouth stayed open and his body did not move. He was..."
53,politics,Body doubles will reportedly replace ailing Putin during upcoming surgery,"As Vladimir Putin’s health reportedly declines, body doubles have been put on alert to stand in for the Russian not-so-strongman when he undergoes surgery, according to a report.

Putin will be out of commission for up to 10 days and the body doubles will be used to make it seem like he’s still in control of the country, the anti-Putin Telegram channel “General SVR” reported.

The mysterious Telegram account also claimed that pre-recorded footage will be released of Putin attending meetings and signing laws to make it seem like he is still working.

The channel — which is purportedly run by a former..."
54,politics,Ukrainian Soldier Reveals How He Secretly Blew Up Russian Bridge,A military engineer in the Ukrainian army explained how he spotted where the Russian troops would have tried to cross the Siverskyi Donets river.
