,categories,headers,contents
60,weather,Sunshine and 70s for Mother's Day,"Clear skies remain in the forecast for tonight, which will allow temperatures to drop into the lower 40s tomorrow morning. Mother’s Day looks to be very nice with plenty of sunshine and high temperatures in the lower 70s. We will stay on the warming trend heading into next week with highs on Monday in the upper 70s, then the rest of the week in the low to mid 80s. Monday afternoon winds will increase out of the south to southwest making for very breezy conditions. These winds will move some moisture into the area, which will leave conditions on the muggy side. Right now, most of next week looks to stay dry, but with the heat and humidity, we may have to watch for a few isolated thunderstorms to return for Tuesday and Wednesday afternoon."
61,weather,A very dry 7-day forecast starting on Mother's Day!,"Highs today will be chilly in the mid-50s, with decreasing clouds this evening. Rain showers will be sticking with us for the rest of the morning; however, they will start to taper off into the afternoon. With it being Mother's Day weekend, today is a perfect day to stay inside and celebrate mom or get to do some spring cleaning for mom."
62,weather,Hot & dry Mother's Day,Warm if you are heading out this evening. Temperatures will be falling through the 80s. We'll eventually bottom out in the low-70s by tomorrow morning. Mother's Day will start out with a decent amount of clouds and perhaps even some patchy fog.
63,weather,Light Rain and Clouds Today,"Saturday is still a soggy day with chances of rain through a majority of the day. A few rumbles of thunder through the afternoon shouldn’t come as a surprise either! Highs in the 60s. Severe weather does not look likely on Saturday. Sunday, we begin to dry out and..."
64,weather,"Yankees, Rangers weather forecast: Rained out for 2nd day in a row | What it means (5/7/22)",The start of the New York Yankees and Texas Rangers’ weekend series at Yankee Stadium was rained out for a second day in a row. Friday night’s scheduled series opener was rained out and the same thing occurred on Saturday with the weather forecast is horrible all day and night. It was pouring in New York when the game was occurred at 9:05 a.m.
65,weather,Drying out overnight; remaining cool & cloudy for Mother’s Day,Rain showers will continue to taper off throughout tonight. Most of us will be dry beginning around sunset. Temperatures will be cooler tonight with lows dropping back down into the 40s. MOTHERS’ DAY. Our weather maker will continue to push to the east taking the precipitation with it for...
66,weather,Large Pattern Shift to Bring Summer-Like Heat this Week..,"As low pressure along the Mid-Atlantic Coast gradually pulls away, high pressure over the Central US begins to invade the region bringing clearing to the area overnight and into your Sunday morning. With the return of May sun, temps will improve quickly after a cool start, into the upper 60’s..."
67,weather,Cool Mother's Day with nice weather next week,Cooler weather sticks around this week in the Midlands. Rain chances should hold off until the end of the week.
68,weather,"Weather Now: Dry, Windy Mother’s Day","Most of the rain showers missed us Saturday, but the wind and chilly temperatures certainly didn’t! Afternoon highs were only in the low 50s, but wind chills were in the low 40s at times with the gusty winds. Overnight, outside of a few passing showers toward the coast, will..."
69,weather,Yankees' Gerrit Cole: Saturday's matchup called off,"Cole and the Yankees won't play Saturday against the Rangers after the game was postponed due to inclement weather. Cole was initially slated to start Friday against Texas, but he'll be pushed back once again after a second consecutive game was postponed. Saturday's game will be made up Monday, while Cole will start in Sunday's matinee against the Rangers, Kennedi Landry of MLB.com reports."
70,weather,"To the showers! 6 MLB rainouts, most in a day since 2018","All-Star aces Max Scherzer, Shane Bieber and Gerrit Cole all got early showers Friday. So did many other players after six games were rained out, the most Major League Baseball postponements in a day because of inclement weather since 2018. Wrigley Field, Yankee Stadium and Camden Yards were among the..."
71,weather,"N.J. weather: Coastal storm brings wind, rain, dreary conditions through Mother’s Day","A slow-moving rain and wind storm continues to impact New Jersey’s coastal communities Saturday, with the National Weather Service issuing high wind warnings and coastal flood warnings for the Shore along with advisories for other parts of the state. Northeast winds of 25 to 30 mph, with gusts as..."
72,weather,"UPDATE: Yankees, Rangers weather forecast: Rained out for 2nd day in a row | What it means (5/7/22)",NEW YORK — The start of the New York Yankees and Texas Rangers’ weekend series at Yankee Stadium was rained out for a second day in a row. Friday night’s scheduled series opener was rained out and the same thing occurred on Saturday with the weather forecast is horrible all day and night. It was pouring in New York when the game was occurred at 9:05 a.m.
73,weather,"Heavy Rains, Tornadoes Across the Central Plains – AgFax","This US Drought Monitor (USDM) week was marked by ongoing active weather across areas of the conterminous US including the Pacific Northwest, Northern Rockies, Plains, Lower Midwest, and isolated areas of the South and Southeast. The most severe weather was observed across the Central Plains and areas of the Midwest where numerous tornadoes touched down in areas including eastern Kansas, southeastern Nebraska, and northern Illinois."
74,weather,Damage at Texas RV Park as Storms Tear Across Plains For a Second Day,"Damage occurred at an RV park in East Texas. Storms moved through the area Thursday afternoon. It was the latest in a series of tornadoes and severe weather across the region. A home was flipped on its side and several campers damaged at an RV park in east Texas Thursday afternoon as severe weather continued across the Plains for a second day, bringing tornadoes, hail and flooding."
75,weather,Adley's imminent arrival start of 'big wave' of young talent,"BALTIMORE — This weekend’s inclement weather forced the Orioles to extend their homestand by a day, keeping them at Camden Yards through Monday before they embark on a six-day road trip through the upper Midwest. It may be their last day at home without Adley Rutschman﻿. No,..."
76,weather,"Weekend Weather (May 7-8): Isolated Rains to Lash Himachal, Ladakh, Jammu and Kashmir, Odisha, Karnataka and Tamil Nadu","Here's the latest weather outlook for India for the next two days:. Widespread rains with locally heavy falls, thunderstorms and gusty winds are likely over the Andaman & Nicobar Islands. Scattered showers and thunderstorms are expected over Sikkim, Arunachal Pradesh, Assam, Meghalaya, Nagaland, Manipur, Mizoram, Tripura, West Bengal, and Kerala."
77,weather,Rangers' Glenn Otto: Saturday's game postponed,"Otto and the Rangers won't play Saturday against the Yankees after the game was postponed due to inclement weather. Otto's scheduled start will be pushed back once again after a second consecutive game was called off due to inclement weather. Although Saturday's game will be made up Monday, Otto will start in the second game of Sunday's doubleheader against the Yankees, Kennedi Landry of MLB.com reports."
78,weather,Suddenly summer! First heat wave of 2022 on tap for south-central US,"The year's first heat wave is brewing for the south-central United States, and AccuWeather meteorologists say temperatures that are typical of midsummer will expand across much of the central Plains and the Ohio Valley to the Great Lakes region and even part of the interior Northeast as well next week."
79,weather,Yankees' Gerrit Cole: Strikes out 10 in no-decision,"Cole allowed a run on five hits and a walk while striking out 10 in 6.1 innings during the win over the Rangers in the first game of Sunday's doubleheader. He didn't factor into the decision. Although Cole had his scheduled start pushed back two days due to inclement weather,..."
80,weather,Two damaging tornadoes hit central North Carolina,"Two tornadoes were reported in central North Carolina on Friday afternoon, making it the ninth consecutive day with twisters somewhere in the United States."
81,weather,"A major disaster is declared in New Mexico, unlocking federal aid as wildfires threaten thousands of homes","(CNN) — Wildfires and straight-line winds that have ravaged New Mexico for a month have created a major disaster, President Joe Biden declared, unlocking critical federal aid as the state continues to battle the largest wildfire burning in the United States. The presidential action Wednesday makes federal money available..."
82,weather,"Severe weather to threaten over 30 million Thursday, Friday","Additional rounds of damaging storms and tornadoes are in the offing for the southern U.S. through the end of the week in what has been a tumultuous start to May. It has been a volatile weather week in the central United States with some locations, such as Seminole, Oklahoma, being hit with three tornadoes, with two of those Wednesday alone. AccuWeather meteorologists say that the southern Plains will catch a break at the end of the week, but areas farther east will be at risk for damaging weather into Friday."
83,weather,"Taiwan rattled by 6.1 magnitude quake, no immediate damage reported","TAIPEI, May 9 (Reuters) - Buildings shook briefly in Taipei on Monday as a 6.1 magnitude earthquake struck off Taiwan's eastern coast, but there were no immediate reports of damage. The quake had a depth of 27.5 km (17.1 miles) with its epicentre off Taiwan's east coast, roughly halfway between..."
84,weather,Rangers' Dane Dunning: Lasts seven innings Sunday,"Dunning allowed a run on two hits and three walks while striking out five in six innings during the loss to the Yankees in the first game of Sunday's doubleheader. He didn't factor into the decision. Dunning earned his first win of 2022 during his last start, and he posted..."
85,weather,Strong earthquake shakes Taiwan,"TAIPEI, Taiwan (AP) — A magnitude 6.1 earthquake has been detected off eastern Taiwan. Taiwan authorities said the earthquake Monday afternoon was 27 kilometers deep. No damages have been reported yet."
86,weather,Dry weather in France will cause irreversible damage to crops -Expert,"PARIS, May 5 (Reuters) - Dry, hot weather in France in the coming 10 days after several months of little rainfall will cause irreversible damage to grain crops in the European Union's largest grains producer, a technical institute said on Thursday, adding to worries about tight global supplies. European wheat..."
87,weather,Royals' Carlos Hernandez: Saturday's matchup called off,"Hernandez and the Royals won't play Saturday against the Orioles after the game was postponed due to inclement weather. The Royals and Blue Jays are already scheduled for a doubleheader Sunday after Friday's matchup was called off, so Saturday's matchup will be made up Monday. Hernandez will take the mound Monday since Daniel Lynch is pitching in Sunday's matinee with Zack Greinke starting in the nightcap, Lynn Worthy of The Kansas City Star reports."
88,weather,"Tornadoes strike Texas, Oklahoma; more storms in forecast"," A springtime storm system spawned several tornadoes that whipped through areas of Texas and Oklahoma, causing damage to a school, a marijuana farm and other structures. There were no reports of serious injuries following the Wednesday night tornadoes, but the system was causing flooding in parts of Oklahoma and Arkansas and more stormy weather was expected Thursday.Significant damage was reported in the Oklahoma city of Seminole, about 60 miles (97 kilometers) southeast of Oklahoma City, the Oklahoma Department of Emergency Management said. The Academy of Seminole took a direct hit but no one was injured, the school said on..."
89,weather,Upper Midwest flooding could last until late May,Parts of the Upper Midwest have been flooded for at least a week — and there may be no relief in sight until late May. It started with heavy rain the weekend of April 23-24 — up to 4 inches in some spots — and rapid snow melt. Then there was an additional 1 to 2 inches of rain and a bit more snow melt the following weekend.
90,weather,Column: Dry weather in Brazil tests bumper corn crop outlook,"NAPERVILLE, Ill., May 4 (Reuters) - Brazil has been slated for a record corn harvest this year after drought ravaged the country’s soybeans just months ago and its corn a year ago, but dryness once again threatens to curb potential on its second crop. Brazil is typically the second-largest..."
91,weather,Megadrought in the West threatens energy and water security,"Western states are experiencing the worst drought in at least 1,200 years, and scientists say climate change has made conditions significantly worse. Dartmouth College assistant professor of geography Justin Mankin joined CBS News' Mola Lenghi and Tanya Rivero to discuss the historic drought and how it's forcing communities to make an impossible choice."
92,weather,Phillies' Kyle Gibson: Saturday's matchup postponed,"Gibson and the Phillies won't play Saturday against the Mets after the game was postponed due to inclement weather. Gibson was initially slated to start Friday before the game was called off, and he'll have to wait at least one more day before taking the mound. Saturday's matchup will be made up as part of a doubleheader Sunday, and the right-hander will likely start in one of those two games."
93,weather,Severe weather to continue its charge into the Southeast,"Additional rounds of damaging storms and tornadoes are in the offing for the southern U.S. through the end of the week in what has been a tumultuous start to May. It has been a volatile weather week in the central United States with some locations, such as Seminole, Oklahoma, being hit with three tornadoes, with two of those Wednesday alone. AccuWeather meteorologists say that the southern Plains will catch a break at the end of the week, but areas farther east will be at risk for damaging weather into Friday."
94,weather,India Is Getting So Hot That Birds Are Coming Down With Heatstroke,At least hundreds of birds have been sent to the hospital during deadly heat waves that have swept across South Asia and killed dozens of people in India. The extreme heat has not just endangered human life but also threatened other animals. One hospital in the Indian city of Gurgaon...
95,weather,"To the showers! 6 MLB rainouts, most in a day since 2018","All-Star aces Max Scherzer, Shane Bieber and Gerrit Cole all got early showers Friday. So did many other players after six games were rained out, the most Major League Baseball postponements in a day because of inclement weather since 2018. Wrigley Field, Yankee Stadium and Camden Yards were among the..."
96,weather,"Cloudy, breezy and cool overnight into Saturday with rain showers",The Storm Team 11 Forecast call for cloudy skies with a chance of showers and a few thunderstorms overnight. The low low will be near 52 degrees. Cloudy skies and cool temperatures are forecast for Saturday with a 70% chance of showers and a few thunderstorms. Some thunderstorms could produce small hail as cold air will be aloft across the region. The high will be near 63 degrees.
97,weather,"To the showers! 6 MLB rainouts, most in a day since 2018","All-Star aces Max Scherzer, Shane Bieber and Gerrit Cole all got early showers Friday. So did many other players after six games were rained out, the most Major League Baseball postponements in a day because of inclement weather since 2018. Wrigley Field, Yankee Stadium and Camden Yards were among the..."
98,weather,What do tornadoes look like on the inside?,"Curious Kids is a series for children of all ages. If you have a question you’d like an expert to answer, send it to curiouskidsus@theconversation.com. What do tornadoes look like on the inside? – Madison, age 7, Noblesville, Indiana. Scientists really don’t know the answer to this question...."
99,weather,New Mexico residents brace for extreme wildfire conditions,"LAS VEGAS, N.M. (AP) — With the worst of the thick wildfire smoke having blown out of town, residents of this small northern New Mexico city tried to recapture a sense of normalcy Saturday as their rural neighbors hunkered down amid predictions of extreme fire conditions. Shops and restaurants..."
100,weather,Where Will the HIGH Temperature Be -15F Today?,"There’s a place in the United States where the high temperature is forecast to be -15F today (May 7). Where do think that is?. Hint: This is a forecast for an elevation of 14,000 feet. That should give you a pretty big hint. While there are a few peaks in Colorado that reach 14,000 feet above sea level and Mt. Whitney in CA. is 14,505 ft. – highest point in the Lower 48 states…"
101,weather,Royals-Orioles game Friday postponed due to weather; doubleheader planned,Friday night's game between the Kansas City Royals and Baltimore Orioles has been postponed due to heavy rain and thunderstorms.
102,weather,Dust storm and wildfires seen from space,Massive plumes of smoke from wildfires in New Mexico have been caught on satellite images at the exact same moment a dust storm swept across Colorado. The footage from the National Oceanic and Atmospheric Administration shows the moment three times. Wind gusts in Colorado reached up to 97km/h (60mph) as...
103,weather,India's Modi asks states to prepare heat action plans amid rising temperatures,"NEW DELHI, May 5 (Reuters) - India's prime minister on Thursday urged states and federally administered territories to prepare heat action plans, as south Asia swelters under extreme temperatures. India recorded its warmest March in over a century, with the maximum temperature across the country reaching 33.1 degrees Celsius, nearly..."
104,weather,Heatwave: India's poor bear the brunt of blistering temperatures,"As a blistering heatwave sweeps through India, the country's poor are once again the most vulnerable. The BBC's Ayushi Shah reports from Mumbai city. Sulachna Yevale, a vegetable vendor, desperately sprinkles water over her produce - some lemons and spinach that she bought from a wholesale market - to keep it from drying."
105,weather,Hundreds of Iraqis hospitalised as thick sandstorm blankets country,"Hundreds of Iraqis have been taken to hospitals with breathing problems and Baghdad airport suspended flights for several hours as a thick sandstorm blanketed the country, the fifth to engulf Iraq within a month. Iraqi state media said most of the patients suffered respiratory issues as clinics across the country’s..."
106,weather,Strong earthquake shakes Taiwan,"TAIPEI, Taiwan (AP) — A magnitude 6.1 earthquake has been detected off eastern Taiwan. Taiwan authorities said the earthquake Monday afternoon was 27 kilometers deep."
107,weather,"ABC 10News Pinpoint Weather for Sun. May 8, 2022: Cool start to the week","The cool conditions continue for the first half of the week, then the heat quickly returns for the second half of the week. Through about Wednesday, temperatures remain cooler than normal for this time of year. The marine layer will return overnight, but skies will be mostly clear in the afternoon."
108,weather,Strong earthquake shakes Taiwan,"TAIPEI, Taiwan (AP) — A magnitude 6.1 earthquake has been detected off eastern Taiwan. Taiwan authorities said the earthquake Monday afternoon was 27 kilometers deep."
109,weather,Severe dust storms in Iraq cause breathing problems for thousands - medics,"BAGHDAD, May 5 (Reuters) - A series of dust storms across central and southern Iraq have led to thousands of Iraqis attending hospitals and clinics to seek treatment for breathing problems, medical officials said on Thursday. During the latest storm, which began overnight on Thursday and covered the capital Baghdad..."
110,weather,New research on Pacific climate pattern may lead to improved cyclone forecasting,"El Niño-Southern Oscillation (ENSO), the climate pattern involving warming or cooling sea surface temperatures in the Pacific, has immense influence on the formation of tropical cyclones globally. A new study involving Florida Tech shows that in the Bay of Bengal, that influence is geographically confined, a discovery that should help extend the lead time of seasonal predictions for cyclones that form in that region."
111,weather,"Dangerous dust storm hospitalizes more than 1,000 in Iraq","A dust storm in Iraq created apocalyptic scenes, dealt a significant blow to air quality and sent more than 1,000 people to local hospitals this week. AccuWeather forecasters say while Iraq has dealt with numerous dust storms this spring, a combination of atmospheric factors led to a particularly potent storm on Thursday."
112,weather,Dust storm and wildfires seen from space,Massive plumes of smoke from wildfires in New Mexico have been caught on satellite images at the exact same moment a dust storm swept across Colorado. The footage from the National Oceanic and Atmospheric Administration shows the moment three times. Wind gusts in Colorado reached up to 97km/h (60mph) as...
113,weather,Climate Warming Raises the Danger of Aflatoxin Contamination in Us Crops According to Scientists,"Scientists at the Michigan State University are predicting the impact of climate change on crops, such as maize, as it continues to affect weather patterns throughout the world, including the Midwest. Aspergillus spp., the aflatoxin-producing fungus, is extensively distributed in nature and has severely polluted human and animal food sources,..."
114,weather,"To the showers! 6 MLB rainouts, most in a day since 2018","All-Star aces Max Scherzer, Shane Bieber and Gerrit Cole all got early showers"
115,weather,"Sandstorm suspends flights, many Iraqis struggle to breathe","BAGHDAD (AP) — Hundreds of Iraqis rushed to hospitals with breathing problems Thursday and the Baghdad airport suspended flights for several hours as a thick sandstorm blanketed the country, the fifth to engulf Iraq within a month. Iraqi state media said most of the patients suffered respiratory issues as..."
116,weather,"Coalition climate target consistent with more than 3C global heating, research says","The Morrison government’s climate change commitments are consistent with more than 3C of global heating, bordering on 4C, a level that would lead to catastrophic damage across the planet, according to a new analysis. Labor’s climate target was found to be consistent with about 2C of heating above pre-industrial..."
117,weather,"Iraq dust storm leaves 5,000 people needing treatment","One person has died and more than 5,000 people have been admitted to hospitals with breathing problems in Iraq after a seventh severe dust storm in a month. A health ministry spokesman said 2,000 of the cases of ""suffocation"" had been reported in Baghdad province, according to the official Iraqi News Agency."
