,categories,headers,contents
59,technology,Russia Uses Huge Demining Robots to Clear Explosives From Seized City of Mariupol,The pro-Russian People's Militia of the so-called Donetsk People's Republic (DPR) said they are continuing demining operations after seizing Mariupol last week.
60,technology,How To Forward Text Messages On iPhone In 2 Different Ways,"It is possible to forward text messages you receive, both at present and in the past. Here's a detailed rundown of how to do both."
61,technology,Best Buy’s deal of the day is a 15-inch Chromebook for $179,"The best laptop deals can help you save a fortune on products you need, as this Samsung Chromebook deal at Best Buy demonstrates. Right now, you can buy a Samsung 15.6-inch Chromebook at Best Buy for just $179, saving you $120 off the usual price of $299. Ideal for students or anyone on a tight budget, it means you can work effectively on the move without having to spend a fortune on a laptop. It’s one of the many early Memorial Day laptop sales we’re seeing pop up at the moment and easily one of the best Chromebook deals around. Here’s why it’s worth your time."
62,technology,HP Memorial Day Sale 2022: Cheap laptops and gaming PCs,"HP Chromebook — $250, was $330. The best Chromebooks appreciate that convenience is often one of the main reasons why people consider buying one. This HP Chromebook offers a sleek design that looks good and weighs just 3.24 pounds so it’s easy to carry around with you. It has a 14-inch HD display so you can see plenty of what you’re doing on it. Alongside that, it uses an Intel Celeron processor, as well as 4GB of memory. It also has 32GB of eMMC storage which is sufficient for basic needs with the majority of your files stored on the cloud as you would expect with a Chromebook. Dual speakers and a 720p HD camera mean you can take video calls when needed, too. One final great feature is the ability to recharge the Chromebook to 50% in just 45 minutes."
63,technology,Former Xbox Executive Warns Industry About Xbox Game Pass,"Subscription services have majorly changed every facet of the entertainment industry, but games. Between Xbox Game Pass, the new PlayStation Plus, and more, it looks like that may finally be changing. And as it does, many are warning that it's not going to be a positive change for the industry. The most notable of these people is former Microsoft executive Ed Fries, who helped release the original Xbox back in 2004."
64,technology,How much GPU memory do I need?,"Just like your PC has memory (called RAM), a dedicated GPU will have its own memory, called VRAM (video RAM). And just like RAM, not having enough VRAM can cause performance problems. How much you have will depend on what GPU you have, and how much you need will depend on the applications you use."
65,technology,Samsung Memorial Day sale: save big on the Z Fold 3 and S22 phones,"It's still almost a full week away, but many online retailers are already serving up some great Memorial Day deals that you can enjoy right now, including our friends at Samsung. Leading up to the official US holiday on May 30th, Samsung is offering hefty discounts on a ton of new devices, including the Galaxy Z Fold 3 and the entire S22 lineup of smartphones."
66,technology,"AirPods Pro 2: Design, features, release date, price, more","Apple is set to release AirPods Pro 2 in 2022. This new generation is rumored to bring a new design, innovative Lossless support, as well as fitness sensors for the first time. Head below as we round up the latest rumors about this product. AirPods Pro 2 to feature new..."
67,technology,This Game-Changing Amazon Find Will Let You Charge Your Phone Without an Outlet (It’s Perfect for Camping!),"We independently select these products—if you buy from one of our links, we may earn a commission. All prices were accurate at the time of publishing. How prepared are you if there’s an emergency at home? Truth be told, I could do a whole lot better. I’ve got a first aid kit, plenty of candles, a fire extinguisher, portable chargers, and backup water, but that just scratches the surface. After dealing with Hurricane Ida in 2021, the holes in my at-home emergency preparedness kit were glaring (though my roll-out futon was so good to have at the time). My lighting, however, needed significant improvements. LuminAID, a woman-owned brand that was initially created for providing lighting in dire situations, caught my eye while I was going down a rabbit hole of Amazon products. They make inflatable lanterns that are not only helpful in emergencies, but are also useful for camping and pretty much anything outdoorsy. When I saw the LuminAID Packlite Max, a variation of the lantern that can also charge phones, I knew I had to try one for myself."
68,technology,Texas parents are suing Apple over claim their son suffered 'permanent hearing loss' from an Amber Alert in his Airpods,A lawsuit says the child was watching Netflix when an Amber Alert went off so loudly that it tore his right eardrum and damaged his cochlea.
69,technology,"The PS5 is available directly from Sony at 4PM ET, and you can start queueing now (Update: sold out)","Update May 24th, 4:59PM ET: Sony has sold out of PS5 consoles for this restock. Update May 24th, 4:30PM ET: This console restock from Sony is for new boxed bundles of the PS5 with Horizon Forbidden West included. The cost of this bundle with the disc-equipped PS5 is $549.99, which reflects a $20 discount off the $69.99 price of the game."
70,technology,What to expect from the Xbox & Bethesda Games Showcase 2022,"With games like these in the pipeline, Microsoft could put on a great show. This June, the games industry will stand in the big hole where E3 used to be and start firing off game announcements like nobody's business. According to the ""E3"" Summer Games Fest calendar (opens in new tab) so far, most livestreams will be happening over the course of a single weekend: June 9-12. While it's still not clear if some of the biggest publishers will have anything to show this year, Microsoft is coming out swinging with the Xbox & Bethesda Showcase."
71,technology,Shiba Inu Drops First Clue About Kusama's Announcement That Will 'Floor Everyone',"The Shiba Inu team dropped the first clue on the announcement, that, according to its pseudonymous lead developer Shytoshi Kusama, would ""floor everyone."" The team said entertainment industry veteran Marcie Jastrow has joined ""Shib: The Metaverse"" team. The Shiba Army was thrilled when Kusama hyped the community by teasing some..."
72,technology,Anker 757 Powerhouse Review: A powerhouse in every sense,"Just a few years ago, if you wanted electricity during a power outage or on a camping trip your only real option was a generator. The insane progress in lithium battery technology has changed that. The Anker 757 Powerhouse is no pocket-sized power bank—it can power full-blown home appliances for hours at a time and is small enough to sit on your kitchen counter. The Powerhouse is an excellent tool in case of a power outage, camping, or any other time you just need honest-to-goodness wall power when there are no outlets in sight."
73,technology,"EcoFlow 400W Solar Panel Review: Powerful, Rugged, and Portable","The EcoFlow 400W portable solar panel folds into four sections. The panel is surprisingly thin and floppy, making it somewhat cumbersome to set up. The carrying case serves as a kickstand, which works well once you get the hang of it. You'll appreciate that it's waterproof. If you already have an EcoFlow power station, this will pair exceptionally well. You can also charge other compatible batteries with this solar panel, but you might need adapters."
74,technology,Kingston touchscreen hardware encrypted external SSD,"Kingston Digital has this week introduced a new hardware encrypted external SSD designed to help keep your documents and media say from third-party prying eyes. The new SSD is the latest addition to the encrypted lineup, IronKey Vault Privacy 80 External SSD (VP80ES) series of storage and is the companies first OS-independent external SSD with touch-screen and hardware-encryption for data protection."
75,technology,Elden Ring is nowhere near the most-played game of 2022,"It looks like Elden Ring is nowhere near the most-played game of this year. Elden Ring took the gaming world by storm when it launched back in February. Even those with no interest in the Souls series couldn't help but be intrigued by The Lands Between. Its vast popularity has led to Elden Ring swiftly becoming From Software's best-selling game ever, with 13.4 million sales in little over a month. As such, you might expect Elden Ring to be among the ten most-played titles of the year. But if you do, then you'd be wrong."
76,technology,Hackers have found a new way to smuggle malware onto your device,"Cybersecurity researchers from HP Wolf Security have spotted a new cybercrime campaign that leverages PDF files to try and distribute the Snake Keylogger onto vulnerable endpoints. According to the researchers, the threat actors would first send an email holding the subject line “Remittance Invoice”, to try and trick the victims..."
77,technology,Impending demise of Roe v. Wade puts a spotlight on a major privacy risk: Your phone reveals more about you than you think,"When Politico published Supreme Court Justice Samuel Alito’s draft opinion that would undo Roe v. Wade, a number of commentators observed how hard it would be for women in states that had made abortion illegal to safely travel to abortion clinics elsewhere. Their phones’ location histories would give them away, or maybe their search histories would. Even their texts might do so.

If people want to travel incognito to an abortion clinic, according to well-meaning advice, they need to plan their trip the way a CIA operative might – and get a burner phone. As a cybersecurity and privacy researcher, I..."
78,technology,"Call of Duty: Modern Warfare 2 arrives in October, June reveal teased","Activision and developer Infinity Ward gave Call of Duty fans a tiny tease of this year’s game, Call of Duty: Modern Warfare 2, in a new video that reveals the game’s release date. According to a new teaser video that shows off artwork of the game’s principal cast, including Modern Warfare favorite Simon “Ghost” Riley, Modern Warfare 2 will be released on Oct. 28."
79,technology,There’s a major problem with MacBook Pro shipments right now,"If you’re looking to purchase a new MacBook Pro at this time, you might be waiting for your new laptop until August, according to reports from 9to5Mac. Orders for the laptop have been slow since their initial launch in 2021, but waiting three months is a hard pill to swallow, especially six months from when the product was announced."
80,technology,Walmart’s Drone Air Force May Be Winning the War,Walmart is expanding its drone delivery service to include 34 U.S. cities by the end of the year. Here's why it could be leading the race.
81,technology,Sony is stiffing PlayStation Plus users with surprise upgrade fees,"Sony's new and improved PlayStation Plus launched in Asia this week, but certain users were dismayed to find that upgrading their existing PS Plus subscriptions would be a lot more expensive than they thought. According to reports from Asia-region gamers on Reddit, the problem is pretty basic: There are quite..."
82,technology,How to Factory Reset iPhone without Passcode by ReiBoot iOS System Repair?,"Breaking into an iPhone is notoriously tricky to fix iPhone is stuck in recovery mode. It’s pretty hard for someone to sneak in without your consent if you have a unique passcode. However, the opposite is also true. The only method to unlock an iPhone if you don’t know the password or it’s been deactivated is to factory reset it. Fortunately, there are methods for resetting an iPhone without a password."
83,technology,Apple Watch Pride Bands Return For 2022 With New Designs,Apple continues its tradition of releasing Apple Watch Pride Bands in vibrant twists of bright color in order to support and honor the LGTBQ+ community.
84,technology,New Luna 2.0 blockchain will not be a fork of Luna Classic,👋 Want to work with us? CryptoSlate is hiring for a handful of positions!. Terraform Labs have confirmed that the new Luna 2.0 blockchain release on May 27 will not share any history with Luna Classic. An official announcement has clarified that the new chain shall be a “brand...
85,technology,Snap's warning sends shock across digital advertising as investors flee social media stocks,Snap CEO Evan Spiegel warned of slowing growth in a note to employees made public on Monday. His message sent a chill across the digital advertising industry. Analysts pointed to macroeconomic trends that could extend far beyond Snap. Social media companies were already having a rough year from the cutback...
86,technology,"Domestic violence app aims to help victims, including disguised emergency button","A domestic violence app aims to provide help to victims of intimate partner violence (IPV), offering everything from an encrypted diary of evidence to a way to call police without the need to speak. To guard against the risk of abusive partners recognizing the app, it takes a number of..."
87,technology,Walmart drone delivery plan includes millions of customers,"Walmart first revealed its interest in drone delivery five years ago. Since then it’s been conducting a number of pilot schemes, its most recent one close to its headquarters in Bentonville, Arkansas. Now ready to take it further, Walmart has just announced it’s planning to expand its drone network..."
88,technology,Linksys Atlas 6 And Hydra 6 Routers Deliver Wi-Fi 6 Without Breaking The Bank,Linksys attempts to make Wi-Fi 6 devices affordable with a new router and a new mesh internet system for the average user's home or office environment.
89,technology,"Best Memorial Day TV sales to shop in 2022: Sony, Roku, more deals","Whatcha watching? 

At The Post, we are watching for Memorial Day TV sales, so don’t switch screens if you are in the market for a new one. 

Memorial Day is synonymous with sales, from furniture to fashion and everything in between. For tech, now is also the time to shop, as TV’s and other goodies are on markdown, some for the best prices you will see all summer. 

We scanned every outlet to find the best deals this Memorial Day 2022, and rounded up some options to fit every room and budget you may have. 

Read on for options from..."
90,technology,Twitter Deal To Be Turned Down by the High Number of Fake Accounts,"Elon Musk mentioned in a tweet that about 20% of all accounts on Twitter are fakeMohamed Hassan/Pixabay. Elon Musk, the CEO of Tesla offered $43.3 billion to purchase Twitter earlier this month. Many people are against this purchase as they say Elon will use the platform for his own personal gain to gain political influence over other parties around the world."
91,technology,iPhone 14 leak points to a price bump – but for a good reason,"The arrival of the iPhone 14 may see Apple finally taking its selfie cameras seriously – but it could come at a price that puts off some buyers. That's according to Korean news site ET News (opens in new tab), which has published the latest in a series of reports on the Apple supply chain, looking at the camera modules Apple is said to be using for the front-facing snapper."
92,technology,"NeuraLight aims to track ALS, Parkinson’s and more with an ordinary webcam","The lack of standardization is a huge problem in diagnosis and tracking of neurological disorders: because they are so complex and often slow to develop, it is extremely difficult for a single approach to catch something like Alzheimer’s at an early stage. In fact, it’s estimated that misdiagnosis is..."
93,technology,Elon Musk admits to having a secret Instagram account," Billionaire and tech entrepreneur Elon Musk has reportedly admitted to having a “secret” account on Instagram.Tweeting in response to an apparent fan on Sunday, the SpaceX founder rubbished a user’s claims he was secretly running the account.“Many people think that @elonmusk runs my Twitter account. And it’s TRUE,” wrote user Pranay Pathole.“He’s a super busy guy, building rockets, making life multi-planetary, building futuristic electric vehicles, and digging tunnels,” the user added, “And somehow he finds time to run multiple Twitter accounts. YES.”Mr Musk tweeted back by denying the claims about running Pathole’s account, but did admit to allegedly operating..."
94,technology,This 70-inch TV is $500 in Best Buy’s Memorial Day sale,"Memorial Day TV sales have begun early and right now, you can buy a 70-inch TV for just $500 from Best Buy. Normally priced at $550, the Hisense 70-inch A6G 4K TV is down to just $500 for a limited time only, saving you $50 off the usual price. One of the best 70-inch TV deals around, it’s a great way of enjoying an extra-large screen for far less than usual. We can’t see it sticking around for long so buy it now before it sells out or goes back to its original price."
95,technology,How to install ExpressVPN on Amazon Fire Stick,"If you are after the best Amazon Fire TV Stick VPN to unlock all the power your streaming device has to offer, you have probably already come across ExpressVPN during your search. There are many reasons why you might want to install a VPN on your Fire Stick, and many..."
96,technology,Gollum’s solo video game brings us back to Middle-earth in September,"It’s going to be a Sméagol summer as The Lord of the Rings: Gollum, Daedalic Entertainment and Nacon’s stealth action-adventure game starring Gollum, finally has a release date. The new video game set in J.R.R. Tolkien’s Middle-earth is headed to PlayStation 4, PlayStation 5, Windows PC, Xbox One, and Xbox Series X on Sept. 1, Daedalic Entertainment and Nacon confirmed in a news release."
97,technology,The 14 Best Robot Vacuums That Do the Dirty Work for You,"If you’re still lugging around a clunky, corded traditional vacuum cleaner from room to room, stop right there. The best robot vacuums do all that gross, grimy work for you so that you can spend your time in other, more important ways. By now you’ve likely contemplated buying one or know someone who has and raves about it. And if you’re ready to take the plunge, let us help."
98,technology,The metaverse could lead to an urban exodus,"Several companies, including Apple and Microsoft, are betting that the world of tomorrow will, at least in part, be carried out in the metaverse. To this end, Microsoft recently acquired the video game giant Activision Blizzard for US$68.7 billion. As more of our daily activities take place online, we believe..."
99,technology,The Insta360 Sphere is a virtual invisibility cloak for drones,"On paper, drones and 360 cameras go together like pineapple and pizza, that is to say, they are an excellent if rather niche combination. However, the problem has always been when filming with a camera that sees everything, that the view also includes whatever the camera is attached to. This means that filming with a 360 camera on a drone feels more like riding a speeder on Endor than flying unsupported through the sky. The Insta360 Sphere solves this issue by turning the drone invisible, thus fully immersing you in the experience of flight."
100,technology,"Young people discuss how phones and social media create connection — and self-doubt: ""Compared to them, I am a nobody""","As more children and teenagers use cell phones and technology, some say the digital world can negatively impact their mental health. Despite the dangers technology can create, young people say social media platforms can be used for both good and bad. Around eight in 10 parents of children aged 11..."
101,technology,"Even if your iPhone dies, it can still do these 3 things","Your mobile phone is a lifeline to many daily activities. It is often the first thing we reach for in the mornings to check social media or pour over the latest news with a cup of coffee. It also keeps us in touch with family and friends. So, when you..."
102,technology,"Your iPhone, iPad and Mac have a secret setting to massively boost call quality","There's a bizarrely hidden setting in the Control Center of Apple’s iOS 15 and MacOS Monterey that you need to know about, because it significantly boosts vocal clarity when using audio and video calling apps. The feature is called Voice Isolation and, though it was announced when iOS 15..."
103,technology,Top Gun: Maverick spoiler-free review: A worthy return to the danger zone,"As I walked out of my review screening of Top Gun: Maverick, coming down from its adrenaline-filled finale, a small part of my brain began looking for dents in the film's armor. Maybe it's the critic in me, but my thoughts didn't need long to land on stuff from the original film—a plot point, a stylistic choice, a particular character—that didn't return this time."
104,technology,"Jesus doesn’t love you in the new game I, the Inquisitor","The Jesus in I, The Inquisitor, isn’t forgiving. He’s quite the opposite. In the new game from The Dust S.A, you’ll play in a world where Jesus takes revenge upon the non-believers, rather than granting them forgiveness for his own crucifixion. It’s a wild concept, and was inspired by the novels of Polish author Jacek Piekara. On Tuesday, the developers released a trailer showing just how punitive Jesus can be."
105,technology,Google Assistant on the Galaxy Watch 4 is great except for one thing,"When Google and Samsung announced Wear OS 3 last year, I had lots of questions about how well Google services would run on Samsung hardware. Of Google’s expansive suite of apps, I was most curious about Google Assistant. The only catch was it wasn’t available when the Galaxy Watch 4 lineup launched — and there were only vague promises as to when it would actually be available. But yesterday, Google Assistant finally arrived on the Galaxy Watch 4, and after a few hours of playing around with it, I’m cautiously optimistic."
106,technology,PlayStation Days of Play sale begins May 25,"Sony has just announced that this year's Days of Play sale begins tomorrow, May 25. If you've not heard of it before, it's a yearly event that features a wide range of discounts on PlayStation games, accessories and more for PS5 and PS4. A vast number of deals are made available at major retailers and the official PlayStation Store - and it looks like this year will be another big one."
107,technology,Snapchat Is Facing a Class Action Lawsuit in 2022 –– Here Are the Details,"It looks like Snapchat is dealing with some legal drama in 2022. Snapchat dealt with major backlash back in 2018 after unrolling what was considered a hideous interface update that year. Snapchat users were super disappointed in the major changes, and even Kylie Jenner took to Twitter to post about how bothered she was."
108,technology,Best ultrawide monitors of 2022,"
                    Stan HoraczekGet more screen real estate without the need for multiple monitors."
109,technology,How to banish those irritating pictures from your Windows search bar,"A new feature in Windows inserts an image in your search bar or search menu, and it's been driving me bonkers. The ongoing transition between Windows 10 and Windows 11 has seen features shared across both versions of the OS. One of them puts an image in the search bar in the lower-left of your screen."
110,technology,Bride Asks Internet For Advice After Wedding Dress Regret: 'Marshmallow',"""It sounds like an expensive mistake. Can you sell it and recoup some of your money?"" one user asked."
111,technology,This Compact New Ultra-Short-Throw Projector Casts a 130-Inch Image in 4K,"Click here to read the full article. Hisense wants to help you create a home movie theater with one, 20-pound box.
The Chinese electronics outfit has unveiled a new ultra-short-throw projector that is designed to deliver a high-quality cinematic experience without hogging space in your abode. The PX1-PRO TriChroma Laser Cinema, which was first teased at CES earlier this year, combines Hisense’s award-winning TriChroma laser engine with a newly developed digital lens focus system to create a razor-sharp image with impressive depth and detail.
The streamlined projector, which sits neatly on an accompanying stand, can throw a picture spanning up to 130..."
112,technology,Niantic’s New Technology Could Enable The Next Generation of Developers To Build Their Own Pokémon Go,The tech company announced two key features that they hope will pave the way for the expanded use of augmented reality (AR) in everyday life
113,technology,'Ideally it melts your face off' says Destiny 2 dev about Solar rework,Bungie wants to turn the heat up to uncomfortable levels.
114,technology,Capcom Hints at Return for Dormant Franchises,"When it comes to video game publishers, Capcom might have one of the biggest franchise stables in the industry. The company is responsible for a number of beloved series, including Resident Evil, Monster Hunter, Street Fighter, and Mega Man. However, the company also has plenty of franchises that have all but disappeared over the last few years. During an investor relations Q&A, the publisher was asked whether any of its dormant IPs might once more see the light of day. Apparently, Capcom is planning to listen to the fans more, to see which franchises could be suited for a comeback."
