,categories,headers,contents
55,politics,"Russia is resorting to putting computer chips from dishwashers and refrigerators in tanks due to US sanctions, official says",US commerce secretary Gina Raimondo said Wednesday that exports of US technology to Russia have fallen by 70% as a result of sanctions.
56,politics,US leads exercise in NATO’s newest member,"KRIVOLAK, North Macedonia (AP) — U.S. troops joined forces from Britain, France, Italy and allied countries in the region Thursday in a military exercise held in NATO’s newest member, North Macedonia, aimed at displaying deployment readiness along the alliance’s eastern borders. Nearly 10,000 soldiers from 19 nations..."
57,politics,Rand Paul blocked a bill that would keep judges' personal information from showing up online. He wants the same protections for lawmakers.,"The Kentucky Republican has complained about threats to him and his family. More Paul blocking: A bill that would limit the posting of federal judges’ personal information to the internet hit a roadblock in the Senate again Thursday, after Sen. Rand Paul (R-Ky.) insisted that the measure be expanded to cover members of Congress."
58,politics,Parents File Lawsuit Against Son and Daughter-in-Law for Not Having Grandchild,"A couple in India filed a lawsuit against their son and his wife because they have not given them a grandchild after being married for six years, BBC reports. Sanjeev and Sadhana Prasad are claiming “mental harassment” since they allegedly used up all of their savings on their son only for he and his wife to prevent them from having a “grandchild to play with” during retirement. They are seeking nearly $650,000 in the event that a child is not born within a year."
59,politics,Mexico president says soldiers did not confront cartel 'to avoid deaths',"MEXICO CITY, May 12 (Reuters) - A military convoy in the Mexican state of Michoacan did not confront the members of a drug cartel who chased them out of town in broad daylight ""to avoid deaths,"" the country's president said Thursday. ""Some used (the incident) to say what kind of..."
60,politics,Russia begins transfer of troops from Syria to Ukraine as Finland signals Nato membership,"Russian president Vladimir Putin has begun moving troops from Syria to Ukraine to help in the Battle for Donbas, reports have claimed. Military forces are being moved from Syria where the Kremlin had thousands of troops based since 2015 when Vladimir Putin ordered his fighters to support president Bashar al-Assad. The Moscow Times reported that these troops are being stationed at three airports in Ukraine before being transferred to the frontline to increase Russia’s presence as fighting in the southeast increases.More than 63,000 Russian military personnel have deployed to Syria between 2015 and 2018, Moscow says, however it is unclear..."
61,politics,Trump Wanted Praise for Downplaying COVID Concerns in Meat Industry: Report,"A government report released Thursday estimates that more than 59,000 workers in the industry became sick and approximately 269 people died."
62,politics,Departing White House press secretary Jen Psaki details threats against her and her family,"White House press secretary Jen Psaki, who leaves Friday, called threats to public figures common and alarming. Karine Jean-Pierre takes the job next."
63,politics,This Map Shows Which State Drinks the Most Beer — And it’s Not Who You Think,"There is something about a drinking a cold beer on a hot summer day that hits like nothing else can. It’s a pastime that is really popular, but if you thought about which state drinks the most beer, you’d probably be wrong. A new map was released that has opened our eyes on beer-drinking habits and opened our eyes to one state that really likes their beer — and it’s not Wisconsin. Here’s what you need to know."
64,politics,Republicans Criticize Biden For Not Starving Undocumented Immigrant Babies,GOP lawmakers blasted the Biden administration for providing baby formula to detained undocumented immigrants during a shortage.
65,politics,U.S. prosecutors open grand jury probe into Trump's handling of classified records -NYT,"WASHINGTON, May 12 (Reuters) - Federal prosecutors have opened a grand jury probe into whether former U.S. President Donald Trump mishandled classified records that ended up at his Florida residence, the New York Times reported on Thursday, citing two people briefed on the issue. Prosecutors have issued a subpoena to..."
66,politics,"As Finland Nears NATO, Russia Flags 'Full-Fledged Nuclear War' Risk","Soon after Helsinki announced its intention to join NATO, Dmitry Medvedev, ex-President of Russia, said the alliance was in a ""proxy war"" with Russia in Ukraine."
67,politics,Susan Collins goes full MAGA on abortion,"Republican Sen. Susan Collins still wants voters to believe she is pro-choice. During the hearings for Supreme Court Justice Brett Kavanaugh, Collins defended her decision to vote for the Federalist Society-linked judge by claiming to believe his assurances to her that he had no plan to overturn Roe v. Wade. In the three and a half years since, there's been a raging debate over whether she said that because she's stupid, or just a liar that knows she can't win in Maine without maintaining the illusion that she's a moderate Republican."
68,politics,"Jen Psaki says she'll miss Fox News' Peter Doocy after she leaves the White House: 'We have a very good, professional relationship'",Psaki is stepping down from her role as White House press secretary on Friday. She and Doocy often sparred in the briefing room.
69,politics,Navy hush-hush after secret boat’s unexplained sinking,"A Navy vessel sank under unclear circumstances, at an undisclosed location, while testing out some secretive technology last December — and that’s about all the sea service will say on the subject. The vessel’s name and the nature of the technology tests were not disclosed, though officials did..."
70,politics,What Has Kamala Harris Accomplished So Far as Vice President?,"It has been two years since President Joe Biden named Kamala Harris as his vice president, and just as many years since they were elected into the White House. While President Biden has been front and center when it comes to major issues such as the Russia-Ukraine conflict, student loan forgiveness, and the ongoing pandemic, Harris has been busy working behind the scenes."
71,politics,Ukraine conflict: Russian soldiers seen shooting dead unarmed civilians,"When Leonid Pliats and his boss were shot in the back by Russian soldiers, the killing was captured on CCTV cameras in clear and terrible detail. The footage, which was obtained by the BBC, is now being investigated by Ukrainian prosecutors as a suspected war crime. It was the height..."
72,politics,"Cause Of Mysterious Gulf War Syndrome Finally Uncovered, Major New Study Claims","New research claims to have “solved the mystery” of what causes Gulf War syndrome. Just as many suspected, a study published today concludes that the nerve agent sarin was largely responsible for the much-debated condition. Gulf War syndrome, or Gulf War Illness (GWI), describes the chronic multisymptom illness..."
73,politics,More Countries Are Considering NATO Membership and Putin Is Not Happy,"Amid Russia's continuous invasion of Ukraine, neighboring countries have growing concerns and are eyeing joining NATO. The possible acceptance of more countries into NATO has Russian President Vladimir Putin on edge. Article continues below advertisement. NATO may be gaining some more members as the war between Ukraine and Russia continues...."
74,politics,Goodbye Jen Psaki — no one condescends quite like you,"So long Jen Psaki! As White House press secretary, you were indeed very informative: every day you provided an example of how today’s Democratic Party turns normie soccer moms from Greenwich into reality-denying attack machines sputtering insults and cheering on lawbreakers because they can’t face up to the unpopularity of the far-left agenda. 

As blathering Joe Biden retreated into the background and suggested to the world that America was in the hands of a man who should be shuffling around Sunset Acres in a bathrobe, Psaki became the face of an administration that is determined to head into the midterms..."
75,politics,A Democratic senator with student debt says his party 'spends a little bit too much time' on loan forgiveness without addressing the cost of a degree,"""I'm one of the few members of the Senate that still has student debt,"" Sen. Chris Murphy said on Fox News Sunday. ""I don't need my debt forgiven."""
76,politics,A January 6 defendant ruined his plea deal by saying he thinks he's innocent and was only going to plead guilty to avoid a trial,"YouTuber ""Baked Alaska"" nixed his January 6 plea deal by declaring himself innocent in court — meaning the judge felt compelled to set a court date."
77,politics,"The V.A. Bought 10,000 iPhones for Veterans. 8,544 of Them Were Never Used.","The U.S. Department of Veterans Affairs (V.A.) lost nearly $2.4 million on data plans for iPhones and iPads that were supposed to help homeless veterans connect to telehealth services. Ultimately, 85 percent of the iPhones meant to be loaned went unused and remained in storage one year after their purchase, according to a new inspector general's report."
78,politics,Ex-Labor Secretary Says Second American Civil War Has Begun,Clinton-era Cabinet member Robert Reich likened the widening split between GOP and Democratic states to an unhappy marriage.
79,politics,"U.S. should prepare for drawn-out conflict if China invades Taiwan, war game suggests","The year is 2027. China has invaded Taiwan and the wheels of all-out war have begun to turn. “We are not going to let them survive the initial onslaught of our military operations,” says one of the masterminds of Beijing’s military strategy. “We are not going to let the president of Taiwan survive the first day.”"
80,politics,Cammack: Illegal immigrants getting baby formula while Americans left with empty shelves,"(The Center Square) – U.S. Rep. Kat Cammack and other Republican lawmakers are calling on the FDA and the Biden administration to take immediate action to solve a months-long baby formula shortage that's left parents scrambling to find healthy food for their infant children. Cammack, R-Florida, called on Americans..."
81,politics,The Middle East’s Indifference to Ukraine Is a Warning,"We are now more than two months past the high-water mark of international solidarity on the Russian invasion of Ukraine. Then, more than 140 countries voted in favor of a UN General Assembly resolution calling for an end to the Russian offensive, with 35 abstentions. A casual observer might think that the vote was proof that the rules-based international order that the United States had been nurturing for 75 years was alive and well."
82,politics,Russia Losing Ground in Ukraine as Putin's Troops Forced to Mount Defense,The Institute for the Study of War said in its May 11 assessment that Ukrainian forces took further ground northeast of Kharkiv.
83,politics,The largest labor federation in the country calls on Biden to cancel student debt: 'We cannot ask working people to make further sacrifices',"""Now is the time to cancel, not collect, student debt,"" AFL-CIO's president Liz Shuler said. She's the latest advocate pushing for loan forgiveness."
84,politics,First Russian soldier to go on trial in Ukraine for war crimes,"As Nato expansion ratchets up the pressure on Vladimir Putin, Vadim Shysimarin, 21, is charged with murdering a 62-year-old civilian"
85,politics,Texas Gov. Greg Abbott criticized Biden after a GOP lawmaker said 'pallets of baby formula' were sent to migrant holding facilities amid national shortage,"The baby formula shortage has caused panic, but CBP said it has a ""legal responsibility to ensure the safety and security"" of those in its custody."
86,politics,'Nervous about Oz's prospects': Trump and his allies worry about a Barnette victory in Pennsylvania,"(CNN) — In the hours after Fox released a poll this week showing Pennsylvania Republican US Senate candidate Kathy Barnette locked in a statistical tie with primary opponents Mehmet Oz and Dave McCormick, allies of former President Donald Trump went to work trying to stifle her momentum. To sow..."
87,politics,"Russians are using semiconductors from kitchen appliances in military equipment, says U.S. commerce secretary",U.S. sanctions and export controls imposed at the outset of Russia's invasion of Ukraine and aimed at crippling its economy are starting to have an impact on Russian battlefield operations. Commerce Secretary Gina Raimondi in a pair of congressional hearings this week told lawmakers that Russia has been using semiconductors...
88,politics,Rudy Giuliani Still on the Hook as OAN Formally Settles Georgia Election Workers’ Defamation Case on ‘Fair and Reasonable’ Terms,"A federal judge on Wednesday agreed to dismiss a lawsuit filed by two Georgia election workers against the company which owns the One America News (OAN) Network, several of the network’s executives, and correspondent Chanel Rion. The judge, however, agreed to keep the case alive against one defendant: Rudy Giuliani."
89,politics,The Supreme Court Has Itself to Thank for Upholding Laws That Could Be Used to Criminalize Protests Outside Justices’ Homes,"While seeking to balance the First Amendment with the rights of due process and of the courts to function as a co-equal branch of government, the U.S. Supreme Court has signaled support for laws which criminalize picketing around judicial facilities — laws which might be used to prosecute those who protested outside the homes of several justices in the wake of a leaked draft opinion by Justice Samuel Alito that seeks to overturn Roe v. Wade."
90,politics,GOP’s culture wars force its decades-long marriage to Big Business to end in divorce,"Florida Gov. Ron DeSantis’ head-scratching public vendetta against Disney over its opposition to Florida’s Parental Rights in Education law, dubbed by critics the “Don’t Say Gay” law, sends a clear message to boardrooms across the country: Stay the heck out of politics. The law bans..."
91,politics,"Senator Kirsten Gillibrand says vote reveals where senators stand on ""women's reproductive freedom""","Ahead of Wednesday's Senate vote on a bill to protect abortion rights nationwide, Democratic Senator Kirsten Gillibrand of New York told CBS News' Nikole Killion that it would reveal to voters whether their senators ""protect women's reproductive freedom or don't."" The bill failed to advance amid Republican opposition."
92,politics,Air Force flight crew punished for stopping C-130 to pick up a motorcycle,Five members of a U.S. Air Force reserve flight crew tasked with tracking hurricanes and other severe weather systems were punished after making an unannounced detour during a C-130 training flight in March to pick up one member’s vintage motorcycle. Members of 53rd Weather Reconnaissance Squadron (WRS) “Hurricane Hunters”...
93,politics,"Lindsey Graham was right about Trump, Jan. 6 (but only briefly)","When a previously undisclosed recording of a politician causes a controversy, it’s generally because he or she is heard saying or doing something provocative. In recent weeks, however, this model has been turned on its head. In the aftermath of the Jan. 6 attack, for example, House Minority Leader..."
94,politics,"Second migrant bus leaves Yuma, passengers headed for nine east coast states","(The Center Square) – Immigrants from Brazil, Haiti, Colombia, Nicaragua, Peru, Senegal, and the Dominican Republic are en route to Washington D.C aboard a bus from Arizona. A spokesperson for Gov. Doug Ducey says they’re headed to Connecticut, Florida, New York, Rhode Island, New Jersey, South and North Carolina, Pennsylvania, Massachusetts and the nation’s capital."
95,politics,Justice Amy Coney Barrett's Home Site of 'Handmaid's Tale' Protesters,"When it comes to the fight over abortion, imagery is all-important, and protesters took that to heart Wednesday night when they wore 'Handmaid's Tale' costumes and took it to the home of Supreme Court Justice Amy Coney Barrett. A small group of pro-choice demonstrators made their way to Falls Church,..."
96,politics,Russia said Finland joining NATO is definitely a threat and warned it would retaliate as the country moves ever closer to membership,Finland's president and prime minister said they want their country to join NATO as fast as it can. Russia repeated its threats in response.
97,politics,Watch: Treesily Found: Russian Unit Hiding In Trees Wiped Out In Artillery Strike,Video footage of the strike shows a furious fusillade hammered down on the line of vehicles and men within seconds.
98,politics,Members of ‘Putin’s Caucus’ on Capitol Hill still won’t budge,"By most measures, Congress has responded to Russia’s invasion of Ukraine in a bipartisan way. Every measure that’s come up has passed, with the support of Democratic and Republican leaders in both chambers. The parties may be further apart than at any point in modern American history, but not when it comes to this ongoing crisis."
99,politics,Russia lashes out as Finland races to join NATO,"Finland announced Thursday it is applying to join the North Atlantic Treaty Organization and Sweden is expected to quickly follow, which could expand the Western military alliance to 32 nations. Russian President Vladimir Putin has long been opposed to NATO expansion — even citing it as one of the reasons for his invasion of Ukraine."
100,politics,Government watchdog: One in four older Americans on Medicare harmed during hospital stays,"One in four older Americans covered by Medicare had some type of temporary or lasting harm during hospital stays before the COVID-19 pandemic, government investigators said in an oversight report published Thursday. The report from the U.S. Department of Health and Human Services Office of Inspector General said 12% of..."
101,politics,Tucker Calls Out Montana Senator Steve Daines on Spending,"Do they even know what all is in this bill? Even for those of us who support aid to Ukraine- how much of our money is enough money? Is the money in this bill actually going to Ukraine, or to a bunch of liberal wish-list items? Have all of these Senators even read the entire bill before committing to spending $40 billion of our money, as government spending is fueling the inflation eating away at American's pocketbooks?"
102,politics,"Trump attorney John Eastman pushed Pennsylvania lawmakers to appoint alternate electors in bid to overturn Biden victory, emails show","Washington – An attorney with close ties to former President Donald Trump unsuccessfully urged the Pennsylvania House of Representatives to help overturn Joe Biden's 2020 presidential election victory by recalculating vote counts and appointing a new slate of ""Trump electors,"" emails sent in the weeks following the election show."
103,politics,"D'Souza Targets Fox News, Says Network Banning Mention of '2000 Mules'","The conservative political commentator and filmmaker is now going after Fox News for its coverage of ""2000 Mules."""
104,politics,Migrant families separated by Trump-era policy fighting for restitution,"More than 80 families are suing the Biden administration over the emotional trauma they endured by being separated by U.S. border officials under a Trump-era policy. CBS News immigration reporter Camilo Montoya-Galvez joins ""Red and Blue"" with details."
105,politics,US says 'tens of thousands' Ukrainians sent to Russian territories: 'Everybody afraid to be taken to Dontesk',"A top U.S. official overseeing security in Europe warned Thursday that ""tens of thousands"" of Ukrainians have been forcibly sent to ""filtration camps"" or deported to Russian-controlled territories over the last three months. U.S. Ambassador to the Organization for Security and Cooperation in Europe (OSEC) Michael Carpenter warned in an..."
106,politics,Russian forces gain ground in eastern Ukraine; U.N. official cites likely war crimes,"May 12 (UPI) -- Russian forces assaulted a number of targets in eastern Ukraine on Thursday, including the last bastion of resistance at a steel plant in the port city of Mariupol, Ukrainian officials said as the war approaches the start of its fourth month. Russian troops have stepped up..."
107,politics,Biden administration cancels Alaska oil and gas lease sale,"The Biden administration has canceled one of the most high-profile oil and gas lease opportunities pending before the Interior Department. The decision, which halts the potential to drill for oil in over 1 million acres in the Cook Inlet in Alaska, comes at a challenging political moment, when gas prices are hitting painful new highs."
108,politics,"Jan. 6 committee subpoenas Kevin McCarthy, other Trump House allies","The committee investigating the Jan. 6 riot at the U.S. Capitol took the unprecedented step Thursday of issuing subpoenas to five Republican congressmen, including House Minority Leader Kevin McCarthy of California. The Democratic-controlled committee previously had asked the congressmen, who also include Reps. Jim Jordan of Ohio, Scott Perry of..."
109,politics,Biden warns Republicans plan to reverse gay marriage rights next," President Joe Biden had a stark warning for his Democratic supporters and colleagues: Republicans are coming for gay marriage next.That was the message he delivered to donors at a fundraiser on Wednesday hosted by the Democratic National Committee as the White House and Democrats nationally face questions about whether they have a strategy to see abortion rights protected at the federal level in the event that the Supreme Court overturns Roe v Wade.“Mark my words: They’re going to go after the right of the — Supreme Court decision on the right of same-sex marriage,” he warned.His warning about conservative..."
110,politics,Speaker Nancy Pelosi is standing firm in her endorsement of the only anti-abortion Democrat in the House: Henry Cuellar.,"“He’s a valued member of our caucus,” Pelosi said of the Texas Democrat. “He is not pro-choice. But we do need him.”. Speaker Nancy Pelosi affirmed her support Thursday for Rep. Henry Cuellar (D-Texas) in his tight battle against a progressive primary challenger who has condemned the senior Democrat's stance on abortion."
111,politics,"Biden cancels offshore oil lease sales in Gulf Coast, Alaska","WASHINGTON (AP) — The Biden administration is canceling three oil and gas lease sales scheduled in the Gulf of Mexico and off the coast of Alaska, removing millions of acres from possible drilling as U.S. gas prices reach record highs. The Interior Department announced the decision Wednesday night, citing..."
112,politics,"The US won't give Ukraine intel that would help it kill Russia's most senior commanders over fears it could provoke a wider war, report says","Intel that could help Ukraine go after Valery Gerasimov, chief of Russia's general staff, or Sergey Shoigu, Russia's defense minister, is off limits."
113,politics,‘There’s no way to hide history’: Teachers react to Georgia law limiting discussion of race,"In Georgia, Black educators are disheartened. They are insulted. Most of all, they are mad. A new law, signed by Republican Gov. Brian Kemp, restricts teachers from teaching students about race and racism. According to the text of HB 1084, this includes any discussions that “the United States of America is fundamentally racist,” “any other form of race scapegoating or race stereotyping,” or “espousing personal political beliefs.” The law “prevents divisive concepts and ideologies from invading the classroom” and removes “obscene materials” from school libraries."
114,politics,House Republicans say whistleblowers confirm FBI investigations into outraged parents,"House Republicans issued a public letter Wednesday to Attorney General Merrick Garland, claiming that whistleblowers have confirmed federal investigations into parents outraged by school curriculum across the country. According to House Republicans, who cite unnamed whistleblowers, the FBI's counter-terrorism bureau began placing ""threat tags"" to track parents deemed unruly or..."
115,politics,Ukraine's Zelenskiy lauds Finnish readiness to apply to join NATO,"KYIV, May 12 (Reuters) - Ukrainian President Volodymyr Zelenskiy lauded Finland's readiness to apply to join the NATO military alliance in a phone call with Finland's president on Thursday, Zelenskiy said. ""We also discussed Ukraine's European integration. And - defense interaction,"" he wrote on Twitter. Reporting by Pavel Polityuk; writing..."
116,politics,Rand Paul blocks quick passage of $40 billion Ukraine aid package,WASHINGTON — Kentucky Republican Sen. Rand Paul defied leaders of both parties Thursday and single-handedly delayed until next week Senate approval of an additional $40 billion to help Ukraine and its allies withstand Russia’s three-month old invasion. With the Senate poised to debate and vote on the package...
117,politics,Biden cancels massive oil and gas lease sale,PAIN AT THE PUMP - Biden admin cancels massive oil and gas lease sale with gas prices soaring to record-highs. EXPLOSIVE EXPANSION - Close Russian neighbor takes major step toward joining NATO—Putin responds with ominous statement. Continue reading …. GOVERNMENT WA$TE - Millions of dollars from Biden's massive COVID...
