,categories,headers,contents
59,sports,WFAN bags interview with ex-Yankees star Paul O’Neill for refusing to talk Josh Donaldson-Tim Anderson controversy,"WFAN benched Paul O’Neill. The former New York Yankees star was scheduled to be a guest Monday on “Tiki & Tierney.” But according to the New York Post, Brandon Tierney made the decision to not bring O’Neill on the air because the five-time World Series champion refused to talk about the controversy between Yankees third baseman Josh Donaldson and Chicago White Sox shortstop Tim Anderson."
60,sports,Deshaun Watson Accuser Calls QB's New Browns Contract 'A Big Screw You',"Two of Deshaun Watson's 22 accusers are voicing their disgust over the quarterback's new $230 million contract with the Cleveland Browns ... claiming the team only cares about his talents, not the disturbing claims made against him. Massage therapists Ashley Solis and Kyla Hayes are set to appear on HBO's..."
61,sports,NBC Announces Decision On Al Michaels: NFL World Reacts,"It was announced earlier this year that Al Michaels will call Thursday Night Football for Amazon Prime Video this fall. That being said, he'll continue to have a role with NBC Sports. On Tuesday, NBC announced that Michaels was named to an emeritus role with the network. He'll continue to..."
62,sports,"With this handy tool, finding the best ball for your game is easier than ever","The variety of golf balls on the market can be overwhelming. With each manufacturer offering multiple models, the decision of which ball is best for your game is tougher than ever. Titleist’s ProV1 is beloved by the pros, but will the ball have the same effect off your clubface? What..."
63,sports,"Ex-Red Sox nemesis slams Yankees: ‘D****e’ Josh Donaldson, ‘dumb’ Aaron Hicks","Once again, Joe Kelly is causing problems for the New York Yankees. In 2018 while pitching for the Boston Red Sox, Kelly ignited a bench-clearing brawl after plunking former Yankees first baseman Tyler Austin. Four years later, Kelly is once again taking aim at the Yankees. But this time it’s..."
64,sports,We had a legitimate 'Assault.' moment in Game 4 of the Blues-Avs series,"As those of us who are terminally online know, ""Assault."" has become a phrase synonymous with NFL insider Adam Schefter, who tweeted that word followed by a period—and only that word followed by a period—after Myles Garrett swung his Mason Rudolph's own helmet at Rudolph during a Thursday night game in 2019. ""Assault."" has become a great running joke on social media for any minor or major sports infraction since."
65,sports,Ukrainian Former Boxing Champ Dies Fighting In War Against Russia,Former Ukrainian boxing champion Oleg Prudky died while fighting for his country. The Cherasky Boxing Federation expressed its condolences to Prudky’s family and friends on social media. Ukrainian boxer Oleg Prudky was killed while defending his country against Russian troops. The former Ukrainian boxing champion reportedly died fighting on...
66,sports,Former Chiefs RB signs with Cardinals with vouch from Mahomes,Former Kansas City Chiefs running back Darrel Williams is reportedly signing with the Arizona Cardinals with help from a former teammate.
67,sports,Orioles disrespect Yankees Hall of Famer,"Much like Rodney Dangerfield, Mike Mussina can’t get any respect. On Saturday, the Baltimore Orioles called up top prospect Adley Rutschman and assigned him No. 35. That’s the same number Mussina wore for a decade in Baltimore, where he began his Hall-of-Fame career. ESPN’s Buster Olney and Paul..."
68,sports,Heat's Erik Spoelstra on Celtics' Payton Pritchard grabbing Jimmy Butler's leg: 'It was not a basketball play',"We've got another knee-twisting controversy in the NBA Playoffs. During the first half of Game 3 of the Eastern Conference Finals on Saturday, Celtics guard Payton Pritchard found himself in a bad spot defensively. Pritchard bumped into Heat star Jimmy Butler near the left wing and fell to the floor. Grant Williams switched onto Pritchard's assignment, Tyler Herro, but Pritchard had no way of recovering quickly enough to prevent Butler from penetrating into the paint."
69,sports,Khloe Kardashian Shares a Cryptic Quote About Love Following Tristan Thompson Drama: You Can’t ‘Un-Love’ Someone,"Is there still something there? Khloé Kardashian posted a cryptic quote about love, seemingly addressing how she feels about her ex-boyfriend, Tristan Thompson. “You never stop loving. Once you love someone honestly, truly, you will never be unable to un-love them,"" Kardashian, 37, shared via her Instagram Story on Monday, May 23. ""You only find […]"
70,sports,Steelers Decide On New GM: Fans React,"The Pittsburgh Steelers have reportedly decided on their next general manager ahead of the 2022 NFL season. The franchise is expected to name vice president Omar Khan to the high-ranking position, per ESPN NFL insider Adam Schefter. The NFL world took to Twitter to react to this news. ""It was..."
71,sports,JUSTIN FIELDS TAKES A SHOT AT MATT NAGY,"We have heard multiple players take shots at former Bears head coach Matt Nagy ever since he left Chicago. From Anthony Miller and Allen Robinson complaining about bad plays calling or offensive lineman saying that the mood was always bad in the locker room, we have heard it all. Well, here is the latest. QB Justin Fields had an interview with Ryan Gaydos of Fox News earlier this week. I found his response very interesting. Here is what he said about the new culture:"
72,sports,Indianapolis Colts sign another veteran running back,"The Indianapolis Colts made a lot of changes during the offseason and they seem intent on stocking up their running back corps as much as possible. While the franchise will certainly be leaning on Jonathan Taylor to anchor their running game this season, they’ve signed former Baltimore Ravens running back Ty’Son Williams just two weeks after his previous franchise let him go."
73,sports,Aaron Judge’s take on Josh Donaldson controversy says it all,"In the 72 hours following Josh Donaldson’s racially-tinged “Jackie” snipe directed towards White Sox SS Tim Anderson, Yankees fans have been treated to take after take attempting to rebuke Donaldson’s words while defending his intent, determining what’s in his head without getting an X-Ray. They’ve..."
74,sports,Game 4 Most Recent Injury Reports For Mavs And Warriors,"The Golden State Warriors have a 3-0 lead over the Dallas Mavericks in the Western Conference Finals, and on Tuesday night in Game 4 they can sweep them to advance to the NBA Finals."
75,sports,Michael Vick will no longer play in the Fan Controlled Football League | The veteran QB returns to retirement,There were rumors that Michael Vick would return to the football field and it had a bunch of people fired up to see the former athletic freak of a quarterback. Vick however has decided that he will not suit up this week and play for the Fan Controlled Football League.
76,sports,Ryan Tannehill “disappointed” over Malik Willis comments,"Last month, Ryan Tannehill made headlines when he said he didn’t “think it’s my job to mentor” Malik Willis after the Tennessee Titans selected the quarterback in the NFL Draft. Now, Tannehill says he’s “disappointed” with the way those comments were interpreted. “I..."
77,sports,Nebraska Lands Major Wide Receiver Transfer Commitment,"The Nebraska Cornhuskers continue to utilize the NCAA's transfer portal, going back to the well to land another former Texas Longhorn. On Tuesday, UT wide receiver transfer Marcus Washington took to Twitter to reveal his commitment to Sean Frost's Huskers. Washington is a major pickup for Nebraska as it continues..."
78,sports,Meet Payton Pritchard's parents as the Celtics guard bids for NBA Finals,"Here, we take a look at Payton Pritchard’s parents Terry and Melissa, as well as the Celtics star’s relationship history. Payton Pritchard is enjoying a stellar postseason run with the Boston Celtics as the franchise reached the Eastern Conference Finals for the fourth time in the last six years. They are currently taking on the Miami Heat with the series even at 2-2."
79,sports,Who is in play for the Red Wings Coaching Vacancy?,"The Detroit Red Wings are watching closely as the playoffs power on with the off-season right around the corner. General manager, Steve Yzerman, is viewing his teams architecture and is undoubtedly hard at work. Yzerman’s credentials lives in the Tampa Bay Lightning. With the Lightning only one round away from..."
80,sports,Former NFL player knocks out violent United Airlines employee (video),"A video went viral after it showed an aggressive United Airlines employee squaring off against a former NFL player inside the Newark Liberty International Airport in New Jersey. One video on social media shows the confrontation in mid-fight. You can see the United worker and a passenger, identified as ex-gridiron..."
81,sports,Michael Jordan Rejected Idris Elba: NBA World Reacts,"During a recent appearance on Complex's hit show ""Sneaker Shopping"" with Joe La Puma, English actor Idris Elba shared a story of the time he pitched himself to play Michael Jordan in a movie. But, Elba says the six-time NBA champ turned down the request. In response to La Puma..."
82,sports,Report: Teams making 1 demand in Russell Westbrook trade talks,"The Los Angeles Lakers want to trade Russell Westbrook this offseason, but that does not mean they are going to facilitate a deal by any means necessary. Westbrook was not the player the Lakers hoped he would be when they acquired him in a blockbuster trade with the Washington Wizards. His shooting was erratic for much of the year, which resulted in him being benched multiple times by former head coach Frank Vogel. Because Westbrook was such a poor fit, teams that have interest in the star point guard are trying to get the Lakers to include a sweetener in any potential trade. L.A. may not be willing to do that."
83,sports,"Former Texans star J.J. Watt raves about H-E-B, hates on Texas' notorious humidity",'That humidity is no joke'
84,sports,College Football Analyst Predicts No. 1 Game Of 2022 Season,"The 2022 college football schedule is full of must-see matchups. With so many epic showdowns, it's difficult to pick one that stands out above the pack. Yet given recent events, the top choice might not be too shocking. Brandon Marcello picked his 10 most-anticipated matchups for the upcoming season on..."
85,sports,Kyler Murray scoffs at being paid $5.489M as Arizona Cardinals quarterback; sits OTAs,"Our society has lost its collective mind. Not only is Arizona Cardinals quarterback Kyler Murray sitting out OTAs because of the “disrespect” he feels as he is scheduled to be paid over five-million bucks for the 2022 season, but pundits are defending his stance because other quarterbacks make so much more."
86,sports,3 forgotten former Steelers players who are miraculously still in the NFL,"Our focus is on the present, but here are three former Pittsburgh Steelers still paying in the NFL that you might have forgotten about. The Pittsburgh Steelers are an old-school team with philosophies that have stuck around through the generations. One of those is retaining their own players. If they feel like they have a really talented football player, they will typically do everything in their power to keep that player around for the long haul."
87,sports,Colin Cowherd Names The 'Best Fit' For Lakers Head Coach,"As the Los Angeles Lakers continue to search for their new head coach, Colin Cowherd believes their ideal candidate is currently employed. On Monday, Marc Stein said the Lakers have not ""abandoned hope"" of Philadelphia 76ers head coach Doc Rivers becoming available. Although Rivers still has a job, Cowherd said his experience and championship pedigree would make for the perfect hire."
88,sports,Wife of WNBA star Brittney Griner speaks to ABC News' Robin Roberts,"Cherelle Griner, the wife of WNBA superstar Brittney Griner, who has been detained in Russia, spoke for the first time in an exclusive interview with ""GMA."""
89,sports,Bradley Beal Reveals Where He's Leaning: NBA World Reacts,"Washington Wizards star Bradley Beal is set to be a free agent this summer. However, it doesn't sound like he'll be leaving the nation's capital. Beal is reportedly ""leaning"" towards staying with the Wizards. He could, in theory, sign a $250 million extension this offseason. “This injury also gave me..."
90,sports,San Diego Padres: 3 questions about the return of Fernando Tatis Jr.,"San Diego Padres fans now have a timeline of when Fernando Tatis Jr. might bring his All-Star skills back to the San Diego lineup. However, there are still some questions looming about the 23-year-old shortstop/outfielder leading up to, and likely after, his return. Here are 3 questions we have about..."
91,sports,NFL safety turned neurosurgeon shares secret behind his success beyond the football field,"Only three people have ever had the distinction of both playing in the NFL and having been awarded a Rhodes Scholarship, and Myron Rolle is one of them. For more than five years, he has worked in the neurosurgery department at Harvard Medical School and Massachusetts General Hospital. Rolle recently sat down with CBS News special correspondent James Brown to discuss his journey from the gridiron to the operating room, and his new book, ""The 2% Way,"" which is out now."
92,sports,Giants fans will be furious with James Bradberry’s reason for picking Eagles,"Hearts are still broken in East Rutherford with former NY Giants Pro Bowl cornerback James Bradberry signing with the Philadelphia Eagles. Bradberry, who spent two years with the Giants after four campaigns with the Panthers, was released by the team and signed with Philly earlier this month. Bradberry didn’t want..."
93,sports,"Buffalo Bills OTAs Week 1 practice observations: Von Miller debuts, fight breaks out","Orchard Park, N.Y. — Von Miller arrived for Organized Team Activities on Tuesday and participated in his first full practice with the team since signing his mega deal in free agency in March. Miller spent his time bouncing around the defensive line chatting with some of the young Buffalo..."
94,sports,Astros OF Kyle Tucker doesn't want to 'prolong' extension deal,"Astros outfielder Kyle Tucker has quickly rebounded after a rocky couple weeks to begin the year, hitting .310/.402/.530 over the past month after getting out to a brutal .087/.192/.217 start through his first 13 games. That production only serves as a reminder that the 25-year-old is viewed as a building block in Houston. That fact is also backed up by the team’s apparent efforts to sign Tucker to a long-term extension. Mark Feinsand and Brian McTaggart of MLB.com reported recently that the ’Stros approached Tucker’s camp about an extension this year but talks proved unsuccessful and are not active at this time (Twitter link)."
95,sports,Warriors-Mavs: Star Player Ruled Out For Game 4,Otto Porter Jr. has been ruled out for Game 4 of the Western Conference Finals on Tuesday night in Texas. The Golden State Warriors have a 3-0 lead in the series over the Dallas Mavericks.
96,sports,Braves: Is there an end in sight for Adam Duvall?,"Several aspects of the Braves have been painful to watch through the first 42 games of the season, but none more so than Adam Duvall‘s regression to his 2018 self. The powerful right-hander that hit 38 homers last season and led the National League in RBIs has become an automatic out at the plate, much like he was when the Braves originally acquired him from the Reds four years ago."
97,sports,3 Free-Agent Goalies Who Should Be On Pittsburgh Penguins’ Radar,"Pittsburgh Penguins general manager (GM) Ron Hextall has his plate full at the moment as the long-time executive has a number of major decisions looming for the franchise this offseason. It has already been a busy one for the Penguins GM and it won’t be slowing down anytime soon. While contract extensions for Kris Letang and Evgeni Malkin are just two of the orders of business, so too is finding some goaltending depth for next season. We saw the desire to stand pat in the crease at this season’s trade deadline and quite frankly that didn’t work at all. The Penguins need more depth behind starter Tristan Jarry, so let’s take a look at three free agents who could help in that regard."
98,sports,Ex-Lakers Player Slava Medvedenko Selling His 2 Championship Rings to Support Ukraine amid Russian Invasion,"Slava Medvedenko is helping his home country of Ukraine – and the Los Angeles Lakers are in full support. The former NBA player, 43, who played for the championship-winning organization from 2000 to 2006, is going to extra lengths to defend the country amid the Russian invasion, which began in February."
99,sports,Panthers make decision about Christian McCaffrey,"Carolina Panthers fans who were expecting to see running back Christian McCaffrey during the preseason will be disappointed. Panthers head coach Matt Rhule has ruled him out as they attempt to avoid aggravating any old injuries unnecessarily. McCaffrey hasn’t played a full season in two years, so it’s understandable why..."
100,sports,Lakers: Former LA Guard Makes His Pitch to Rejoin Team This Summer,Jodie Meeks thinks he could contribute for the Lakers next season.
101,sports,Kyle Shanahan Sends Clear Message About Deebo Samuel,"Deebo Samuel remains on the San Francisco 49ers without a new contract, and the disgruntled wide receiver unsurprisingly will not report to voluntary offseason workouts. Although the two sides have yet to reach a resolution, Kyle Shanahan still believes they can repair the relationship. During Tuesday's press conference (h/t Pro..."
102,sports,Kyle Shanahan Reveals His Expectation For Jimmy Garoppolo,"Pre-offseason shoulder surgery, Jimmy Garoppolo was a sure bet to be dealt by the 49ers in order to clear the decks for Trey Lance. But right now, Garoppolo remains on San Francisco's roster, unable to throw until some time this summer, with a $25 million salary. Speaking to reporters Tuesday,..."
103,sports,Saints Have Announced Two Roster Moves,"The New Orleans Saints announced a couple of roster moves made earlier today. They have signed free agent TE Kahale Warring and waived rookie DB Jack Koerner. Warring played at San Diego State and was drafted 86th overall by the Houston Texans in the 3rd round of the 2019 NFL Draft. He played seven games for the Texans in 2020, one game for the Buffalo Bills as well as one game for the Jacksonville Jaguars in 2021."
104,sports,Aaron Rodgers Not At OTAs: NFL World Reacts,"Earlier Tuesday afternoon, Green Bay Packers head coach Matt LaFleur met with the media. During his media appearance, LaFleur admitted that star quarterback Aaron Rodgers was not participating in organized team activities this week. LaFleur said he did not expect Rodgers to attend OTA's and doesn't expect to see him the rest of the week."
105,sports,Tyreek Hill Makes His Opinion On Tua Tagovailoa Very Clear,"From the moment Tyreek Hill landed in Miami earlier this offseason, fans and analysts from around the league have all posed a similar question:. Will the superstar wide receiver be able to thrive with Tua Tagovailoa at the quarterback position?. During a post-practice press conference on Tuesday, Hill expressed his..."
106,sports,"Jimmy Butler, Miami's ceiling exposed in Game 4 loss to Celtics I THE HERD","Colin Cowherd says the Miami Heat has little margin for error going into Game 5 of the Eastern Conference Finals after losing soundly to the Boston Celtics by 20 points in Game 4. While he maintains Jayson Tatum's Celtics aren't talented enough to phone it in against Jimmy Butler, Colin shares why he still believes the Celtics have exposed Miami's ceiling."
107,sports,49ers Have Reportedly Communicated Plan To Jimmy Garoppolo,"Following the 2021 season, it certainly seemed like Jimmy Garoppolo would be on the move in the near future. However, he remains on the San Francisco 49ers' roster heading into the back half of the offseason. After trading up to select Trey Lance with the No. 3 overall pick in the 2021 NFL draft, the team now has a decision to make."
108,sports,Former NFL Player Charged After Fight with United Airlines Employee at N.J. Airport Goes Viral,"United Airlines has fired an employee who fought with a former NFL player at Newark Airport, and the football star himself is facing criminal charges. Brendan Langley, 27, scuffled with a United Airlines employee last week, ultimately knocking the airline worker to the ground more than once. The employee is seen repeatedly returning to Langley and appearing to taunt him into an ongoing fight."
109,sports,"Yankees’ Aaron Judge, Aaron Boone react to Josh Donaldson suspension","NEW YORK — Yankees right fielder Aaron Judge didn’t like the comment teammate Josh Donaldson made to White Sox shortstop Tim Anderson that led to benches clearing and an eventual suspension for Donaldson. “A joke or not,” Judge told reporters after a 6-4 loss to the Orioles at..."
110,sports,"Little by little, this Lightning team will steal your heart","TAMPA — All these years later, how do they do it?. Not just the winning. That’s explained easily enough with a stat here and an Andrei Vasilevskiy there. No, after all the records, awards, championships, farewells, arrivals, injuries, slumps, salary caps, grudges and community heroes, how do they pull off the most remarkable feat in sports?"
111,sports,Houston Astros GM says the decision not to re-sign Carlos Correa was about ‘winning’,Houston Astros general manager James Click says that the team’s decision not to re-sign star shortstop Carlos Correa for 2022
112,sports,2nd Half Of Warriors-Mavericks Game Delayed - Here's Why,"The second half of tonight's Game 4 matchup between the Golden State Warriors and Dallas Mavericks was delayed for a pretty unique reason. With rain in the Dallas area, the American Airlines Center roof is being put to the test. Unfortunately, a weak point in the structure resulted in a significant leak."
113,sports,Chiefs rookies were blown away after trying Kansas City barbecue for the first time,A side benefit to being drafted by the Chiefs: a chance to sample the barbecue around town.
114,sports,Herschel Walker Wins GOP Primary: Fans React,"Former football star Herschel Walker has claimed victory in the Georgia Republican senate primary. The 60-year-old politician, who's backed by former president Donald Trump and minority Senate leader Mitch McConnell, will face off against democratic Senator Raphael Warnock in the general election later this year. Walker won the primary despite..."
115,sports,Ex-football star Herschel Walker wins Georgia GOP Senate nomination,"Former University of Georgia football standout  and pro-football running back Herschel Walker easily won the Republican Senate primary in the Peach State on Tuesday, lining him up to take on incumbent Democrat Raphael Warnock in November. 

Walker defeated six other GOP candidates, including state Agriculture Commissioner Gary Black. The AP called the race an hour after polls closed. 

Walker had 70.4% of the vote with 16% of precincts reporting.

Walker, who won the 1982 Heisman Trophy as the best college football player in America and helped the Bulldogs to the national championship as a freshman in 1980, was the heavy favorite to..."
116,sports,Jalen Rose Reacts To Juwan Howard's Coaching Decision,"On Monday, ESPN insider Adrian Wojnarowski announced that Michigan head coach Juwan Howard declined an interview with the Lakers for their job opening. That decision doesn't surprise his former ""Fab Five"" teammate, Jalen Rose. During the latest episode of Jalen & Jacoby, Rose shared his thoughts on Howard turning down..."
117,sports,Alabama Lands Commit From Elite QB Eli Holstein; Tide Moving on From Manning?,"The Alabama Crimson Tide has landed a commitment from an elite 2023 QB, Eli Holstein. Does that signal they have moved on from Arch Manning?"
118,sports,Mike Trout reacts to Tom Brady baseball video,"Tuesday, Tom Brady posted a video of himself taking in some batting practice along with Rob Gronkowski. Brady looked pretty good at the plate and had some solid cuts. He captioned the video by saying, “Wonder if that Expos offer is still on the table…”. While Brady played..."
119,sports,Are Gronkowski’s Contract Demands Too Much For Bucs?,"Another day, another Pro Football Talk speculation story about the Bucs. But this one is not about Tom Brady or Bruce Arians. The latest is regarding tight end Rob Gronkowski, who has yet to re-sign with Tampa Bay. The PFT story speculates that Gronkowski’s contract demands may be what is keeping him unsigned. And as it turns out, it’s another incorrect speculation piece – as usual."
120,sports,Kansas City Chiefs' Mecole Hardman sees 'opportunity' after losing 'once-in-a-generation' WR Tyreek Hill,"KANSAS CITY, Mo. -- Mecole Hardman said he did no celebrating upon learning the Kansas City Chiefs traded fellow wide receiver Tyreek Hill. He called the loss of Hill ""definitely a hit for sure,"" adding that Hill's mere presence opened chances for other Chiefs receivers. But now that Hill is..."
121,sports,Cincinnati Bengals rookie Cordell Volson could be the final piece to Joe Burrow's offensive line,"CINCINNATI -- In a massive, tool-filled North Dakota garage made for holding payloaders and semi-tractors, Cordell Volson watched April’s NFL draft on a projection screen, waiting to see if all his hard work had paid off. Finally, the phone rang. With the 136th pick, the Cincinnati Bengals selected the..."
