,categories,headers,contents
64,sports,"Cowboys Firing Coach Mike McCarthy at Midseason, NFL Network Predicts",A hot-seat hot take? Here's the NFL Network sizzler: Mike McCarthy will get fired in-season.
65,sports,MLB World Reacts To Absurd Oneil Cruz Throw,"Oneil Cruz has finally arrived. The Pittsburgh Pirates promoted the shortstop on Monday, and he's instantly made his mark. During the third inning, Cruz fired a 96.7-mph laser to first base to retire Chicago Cubs catcher Willson Contreras. It was the hardest throw by an infielder all season. Not even..."
66,sports,Why Paul DeJong could soon be called up by the St. Louis Cardinals,"Why Paul DeJong could soon be called up by the St. Louis Cardinals as he continues to play well with Triple-A Memphis. This past offseason, the St. Louis Cardinals front office elected to go with Paul DeJong rather than pursue a generational class of free-agent shortstops. It turned out to be a massive mistake, as DeJong struggled and was eventually optioned to the minors in hopes of recapturing his swing and confidence."
67,sports,Lance Lynn Furious With Umpire Ramon De Jesus After Horrible Call,Lance Lynn was angry after Ramon De Jesus made one of the worst ball/strike calls of the season.
68,sports,Tyreek Hill fires back at Ryan Clark for saying WR was ‘lying’ about Tua Tagovailoa-Patrick Mahomes claim,"Miami Dolphins newcomer Tyreek Hill recently made a fairly surprising statement when he claimed that Dolphins quarterback Tua Tagovailoa is more accurate than Kansas City Chiefs superstar Patrick Mahomes. Of course, Mahomes and Hill were teammates for several years on the Chiefs and made up one of the most potent..."
69,sports,72 U.S. Open takeaways — including a near-death at The Country Club,"THE SAMUEL ADAMS TAPROOM, HAPPY TO BE ALIVE, Mass. — You ain’t livin until 2,000 rowdies and 50 cops collapse onto you. If that’s not a saying already, I’m making it one. It’s the day after another memorable U.S. Open, we’re toasting the week that was,..."
70,sports,"Draymond Green at Warriors parade: Thank you all, ‘f–k everybody else’","see also







Draymond Green trolls Celtics one last time on Father’s Day after Warriors’ title win



Draymond Green’s speech at the Warriors’ championship parade on Monday could not have ended any differently.

Earlier in the day, Green had quipped about how he might as well skip the San Francisco celebration if there were no speeches. 

Lo and behold, he found himself with a live microphone.

The Golden State forward concluded his turn to speak with a succinct message to Warriors fans: “Thank you all, and it’s always f–k everybody else.”

Green spoke at the parade for a couple minutes, joking that he was going to..."
71,sports,Former Penn State Quarterback Christian Hackenberg Was Doing a Keg Stand When Coach Bill O’Brien Left for NFL,"Bill O’Brien celebrated New Year’s Eve 2013 by leaving Penn State for a head coaching…
The post Former Penn State Quarterback Christian Hackenberg Was Doing a Keg Stand When Coach Bill O’Brien Left for NFL appeared first on Outsider."
72,sports,Steve Kerr Speaks on Kenny Atkinson's Decision to Turn Down Hornets,Head coach of the NBA champion Golden State Warriors breaks the silence.
73,sports,NFL World Reacts To Ex-First Round Pick Retirement News,"In 2015, the Minnesota Vikings made former Michigan State cornerback Trae Waynes the 11th overall pick in the 2015 NFL Draft. But seven years and two teams later, Waynes is calling it a wrap on his career. In a radio interview on Monday, Waynes announced that he feels he's ready..."
74,sports,"Nick Faldo retiring from CBS Golf analyst role, network names replacement","Sunday afternoons on CBS are about to sound different. On Tuesday morning, longtime lead analyst Nick Faldo announced his intention to retire from the CBS Golf booth upon the completion of the PGA Tour season in August, ending a 16-year run with the network. “I have come to the time..."
75,sports,Look: Steph Curry Has 5-Word Message For Everyone Today,"Stephen Curry has nothing left to prove. The star point guard led the Golden State Warriors to their fourth championship in eight years. He also picked up plenty of individual accolades along the way. In February, Curry was named the 2022 NBA All-Star MVP following a 50-point showcase. He also..."
76,sports,Browns Say They Don't Want New Stadium: NFL World Reacts,"The Cleveland Browns disputed a report alleging their plans to build a new stadium when their FirstEnergy Stadium lease expires in 2028. According to Ken Prendergast of NEOtrans, Haslam Sports Group wants a new stadium with a retractable roof or dome. They have identified two potential spots for a venue that would potentially cost more than $1 billion."
77,sports,Top Faction Appears And Title Change Takes Place On WWE Main Event,"Judgment Day were conspicuous by their absence during “WWE Raw” this week after their recent push, but the group was involved prior to that during the latest taping for “WWE Main Event.”. While Rhea Ripley did not appear on the show, Finn Balor and Damian Priest were..."
78,sports,New photo shows Tiger Woods’ injured right leg without leg sleeve,"If you weren’t impressed with Tiger Woods’ return to golf, visual proof of the damage incurred to his right leg during his February 2021 single-vehicle accident might change that. Despite displaying signs of fatigue and soreness, Woods has impressed in his return to major championship golf, making the..."
79,sports,Everybody is trying to figure out Kyrie Irving’s latest tweet,"Kyrie Irving can be…cryptic at times on social media. His latest tweet came almost an hour after Shams Charania reported that Irving may decline his player option and go to free agency after conversations between he and the Brooklyn Nets have gone “stagnant.”. Irving’s tweet, seemingly in response..."
80,sports,Rockets' Kenyon Martin Jr. Wants Out; Why Not Expand Christian Wood Trade with Mavs?,The 21-year-old forward wants a change of scenery just two years into his young career.
81,sports,Brooks Koepka joining Saudi-backed LIV Golf tour,"The turbulent times for the PGA Tour roll on as yet another one of its big-name stars is poised to join the Greg Norman-led LIV Golf series, according to The Telegraph.

The United Kingdom paper reports that Brooks Koepka is joining the controversial Saudi-backed tour, joining the likes of Phil Mickelson, Dustin Johnson, Bryson DeChambeau and other stars the game who have already defected.  

Koepka, who’s won four major championships, notably scrubbed the PGA Tour from his social media platforms. He’s expected, according to the report, to play in the next LIV Golf event, next week in Portland.  

The 32-year-old Koepka is a..."
82,sports,Former Purdue Star Caleb Swanigan Dead at 25,The college basketball morns the loss of the former Purdue Boilmaker.
83,sports,Rays’ long-shot chances of catching Yankees just took a major hit,"It ain’t over ‘til it’s over. But it’s pretty darn close. The Tampa Bay Rays are the two-time defending American League East champions. But a third straight title doesn’t appear to be in the cards, with the New York Yankees (50-17) running away with the division this season. The Toronto Blue Jays (38-29) are in second place, 12 games back. The Rays (36-31) are in fourth place, 14 games back."
84,sports,Brittney Griner Unable To Call Wife: Sports World Reacts,"Brittney Griner and her wife, Cherelle, attempted to celebrate their fourth wedding anniversary with a phone call over the weekend. However, despite repeated attempts to connect, there were unable to get a call completed. The Associated Press reports that Cherelle Griner was unable to connect with her wife in Russia."
85,sports,NFL Team Is Reportedly Exploring Sites for New Stadium,"An NFL team is ready to move into a new stadium. According to a report by neo-trans.blog which was picked by The News-Herald, the Cleveland Browns are exploring sites for a new stadium while debating if they want to renovate the current stadium the team plays in. If the Browns find a location for a new stadium, the current one, FirstEnergy Stadium would be demolished and the land that occupies it would be developed into retail stores and housing."
86,sports,Chicago Bears lose one name in right guard competition,"The Chicago Bears do not currently know who is going to start at right guard for them. In the tear down of the roster, they have yet to build it all the way back up yet, and it meant that one spot was going to be a weakness, and it was looking like right guard was that spot."
87,sports,Nick Faldo announces retirement from full-time broadcasting,"Nick Faldo has today announced that he will retire from full-time broadcasting duties, having been on CBS’s golf telecasts for the last 16 years. The 6-time major champion announced the news in a lengthy statement on social media, saying in part:. “After much consideration and discussions late last year..."
88,sports,Is Kyrie Irving Clearing Suns' Path to Land Kevin Durant?,"With Kyrie Irving potentially on the way out of Brooklyn, the Suns might just have a better shot at landing Kevin Durant."
89,sports,Lightning star Nikita Kucherov injured on ‘dangerous play’ by Avalanche,"The Tampa Bay Lightning defeated the Colorado Avalanche 6-2 Monday night in Game 3 of the Stanley Cup Final, but it may have come with a cost.

Tampa Bay’s star winger Nikita Kucherov left the contest with 6:05 remaining in the third period after what one teammate deemed “a dangerous play” by Avalanche defenseman Devon Toews. 

As Kucherov handled the puck and attempted to navigate around Toews, the Colorado defenseman cross-checked him from behind. The thunderous blow sent Kucherov crashing into the boards as he buckled to one knee. 

The Lightning forward briefly remained on the ice following the collision – even going..."
90,sports,"Where is Arch Manning going to college? Latest news, recruiting updates after Texas, Alabama, Georgia visits","Arch Manning has taken the recruiting world by storm. Cooper Manning's eldest son is not only the No. 1 recruit in the 2023 class, per 247Sports Composite Rankings, but he has a perfect 1.000 score, making him one of only seven players in 247 history to earn the perfect score and one of three quarterbacks, joining Vince Young and Quinn Ewers."
91,sports,Watch Kerr fulfill 'Ted Lasso' dance promise in parade ... sort of,"Steve Kerr’s coaching abilities are much better than his dancing. That much was evident during the Warriors championship parade on Monday, where he fulfilled his promise to do the “Ted Lasso” dance made famous by AFC Richmond’s coach from the hit Apple TV show. Kerr previously had vowed to give it his best shot if the Warriors won a title this season."
92,sports,"Purdue All-American, former NBA player, Caleb Swanigan dead at the age of 25","Former Purdue standout and 2016-17 consensus First Team All-American Caleb Swanigan died Monday, the school announced. The family confirmed the death. He was 25. Swanigan was also the Big Ten Player of the Year in 2017, following a season in which he averaged 18.5 points, 12.5 rebounds and 3.1 assists for a Purdue team that went 27-8 and made the Sweet 16. Swanigan, a former McDonald's All-American, parlayed his dominant sophomore campaign to early entry into the NBA Draft. He was selected 26th overall in 2017 by the Portland Trail Blazers, where he played for two seasons."
93,sports,"Warriors' Klay Thompson has sloppy title parade in SF as he drops ring, accidentally lays out fan",Klay's earned the right to get a sloppy. And boy did he take advantage of that right.
94,sports,Experts continue to question why the Colts hired Gus Bradley,"The Indianapolis Colts have a new defensive coordinator in Gus Bradley but some NFL experts are questioning if it’s a good fit. This offseason, the Indianapolis Colts had to find a new defensive coordinator after Matt Eberflus accepted the head coaching job with the Chicago Bears. Indy decided to clean house defensively and moved on with Gus Bradley."
95,sports,Dodgers acquire right-handed hitting Trayce Thompson from Tigers,"In need of a right-handed hitting outfielder in the light of Mookie Betts' injury, the Dodgers traded for Trayce Thompson from the Detroit Tigers."
96,sports,Mets recall Dominic Smith,"With teams cutting their pitching staffs down to 13 on Monday, the Mets announced that they have recalled first baseman/outfielder Dominic Smith from Triple-A Syracuse and placed righty Seth Lugo on the paternity list. Another arm will have to be sent out once Lugo returns from the paternity list later this week."
97,sports,Surprising team listed as favorite to land Bradley Beal,"Bradley Beal could be making a Jaws-sized splash this offseason. Online sportsbook SportsBetting.ag posted odds this week for the three-time All-Star Beal’s next landing spot. Surprisingly, they have the Boston Celtics listed as the favorite to land Beal at 3-1 odds. The Portland Trail Blazers (4-1), Miami Heat (5-1), Brooklyn Nets (6-1), and Atlanta Hawks (7-1) round out the top five on the list."
98,sports,‘I’ll have a liver like a football’: Matt Fitzpatrick’s caddie hilariously describes his post-Open plans,"Matt Fitzpatrick wasn’t the only person to claim his first major title on Sunday at the U.S. Open. Fitzpatrick’s caddie, Billy Foster, has been a Tour bagman for four decades. His client list includes a who’s-who of European greats like Seve Ballesteros, Thomas Bjorn, Darren Clarke, Lee Westwood and Sergio Garcia, and even a short stint with Tiger Woods."
99,sports,Free agent debated joining Eagles but will now ponder official retirement,"Here’s something intriguing if you missed it. What if we told you there’s a possibility that the Philadelphia Eagles may have been oh so close to adding Trae Waynes before getting lucky and landing James Bradberry after the latter’s release from the rival New York Giants? Apparently, it could have happened… possibly."
100,sports,"Rory, I think it's time for me to see other golfers","I'm wide awake and I can see the perfect sky is torn."" —Natalie Imbruglia, presumably singing about Rory McIlroy. I can't take this anymore. I'm happy for Matt Fitzpatrick, and I know you are too, and I'm happy for the sport of golf. But sitting here alone, on another bleak Sunday night, watching the fireflies outside the window, I can't escape my own truth. And my truth is that I dreamed of something different this weekend. Something more. I'm talking about real-life dreams, Rory, not like at night when I have nightmares of being chased by wolf-cats with the face of Tyrrell Hatton."
101,sports,Why The Magic And Rockets Should Trade Draft Picks,A trade between the two sides is a win-win scenario.
102,sports,"Rhea Ripley Injured, Pulled From Money in the Bank Match Against Bianca Belair","Rhea Ripley is apparently injured and will no longer face Bianca Belair at WWE's next Money in the Bank premium live event. The news that Ripley would be pulled from the Raw Women's Championship match broke only minutes before Monday Night Raw via a show rundown obtained by Fightful Select. At the very start of the broadcast, Belair confirmed the news but did not elaborate on exactly what was going on with her intended adversary."
103,sports,"Brittney Griner's Wife Cherelle ""Very Pissed"" After She's Unable to Reach WNBA Star on Their Anniversary","Watch: Brittney Griner's Wife Speaks Out After Arrest. Brittney Griner's wife Cherelle was left furious after the couple could not celebrate their fourth wedding anniversary by phone over the weekend. During a June 20 conversation with the Associated Press, Cherelle explained that she and the WNBA star—who is currently behind..."
104,sports,This Nets-Celtics Trade Features Kevin Durant To Boston,"The Golden State Warriors proved to be too much for the Boston Celtics in the 2022 NBA Finals. Among the themes for the Cs was Jayson Tatum shouldering a heavy load, which seemed to impact his performance in the series as it progressed. Adding another superstar could go a long way."
105,sports,"Buckeyes Could Land Another Five-Star Receiver, Ohio State Dominates NIL Game, and Jack Sawyer Gets a New Truck","I like to think that's what I look like when I work out. Nobody tell me if I'm wrong. Word of the Day: Incubus. DOUBLE-BARRELLED BOOM? You know what's better than landing a five-star receiver? Landing two five-star receivers. After securing a commitment from Carnell Tate yesterday, Brian Hartline's now..."
106,sports,WWE Names New Interim Head Of Talent Relations To Replace John Laurinaitis,"WWE issued a memo to talents Monday evening following “Raw” announcing that Senior VP Bruce Prichard will be taking over as the Interim Head of Talent Relations effective immediately, according to PWInsider. The memo also informed talents that John Laurinaitis has been placed on “administrative leave” in light..."
107,sports,Wife of WNBA’s Griner tells AP scheduled call never happened,"WASHINGTON (AP) — WNBA star Brittney Griner tried to call her wife nearly a dozen times through the American embassy in Russia on the couple’s fourth anniversary Saturday, but they never connected since the phone line at the embassy was not staffed, Cherelle Griner said Monday. The couple..."
108,sports,NASCAR: Hendrick Motorsports Picks Replacement Crew Chief for Kyle Larson Amid Suspensions,"When NASCAR was in Sonoma, California, Kyle Larson lost a wheel. That cost him his crew chief and more for four weeks. So, starting this week in Nashville, Larson’s No. 5 team is going to be without Cliff Daniels for the next four Cup Series races. That’s the same thing that has happened to each team this season that has lost a wheel during a race."
109,sports,Look: Graphic Designer Posts Four Potential Bengals Uniform Combinations For 2022,Which one do you like the best?
110,sports,"VIDEO: Klay trips, knocks woman over at parade",SAN FRANCISCO (KRON)– Klay Thompson had no shortage of memorable moments at the Golden State Warriors’ 2022 championship parade. One of them ended in a woman falling on her back. KRON ON is streaming news live now A video shared with KRON4 shows the Warriors star tripping and charging into a woman as he tries […]
111,sports,Transgender ban for women's rugby league Tests,"The International Rugby League has followed the lead of swimming's world governing body FINA by banning transgender athletes from sanctioned international matches. The decision will prevent male-to-female athletes from competing in this year's Rugby League Women's World Cup in England. The IRL said that ""until further research is completed"" the..."
112,sports,"Former KC Chiefs players find new homes with Cardinals, Patriots","A few former members of the Kansas City Chiefs roster found new homes for the 2022 season in the last few days, including LB Ben Niemann. While our primary focus is all about the current state of the Kansas City Chiefs roster, the truth is we remain interested in what’s happening with former players who played at Arrowhead Stadium even after they’ve last donned the red and gold. That means our interest was piqued when we heard about new faces in new places in recent days as former Chiefs fortunately had the chance to extend their careers with new teams."
113,sports,Jameis Winston's younger brother works out for Florida State's coaching staff,The rising high school freshman threw for the Seminoles' staff over the weekend.
114,sports,Steph's not-so-subtle bling necklace with every championship ring,"Steph Curry always is lauded for his humility, and that’s what sets him apart as an NBA superstar. So it was awesome to see Curry show up to the Warriors championship parade with the perfect bling - a necklace holding all three of his title rings. The only thing..."
115,sports,Anthony Rendon's $245 Million Contract Is an All-Time Bust,"Anthony Rendon is having season-ending wrist surgery, putting a stop to this third season with the Los Angeles Angels after only 45 games. Given that he's never played more than 58 games in a season for the Halos, the seven-year, $245 million contract Rendon signed in December of 2019 is looking like an enormous bust and one of the worst deals in MLB history."
116,sports,One Insider: Rudy Gobert to the Chicago Bulls Has Become a League “Expectation”,The Chicago Bulls have arguably been the most widely discussed team when it comes to potential trade partners for Utah’s Rudy Gobert. And Matt Moore of The Action Network and Locked on Nuggets Podcast just added even more fuel to the fire. When discussing potential opportunities for Denver to...
117,sports,"Megan Rapinoe Says Trans Athletes Aren't Ruining Women's Sports, 'Show Me The Evidence'","U.S. women's soccer legend Megan Rapinoe believes it's ""disgusting"" to ban transgender athletes from competing in women's sports ... saying people need to ""get a grip on reality and take a step back."" The 36-year-old made the comments in an interview with TIME shortly after FINA -- the swimming world's..."
118,sports,"NFL to Seek 'Significant' Punishment for Deshaun Watson, According to Report","It's likely Deshaun Watson will not play in any NFL games for the second consecutive season. According to the Washington Post per Sports Illustrated, the league is going to argue that the Cleveland Browns quarterback should receive a ""significant"" suspension for violating the NFL's personal conduct policy. A source close to Watson's side said the NFL will ""probably"" suspend Watson for the entire year. But another source who is close to the NFL's side said to be ""careful"" about a specific suspension length."
119,sports,Gary Player urges US Open champion Matt Fitzpatrick to avoid ‘poison’ of modern-day coaching," Nine-time major winner Gary Player has urged new US Open champion Matt Fitzpatrick not to change his game in the wake of his major breakthrough as others who have “can’t play any more”.The outspoken 86-year-old claims there are at least a dozen recent major winners who have no chance of being successful on the biggest stage again as they have been “poisoned” by modern-day coaching methods in an attempt to get to the next level.Player highlighted Bryson DeChambeau, who has been pushing the boundaries of distance off the tee, winning just once on the PGA Tour since his 2020..."
120,sports,3 Bruins Defensemen Who Could Be On the Move This Offseason,"The Boston Bruins are at a crossroads. Management must decide how to construct the team, with an eye towards competing in the short term, building for the long term, or some awkward combination of both. Also up in the air, who will be behind the bench for the Bruins? How will their style impact this roster construction? Finally, and today’s topic of debate, what will their blue line look like for the upcoming season? Will there be pieces moved? Can there be any leaving the organization with the injury bug ripping through the group?"
121,sports,2 Teams Are Reportedly Emerging For Kyrie Irving,"Kyrie Irving might not return to the Brooklyn Nets in 2022-23. According to a report from Shams Charania of The Athletic, the Brooklyn Nets and their star point guard are in a standstill regarding his contract situation. This could reportedly open the door for Irving to leave the Nets in..."
122,sports,"Tristan Thompson, Khloe Kardashian looking cozy again -- mere days after she said she’s single","Khloe Kardashian and Tristan Thompson appear to be getting close again, as the former couple were spotted together only days after the reality star said that she was single.The 37-year-old Good American founder and 31-year-old NBA star were photographed together on 18 June, one day before Father’s Day. The pair were out to lunch with their four-year-old daughter, True.This is the first time that the duo has been publicly photographed with one another since December 2021. Notably, that time period was when Kardashian found out that the basketball player had cheated on her with fitness instructor Maralee Nichols, who filed..."
123,sports,Arch Manning's High School Teammate Announces His Commitment,"Top college football recruit Arch Manning may not have made a decision on his future yet, but one of his teammates did on Sunday. Will Randle, a three-star tight end who played alongside Manning at Isidore Newman, will continue his football career at the University of Texas. Tweeting, ""Something in..."
124,sports,"Draymond Green at Warriors Championship Parade: 'F*** Everybody Else""",Draymond Green is having a time at the Warriors' championship parade.
125,sports,Packers' Quay Walker admits to losing confidence,"When the Green Bay Packers used their first pick in the 2022 NFL Draft on Georgia linebacker Quay Walker, there was a great deal of hype surrounding him. Of course, there were some fans who were upset the Packers did not use the pick on a wide receiver, but some people are happy being unhappy."
126,sports,Brian Hartline Trending Following Ohio State's Latest Commitment,"Brian Hartline sure can pick 'em. Since taking over as Ohio State's wide receivers coach, the former Buckeye standout has earned a number of five-star WR recruits and sent some big names to the NFL. Over the past five years, no school has landed more top-50 receivers. Thanks in large..."
127,sports,3 Bold Trades To Send Damian Lillard To Houston Rockets,"Generally speaking, rebuilding teams are best advised to avoid rash decisions in the NBA. Cutting the process short may alleviate short-term pain at the expense of long-term gain. The Houston Rockets are clearly a rebuilding team. In fact, they’ve been the worst team in the NBA in back-to-back seasons. Any..."
