,category,header,content
7,weather,"Possible Arizona Tornado Damages Homes, Fells Trees East of Tucson; Flooding Hits East of Phoenix",Parts of Arizona were inundated with rain Monday. Here's the latest.
8,weather,"Tropical Storm Karen's Rains Drenching Virgin Islands, Puerto Rico",Karen appears is hitting Puerto Rico and the Virgin Islands after causing damage in Trinidad and Tobago.
9,weather,"Flooding Inundates Streets East of Phoenix, Prompts Rescues",Parts of Arizona were inundated with rain Monday. Here's the latest.
0,weather,Washington Family Finds Missing Dog in Montana After 57-Day Search,A dog's owners didn't give up after she disappeared from a hotel room.
1,weather,"Tropical Storm Karen Floods Streets, Traps People in Homes in Tobago","Tropical Storm Karen, which formed Sunday morning, has already caused damage in Trinidad and Tobago."
2,weather,Over 340 Aftershocks Follow Earthquake in Western Albania; 105 People Injured,An earthquake has struck western Albania. Here's the latest.
3,weather,Drought Reveals 'Spanish Stonehenge' That Has Been Submerged Since the 1960s,"The Dolmen of Guadalperal stone monument was erected 4,000 to 7,000 years ago."
4,weather,"Hurricane Dorian Left 1.5 Billion Pounds of Debris in Marsh Harbour, Bahamas",The magnitude of hurricane debris in the Bahamas is overwhelming.
5,weather,"Parts of Interstate 10 Remain Closed in Texas After Barges Hit Bridge, Flooding From Imelda",Portions of Interstate 10 through Texas are closed.
6,weather,"President Trump’s Border Wall Could Devastate Arizona Park, National Park Service Says ",
7,weather,Two Die in Devastating Texas Floods; Hundreds Rescued in Wake of Imelda's Torrential Rains,Here's how Imelda is impacting parts of Texas and Louisiana along the Gulf coast.
8,weather,"Houston Parents, Teachers Angry that School Wasn't Canceled in Imelda's Wake",Houston parents and teachers wondered why school wasn't canceled on Thursday.
9,weather,First Fatality Confirmed in Devastating Texas Floods,Authorities have confirmed a death in the wake of Imelda's flooding.
0,weather,Bermuda Swiped by Hurricane Humberto; Thousands Lose Power,Here's the latest as Hurricane Humberto made its closest pass to Bermuda.
1,weather,Flooding Hits Parts of Texas as Imelda Moves Inland; Tornado Causes Damage Near Baytown,Here's how Imelda is impacting parts of Texas and Louisiana along the Gulf coast.
2,weather,Iowa Braces for Another Round of Flooding as Missouri River Rises,Residents and officials in Iowa are preparing for yet another round of flooding.
3,weather,California Utility Cuts Electricity to Thousands Because of Wildfire Risk,"Southern California Edison shut off electricity to more than 14,500 customers."
4,weather,Snow Falls in Sierra as Strong Winds Cause Damage in Reno,An early-season snowfall was reported in the higher elevations of the Sierra Nevada on Monday.
5,weather,"Wildfires Are Top Cause of School Closures in California, Report Says",The number of times California schools have shut down due to wildfires has spiked in recent years.
6,weather,Barges Break Loose on Mississippi River; At Least One Hits Bridge,Several barges broke loose Monday on the Mississippi River.
7,weather,It’s Been One of the Most Miserable Starts to September in Parts of the South and Midwest,The South has not seen any glimpses of fall-like temperatures and portions of the Midwest have been soaked.
8,weather,Colorado Wildfires Prompt Evacuations,Two new wildfires in Colorado prompted mandatory or voluntary evacuation orders.
9,weather,"Southern California Wildfire Threatens Homes, Forces Evacuations","The fire began Saturday evening near San Jacinto, California, forcing nearly 200 people from their homes."
0,weather,"At Least 14 Dead, 24 Missing After Tourist Boat Capsizes on India's Rain-Swollen Godvari River","The sightseeing boat was not supposed to be on the flooded river, authorities said."
1,weather,How Does a Home Survive Amid the Devastation of A Major Hurricane like Dorian?,"In recent hurricanes, a few homes have managed to survive when others have been wiped clean."
2,weather,Maine Town Drops Below Freezing Before 'The Icebox of the Nation' ,"One Maine town saw its first freeze before International Falls, Minnesota."
3,weather,Aid Efforts Temporarily Suspended in Bahamas as Tropical Storm Humberto Passes,Tropical Storm Humberto slows aid efforts in the Bahamas.
4,weather,"Homes Evacuated, Roads Washed Out in South Dakota Flooding",Flood waters inundated homes and roads in parts of South Dakota.
5,weather,"Death Toll Rises to 6 in Southeast Spain Floods; 3,500 People Rescued",Torrential rains lead to major flooding in southeastern Spain.
6,weather,"Northern Cascades Glaciers Suffer 'Shocking Loss' Due to Climate Change, Annual Survey Shows","The Northern Cascades Glaciers are melting, and that's a dire sign for climate change."
7,weather,Clean-up of Dorian Devastated Bahamas Slowly Begins; $7 Billion in Damage Estimated,"Crews have started to remove some debris on Abaco and Grand Bahama, the two islands hit hardest by Dorian."
8,weather,Intellectual Property Terms,By accepting this license you agree that:
9,weather,Intellectual Privacy Terms,By accepting this license you agree that:
0,weather,"Southeast Spain Battered by Severe Storms that Kill 2, Wash Away Cars",Torrential rains lead to major flooding in southeastern Spain.
1,weather,More Fires Are Burning In Brazil's Cerrado Region Than in the Amazon,"More than 8,000 fires have been reported in the large savanna this month. That's 550 more than in the Amazon."
2,weather,"2,500 People Missing After Hurricane Dorian in Bahamas; Flood of Evacuees Strains Shelters, Services in Nassau",Bahamas government reports long list of missing people.
3,weather,Stranded Baby and Mother Manatee Freed From Enclosure at Florida Marina,A mother manatee and her baby are free at last.
4,weather,Trump Says 'We Have To Be Very Careful' About Bahamian Refugees; Customs Chief Agrees Each Case Will Be Reviewed,Confusion arises over U.S. entry requirements for Bahamians fleeing Hurricane Dorian's destruction.
5,weather,"'Human Error' Caused Warning Siren Failure as Tornadoes and Straight-Line Winds Ripped Through Sioux Falls, South Dakota","Tornadoes and straight-line winds caused damage in Sioux Falls, South Dakota. Here's the latest."
6,weather,South Carolina Couple Finds Cannonballs on Beach After Hurricane Dorian,A South Carolina couple found a pair of Civil War-era cannonballs.
7,weather,"Former FEMA Officials, Contractor Arrested, Accused of Fraud During Hurricane Maria Recovery in Puerto Rico",Federal officials say the mission to restore power to Puerto Rico following the devastation of Hurricane Maria was filled with corruption.
8,weather,Crew Members Survived 'Hellish Conditions' Inside Capsized Cargo Ship Off Georgia Coast,All four trapped crew members were rescued Monday from a capsized cargo ship off the coast of Georgia.
9,weather,"When and Where Fall Foliage Colors Typically Peak, in One Map ","Here's how fall colors spread across the country, on average."
0,weather,Hurricane Dorian Victims Arrive in U.S.; Bahamas Government Says There Will Be No Formal Evacuation,Hurricane Dorian victims are leaving the hard-hit islands of Grand Bahama and the Abacos.
1,weather,Ocracoke Island Remains Without Power; Residents Who Evacuated Allowed to Return Home,Here's the latest on how residents on North Carolina's Ocracoke Island are recovering after Hurricane Dorian.
2,weather,Boy Who Gave Up Disney Trip to Feed Dorian Evacuees Still Gets His Vacation,Jermaine Bell used money he had saved for a trip to Disney World to buy food and water for evacuees from the South Carolina coast.
3,weather,"In the Bahamas, Official Hurricane Dorian Death Toll Rises to 45, But Newspaper Says It's in the Thousands",Here is the latest information on search and recovery efforts in the northwestern Bahamas.
4,weather,Ocracoke Island Remains Cut Off After Hurricane Dorian's Damage,Here's the latest on Hurricane Dorian's impacts to the East Coast.
5,weather,Former National Weather Service Chief: Rewriting History 'Diminishes NOAA',Former director of the National Weather Service offers insights into political pressure and the importance of independent forecasters.
6,weather,"Typhoon Faxai Kills 3 in Japan,  Injures 40, Causes Widespread Damage","The typhoon made landfall early Monday in Chiba City, east of Tokyo. Here are the impacts."
7,weather,"In the Bahamas, Official Hurricane Dorian Death Toll Rises to 45, But Newspaper Says It's in the Thousands",Here is the latest information on search and recovery efforts in the northwestern Bahamas.
8,weather,"In Japan, Typhoon Faxai Damages Homes, Disrupts Travel, Knocks Out Electricity","The typhoon made landfall early Monday in Chiba City, east of Tokyo. Here are the impacts."
9,weather,"Summer Heat Waves Kill 1,500 People in France","The toll was more than 1,000 deaths above the annual average for the time of the year, France's health minister says."
0,weather,Aid Begins to Reach Bahamas Islands Devastated by Hurricane Dorian; At Least 43 Dead,Here is the latest information on search and recovery efforts in the northwestern Bahamas.
1,weather,"In Stunning Rebuke of Its Own NWS Office, NOAA Statement Supports Trump's Hurricane Dorian Alabama Comments",NOAA has done an about-face on President Trump's Hurricane Dorian track.
2,weather,"Typhoon Lingling Kills 3 in South Korea, Leaves Thousands Without Power","Typhoon Lingling toppled trees, left thousands without power and caused at least three deaths in South Korea."
3,weather,Aid Begins to Reach Bahamas Islands Devastated by Hurricane Dorian; At Least 43 Dead,Here is the latest information on search and recovery efforts in the northwestern Bahamas.
4,weather,"Hurricane Dorian Clobbers the Carolinas, Virginia; Residents Stranded on Outer Banks",Here's the latest on Hurricane Dorian's impacts as the storm pounds the East Coast.
5,weather,'The Best Way You Can Assist the Bahamas ... Is to Come and Visit',"Abaco and Grand Bahama are destroyed, but the Bahamas is encouraging tourism to the nation's other islands."
6,weather,"Humanitarian Aid Begins to Reach Bahamas; Death Toll Could Be ""Staggering""",Here is the latest information on search and recovery efforts in the northwestern Bahamas.
7,weather,"Hurricane Dorian Floods Charleston, Spawns Damaging Tornadoes; Virginia Urges Evacuations ",Major Hurricane Dorian began impacting the Carolinas overnight Thursday. Here is the latest.
8,weather,South Carolina Feeling First Effects of Hurricane Dorian; First Death Reported in North Carolina,Here's the latest on preparations for Hurricane Dorian in North Carolina and South Carolina.
9,weather,"Hurricane Dorian Kills 20 in Bahamas, Where Humanitarian Crisis Is Unfolding",Here is the latest information on search and recovery efforts in the northwestern Bahamas.
0,weather,20 Killed by Hurricane Dorian in the Bahamas,
1,weather,"Trees, Signs Down in Georgia as Hurricane Dorian Approaches",Georgia residents and officials are preparing for potential impacts from Dorian. Here's the latest.
2,weather,"Hurricane Dorian Knocks Out Power in Florida, Causes 2 Indirect Deaths",Here's the latest on Hurricane Dorian in Florida.
3,weather,"In Florida, Effects of Dorian Being Felt; Disney Parks Closed Early, Flights Canceled",Here's the latest on Hurricane Dorian in Florida.
4,weather,"'It's Horror' in Bahamas: Survivors Tell of Being Trapped, Witnessing Dorian's Catastrophic Power",Here's what we know about the serious situation unfolding in the northwestern Bahamas.
5,weather,"Hurricane Dorian Evacuations and Closures Ordered in North Carolina, South Carolina",Here's the latest about preparations for Hurricane Dorian in North and South Carolina.
6,weather,"Georgia Prepares for Hurricane Dorian: Residents Line Up To Evacuate, Businesses Boarding Up",Georgia residents and officials are preparing for potential impacts from Dorian. Here's the latest.
7,weather,"Hurricane Dorian Devastates Bahamas: Five Dead, Distress Calls Overwhelm Emergency Responders",Here's what we know about the serious situation unfolding in the northwestern Bahamas.
8,weather,"Southeast Prepares for Dorian: Schools Closed, Evacuations for Georgia, South Carolina, North Carolina",Georgia and the Carolinas are getting ready for potential impacts from Dorian. Here's the latest.
9,weather,"Hurricane Dorian Clogs Interstates, Shuts Down Airports and Flights and Jumbles Cruises","Cruise ships are unable to return to port and more than 1,000 flights have been canceled by Hurricane Dorian."
0,weather,Hurricane Dorian Death Toll Rises to 5,
1,weather,"Hurricane Dorian Likely to Cause Major Beach Erosion from Florida to North Carolina, USGS Says",Coastal change experts predict 80 percent of the sandy beaches from Florida to North Carolina will be damaged by Hurricane Dorian.
2,weather,"In Florida, Evacuations Underway, Flights Canceled For Hurricane Dorian ",Here's the latest on Hurricane Dorian in Florida.
3,weather,"Where Are the Hurricane Dorian Evacuations in Florida, South Carolina, Georgia?",Here are all of the evacuations in the path of Hurricane Dorian.
4,weather,Florida Counties Order Evacuations For Hurricane Dorian,Here's the latest on Hurricane Dorian in Florida.
5,weather,"Southeast Prepares for Dorian: Georgia, South Carolina Coastlines to Be Evacuated",Georgia and the Carolinas are getting ready for potential impacts from Dorian. Here's the latest.
6,weather,Hurricane Dorian Causes Devastation as Category 5 Storm Smashes across Bahamas,Here's what we know about the serious situation unfolding in the northwestern Bahamas.
7,weather,Emergencies Declared in Georgia and Carolinas as Hurricane Dorian's Track Shifts,Georgia and the Carolinas are getting ready for potential impacts from Dorian. Here's the latest.
8,weather,Alert Level Raised at Florida Ports; Cruise Lines Change Itineraries,Florida ports are on the alert for Hurricane Dorian.
9,weather,NASA Moving Massive Launch Tower as Kennedy Space Center Prepares for Dorian,NASA is making a big move to prepare for Dorian.
0,weather,Welcome Greta: Teen Climate Activist Sails into Manhattan (PHOTOS),"""It is insane that a 16-year-old would have to cross the Atlantic to take a stand,"" Thunberg said."
1,weather,"FEMA Unprepared for Disasters, New Report Says",A new report takes a deep dive into shortcomings at the Federal Emergency Management Agency.
2,weather,President Trump Laments That 'Yet Another Big Storm' Is Headed Toward Puerto Rico,The president tweeted incorrectly that Congress approved $92 billion for Puerto Rico for recovery from Hurricane Maria.
3,weather,Lake Michigan's Deadly Waves Prompt Warnings for Swimmers and Boaters in Illinois and Michigan,"Dangerous high waves and rip currents are expected to continue, the National Weather Service warns."
4,weather,California Police Dog Dies in Officer's Hot Car,Even K-9 dogs aren't immune to hot cars.
5,weather,"Flooding Near St. Louis Sweeps Cars off Road, Closes Schools",Flash flooding hit parts of Missouri on Monday. Here's the latest.
6,weather,President Trump Says He Has Never Suggested Using Nuclear Bombs on Hurricanes,"A report says the president twice suggested bombing hurricanes to prevent them from reaching the United States. Trump calls the report ""fake news."""
7,weather,Lightning Strike Injures Six People at Golf Tour Championship Near Atlanta,
8,weather,"One Killed, 62 Homes Flooded in and around Fort Smith, Arkansas, Saturday Morning",Flooding from torrential rain Saturday turned deadly in northwest Arkansas.
9,weather,"Tropical Storm Bailu Kills at Least Three in Philippines, Taiwan Before Making Landfall in China",Tropical Storm Bailu brought heavy rain and mudslides to Taiwan.
0,weather,"Poland, Slovakia Lightning Kills at Least 5, Injures 150 ",A thunderstorm turned deadly in a popular tourist destination Thursday.
1,weather,1969 New Hampshire Time Capsule Opened to Reveal a Big Mystery – There's Nothing Inside,The safe was sealed in 1969 and was supposed to be opened for the 300th anniversary of settlers arriving in the Derry and Londonderry area of New Hampshire.
2,weather,Insurance Becoming Harder for Californians to Find in Areas at High Risk of Wildfires,Insurance is a challenge for those in California's most fire-prone regions.
3,weather,Twitter Heats Up Over Energy Department Recommendation to Keep Thermostat Above 78 When Using Air Conditioning,Is 85 degrees too hot to sleep?
4,weather,Tornadoes Cause Damage in Iowa; Semitrailers Blown Over on Interstate 80,Severe thunderstorms and tornadoes erupted overnight and early Tuesday morning in Iowa. Here's the latest.
5,weather,Four Texas Lakes to Be Drained Because Risk of Dam Spillways Failing Is So High,The Guadalupe-Blanco River Authority has set Sept. 16 as the start date to drain the area lakes to prevent the collapse of 90-year-old spillway gates.
6,weather,"French Couple Faces Jail Time, Fine for Stealing Sand from Sardinia Beach",A French couple is in trouble for stealing protected sand from a beach in Sardinia.
7,weather,"India's Monsoon Season Has Left More Than 1,000 People Dead","While overall rainfall has been about average, extreme downpours have caused flooding and landslides."
8,weather,"10,000 Forced to Flee Another Wildfire on Gran Canaria Island","The evacuations began Sunday, one week after wildfires ravaged the countryside of one of Spain's Canary Islands."
9,weather,Video Shows Dozens of Air Mattresses Blowing Across a Field Near Denver,"""The Great Mattress Migration of 2019"" was caught on video near Denver."
0,weather,Lake Michigan Beaches in Indiana Closed After Cyanide and Ammonia Spill Causes Fish Kill,A steel mill has apologized for the chemical spill that led to beaches at Indiana Dunes National Park and Ogden Dunes being closed.
1,weather,"Alaska Wildfire Burns at Least 50 Structures; Evacuations, Rescues Carried Out",A wildfire in Alaska burned out of control on Sunday. Here's the latest.
2,weather,"Montana Hailstorm Kills or Injures More Than 11,000 Birds","Hail driven by high winds killed thousands of ducks, pelicans, cormorants and other waterfowl at Big Lake Wildlife Management Area."
3,weather,Arizona and Nevada Face First-Ever Mandatory Water Cuts from the Colorado River,Lake Mead is expected to be below the level that triggers restrictions on the amount of water that can be taken from it.
4,weather,Phil Mickelson Late to the Golf Course After Lightning Hits His Hotel,"The hotel where Phil Mickelson was staying in Medinah, Illinois, was struck by lightning Sunday, making him late to the golf course for the BMW Championship."
5,weather,300 Tourists Stuck in Alaska's Denali National Park After Heavy Rains Close Road,Weeks of heavy rains have caused mudslides and debris falls along the only road inside the national park.
6,weather,"Heavy Rain Triggers Flash Flooding in Istanbul, Killing 1","Flooding hit the Turkish capital of Istanbul on Saturday, Here's the latest."
7,weather,Earthquake Damage at California Navy Base Could Top $5.2 Billion,The Ridgecrest earthquakes were another costly natural disaster for the U.S. military.
8,weather,Scientists Trying to Understand No-Name Fault That Caused Largest Ridgecrest Earthquake,"Scientists didn't know about the fault that caused the 7.1 magnitude Ridgecrest, California, earthquake."
9,weather,New Orleans' Levees Threatened by Flooded Mississippi River as Hurricane Season Heats Up,"After record flooding this year, the Mississippi River remains at nearly 11 feet above sea level. A storm surge could push the river over New Orleans' levees."
0,weather,"Heavy Rains Douse Central and South Florida, Prompting Rescues",Heavy rains saturated parts of Florida on Wednesday. Here's the latest.
1,weather,Greece Wildfire Burning Out of Control In Nature Preserve Forces Evacuation of Hundreds,A wildfire is burning out of control in a protected nature preserve on the Greek island of Evia.
2,weather,Extreme Heat Wave Caused Stones to Fall from Notre Dame Cathedral Ceiling,Europe's record-breaking July heat wave smashed more than records.
3,weather,'Wildfire Waiting to Happen': More Than 100 Abandoned Campfires Found in Mount Hood National Forest,Campers and hikers are leaving their fires burning in Mount Hood National Forest.
4,weather,"Newark, New Jersey, Begins Handing Out Bottled Water Because of Lead Problems",EPA testing showed high levels of lead in homes that had city-issued filters.
5,weather,Severe Weather Damage to U.S. Public Infrastructure Tops $1 Billion in First Half of Year,Here's how much storm damage has cost so far this year.
6,weather,"Monsoon Rains Leave At Least 200 Dead in India, Dozens More in Myanmar and Pakistan",Days of heavy rainfall have caused landslides and flooding.
7,weather,Snow and High Winds Hammer Southeast Australia,Some places in southeast Australia saw their heaviest snow in decades.
8,weather,"Wildfire on Spain's Canary Islands Forces 1,000 People to Flee Their Homes",High winds are hampering efforts to contain the fire on Gran Canaria.
9,weather,Rare Lightning Strikes Detected Near the North Pole on Saturday,Lightning flashes in this region of the Arctic are extremely rare.
0,weather,More Than 30 Dead in China After Typhoon Lekima Triggers Landslides and Floods,Typhoon Lekima has caused damaged and killed more than 30 people as it moved into eastern China.
1,weather,"India Flash Flooding, Mudslides Kill at Least 66",Torrential rainfall has led to flash flooding and mudslides in southern India.
2,weather,"Myanmar Landslide Buries a Dozen Homes, Kills at Least 34",A landslide wiped out dozens of home in Myanmar.
3,weather,"Tornadoes Tear Through Southern Luxembourg, Amsterdam: Storms Injure Nearly 2 Dozen",Thunderstorms spawn tornadoes in Europe.
4,weather,"Fukushima, Site of Nuclear Disaster after Japan Tsunami, Set to Host Olympic Events",The Olympics are coming to Fukushima.
5,weather,Popular Jacksonville Beach Pier Destroyed by Hurricane Matthew Being Rebuilt to Withstand Stronger Storms,A Florida fishing pier is being fortified against future extreme weather.
6,weather,Deaths in the Netherlands Spiked During Europe Heat Wave ,A rise in deaths in the Netherlands coincided with July's sweltering heat.
7,weather,"E-Scooters Are Not as Green as People Think, Research Says","Those annoying scooters blocking the sidewalk in cities across the country? Yeah, they are also bad for the planet."
8,weather,Utah Flash Flooding Triggers Evacuations; Mudslides Close Canyon Roads,Thunderstorms triggered flash flooding and mudslides in northern Utah.
9,weather,"California's Central Valley Battling Destructive, Invasive Nutria",A giant rodent could destroy infrastructure and wetlands in California.
0,weather,"A Paradise Fire Survivor Dies of His Injuries, Nine Months Later","The catastrophic Camp Fire in Paradise, California, has claimed another victim."
1,weather,Sitting on Steps of This Famous Tourist Spot in Rome Would Be a Costly Mistake,Rome has imposed a ban on sitting on the site one of the city's most famous landmarks.
2,weather,"Japan Heat Wave Kills at Least 57 People; Over 18,000 Hospitalized ","Japan is baking under deadly, relentless heat."
3,weather,Florida Man Wrestles Alligator to Save His Beloved Pup,It appears a Florida man would do anything to protect his chocolate lab.
4,weather,"Mid-Atlantic Storms and Flooding: Tornado Hits New Jersey, Water Rescues in Pennsylvania and Virginia",A line of storms moved up the I-95 corridor from Maryland to New Jersey Wednesday night. Here's the latest.
5,weather,"Storms Cause Damage in Wisconsin, Pennsylvania, Virginia; Tornado Touches Down in New Jersey",A line of storms moved up the I-95 corridor from Maryland to New Jersey Wednesday night. Here's the latest.
6,weather,Two Men Charged in Scheme that Stole More than $8 Million in Disaster Aid,A fraud ring allegedly stole millions in federal disaster aid money meant for victims of natural disasters.
7,weather,"Montana Wildfire Forces Evacuations, Could Quickly Spread Through Dense Forest Full of Dead Trees Killed by Beetles",A wildfire is spreading quickly through dense forest filled with dead trees killed by bark beetles.
8,weather,For Sale: Extinct Volcano in Southern England,A formerly hot property is up for sale amidst rolling farmland.
9,weather,"Florida Lightning Strike Causes Toilet to Explode, Homeowner Says",Pipes burst and the toilet shattered when the bolt of electricity caused methane gas in a septic tank to explode.
0,weather,Phoenix Postal Worker Cooks A Steak on the Dash of his Sweltering Mail Truck,An Arizona state representative draws attention to triple-digit temperatures inside mail carriers' trucks.
1,weather,Gurgling Hole on Florida Beach Worries Parents; 'Water and Sand Instantly Sucked Me In',Dozens of people were on Juno Beach for the release of a sea turtle when they noticed a gurgling hole. Here's what it is.
2,weather,"Jakarta's Neighborhood in the Sky Draws Attention, But It's Not the Only One",Unique housing developments bring new life to rooftop dead space.
3,weather,Flash Flood Kills 12 People at Scenic Gorge in China,"County officials had banned people from the Duobi Gorge in the Pingshan scenic area, but the crystal-clear lake was too much of a draw."
4,weather,Baseball-Sized Hail in Minnesota; High Winds as Storms Move Across Upper Midwest,A line of thunderstorms moved across the upper Midwest Monday afternoon.
5,weather,"Ocean City, New Jersey, Deploys Hawks, Other Raptors to Scare Seagulls Away","Ocean City, New Jersey, is deploying a new tool in the battle against aggressive, snack-stealing seagulls"
6,weather,"Dam in England Town Could Collapse, Officials Say; Residents Evacuated",Heavy rains could mean danger for the Derbyshire town of Whaley Bridge.
