,category,header,content
1,weather,Artist Creates Giant Painting in the Swiss Mountains to Inspire Hope (PHOTOS),
2,weather,"Floodwaters in Kentucky Sweep Away Amish Buggy; 4 Children Killed, 1 Missing",The family of six was crossing a bridge over a rain-swollen river.
3,weather,"Moving 1 Million Houses From Flood Zones Could Save U.S. $1 Trillion, Study Finds","Moving the homes would save much more money than several other mitigation measures combined, the report from the National Institute of Building Sciences says."
4,weather,Tornado Destroys More Than 170 Homes in One Texas Town,
5,weather,Two Arrested for Hoarding Diapers and Other Supplies Donated to Tennessee Tornado Victims,Managers of a Tennessee mobile home park are accused of withholding hurricane donations from residents.
6,weather,"One Person Dead in Florida as Storms, Tornadoes Pummel South",Severe storms and tornadoes turned deadly on Thursday. Here's the latest.
7,weather,"Widespread Damage, Injuries, Flooding Reported as Storms Batter South for Second Day",Severe storms and tornadoes continue to move across the South. Here's the latest.
8,weather,"Buildings Damaged, Trees Toppled as Tornadoes, Storms Move Across South Today","Severe storms and tornadoes struck the Southern Plains and South on Wednesday night, killing at least seven people. Here's the latest."
9,weather,Drone Video Shows How Dangerous Rip Currents Can Be,"A stunning drone video shows a swimmer getting caught in a rip current in Hawaii. It’s a reminder just how dangerous rip currents can be. <a href=""ClarkLittle.com"">For more visit: ClarkLittle.com</a>"
0,weather,"Tornadoes Strike Texas and Oklahoma, Killing At Least 5 ","Tornadoes struck the Southern Plains on Wednesday night, killing at least five people. Here's the latest."
1,weather,"It’s Harmless, But a Vivid Cloud Vortex Swirled Over the Gulf Of Mexico on Monday","A fascinating, but harmless cloud swirl appeared on satellite over the Gulf of Mexico. Here's what it was."
2,weather,Judge Halts Keystone Pipeline By Revoking Key Permit ,"Just three weeks after the Canadian company decided to proceed with the controversial Keystone XL tar sands pipeline, a Montana federal judge revoked a permit because it had been granted without weighing environmental impacts."
3,weather,"Tornadoes, Storms Rake Across Florida After Killing Three and Damaging Homes in Mississippi, Alabama, Georgia","For the second consecutive weekend, the Deep South dealt with severe weather and tornadoes."
4,weather,Third Body Recovered in Idaho Ski Resort Avalanche,Three people died and five others were rescued when the avalanche struck Tuesday morning.
5,weather,Satellite Images Show Massive Burn Areas From Devastating Australian Bushfires,Australia's devastating wildfire damage this fall and winter can be seen from satellite.
6,weather,Blue-Green Algae Showing Up Early This Year in Some Florida Waterways,Algae blooms are arriving early this year in parts of Lake Okeechobee.
7,weather,Florida Says Apalachicola River and Its Oysters Are Doomed Unless Georgia Is Ordered to Let More Water Flow South,Florida asks the U.S. Supreme Court to reject a recommendation that a decree allocating water between it and Georgia isn't needed.
8,weather,Yellowstone’s Cougars Are Dying of The Plague,"The researchers found the first dead cougar, a victim of plague, in winter in 2006, and the research shows that 43% of cougars studied were exposed to the pathogen."
9,weather,Upper Mississippi Named 'Most Endangered' River of 2020 by Environmental Group,An advocacy group has released its annual list of most threatened rivers.
0,weather,Coronavirus Ripple Effects Will Impact Your Weather Forecasts,"Climate and ecological measuring data are being interrupted by COVID-19, and that will have strong impacts on forecasting capabilities in the near term and lead to lags in climate studies in the long term."
1,weather,The House That Was Blown Intact Into Georgia Road? This Is What It Looks Like Now,"The home was cleared from road after heavy winds lifted it onto State Route 74 between Yatesville and Thomaston, Georgia."
2,weather,Severe Weather Blows An Entire House Onto Georgia Highway,"Heavy winds lifted a home onto State Route 74 between Yatesville and Thomaston, Georgia."
3,weather,Married Couple Killed in Southern Tornadoes Were Public Servants,"Deputy Robert Ainsworth and his wife, a public servant, Paula Reid Ainsworth, were killed as tornadoes ravaged Mississippi."
4,weather,National Weather Service Warns of Damaging Winds Monday,High wind warnings are in effect across the Northeast.
5,weather,Tens of Thousands in Maine Still Without Electricity After Powerful Snowstorm,"A potent April snowstorm packing heavy, wet snow knocked out power to more than 250,000 people in Maine."
6,weather,"Indonesia's Anak Krakatau Volcano Shoots Ash, Lava in Longest Eruption Since Deadly 2018 Event",It was the longest eruption since the explosive collapse of the island caused a deadly tsunami in 2018.
7,weather,The Weather Channel Podcast Prepares You for Southern Severe Weather Outbreak,Spend 25 minutes getting all the necessary information for the upcoming holiday weekend as severe storms threaten the South.
8,weather,"Billions of Locusts Hitting Africa in Second Wave of Plague, Fueled by Higher-Than-Normal Rainfall",Billions of locusts are descending on parts of Africa – again.
9,weather,"Severe Weather Damages Homes, Knocks Out Power from Arkansas to Virginia",Storms moving across the South and Midwest left tens of thousands without power and damaged a number of homes.
0,weather,Body of Second Kennedy Family Member Recovered After Canoe Accident in Windy Conditions on Chesapeake Bay,Two members of the Kennedy family went missing while in a canoe on the Chesapeake Bay.
1,weather,"Cyclone Harold Nears Tonga After Leaving Injuries, Damage in Fiji",Cyclone Harold continues its damaging trek.
2,weather,Argentina Storm Dumps Massive Hail on Córdoba Province,"If these hailstones weren't record-breaking, they were very close."
3,weather,"Reports of Injuries, Damaged Buildings from Cyclone Harold in Fiji",Cyclone Harold continues its damaging trek.
4,weather,Kennedy Family Members Presumed Dead After Canoe Accident in Windy Conditions on Chesapeake Bay,Two members of the Kennedy family went missing while in a canoe on the Chesapeake Bay.
5,weather,"Florida Brush Fire Destroys More than 3,500 Rental Cars at Airport Near Fort Myers","A fire burned dozens of cars amid hot, dry conditions in Florida."
6,weather,Passengers Tossed from Ferry as Cyclone Harold Battered Solomon Islands; at Least 24 Reported Missing,Boats were warned not to travel in the area as Cyclone Harold hit the Solomon Islands Thursday night.
7,weather,Southern California Rattled by 4.9-Magnitude Earthquake,
8,weather,South Dakota River Has Been in Flood Stage for a Full Year,"A bomb cyclone in early 2019 helped kickstart this flooding, which continues a year later."
9,weather,Large Earthquake Strikes Idaho; No Major Damage Reported,Here's what we know so far.
0,weather,"Homes Damaged as Tornadoes Strike Mississippi, Alabama",A line of severe weather is moving across the Deep South. Here's the latest.
1,weather,Damage Reported in Northeastern Arkansas as EF3 Tornado Strikes Jonesboro; Flash Flooding Swamps Cleveland,Here's everything we know about this situation.
2,weather,"West Texas Shaken by Magnitude-5 Earthquake, but No Damage Reported",It was one of the strongest earthquakes on record in the Lone Star State.
3,weather,Treasure Hunter Dies After Being Stranded in Utah Wilderness,The search for a famed treasure hidden in the Rocky Mountains has claimed another life.
4,weather,"Buildings Damaged, Injuries Reported After Tornado Hits Northeast Mississippi",Severe weather is moving through Mississippi and Alabama. Here's the latest.
5,weather,"Magnitude 5.4 Earthquake Causes Damage Across Zagreb, Croatia",The prime minister said the Sunday morning quake was the biggest in Zagreb in the last 140 years.
6,weather,5.7 Magnitude Earthquake Shakes Salt Lake City,A 5.7 magnitude earthquake damaged buildings in Utah and forced the closure of the Salt Lake City airport.
7,weather,Sixth Victim Found After Floodwaters Wash Out Bridge in Indiana,Flooding claimed the lives of six people in Southeast Indiana.
8,weather,"Strongest Earthquake in Years Hits Salt Lake City, Knocks Out Power",A strong earthquake has struck the Salt Lake City area. This is a developing story.
9,weather,Climate Change Threatens Colorado River And the Water Supply for 40 Million People,New research explains the role of less snowpack and more evaporation in the Colorado River basin.
0,weather,"Drought, Climate Change Threaten Panama Canal","As Panama marked the 20-year anniversary of the turnover of the Panama Canal, a water crisis threatens the viability of the waterway."
1,weather,"More Than 50 Invasive Carp Found Upstream in Mississippi River, Likely Due to Months of High Waters",Last year's months of high waters along the Mississippi River may have given invasive carp an easier route upstream.
2,weather,"Thunderstorms, Flooding Leave 21 Dead in Egypt",Severe weather flooded streets and collapsed homes in parts of Egypt.
3,weather,"Small Plane Crashes in Southern California, Killing 2",The wreckage was found near a landfill northwest of Los Angeles.
4,weather,"Oklahoma Panhandle Wildfire Burns Several Homes, Prompts Evacuations",A wildfire prompted evacuations in two Oklahoma towns Saturday.
5,weather,Couple Married More Than 57 Years Die Together in Tennessee Tornado,A Tennessee couple lived and died side by side.
6,weather,Don't Forget! Spring Forward Tonight as Daylight Saving Time Begins ,Daylight saving time about to begin. Time to spring forward!
7,weather,"San Diego At Risk For Devastating Earthquake Damage, New Report Says",A new study looks at what would happen to San Diego in a 6.9 magnitude earthquake.
8,weather,Tennessee Tornado Death Toll Rises; Several People Still Missing in Putnam County,Destructive storms spawned at least one deadly tornado in Middle Tennessee early Tuesday.
9,weather,Here's How to Help Tennessee Tornado Victims,Want to lend a hand to Tennessee tornado victims? Here's how.
0,weather,"Wildfire in Dry, Windy Conditions Forces Evacuation of Residents Near Riverside, California","A wildfire broke out in the dry Santa Ana river bottom near Riverside, California, on Tuesday."
1,weather,Wyoming's I-80 Shut Until Tuesday After 100-Vehicle Pileup Kills Three People,Two crashes led to a pileup with about 100 vehicles and killed three people.
2,weather,Before and After Images of Deadly Tennessee Tornado Aftermath (PHOTOS),Before and after images show how parts of Tennessee were changed by tornadoes overnight.
3,weather,"Tennessee Tornado Death Toll Jumps to 19; Widespread Damage in Nashville, Middle Tennessee",Destructive storms spawned one or more deadly tornadoes in Middle Tennessee early Tuesday.
4,weather,Tennessee Tornadoes Leave At Least 19 Dead; Widespread Damage in Nashville,Destructive storms spawned one or more deadly tornadoes in Middle Tennessee early Tuesday.
5,weather,Tennessee Tornadoes Leave At Least 5 Dead; Widespread Damage in Nashville,Destructive storms spawned one or more deadly tornadoes in Middle Tennessee early Tuesday.
6,weather,"Since Coronavirus Outbreak, Airborne Nitrogen Dioxide Pollution Has Plummeted Over China",NASA scientists say there is evidence the drop in NO2 levels is at least partly related to the economic slowdown following the outbreak of coronavirus.
7,weather,February's Extremes: Parts of Southeast Were Record Wet While Some in California Didn't See a Drop,"The strange contrast, and what was driving it."
8,weather,"Treasure Hunter Follows Weather, Finds The Booty","The 1715 Fleet off Florida's Treasure Coast gave up more of its treasure, thanks to high winds and waves."
9,weather,Sacred Saguaro Cactus Being Destroyed in Border Wall Construction,Observers say some of Arizona's famed saguaro cactus are being cut down for President Trump's border wall.
0,weather,Where Did Winter Go? March Will Mark 2 Years Since the Last ‘High-Impact Snowstorm’ Hit the Northeast Urban Corridor,"Using one measure, it's been nearly two years since a significant, widespread snowstorm hit the Northeast urban corridor."
1,weather,Surfing Legend Kelly Slater Plans World's Largest Man-Made Wave in California Desert,The Kelly Slater Wave Co. is building an 18-million-gallon wave basin in a California luxury resort community.
2,weather,"Silicon Valley Reservoir Must Be Drained Because of Earthquake Risk to Dam, Federal Safety Agency Says","The risk of the Anderson Dam collapsing during an earthquake is ""unacceptably high,"" the federal Division of Dam Safety and Inspections said."
3,weather,Supreme Court Signals It Will Allow Atlantic Coast Pipeline to Cross Under Appalachian Trail,"During oral arguments Monday, the high court's justices questioned a lower court's ruling that blocked the natural gas pipeline."
4,weather,"Katherine Johnson, NASA Mathematician Celebrated in 'Hidden Figures,' Dies at 101","One of NASA's ""human computers,"" Katherine Johnson developed equations that helped put America's astronauts into orbit and later sent them to the moon and back. She died Monday."
5,weather,9 Killed After 5.7 Earthquake Rattles Iran and Turkey Border Region,A deadly earthquake struck Sunday morning near the border between eastern Turkey and western Iran.
6,weather,Ruptured Gas Line Forces Hundreds to Evacuate; Mississippi's Torrential Rains May Be To Blame,"The pipeline near Satartia, Mississippi, ruptured when the ground collapsed in a ravine."
7,weather,At Least Six Students Killed in Indonesia Flash Flood,A group of students and teachers hiking in Indonesia were hit by a deadly flash flood.
8,weather,"Winter Storm Closes Schools, Cancels Flights in North Carolina, Virginia; Officials Warn of Hazardous Road Conditions",A winter storm is moving across parts of the South. Here's the latest.
9,weather,"'We Couldn't See Anything': Deadly 200-Vehicle Pileup Near Montreal, Canada, Preceded by Whiteout ",Dozens of cars were mangled in a deadly pileup near Montreal.
0,weather,"'Recyclable' Plastics Are Often Rejected by U.S. Recycling Plants, Greenpeace Says",Plastics are often rejected by recycling plants – here's why.
1,weather,"Coral Reefs Could Disappear Completely Within 80 Years, New Research Predicts",Earth's coral reefs are under attack from climate change.
2,weather,City-Sized Locust Swarms are Expanding Across East Africa and Threatening Food Supplies,Massive swarms of locusts threaten the food supply for millions of people in Africa.
3,weather,"North Carolina Officials Work to Prevent Future Flooding, Regardless of FEMA Flood Maps",North Carolina and other states preparing for natural disasters made worse by climate change.
4,weather,North Carolina Officials Work to Prevent Future Flooding,
5,weather,"Afghanistan Avalanches Kill 21, Destroy Dozens of Homes",More deadly avalanches have hit Afghanistan. Here's the latest on the situation.
6,weather,Severe Floods From Storm Dennis Still Threaten Large Parts of the UK,"The impacts of Storm Dennis continue to be felt across Wales, England and parts of northern Europe."
7,weather,Vandals Spray-Paint Plymouth Rock with Red Graffiti,"The rock and other monuments in Plymouth, Massachusetts, were targeted over the weekend."
8,weather,Rare Ice Balls Wash Up by the Thousands on Shore of Lake Michigan,"Thousands of the balls, which need lake-effect snow, cold temperatures and waves to form, turned up at Holland State Park."
9,weather,Mississippi's Pearl River Crests But Flooding Remains a Worry; Hundreds of Homes Already Damaged,Flooding from the Pearl River has damaged homes and buildings in Mississippi. Here's the latest.
0,weather,Mild Winter Forces French Ski Resort to Haul in Snow by Helicopter,Ski resorts across the globe could take an economic hit from global warming and changing weather patterns.
1,weather,"With Shorter Winters, Norway Opens Its First Indoor Ski Resort",Climate change threatens Norwegian skiing. Is Norway Sno the way to save it?
2,weather,Colorado Avalanche Buries Two Snowmobilers near Vail; Search Underway,"Three men triggered an avalanche near Vail on Saturday, but one escaped. Crews are searching for the other two men."
3,weather,"French Officials Move to Further Limit Access to Mont Blanc; Concerns Raised Over Environment, Climate Change Impacts",Climbers on Mont Blanc will soon face new restrictions.
4,weather,Missing: One Giant Narwhal Tusk,"A narwhal tusk is missing, and the FBI wants your help to find it."
5,weather,"Climate Change is Making it Harder for Planes to Get in the Air, New Study Says",A new study says some aircraft need more time and more space to take off thanks to climate change.
6,weather,Billionaire's Luxury Yacht Damages 'Sensitive' Coral Reef in Belize Near Great Blue Hole,A 200-foot luxury yacht dragged its anchor across a pristine coral reef.
7,weather,Rockslide Derails Train in Kentucky; Rain-Damaged Alabama Highway Shuts Down Indefinitely,Storm systems in the South continue to create major problems.
8,weather,"Polar Vortex Grows Arctic Sea Ice to 10-Year High, but There's a Catch",Here's why you shouldn't get too excited that there's more ice this year.
9,weather,"Three Women Die After Crossing US-Mexico Border During Winter Storm, Border Patrol Says",The women got lost amid cold temperatures and snow in the rugged terrain of the Laguna Mountains east of San Diego.
0,weather,"Schools Across the Midwest Close Because of Frigid Temperatures, Icy Roads",A winter storm is bringing snow and ice to the Plains and Midwest. Here's the latest.
1,weather,"A Manatee Was Found Dead on a New Jersey Beach, Far From Its Usual Warm Habitat",A dead manatee was far from home when he washed up on a New Jersey Beach.
2,weather,"New U.S. Government Budget Proposal Threatens National Parks, Land and Water Conservation Fund",Here's what would happen if these budget changes were approved.
3,weather,More Than 100 Species on List of Animals That Need 'Urgent Attention' in Wake of Australian Wildfires,Fires in Australia have devastated much of the country's wildlife.
4,weather,"Storm Ciara Kills 8 in High Winds, Heavy Rain; Damage Reported in Several Countries",Storm Ciara slammed the United Kingdom and Northern Europe before pushing eastward.
5,weather,Residents Urged to Flee as Mudslide Reported in Western Washington Town,Here's what we know about this developing situation.
6,weather,Australia's Weekend Downpours Help Extinguish Bushfires,"The storms caused flash floods and power outages, but they brought some help against large bushfires."
7,weather,"Eco-Friendly Fashion At The Oscars? Oh Yes, And There’s More",
8,weather,British Airways Boeing 747 Set a Record Fastest Subsonic New York to London Flight Time This Weekend,A powerful North Atlantic jet stream helped set a new record fastest subsonic New York to London flight time.
9,weather,"North Atlantic Jet Stream Topping 200 MPH Steers Damaging Storm Toward Ireland, United Kingdom This Weekend",A strong North Atlantic jet stream has spawned an intense storm and could also shorten flight times this weekend.
0,weather,"Winds, Possible Tornadoes Cause Damage From Florida to New York ",Severe weather is hitting the South and East. Here's the latest.
1,weather,The Animals that Survived Australia's Fires (PHOTOS),
2,weather,"Winter Storm Brings Slick Roads Across Parts of Midwest, Northeast",A winter storm continues its marching across the Midwest and Northeast. Here's the latest.
3,weather,Winter 2019-20 Has So Far Been the Warmest on Record in the Contiguous U.S.,This winter is off to its warmest start on record.
4,weather,"Avalanches in Turkey Kill 40, Including Rescuers as They Saved People From First Avalanche",Two avalanches struck in Eastern Turkey. Here's the latest.
5,weather,3 Killed as Plane Slides off Runway and Breaks Apart in Bad Weather at Istanbul Airport,A plane skidded off a runway in Turkey and broke into pieces on Wednesday.
6,weather,At Least 38 Killed in Avalanche in Turkey (PHOTOS),Rescue workers attempted to locate two missing people in the area when the second avalanche struck.
7,weather,"With the Help of Little Clay Koalas, 6-Year-Old Boy Raises Nearly $300,000 for Australian Animals",The Massachusetts boy wanted to help animals hurt in the bushfires. The response has exceeded all expectations.
8,weather,"Winter Storm Prompts School Closures in Oklahoma, Missouri, Texas; Stretch of I-80 in Wyoming Closed ",A winter storm that slammed the Rockies on Monday continued to spread problems as it moved eastward.
9,weather,"Sea Level Rise Happening Faster Along U.S. Coastlines, According to Annual Report",Scientists have released an annual report on sea level rise in the U.S.
0,weather,"Crucial Pelican Habitat in Louisiana Being Restored After Decades of Erosion, Oil Spill",A restoration project in Lousiana is giving thousands of seabirds more room to roost.
1,weather,Four Alaskan Children Rescued After Being Stranded Overnight in Winter Storm,The four children became stranded after going for a ride in a snow machine.
2,weather,"For Hundreds of Potentially Hazardous California Dams, Emergency Plans Remain Unfinished, Audit Finds",The Assessment of High-Risk Issues found only 22 emergency plans – out of 650 required – have been approved.
3,weather,Australian Bushfires Have Destroyed Dozens of More Homes,"Since September, bushfires in Australia have burned across nearly 41,000 square miles."
4,weather,"This Groundhog Day, Punxsutawney Phil Does Not See His Shadow, Predicts Early Spring","Once again, thousands turn out in western Pennsylvania to watch Punxsutawney Phil emerge from his burrow."
5,weather,"Evidence Points to Weather as Key Factor in Kobe Bryant Helicopter Crash, Experts Say","Investigators are working to narrow down the cause of the helicopter crash that killed Kobe Bryant, his daughter and seven other people."
6,weather,Climate Change Could Threaten Future South Florida Super Bowls,The 2020 Super Bowl in Miami is drawing attention to rising sea levels.
7,weather,Climate Change Could Force Winemakers to Seek New Varieties of Grapes,Wine drinkers may be raising their glasses to different tastes thanks to climate change.
8,weather,Extreme Weather Could Dampen Border Wall's Effectiveness,Trump's border wall will have to contend with the weather.
9,weather,"Raging Australian Wildfires Prompt Emergency Declaration for Capital of Canberra, Surrounding Areas",Australia's horrific wildfires are inching closer to its capital city.
0,weather,French Skier Dies in Japan Avalanche Despite Efforts by Companions to Save Him,An avalanche hit near a popular Japanese ski resort.
1,weather,MacLean Brothers Become Fastest and Youngest to Row Across Atlantic Ocean,Three brothers traversed challenging weather conditions to set a new rowing record.
2,weather,PETA Wants An AI Robot to Be the Star of Groundhog Day,"What about Punxsutawney Phil, the groundhog we’ve all come to know and love?"
3,weather,Deadly Madagascar Flooding Seen From Space,Photos from the International Space Station show Madagascar's disastrous floods.
4,weather,High Winds Blow Down Section of New Border Wall Between U.S. and Mexico,"The steel panels had been set in concrete between Calexico, California, and Mexicali, Mexico. The concrete hadn't cured before the wind began gusting."
5,weather,Severe Weather Kills 45 in Mozambique ,"Forty-seven schools and 13,000 homes are flooded, according to the INGC, and more than 100 power lines are downed by the winds and rain."
6,weather,Powerful Magnitude 7.7 Earthquake Strikes Near Jamaica and Cuba; Buildings Shake in Miami,The quake caused strong to severe shaking in northwest Jamaica.
7,weather,Brazil Flooding and Landslides Kill At Least 30 People After Record Rainfall,Record rainfall in southeast Brazil has caused disastrous flooding and landslides.
8,weather,"Brazil Flooding, Landslides Kill 54, Displace 30,000",Storms in recent days submerged entire neighborhoods and turned streets into violent rapids.
9,weather,Icelandic Volcano Showing Signs of Potential Eruption,Emergency management officials declared a “state of uncertainty” after Mount Thorbjörn began swelling and experiencing earthquakes.
0,weather,Kobe Bryant's Helicopter Was Given Special Clearance to Fly in Sunday's Foggy Weather ,"Low clouds and fog were present in the area at the time of the crash, though it's still unclear whether the weather played any role in the crash."
1,weather,Amazon Employees Publicly Criticize Company's Climate Record Even Though They Could Be Fired,A group called Amazon Employees For Climate Justice organized an online protest Sunday of the company's record on climate change.
2,weather,"Death Toll Climbs in Turkey Earthquake; More than 1,600 Injured",A strong earthquake struck eastern Turkey Friday. Here's the latest.
3,weather,Satellite Images Show Industrial-Effect Snow in Hungary,Snowfall from industrial plants in Hungary can be seen in satellite images from last week.
4,weather,Florida Strawberries Threatened by Fungus,"Some of Florida's strawberry fields turned brown, thanks to a fungus."
5,weather,26 Dead in Madagascar Flooding,"Madagascar is being battered by heavy rains, landslides and flooding."
6,weather,"In Africa's Nile River Basin, More Than 100 Million Could Face Water Shortages Due to Extreme Weather",Extreme weather could plunge millions of Africans into a water crisis.
7,weather,PFAS 'Forever Chemicals' Found in Drinking Water of Dozens of U.S. Cities,"Samples from 43 cities, including Miami, Philadelphia and New Orleans, contained the toxic chemicals, an environmental group says."
8,weather,Previously Unknown Viruses Discovered in Melting Glacier,Glaciers hold clues to ancient diseases.
