,category,header,content
2,weather,California Wildfire Evacuees Allowed to Return Home in Time For Christmas As Firefighters Gain Upper Hand,A fast-moving wildfire threatened homes and a military base in Southern California.
3,weather,Three Die in Winter Storm's White-Knuckle Travel Conditions; Over 100 Flights Canceled,Winter Storm Harold caused multivehicle pileups on several interstates across the Upper Plains.
4,weather,"Whiteout Conditions Trigger Multicar Pileups, Crashes Across South Dakota, Nebraska, Minnesota",A winter storm caused treacherous driving conditions in the upper Midwest.
5,weather,Photos of Kilauea's New Eruption,
6,weather,Iceberg Threatens British Overseas Territory,The world’s largest iceberg is located within striking distance of South Georgia Island in the southern Atlantic Ocean.
7,weather,Watch the Moment a Rockslide Traps People on Oregon Beach,"A rockslide blocked the tunnel entrance to a beach in Oceanside, Oregon, prompting rescue operations."
8,weather,"One Third of U.S. Rivers Changed Their Color, Three Decades of Satellite Images Show","Viewing the color of an entire river from space can reveal a lot about water quality, a new study says."
9,weather,Lava Lake in Hawaii's Kilauea Volcano Grows After Weekend Eruption,Here's the latest on an eruption of the Kīlauea volcano in Hawaii on Sunday night.
0,weather,Tens of Thousands in Southern California May See Power Cut on Christmas Eve Because of Fire Danger,"High winds are once again increasing the risk of wildfires, and SoCal Edison warns it may shut off electricity as a precaution."
1,weather,10 Broken U.S. Records That Blew Our Meteorologists' Minds in 2020,Some of these new weather records set in 2020 left meteorologists speechless.
2,weather,Hawaii's Kilauea Volcano Stabilizes After Overnight Eruption; New Lava Lake Forms,Here's the latest on an eruption of the Kīlauea volcano in Hawaii on Sunday night.
3,weather,20 Weather Occurrences That Could Have Only Happened in 2020,"We ranked the 20 weirdest weather events of 2020, and it got strange."
4,weather,"2020's Worst Environmental Disasters, and How Climate Change Played a Role",A common thread to some of the year's worst environmental disasters is their connection to climate change.
5,weather,Driver Rescued After 10 Hours Buried in Snow,"A driver was buried under the snow during Winter Storm Gail. Lucky for him, New York State Police Sgt. Jason Cawley was on duty."
6,weather,"Explosion Rocks West Virginia Chemical Plant, Killing 1",A chemical plant explosion in West Virginia prompts a shelter-in-place order for nearby residents.
7,weather,Winter Storm Gail Leaves at Least Five Dead After Record Snowfall,Winter Storm Gail brought piles of snow and hundreds of car crashes across the Northeast.
8,weather,2020: When a Pandemic and Extreme Weather Collided,"From hurricanes to wildfires to cold, the coronavirus pandemic complicated nearly every season of weather."
9,weather,FEMA Funding Change Could Mean Less Disaster Aid Money for Victims of Extreme Weather,The Federal Emergency Management Agency is proposing a rule change for the way disaster aid is allocated.
0,weather,"Winter Storm Gail: Two Killed in Pennsylvania Pileup; Hundreds of Crashes in Virginia, Maryland",Officials urged residents to take Winter Storm Gail seriously.
1,weather,"Possible Tornado Damages Buildings, Knocks Down Trees In Tampa Bay Area",Trees were knocked down and buildings destroyed by a possible tornado in the Tampa Bay area Wednesday.
2,weather,"Winter Storm Gail: Road Crews, Utilities, Airlines Prepare for Major Snowstorm",The Northeast prepares for what could be the region's first high-impact snowstorm in more than two years.
3,weather,"West Virginia School Superintendent Nixes Virtual Learning, Calls a Snow Day",Virtual learning is making snow days obsolete in some areas.
4,weather,Rescuers Search Pacific Ocean for Sailor Missing from USS Theodore Roosevelt,A sailor is missing at sea from the USS Theodore Roosevelt aircraft carrier.
5,weather,Asian Honey Bees Use Animal Dung as Extreme Defense Against 'Murder Hornets',"Honey bees in Vietnam have developed their own chemical weapon against giant ""murder hornets."""
6,weather,"French Rescue Helicopter Crashes in Bad Weather, Killing 5",Officials said the weather might be to blame after a helicopter carrying a mountain rescue crew crashed in the French Alps.
7,weather,"Fire Danger Means Power Shutoffs Possible for Over 200,000 California Homes and Businesses","With Santa Ana winds returning, California utilities warned customers electricity could be cut to help prevent wildfires."
8,weather,PG&E Warns of Power Outages as California Braces For Another Round of Dangerous Fire Weather,"Power outages are possible as high winds once again moves across parts of warm, dry California."
9,weather,Firefighters Gain Upper Hand on Southern California Wildfire Fueled by Fierce Santa Ana Winds,"The Bond Fire, fueled by fierce Santa Ana winds, spread quickly in Orange County's Silverado Canyon area."
0,weather,Mexico Earthquake Makes Waves in Pool,A powerful earthquake in southern Mexico Tuesday turned a swimming pool into a wave pool in Mexico City.
1,weather,Watch: Moment Tsunami Flows Through Turkey Town After Earthquake,"A small-scale tsunami struck the town of Seferihisar after a 7.0 magnitude earthquake struck the Aegean Sea south of Izmir, Turkey."
2,weather,Two Firefighters Injured In California Wildfire Fueled By High Winds,The Bond Fire burning in Orange County quickly grew to 11.25 square miles amid Santa Ana winds.
3,weather,"'Everybody Is on Edge': 2020's Weather Piled on More Devastation in Butte County, California","Butte County, California, where the Camp Fire destroyed Paradise two years ago, tries to move forward as another disaster strikes."
4,weather,Cold-Stunned Sea Turtles Rescued on Cape Cod,Dozens of sea turtles washed up onshore amid high winds and sudden drop in temperatures.
5,weather,Atmospheric River Smashes Alaskan Capital’s 24-Hour Rain Record,"As weather records go, this one was quite impressive, considering southeastern Alaska is typically wet this time of year."
6,weather,"Nation's Only Underground Nuclear Waste Dump Could Face Disruptions, GAO Report Says","A crucial nuclear storage facility in New Mexico faces staffing and space shortfalls, the GAO says."
7,weather,California Fire Threat Could Leave Hundreds of Thousands Without Power,Another round of Santa Ana winds prompts warnings for power outages across Southern California.
8,weather,Winter Storm Knocks Out Power to Tens of Thousands From Ohio to Maine; Schools Closed,Winter Storm Dane is bringing snow and high winds from the Great Lakes to the Appalachians.
9,weather,Golden Ray Shipwreck Dismantling Reveals Thousands of Cars (PHOTOS),The capsized ship has been in Georgia's St. Simons Sound for more than a year.
0,weather,We Now Know How The Mysterious Monolith in Utah Disappeared,A state crew counting bighorn sheep discovered the shiny metal structure last month. The federal Bureau of Land Management announced Saturday it had been removed by an unknown person or group. Now a photographer explains what he saw.
1,weather,"Volcano Erupts in Indonesia, Forces Thousands to Evacuate",Volcano sends column of ash and smoke high into the air. Thousands were forced to evacuate on Sunday.
2,weather,Arecibo Observatory in Puerto Rico Collapses Weeks After Suffering Major Damage,"Two cables snapped on the huge radio telescope in Puerto Rico earlier this year, forcing it to close."
3,weather,Northeast Urban Corridor ‘High-Impact Snowstorm’ Drought Enters Third Winter,"Using one measure, it's been more than two years since a significant, widespread snowstorm hit the Northeast urban corridor."
4,weather,Beautiful Map Shows River Basins of the U.S. in Striking Detail,This map will teach you a thing or two about the country's river basins.
5,weather,"Frigid Temperatures, Coronavirus Pandemic Significantly Add to Homeless Shelters' Burdens",Shelters are struggling to accommodate social distancing restrictions and provide beds for people with nowhere else to go to get out of the cold.
6,weather,It's Gone: Mysterious Monolith in Utah Disappears,A state crew counting bighorn sheep discovered the shiny metal structure earlier this month. The federal Bureau of Land Management announced Saturday it had been removed by an unknown person or group.
7,weather,Frying a Turkey This Thanksgiving? Don’t Do This,"If you’re frying a turkey this Thanksgiving, here are some tips to avoid a disaster."
8,weather,5.3 Magnitude Earthquake Strikes Nevada,A 5.5 magnitude earthquake in Nevada is the second earthquake this year.
9,weather,California Wildfire Risk Could Leave Tens of Thousands Without Electricity for Thanksgiving,Parts of Southern California could face a blackout Thursday and Friday.
0,weather,"Record-Setting Cyclone Gati Leaves Death, Destruction in Somalia",Gati is the first hurricane-strength system to hit Somalia in recorded history.
1,weather,Mount Merapi Could Be on the Verge of Major Eruption in Indonesia,Authorities on the island of Java have raised the alert level for Mount Merapi as increased volcanic activity has been reported.
2,weather,Victim Identified in Wind-Fueled Wildfire on California-Nevada Border,"The Mountain View Fire destroyed dozens of buildings and killed at least one person in Mono County, California."
3,weather,"Reno Wildfire Burns Homes, Forces Evacuations","The Pinehaven Fire broke out Tuesday, and has burned through at least 1,500 acres."
4,weather,Modern-Day Mayflower Cruises Without Humans,"A solar-powered ship is recreating the journey of the Mayflower, but without any people on board."
5,weather,"Climate Change Leads to More Young People Drowning in Icy Regions, Study Finds","The study, which looked at 4,000 drownings in 10 countries, shows warming air temperatures play a role in the increase."
6,weather,"Landslides Still a Risk After Hurricane Iota's Rains, Officials Warn; Death Toll Nears 40",The toll of deadly Hurricane Iota continues to rise in Central America.
7,weather,Death Toll Climbs After Hurricane Iota Devastates Communities in Central America,The Category 4 hurricane came ashore just 15 miles away from where Hurricane Eta hit two weeks ago.
8,weather,"Wind-Driven Fire Near Reno Burns Buildings, Prompts Evacuations",A fire that broke out in high winds burned through a neighborhood in southwest Reno.
9,weather,"Wildfire Near Reno, Nevada, Threatens Homes, Forces Evacuations",A fire that broke out in high winds near Reno was burning through a neighborhood.
0,weather,Hurricane Iota Tears Off Roofs As It Rakes Across Central America;  At Least 4 Deaths Blamed on Storm,The Category 4 hurricane roared ashore just 15 miles away from where Hurricane Eta hit two weeks ago.
1,weather,Hurricane Iota Drives Thousands From Their Homes in Nicaragua and Honduras,"Less than two weeks after Hurricane Eta devastated parts of Central America, residents are facing an even stronger hurricane."
2,weather,Hundreds of Thousands Still Without Power From Midwest to Northeast After Deadly Windstorm,"A strong cold front drove through the Midwest and Northeast, knocking down trees and power lines. One person was killed by a falling tree."
3,weather,"Storms, High Winds Knock Out Power to Over Three Quarters of a Million Customers; Falling Tree Kills Woman ","A strong cold front drives through the Midwest and Northeast, knocking down trees and power lines. One person was killed by a falling tree."
4,weather,'Heartbreaking' Scene At Flooded North Carolina Campground; Rising Waters Remain a Threat in Some Areas,"Flooding remains a threat in parts of North Carolina, where at least nine deaths have been blamed on heavy rainfall fueled by what was Tropical Storm Eta."
5,weather,Death Toll Rises in North Carolina Flooding Fueled By Eta,"Houses were flooded, a school evacuated and dozens of people rescued as deadly flooding swept parts of North Carolina."
6,weather,North Carolina Flooding Blamed for Seven Deaths; Roads and Bridges Washed Out; Dozens Rescued ,Moisture from Eta added to torrential rainfall in North Carolina.
7,weather,"Snow Squall Causes 29-Vehicle Pileup, Nine Injuries in Minnesota",A multi-vehicle pileup injured at least nine people during a morning snow squall in Minnesota.
8,weather,"Tropical Storm Eta Floods Florida Homes, Businesses and Shuts Down Streets; 1 Person Electrocuted ","After making a second Florida landfall, Tropical Storm Eta continued to flood areas as it moved across the state."
9,weather,Search Called Off For Hurricane Eta Landslide Victims in Guatemala,Eta left a wide swath of devastation from Panama to Mexico.
0,weather,This Is How President-Elect Joe Biden Plans to Tackle Climate Change,"The president-elect's environmental policy calls for a big shift to clean energy, carbon neutrality by the middle of the century and federal investment to help make it possible."
1,weather,Tropical Storm Eta's Drenching Rains Turn Florida Streets Into Rivers,"Tropical Storm Eta made landfall in the Keys, but the storm's impacts are being felt across much of Florida."
2,weather,Tropical Storm Eta Floods Streets in Florida; Schools in 12 Counties Closed Monday,South Florida was being lashed by Eta long before the storm made landfall.
3,weather,"Earthquake Rattles Massachusetts, Rhode Island",The earthquake with a magnitude of 3.6 was centered a few miles off the coast of New Bedford.
4,weather,Florida Gets Ready for Eta; Searchers Comb Debris of Deadly Landslides in Central America,Florida is getting ready for Eta.
5,weather,"More Than 40,000 Still Without Power 10 Days After Oklahoma Ice Storm",Tens of thousands of homes and businesses remained without power around Oklahoma City more than a week after WInter Storm Billy.
6,weather,Fault Could Unleash Major Quake in Portland,Seismologists say there’s a fault near Portland that could unleash a major earthquake.
7,weather,Death Toll Rises From Eta in Central America; Miami-Dade Declares State of Emergency as Storm Moves Toward South Florida,It could be days before the true toll of Eta's wrath is known.
8,weather,Turkey Earthquake Rubble Yields More Survivors,"Three days after a powerful earthquake rocked the Aegean Sea region, rescuers were still pulling survivors from collapsed buildings in the Izmir area."
9,weather,"Dozens Dead as Eta Triggers Catastrophic Flooding, Landslides in Central America","Now a tropical depression, Eta is dumping rain on Central America."
0,weather,"Burrito Levee in Grand Isle, Louisiana, Battered By Multiple Storms","Grand Isle, the only inhabited barrier island in Louisiana, has seen part of its coastal levee system shredded by storms this year."
1,weather,Eta Strands Dozens of Fishermen at Sea; Deadly Landslides Leave Three Dead,"Eta left 60 fishermen stranded at sea, ripped roofs off homes, washed away bridges and caused deadly landslides in Nicaragua and Honduras."
2,weather,Home Shakes as 7.5 Magnitude Earthquake Strikes Alaska,One woman and her three children hid under the kitchen table while a 7.5 magnitude earthquake shook their home.
3,weather,"Hurricane Eta Destroys Homes, Floods Parts of Nicaragua, Honduras; Girl's Death Blamed on Storm","Eta, a strong Category 4 hurricane, ripped off roofs and toppled trees as it came ashore Tuesday. Flooding struck several areas in Central America."
4,weather,"Hurricane Eta Makes Landfall in Nicaragua, Bringing Extreme Winds, Rainfall to Central America","Eta, one of the strongest November storms on record, has made its landfall in Nicaragua."
5,weather,"Weather-Related Power Outages, Hurricane Damage Complicate Voting","More than 200,000 homes, businesses and other buildings - including polling sites - across four states are without power on Election Day."
6,weather,Hurricane Eta Intensifies to Category 4 Ahead of Catastrophic Central America Landfall,"Eta is still intensifying, and headed for a catastrophic landfall and inland path beginning Tuesday."
7,weather,"Historically Powerful Typhoon Goni Kills 16, Destroys Thousands of Homes in Philippines","Some areas had been cut off by the typhoon, the strongest landfalling typhoon on record."
8,weather,'A True Miracle': 3-Year-Old Girl Rescued From Turkey Earthquake Rubble After Being Trapped 65 Hours,The powerful earthquake struck Friday northeast of the Greek island of Samos. More than 100 survivors have been dug out of the rubble in the Turkish city of Izmir.
9,weather,"Hurricane Eta Forces Red Alerts, Evacuations in Nicaragua and Honduras",Eta rapidly intensified to a major hurricane on Monday and was already causing flooding in some parts of Central America.
0,weather,Survivors Pulled From Earthquake Rubble in Turkey,Rescue and recovery efforts continue after a major earthquake that shook Turkey and Greece.
1,weather,Iceland Earthquake Interrupts Prime Minister’s Interview,Prime Minister Katrin Jakobsdottir was speaking with a Washington Post reporter when a 5.6 magnitude earthquake shook her home.
2,weather,Death Toll Rises in Turkey From Earthquake,Rescue efforts continue in Turkey after a deadly earthquake Friday.
3,weather,"More Than 600,000 Still Without Power as South Cleans Up After Zeta","Hurricane Zeta ripped roofs off homes, knocked down trees and left millions without power."
4,weather,"Death Toll Rises in Earthquake That Shook Turkey, Greece; Dozens of Survivors Rescued","The death toll continues to rise from an earthquake that flattened buildings in Izmir, Turkey."
5,weather,Chaos in Turkey and Greek Island of Samos After Large Earthquake,"A 7.0 magnitude earthquake struck the Aegean Sea between Greece and Turkey, causing collapsed buildings and tsunami waves."
6,weather,"At Least 28 Killed by Earthquake in Greece, Turkey",The death toll continues to grow after a major earthquake shook parts of Greece and Turkey Friday.
7,weather,"7.0 Earthquake Kills 6 in Turkey, More Than 250 Injured",A major earthquake shook parts of Greece and Turkey Friday. This is a developing story. Please check back for updates.
8,weather,"Deadly Earthquake Strikes Southern Oaxaca, Mexico",At least two people were killed near the epicenter of a 7.4 magnitude earthquake that shook parts of Mexico on Tuesday.
9,weather,"Zeta Leaves 6 People Dead, Millions in the Dark",Tropical Storm Zeta leaves a swath of damage far inland after landfall in Louisiana.
0,weather,"Dozens Dead or Missing After Sixth Storm, Typhoon Molave, Hits Vietnam","A powerful typhoon slammed into Vietnam Wednesday, sending waves of deep, thick mud over homes and villages."
1,weather,Zeta Leaves Nearly 2 Million Without Power and At Least Two Dead After Slamming Gulf Coast,Zeta is the fifth tropical system to make landfall in Louisiana this year. Its wrath is being felt far inland Thursday.
2,weather,Firefighters Gain Ground on Southern California Wildfires as Weather Improves,Firefighters gained ground against the Silverado and Blue Ridge fires as the weather improved.
3,weather,Zeta Forces Evacuations in Louisiana; Shelters To Open In Mississippi,Zeta would be the fifth tropical system to make landfall in the Louisiana this year.
4,weather,"Hurricane Zeta Evacuations in Louisiana, Alabama, Mississippi",Here are all the current evacuations ahead of Hurricane Zeta.
5,weather,"Hurricane Zeta Evacuations in Louisiana, Mississippi, Alabama",Here are all the current evacuations ahead of Hurricane Zeta.
6,weather,Drone Video Shows Glass Fire Destruction,A drone video shows the charred remains of a Santa Rosa neighborhood.
7,weather,"Hundreds of Thousands Still In The Dark After Icy Winter Storm Slams Oklahoma, Texas Panhandle",A winter storm coated parts of Oklahoma and Texas in ice and snow.
8,weather,"Weather Can Influence Voting, But Probably Not The 2020 Election","Rain and temperatures affect voter behavior, but neither will likely play a big role this year."
9,weather,Air Force Called in For Mosquito Outbreak in Louisiana,Hurricane Delta left something else in its wake -- a mosquito problem. Now the Air Force is sending in C-130 planes to try to quell the outbreak.
0,weather,"Southern California Wildfire Forces up to 100,000 to Evacuate; Power Cut to 1 Million Because of Fire Danger",The state may see some of the most extreme fire conditions of a season that has already been extraordinary.
1,weather,Colorado Wildfires Burn Hundreds of Homes Before Snow Brings Some Relief,Two of the largest wildfires in state history are burning in Colorado.
2,weather,California Wildfire Threat: Millions Could Lose Power As Dangerous Fire Weather Moves In,California is bracing for what could be another round of catastrophic wildfires.
3,weather,Colorado Wildfire : Entire Town of Estes Park Told To Evacuate; Couple Who Sheltered in Basement Confirmed Dead,"Thousands were forced to flee as new evacuations were ordered in the East Troublesome Fire, already blamed for the deaths of an elderly couple."
4,weather,Ballots Rescued From Colorado's East Troublesome Fire,"Early voters had placed their ballots in a drop box in Grand Lake, Colorado. The East Troublesome Fire threatened to destroy them."
5,weather,Colorado Fire Evacuees Asked To Be Patient,An explosive wildfire burning in northern Colorado continued to grow in size.
6,weather,"Colorado Fire Jumps Continental Divide, Forces Evacuations in Estes Park","An explosive wildfire in Colorado continues to grow, threatening homes and businesses."
7,weather,Explosive Colorado Wildfire Prompts More Evacuations,An explosive wildfire threatening homes in Colorado is one of a few raging across the state.
8,weather,"After Wildfires, Mudslides Could Be California's Next Deadly Disaster",California's been waiting for the rainy season to bring wildfire relief. But it's also going to bring the danger of potentially deadly debris flows.
9,weather,Colorado's Largest Wildfire Ever Gets Even Bigger; Fire Near Boulder Forces Evacuations,"The Cameron Peak Fire, the largest in Colorado's history, grew bigger as it consumed more homes in its path."
0,weather,"New Wildfire Prompts Evacuations in California As More Hot, Dry Weather Moves In","Officials warn a new round of hot, dry weather in California could spark new wildfires and set back efforts to fight existing ones."
1,weather,Hurricanes Laura and Delta Complicate Voting For Displaced Louisianans,"As election day approaches, thousands of people remain displaced from their homes after back-to-back to hurricanes in Louisiana."
2,weather,IBM 2020 Call for Code Winner Agrolly Connects Farmers to Data,The winner was announced during a virtual ceremony Tuesday evening.
3,weather,"Nearly 700 Elderly Nursing Home Residents May Have Died Because of Hurricane Irma, New Study Says",A new study shows that nearly 700 more frail nursing home residents died in the months following Hurricane Irma than in the same period during a year without a hurricane.
4,weather,"Georgia Train Derailment Forces Evacuations as Delta's Remnants Bring Flooding, Tornadoes Across South","A track washout caused by Delta's rains may have caused the train to derail in Lilburn, Georgia. The remnants of the hurricane continues to bring rain to the East."
5,weather,Delta Leaves Hundreds of Thousands Without Power; Storm Weary Residents Assess Damage,"Delta knocked out power, flooded roadways and damaged buildings as it came ashore and moved inland."
6,weather,"Louisiana Just Spent Weeks Restoring Power After Hurricane Laura. Now, After Hurricane Delta, They're Starting Over.","Hurricane Laura caused hundreds of thousands of power outages in Louisiana six weeks ago. Seven days ago, almost everyone had their electricity restored. Now, Delta has caused more than 600,000 outages."
7,weather,Hurricanes Delta and Laura Mean Some People Will Be Forced to Seek Disaster Aid Twice,Those unfortunate enough to be hit by both hurricanes Laura and Delta now have to navigate the logistics of filing two disaster claims.
8,weather,"Where Hurricane Delta Evacuations Have Been Issued in Louisiana, Alabama",Here's a look at evacuations called for Hurricane Delta.
9,weather,Hurricane Delta Puts Hurricane Laura Recovery on Hold in Louisiana,Hurricane Delta is setting back recovery in some areas ravaged by Hurricane Laura.
0,weather,"Hurricane Delta Hits Mexico: Power Out, Trees Down as Storm Makes Landfall on Yucatan Peninsula",Hurricane Delta made landfall Wednesday morning on Mexico's Yucatan Peninsula.
1,weather,Hurricane Delta Prompts Evacuations in Mexico's Yucatan Peninsula,Mexico's Yucatan Peninsula is bracing for a hit by Hurricane Delta.
2,weather,"California Wildfires Have Burned 'Unfathomable' 6,250 Square Miles, Double the Previous Record","There have been more than 8,200 wildfires this year in the state of California. The fires have killed 31 people and destroyed over 8,454 structures."
3,weather,"At Least Eight Missing, Four Dead In Flooding in France and Italy",Storm Alex brought torrential rainfall and flooding to the mountainous region between France and Italy.
4,weather,Buildings Wrapped To Protect Against California Wildfires Look Like Giant Baked Potatoes ,"Firefighters use a material called surface wrap to protect historic buildings from wildfires, turning them into shiny covered boxes."
5,weather,"Weirdly Balanced Rocks Could Be Key To Predicting Earthquakes, New Study Says","Boulder formations known as precariously balanced rocks often draw awe and wonder, but scientists say they can also be used to predict earthquake risk."
6,weather,"Crews Fighting Northern California Wildfire Challenged by Weather, Red Flag Conditions","Hot, windy and dry conditions make Friday one of the most challenging days yet for crews battling blazes in Northern California."
7,weather,"Stories of Survival, Resolve Emerge From Northern California Wildfires","Some residents are returning home after wildfires ripped through their neighborhoods, only to find nothing is left."
